title,byline,url
American Myths are Made of White Grievance—and the Jan. 6 Big Lie Is Just the Latest,Anthony Conwright,https://www.motherjones.com/politics/2023/01/trump-jan-january-6-insurrection-big-lie-white-supremacy-confederate/
American Myths are Made of White Grievance—and the Jan. 6 Big Lie Is Just the Latest,Anthony Conwright,https://www.motherjones.com/politics/2023/01/trump-jan-january-6-insurrection-big-lie-white-supremacy-confederate/
The IRS Finally Got Some Funding. Now Republicans Want It Back.,Michael Mechanic,https://www.motherjones.com/politics/2023/01/house-republicans-vote-defund-irs-80-billion/
"Who’s to Blame for GOP Chaos? “Coco Chow,” Says Trump in Another Racist Rant",Inae Oh,https://www.motherjones.com/politics/2023/01/whos-to-blame-for-gop-chaos-coco-chow-says-trump-in-another-racist-rant/
"As Climate Outlook Worsens, Republicans Go After “Woke” Capitalism",Marianne Lavelle,https://www.motherjones.com/politics/2023/01/republicans-woke-capitalism-ron-desantis-blackrock/
Kevin McCarthy’s Historic House Humiliation,Inae Oh,https://www.motherjones.com/politics/2023/01/kevin-mccarthy-house-speaker-vote/
"In George McCalman’s Dazzling New Book, Black History Is Everyone’s History",Emily Hofstaedter,https://www.motherjones.com/media/2023/01/in-george-mccalmans-dazzling-new-book-black-history-is-everyones-history/
"In Rural California, Farmworkers Fend for Themselves for Health Care",David Bacon,https://www.motherjones.com/environment/2022/12/in-rural-california-farmworkers-fend-for-themselves-for-health-care/
Monster of 2022: J.D. Vance,Eamon Whalen,https://www.motherjones.com/politics/2023/01/monster-of-2022-j-d-vance/
Hero of 2022: The Movement to Bring Brittney Griner and Pay Equity Back Home,Maggie Duffy,https://www.motherjones.com/politics/2023/01/hero-of-2022-the-movement-to-bring-brittney-griner-and-pay-equity-back-home/
Hero of 2022: The Woman Who Defeated Two Anti-Abortion Ballot Measures,Abby Vesoulis,https://www.motherjones.com/politics/2023/01/rachel-sweet-hero-of-2022-the-woman-who-defeated-two-anti-abortion-ballot-measures/
,,https://www.motherjones.com/politics/2022/12/walker-warnock-georgia-run-off-senate-christianity-belief/
,,https://www.motherjones.com/environment/2022/10/brown-pelicans-threatened-gulf-coast-sea-level-rise-climate-change/
,,https://www.motherjones.com/politics/2022/09/it-didnt-start-with-trump-the-decades-long-saga-of-how-the-gop-went-crazy/
Monster of 2022: Cars Parked in Bike Lanes,Jacob Rosenberg,https://www.motherjones.com/mojo-wire/2023/01/monster-of-2022-cars-parked-in-bike-lanes/
Hero of 2022: The James Webb Space Telescope,Daniel Moattar,https://www.motherjones.com/mojo-wire/2022/12/hero-of-2022-the-james-webb-space-telescope/
"Did the Royal Family Bless This Deranged, Violent Fantasy Against Meghan Markle?",Inae Oh,https://www.motherjones.com/mojo-wire/2022/12/meghan-markle-jeremy-clarkson-camilla/
Experiencing Space Flight Just Got a Lot More Accessible,Daniel King,https://www.motherjones.com/recharge/2022/12/space-flight-portal/
"Remembering George Pérez, a Superhero of Superhero Comics",Dan Spinelli,https://www.motherjones.com/recharge/2022/05/remembering-george-perez-a-superhero-of-superhero-comics/
Ukrainian and Russian Dancers Join Onstage (in Italy) to Fundraise for the Red Cross,Daniel King,https://www.motherjones.com/recharge/2022/04/ukrainian-russian-antiwar-ballet-dancers-for-peace/
Did George Santos Speak to a Living Human Today?,Inae Oh,https://www.motherjones.com/politics/2023/01/did-george-santos-speak-to-a-living-human-today/
Monster of 2022: Moynihan Train Hall,Tim Murphy,https://www.motherjones.com/politics/2023/01/monster-of-2022-moynihan-train-hall/
"In New York City, Traffic Deaths Were Almost Equal to Shooting Deaths in 2022",Abigail Weinberg,https://www.motherjones.com/environment/2022/12/in-new-york-city-traffic-deaths-were-almost-equal-to-shooting-deaths-in-2022/
Why US Cities Are Falling Out of Love With the Parking Lot,Oliver Milman,https://www.motherjones.com/environment/2022/12/us-cities-parking-minimums-zoning-policies-climate/
Meet Ron DeSantis’ New “Public Health Integrity Committee”,Kiera Butler,https://www.motherjones.com/politics/2022/12/meet-ron-desantis-new-public-health-integrity-committee/
"As RSV Cases Surge, Experts Warn of America’s Worsening ‘Tripledemic’",Abby Vesoulis,https://www.motherjones.com/politics/2022/11/rsv-covid-flu-cases-winter-2022/
Hero of 2022: Ali Slagle’s Dreams of Dinner,Inae Oh,https://www.motherjones.com/food/2022/12/hero-of-2022-ali-slagles-dreams-of-dinner/
A Jewish Girl’s Guide to Christmas Cookie Boxes,Ruth Murai,https://www.motherjones.com/food/2022/12/a-jewish-girls-guide-christmas-cookie-boxes-dessert-holiday-gift/
Hero of 2022: Alabama Prison Strikers,Ruqaiyah Zarook,https://www.motherjones.com/crime-justice/2022/12/heroes-2022-alabama-prison-strikers/
The Biden Administration Aims to Finally End Racist Sentencing Over Crack Cocaine,Samantha Michaels,https://www.motherjones.com/crime-justice/2022/12/racist-sentencing-crack-cocaine-biden-reform-congress/
Republican States Just Succeeded in Keeping a Key Trump Border Policy in Place,Isabela Dias,https://www.motherjones.com/politics/2022/12/title-42-chief-justice-roberts-republican-states-just-succeeded-in-keeping-a-key-trump-border-policy-in-place/
The Bipartisan Immigration Deal Is Dead on Arrival,Isabela Dias,https://www.motherjones.com/politics/2022/12/sinema-tillis-the-bipartisan-immigration-deal-is-dead-on-arrival/
,,https://www.motherjones.com/politics/2022/12/heroes-and-monsters-of-2022/
,,https://www.motherjones.com/politics/2022/12/curtis-boyd-abortion-clergy-consultation-service-preacher-texas-new-mexico-roe/
,,https://www.motherjones.com/politics/2022/12/hunter-biden-laptop-bannon-guo-musk/
,,https://www.motherjones.com/politics/2022/10/jim-marchant-nevada-secretary-state-trump-divorce-ice-machine-maga/
A White Father and Son Allegedly Tried to Kill a Black FedEx Driver. Did Cops Go Easy on Them?,Samantha Michaels,https://www.motherjones.com/crime-justice/2022/11/a-white-father-and-son-allegedly-tried-to-kill-a-black-fedex-driver-did-cops-go-easy-on-them/
Republicans Hoped a “Crime Wave” Was Their Ticket to a Red Wave. It Wasn’t.,Samantha Michaels,https://www.motherjones.com/politics/2022/11/crime-wave-republicans-midterms-fetterman-oz-hochul-zeldin-fear-progressive-reform-criminal-justice/
"In New York City, Racial Equity Ballot Measures Passed by a Wide Margin",Maggie Duffy,https://www.motherjones.com/politics/2022/11/racial-equity-ballot-measures-new-york-city/
Pay Attention to These Insanely Important District Attorney Races,Samantha Michaels,https://www.motherjones.com/politics/2022/10/pay-attention-to-these-insanely-important-district-attorney-races/
