title,byline,url
A Nationwide Abortion Ban Could Really Happen. You Can Thank Anthony Comstock’s Suitcase Full of Dildos.,Eleanor Cooney,https://www.motherjones.com/politics/2024/05/anthony-comstock-dildos-rubber-articles/
A Nationwide Abortion Ban Could Really Happen. You Can Thank Anthony Comstock’s Suitcase Full of Dildos.,Eleanor Cooney,https://www.motherjones.com/politics/2024/05/anthony-comstock-dildos-rubber-articles/
These Child Sex Abuse Victims Had An Opportunity to Get Justice. The Louisiana Supreme Court Took It Away.,Sophie Hayssen,https://www.motherjones.com/politics/2024/05/louisiana-supreme-court-lookback-window/
Inside Georgia’s Crusade to Make Bail Unpayable,Nia t. evans,https://www.motherjones.com/politics/2024/05/inside-georgias-crusade-to-make-bail-unpayable/
"Under Glenn Youngkin, Parole in Virginia Has Nearly Vanished",Isabela Dias,https://www.motherjones.com/criminal-justice/2024/05/under-glenn-youngkin-parole-in-virginia-has-nearly-vanished-prisons-second-chance-bolts/
Biden Administration Under Pressure to End New Deepwater Oil Export Facilities,Oliver Milman,https://www.motherjones.com/politics/2024/05/biden-administration-deepwater-oil-export-facilities-liquid-natural-gas-lng-terminals/
What Do War Crimes Warrants for Hamas and Israeli Leaders Actually Mean?,Julianne McShane,https://www.motherjones.com/politics/2024/05/why-the-icc-arrest-warrants-for-hamas-and-israeli-leaders-matter/
Shot by a Civilian Wielding a Police Gun,"Chris Hacker, Champe Barton, Alain Stephens, Stephen Stock, Amy Corral, and Nicole Vap",https://www.motherjones.com/politics/2024/05/shot-by-a-civilian-wielding-a-police-gun/
,,https://www.motherjones.com/politics/2024/04/gaza-solidarity-encampments-columbia-college-campus-protest-palestine-israel-how-many-protests/
,,https://www.motherjones.com/politics/2024/04/trump-trial-hush-money-stormy-daniels-manhattan-video/
,,https://www.motherjones.com/politics/2024/04/minority-rule-video-democracy-ari-berman-founding-fathers/
,,https://www.motherjones.com/media/2024/03/beyonce-beatles-mccartney-blackbird-cowboy-carter-little-rock/
How Trump Judges Are Helping Him Escape Accountability and Return to Power,Pema Levy,https://www.motherjones.com/politics/2024/05/donald-trump-aileen-cannon/
Add Rubio to the List of GOP Invertebrates Who Won’t Say if They’d Certify 2024 Election Results,Julianne McShane,https://www.motherjones.com/politics/2024/05/add-rubio-to-the-list-of-gop-invertebrates-who-wont-say-if-theyd-certify-2024-election-results/
Biden Celebrates Black Leadership While Navigating Gaza Crisis Tensions at HBCU Commencement,Julianne McShane,https://www.motherjones.com/politics/2024/05/morehouse-college-joe-biden-commencement-address-navigating-gaza-crisis-black-leadership/
A Mass Shooter’s Mother Explains How She’s Trying to Stop the Next Tragedy,Jeremy Schulman,https://www.motherjones.com/criminal-justice/2024/05/reveal-santa-barbara-isla-vista-mass-shooting-elliot-rodger-mother/
Lessons From a Mass Shooter’s Mother,Mark Follman,https://www.motherjones.com/criminal-justice/2024/05/threat-assessment-mass-shooting-elliot-rodger-isla-vista-mother/
"Report: After Promising to Halt Bomb Shipment, Biden Moving to Send $1 Billion More in Weapons to Israel",Julianne McShane,https://www.motherjones.com/politics/2024/05/biden-bombs-billion-rafah-united-states-gaza-israel/
Trump Wants to Deport Pro-Palestine Protesters—and GOP Lawmakers Are Filing Bills to Make It Happen,Julianne McShane,https://www.motherjones.com/politics/2024/05/trump-protesters-gop-marco-rubio-palestine-college-deport/
Tribal Leaders Ban Gov. Kristi Noem From 20 Percent of South Dakota,Julianne McShane,https://www.motherjones.com/politics/2024/05/kristi-noem-banned/
Modern-Day Lessons From Hiroshima,"May 10, 2024",https://www.motherjones.com/politics/2024/05/hiroshima-nagasaki-modern-day-lessons-nuclear-weapons-our-land/
The GOP’s Grand Plan: Minority Rule,"April 24, 2024",https://www.motherjones.com/politics/2024/04/ari-berman-interview-minority-rule-gop-republicans-founders/
Donald Trump and the United States of Amnesia,"April 3, 2024",https://www.motherjones.com/politics/2024/04/donald-trump-united-states-of-amnesia-better-off-covid/
,,https://www.motherjones.com/politics/2024/04/reveal-podcast-pegasus-spy-el-faro-citizens-lab/
,,https://www.motherjones.com/politics/2024/04/this-weeks-episode-of-reveal-what-happens-when-a-tribal-cops-vanish/
,,https://www.motherjones.com/politics/2024/04/gaza-pregnancy-reveal-episode/
,,https://www.motherjones.com/politics/2024/04/how-famine-and-starvation-can-affect-generations-to-come/
Dobbs Had the Opposite Effect Conservatives Intended,Julianne McShane,https://www.motherjones.com/politics/2024/05/dobbs-had-the-opposite-effect-conservatives-intended/
Greg Abbott Declares Open Season on Protesters in Texas,Tim Murphy,https://www.motherjones.com/politics/2024/05/abbott-daniel-perry-pardon-protesters-texas/
Our Fixation on Forests as a Climate Solution Is Causing Problems,Kate Yoder,https://www.motherjones.com/environment/2024/05/forests-carbon-sequestration-climate-solutions-indigenous-people/
One of the World’s Healthiest Coral Reefs Is Hiding in a Gulf Coast Oilfield,Jesse Nichols,https://www.motherjones.com/environment/2024/05/healthiest-coral-reefs-gulf-coast-oilfield/
Why I Spent Two Years Investigating a Notorious Mass Shooting,Mark Follman,https://www.motherjones.com/criminal-justice/2024/05/investigating-elliot-rodger-incels-isla-vista-threat-assessment/
Oklahoma Is Finally Trying to Cut Prison Time for Abused Moms,Samantha Michaels,https://www.motherjones.com/politics/2024/04/oklahoma-is-finally-trying-to-cut-prison-time-for-abused-moms/
Lost in the Crowd: The Hidden Biases of Medical Fundraising,Julia Métraux,https://www.motherjones.com/politics/2024/05/nora-kenworthy-crowded-out-gofundme-health-care-crowdfunding/
This Majority-Black City Has a Water Crisis That Privatization Won’t Fix,Lylla Younes,https://www.motherjones.com/politics/2024/05/jackson-mississippi-black-water-crisis-privatization-epa/
Climate Scientists Ponder: “Do I Really Want to Bring a Child Into This World?”,Damian Carrington,https://www.motherjones.com/environment/2024/05/climate-scientists-crisis-decision-have-children-kids-childbearing/
The Founder of Mother’s Day Mostly Cared About Her Own Mother,Nina Martin,https://www.motherjones.com/politics/2024/05/mothers-day-anna-jarvis/
Carvell Wallace on Life and Love and Coming of Age in a Cruel World,Carvell Wallace,https://www.motherjones.com/media/2024/05/carvell-wallace-another-word-love-memoir-book-excerpt/
Learning to Love My Trans Self After Conversion Therapy,Henry Carnell,https://www.motherjones.com/politics/2024/05/lgbtq-anti-trans-conversion-therapy-christianity/
,,https://www.motherjones.com/politics/2024/05/privatized-military-housing/
,,https://www.motherjones.com/politics/2024/04/minority-rule-is-threatening-american-democracy-like-never-before/
,,https://www.motherjones.com/criminal-justice/2023/10/foster-kids-psychiatric-hospitals-universal-health-services-uhs-alaska-cps/
,,https://www.motherjones.com/politics/2023/09/unhoused-california-photo-essay/
They Make Viral Gun Videos—With Hardline Christian Values,Lila Hassan,https://www.motherjones.com/politics/2024/03/t-rex-arms-hardline-christian-nationalism-lucas-botkin/
"The Crumbleys Have Been Convicted. Black Parents Will Likely Pay a Price, Too.",Nia t. evans,https://www.motherjones.com/criminal-justice/2024/03/james-jennifer-ethan-crumbley-oxfor-michigan-school-shooting/
Environmentalists Are Having a Cow Over Tyson Foods’ “Climate Friendly” Beef,Georgina Gustin,https://www.motherjones.com/politics/2024/05/usda-tyson-foods-label-brazen-beef-climate-friendly/
TikTok’s Raw Milk Influencers Are Going to Give Us All Bird Flu,Julia Métraux,https://www.motherjones.com/food/2024/05/raw-milk-influencers-h5n1-bird-flu-virus-social-media/
North Carolina’s Protest Crackdown Now Includes a Ban on N95s,Julia Métraux,https://www.motherjones.com/politics/2024/05/north-carolina-mask-ban-palestine-campus-protests-covid-immunocompromised/
Are You Better Off Than Four Years Ago? OMG You Have Got to Be Kidding Me.,James West,https://www.motherjones.com/politics/2024/03/trump-covid-coronavirus-response-biden-four-years-video/
Republican-Led States Across the Country Are Copying Texas’ Radical Anti-Immigration Law,Isabela Dias,https://www.motherjones.com/politics/2024/05/texas-sb4-oklahoma-immigration-migrant-biden-copycat-laws/
Why Are Some Latinos Drifting to the Right?,Isabela Dias,https://www.motherjones.com/politics/2024/05/why-are-some-latinos-drifting-to-the-right/
