title,byline,url
West Bank Midwives Are Facing a Maternal Health Crisis,Story and Photography by Lynzy Billing,https://www.motherjones.com/politics/2024/06/west-bank-midwives-maternal-health-crisis/
West Bank Midwives Are Facing a Maternal Health Crisis,Story and Photography by Lynzy Billing,https://www.motherjones.com/politics/2024/06/west-bank-midwives-maternal-health-crisis/
"Are You There, God? It’s Me, Justice Alito.",Kiera Butler,https://www.motherjones.com/politics/2024/06/are-you-there-god-its-me-justice-alito/
Hunter Biden Convicted on Federal Gun Charges,Julia Métraux,https://www.motherjones.com/mojo-wire/2024/06/hunter-biden-gun-trial-jury-decision/
Insulin Prices Are Deadly High—But Mutual Aid Is Keeping Diabetics Alive,Julia Métraux,https://www.motherjones.com/politics/2024/06/mutual-aid-diabetes-insulin-pharma-community-care/
Once Again I Must Address the Racist Comments in My Feeds,Garrison Hayes,https://www.motherjones.com/politics/2024/06/racist-comments-reconstruction-black-republicans-video/
"Exposure to Wildfire Smoke Killed 50,000 Californians Over a Decade, Study Finds",Dani Anguiano,https://www.motherjones.com/environment/2024/06/wildfire-smoke-exposure-premature-death-california-health-study/
An Investigation: Is Trump Like Jesus?,Julianne McShane,https://www.motherjones.com/politics/2024/06/an-investigation-is-trump-like-jesus/
,,https://www.motherjones.com/politics/2024/04/gaza-solidarity-encampments-columbia-college-campus-protest-palestine-israel-how-many-protests/
,,https://www.motherjones.com/politics/2024/04/trump-trial-hush-money-stormy-daniels-manhattan-video/
,,https://www.motherjones.com/politics/2024/04/minority-rule-video-democracy-ari-berman-founding-fathers/
,,https://www.motherjones.com/media/2024/03/beyonce-beatles-mccartney-blackbird-cowboy-carter-little-rock/
America’s Top 100 Donors Heavily Favor Trump and the Republicans,Michael Mechanic,https://www.motherjones.com/politics/2024/06/rich-top-100-campaign-donors-lean-trump-republican/
Gov. Kristi Noem Says Trump Should Pick a Woman VP to Show That He Supports Women’s Health,Julianne McShane,https://www.motherjones.com/politics/2024/06/gov-kristi-noem-says-trump-should-pick-a-woman-vp-to-show-that-he-supports-womens-health/
"Meth-Addict Fish, Aggro Starlings: How Human Drugs Are Harming Animals",Patrick Greenfield,https://www.motherjones.com/environment/2024/06/prescription-drugs-water-contamination-effects-animals-fish/
"59 Years Ago SCOTUS Guaranteed Access to Birth Control. Now, That and Much More Is Under Threat.",Julianne McShane,https://www.motherjones.com/politics/2024/06/59-years-ago-scotus-guaranteed-access-to-birth-control-now-that-and-much-more-is-under-threat/
Alaska’s Vast Boreal Forest and Its Species Face a Reckoning,Lois Parshley,https://www.motherjones.com/environment/2024/06/alaska-boreal-forest-spruce-species-wildfires-climate-change-carbon/
"Report: After Promising to Halt Bomb Shipment, Biden Moving to Send $1 Billion More in Weapons to Israel",Julianne McShane,https://www.motherjones.com/politics/2024/05/biden-bombs-billion-rafah-united-states-gaza-israel/
Trump Wants to Deport Pro-Palestine Protesters—and GOP Lawmakers Are Filing Bills to Make It Happen,Julianne McShane,https://www.motherjones.com/politics/2024/05/trump-protesters-gop-marco-rubio-palestine-college-deport/
Tribal Leaders Ban Gov. Kristi Noem From 20 Percent of South Dakota,Julianne McShane,https://www.motherjones.com/politics/2024/05/kristi-noem-banned/
"Here Come the Russians, Again","May 24, 2024",https://www.motherjones.com/politics/2024/05/here-come-the-russians-again/
Modern-Day Lessons From Hiroshima,"May 10, 2024",https://www.motherjones.com/politics/2024/05/hiroshima-nagasaki-modern-day-lessons-nuclear-weapons-our-land/
The GOP’s Grand Plan: Minority Rule,"April 24, 2024",https://www.motherjones.com/politics/2024/04/ari-berman-interview-minority-rule-gop-republicans-founders/
,,https://www.motherjones.com/environment/2024/06/reveal-arizona-water-the-grab/
,,https://www.motherjones.com/politics/2024/06/how-a-battle-over-solar-power-tore-one-new-york-community-apart/
,,https://www.motherjones.com/politics/2024/05/not-all-votes-are-created-equal/
,,https://www.motherjones.com/criminal-justice/2024/05/reveal-santa-barbara-isla-vista-mass-shooting-elliot-rodger-mother/
Alex Jones Is Liquidating His Assets to Pay Sandy Hook Families,Russ Choma,https://www.motherjones.com/politics/2024/06/alex-jones-liquidating-assets-sandy-hook/
Mexico’s Next President Is a Climate Scientist—and a Fossil Fuel Supporter,Martha Pskowski,https://www.motherjones.com/politics/2024/06/mexico-claudia-sheinbaum-president-climate-scientist-fossil-fuel-supporter/
Obscure Court System Doles Out Billions in Public Money to Private Interests,Arthur Neslen,https://www.motherjones.com/environment/2024/06/isds-investor-state-court-billions-private-corporations/
Report: Utility Costs Will Skyrocket Across the US This Summer,Aliya Uteuova,https://www.motherjones.com/environment/2024/06/report-utility-costs-will-skyrocket-across-the-us-this-summer/
Oklahoma Takes a Step to Help Incarcerated Survivors of Domestic Violence,Samantha Michaels,https://www.motherjones.com/politics/2024/05/oklahoma-takes-a-step-to-help-incarcerated-survivors-of-domestic-violence/
"Under Glenn Youngkin, Parole in Virginia Has Nearly Vanished",Isabela Dias,https://www.motherjones.com/criminal-justice/2024/05/under-glenn-youngkin-parole-in-virginia-has-nearly-vanished-prisons-second-chance-bolts/
Lost in the Crowd: The Hidden Biases of Medical Fundraising,Julia Métraux,https://www.motherjones.com/politics/2024/05/nora-kenworthy-crowded-out-gofundme-health-care-crowdfunding/
This Majority-Black City Has a Water Crisis That Privatization Won’t Fix,Lylla Younes,https://www.motherjones.com/politics/2024/05/jackson-mississippi-black-water-crisis-privatization-epa/
Texas Is Letting a Maternal-Mortality Skeptic Investigate Maternal Mortality,Nina Martin,https://www.motherjones.com/politics/2024/05/texas-is-letting-a-maternal-mortality-skeptic-investigate-maternal-mortality/
Dobbs Had the Opposite Effect Conservatives Intended,Julianne McShane,https://www.motherjones.com/politics/2024/05/dobbs-had-the-opposite-effect-conservatives-intended/
Carvell Wallace on Life and Love and Coming of Age in a Cruel World,Carvell Wallace,https://www.motherjones.com/media/2024/05/carvell-wallace-another-word-love-memoir-book-excerpt/
Learning to Love My Trans Self After Conversion Therapy,Henry Carnell,https://www.motherjones.com/politics/2024/05/lgbtq-anti-trans-conversion-therapy-christianity/
,,https://www.motherjones.com/politics/2024/06/how-q-became-everything-big-feature-wayfair-balenciaga/
,,https://www.motherjones.com/politics/2024/05/conversion-therapy-lgbtq-anti-trans-gay-gender-affirming-care/
,,https://www.motherjones.com/criminal-justice/2023/10/foster-kids-psychiatric-hospitals-universal-health-services-uhs-alaska-cps/
,,https://www.motherjones.com/politics/2023/09/unhoused-california-photo-essay/
Report: The NYPD Is Trying to Revoke Trump’s Concealed Carry Permit,Julianne McShane,https://www.motherjones.com/politics/2024/06/nypd-trump-gun-revoke/
"Who Can Own a Gun? Hunter Biden’s Trial Highlights Inconsistent, Messy Laws.",Julia Métraux,https://www.motherjones.com/politics/2024/05/hunter-biden-trial-gun-rights-mental-health/
Our Fixation on Forests as a Climate Solution Is Causing Problems,Kate Yoder,https://www.motherjones.com/environment/2024/05/forests-carbon-sequestration-climate-solutions-indigenous-people/
Environmentalists Are Having a Cow Over Tyson Foods’ “Climate Friendly” Beef,Georgina Gustin,https://www.motherjones.com/politics/2024/05/usda-tyson-foods-label-brazen-beef-climate-friendly/
RFK Jr. Is Even Crazier Than You Might Think,David Corn,https://www.motherjones.com/politics/2024/05/robert-kennedy-jr-conspiracy-theory-covid-pandemic-event-201/
North Carolina’s Protest Crackdown Now Includes a Ban on N95s,Julia Métraux,https://www.motherjones.com/politics/2024/05/north-carolina-mask-ban-palestine-campus-protests-covid-immunocompromised/
Biden Is Gutting Asylum. The Right Still Called It “Mass Amnesty” for “Illegals.”,Isabela Dias,https://www.motherjones.com/politics/2024/06/biden-is-gutting-asylum-the-right-still-called-it-mass-amnesty-for-illegals/
What Happens to a Dream Deferred?,Isabela Dias,https://www.motherjones.com/politics/2024/06/daca-dreamers-trump-biden-obama-boder-crisis/
