title,byline,url
What Biden Would Do if He Were Serious About Ending the War in Gaza,Noah Lanard,https://www.motherjones.com/politics/2024/03/joe-biden-israel-gaza-war-netanyahu-rafah-palestinians/
What Biden Would Do if He Were Serious About Ending the War in Gaza,Noah Lanard,https://www.motherjones.com/politics/2024/03/joe-biden-israel-gaza-war-netanyahu-rafah-palestinians/
"Oakland’s Progressive DA Just Wants to Do Her Job. In an Age of Recalls, That Job Is Changing.",Samantha Michaels,https://www.motherjones.com/politics/2024/03/pamela-price-da-progressive-prosecutor-recall-campaign/
Firms That Once Called Themselves “Sustainable” Are Now “Greenhushing”,Kiley Price,https://www.motherjones.com/politics/2024/03/corporations-sustainability-woke-greenwashing-greenhushing/
"If Trump Wants to Curb Medicare Fraud, Why Did He Free This Fraudster From Prison?",Michael Mechanic,https://www.motherjones.com/politics/2024/03/philip-esformes-donald-trump-clemency-medicare-fraudif/
Trump Can’t Afford to Post Bond in His Fraud Case,Russ Choma,https://www.motherjones.com/politics/2024/03/trump-cant-afford-to-post-bond-in-his-fraud-case/
Trump Considers Adding Paul Manafort—a “Grave Counterintelligence Threat”—to His Campaign,David Corn,https://www.motherjones.com/politics/2024/03/trump-considers-adding-paul-manafort-a-grave-counterintelligence-threat-to-his-campaign/
This Is a “Solvable” Crisis: Denver’s Mayor on How the City Is Handling Migrant Arrivals,Isabela Dias,https://www.motherjones.com/politics/2024/03/denver-mayor-mike-johnston-migrant-arrivals-greg-abbott-busing-border-bill/
,,https://www.motherjones.com/politics/2024/03/naacp-nazism-derrick-johnson-trump-biden/
,,https://www.motherjones.com/politics/2024/03/lara-trump-is-all-about-meritocracy/
,,https://www.motherjones.com/mojo-wire/2024/02/trump-sneakers-fox-racism-video/
,,https://www.motherjones.com/politics/2024/01/a-crash-course-on-yemen-are-bidens-attacks-on-the-houthis-the-solution/
Biden Promised Not to Finance Fossil Fuels. So Why Is the US Backing a Huge Gas Project?,Russ Choma,https://www.motherjones.com/environment/2024/03/biden-promised-not-to-finance-fossil-fuels-so-why-is-the-us-backing-a-huge-gas-project/
Why the Big Lie Is Still Dominating Wisconsin Politics,Ari Berman,https://www.motherjones.com/politics/2024/03/wisconsin-vos-supreme-court-trump/
What the Fani Willis Ruling Says About the Criminal Justice System,Jeremy Schulman,https://www.motherjones.com/politics/2024/03/fani-willis-trump-fulton-county-georgia-mcafee/
Russians Found a Different Way to Make Their Votes Matter,Ari Berman,https://www.motherjones.com/politics/2024/03/russians-putin-election-nalvalny-protest/
"“You’re Not Doing a Prank,” Tucker Carlson Tells Man Pranking Him",Daniel Moattar,https://www.motherjones.com/politics/2024/03/tucker-carlson-royal-prank-kate-middleton-palace-photo/
No One Wants to Go to GOP Spring Break,Inae Oh,https://www.motherjones.com/mojo-wire/2024/03/republican-retreat-hate-each-other/
Biden’s “An Illegal” Remark Is More Than Just a Slip,Isabela Dias,https://www.motherjones.com/mojo-wire/2024/03/biden-illegal-laken-riley-georgia-state-of-the-union-slip/
YouTube’s Austin Ambitions Aren’t Going Well. Just Ask These Workers.,Arianna Coghill,https://www.motherjones.com/mojo-wire/2024/03/youtube-austin-livestream-layoff/
Trump’s Back on Top. This Is Not Fine.,"March 10, 2024",https://www.motherjones.com/politics/2024/03/trumps-back-on-top-this-is-not-fine/
It Can Happen Here,"March 1, 2024",https://www.motherjones.com/politics/2024/03/it-can-happen-here-trump-authoritarianism-fascism/
Joe Biden’s Age Is an Issue. So Is How the Media Covers It.,"February 13, 2024",https://www.motherjones.com/politics/2024/02/joe-bidens-age-is-an-issue-so-is-how-the-media-cover-it/
Inside the Movement to Ban Lab-Grown Meat,Wyatt Myskow and Lee Hedgepeth,https://www.motherjones.com/politics/2024/03/inside-the-movement-to-ban-lab-grown-meat/
The GOP Is Too Scared to Let South Dakota Vote on Abortion,Madison Pauly,https://www.motherjones.com/politics/2024/03/south-dakota-republican-abortion-ballot-measure-noem-gop-choice/
Fires Imperil the Future of the Amazon Rainforest,Quentin Septer,https://www.motherjones.com/environment/2024/03/fires-imperil-the-future-of-the-amazon-rainforest/
This Was the Hottest Winter on Record—but What Does That Mean?,Oliver Milman and Dharna Noor,https://www.motherjones.com/environment/2024/03/this-was-the-hottest-winter-on-record-what-does-that-mean/
"The Crumbleys Have Been Convicted. Black Parents Will Likely Pay a Price, Too.",Nia t. evans,https://www.motherjones.com/criminal-justice/2024/03/james-jennifer-ethan-crumbley-oxfor-michigan-school-shooting/
This Week’s Episode of Reveal: How to Catch a Corrupt Philly Cop,Jamilah King,https://www.motherjones.com/criminal-justice/2024/03/this-weeks-episode-of-reveal-how-to-catch-a-corrupt-philly-cop/
Elon Musk Keeps Spreading a Very Specific Kind of Racism,Arianna Coghill and Garrison Hayes,https://www.motherjones.com/politics/2024/03/elon-musk-racist-tweets-science-video/
"Texas School Can Suspend Black Student for His Hair, Court Rules",Arianna Coghill,https://www.motherjones.com/mojo-wire/2024/02/texas-school-can-suspend-black-student-for-his-hair-court-rules/
Let’s Not Take Over-the-Counter Birth Control Pills for Granted,Jackie Flynn Mogensen,https://www.motherjones.com/politics/2024/03/the-pill-drugstore-birth-control-elaine-tyler-may/
What if Everything We Are Told to Think About Periods Is Wrong?,Maddie Oatman,https://www.motherjones.com/politics/2024/03/periods-menstruation-jen-gunter-stigma-patriarchy-blood-abortion/
"Telehealth Abortions Continue to Rise—Even in Banned States, A New Study Shows",Julianne McShane,https://www.motherjones.com/politics/2024/02/telehealth-abortions-continue-to-rise-even-in-banned-states-a-new-study-shows/
What Happens If We Actually Treat Fetuses Like People?,Katie Herchenroeder,https://www.motherjones.com/politics/2024/02/alabama-supreme-court-decision-fetal-personhood-michele-goodwin/
,,https://www.motherjones.com/politics/2024/03/american-labor-ehrp-mother-jones-magnum-photography/
,,https://www.motherjones.com/politics/2024/02/domestic-violence-work-dobbs-roe/
,,https://www.motherjones.com/criminal-justice/2023/10/foster-kids-psychiatric-hospitals-universal-health-services-uhs-alaska-cps/
,,https://www.motherjones.com/politics/2023/09/unhoused-california-photo-essay/
School Shooter’s Mother Convicted in Historic Manslaughter Trial,Mark Follman,https://www.motherjones.com/politics/2024/02/jennifer-crumbley-trial-oxford-school-shooting-michigan/
"Abbott: Texas Would Shoot Migrants, But Biden “Would Charge Us With Murder”",Julianne McShane,https://www.motherjones.com/politics/2024/01/greg-abbott-texas-shoot-migrants-border-biden-murder/
Some Academics Get Funding for Propping Up the Livestock Industry,Georgina Gustin,https://www.motherjones.com/environment/2024/03/some-academics-get-funding-for-propping-up-the-livestock-industry/
Banned Wildlife Products Are Rampant on Facebook Marketplace,Marina Wang,https://www.motherjones.com/environment/2024/03/banned-illegal-wildlife-products-poaching-facebook-marketplace/
Is It Illegal For the White House to Fight COVID Misinfo? Up to SCOTUS.,Julia Métraux,https://www.motherjones.com/politics/2024/02/is-it-illegal-for-the-white-house-to-fight-covid-misinfo-up-to-scotus/
The Internet’s Favorite Supplement Titan Appears to Be Taking Cues From a Psychic,Kiera Butler,https://www.motherjones.com/politics/2024/02/joseph-mercola-the-internets-favorite-supplement-titan-appears-to-be-taking-cues-from-a-psychic/
The Migrant Families Separated Under Trump Are Still in Legal Limbo,Isabela Dias,https://www.motherjones.com/politics/2024/02/migrant-families-trump-zero-tolerance-six-years-later/
The GOP Border Bill Would Deport Families of Child Migrants,Nina Wang,https://www.motherjones.com/politics/2024/02/hr2-child-migrants-immigration/
