title,byline,url
Ron DeSantis Is All In—on Creating an American Autocracy,Pema Levy,https://www.motherjones.com/politics/2023/05/ron-desantis-autocracy/
Ron DeSantis Is All In—on Creating an American Autocracy,Pema Levy,https://www.motherjones.com/politics/2023/05/ron-desantis-autocracy/
Henry Kissinger at 100: Still a War Criminal,David Corn,https://www.motherjones.com/politics/2023/05/henry-kissinger-at-100-still-a-war-criminal/
John Durham’s Report Used Sketchy Intelligence That Might Be Russian Disinformation,Dan Friedman,https://www.motherjones.com/politics/2023/05/john-durhams-report-used-sketchy-intelligence-that-might-be-russian-disinformation/
The Supreme Court Made Just About Everyone Happy for Once,Noah Lanard,https://www.motherjones.com/politics/2023/05/tyler-v-hennepin-supreme-court-roberts-jackson-gorsuch/
"Most of Chevron’s Carbon Offsets Are “Worthless” or Worse, Report Says",Nina Lakhani,https://www.motherjones.com/environment/2023/05/chevron-carbon-offsets-worthless-net-zero-emissions-report-oil-gas-industry/
Death by Debt,Hannah Levintova,https://www.motherjones.com/politics/2023/05/student-loan-debt-cancellation-supreme-court-jessica-madison-collective/
Professor Association Blasts Florida’s “Unparalleled” Assault on Higher Education,Isabela Dias,https://www.motherjones.com/politics/2023/05/professor-association-blasts-floridas-unparalleled-assault-on-higher-education/
The Uvalde Massacre Could Have Been Prevented,Mark Follman,https://www.motherjones.com/politics/2023/05/uvalde-robb-elementary-mass-shooting-anniversary-police-investigation-threat-assessment/
Donald Trump Can’t Keep His Mouth Shut. It’s Getting Him in Trouble.,Russ Choma,https://www.motherjones.com/politics/2023/05/donald-trump-cant-keep-his-mouth-shut-its-getting-him-in-trouble/
"As Ocean Oxygen Levels Dip, Fish Face an Uncertain Future",Nicola Jones,https://www.motherjones.com/environment/2023/05/ocean-oxygen-levels-fish-marine-life-global-warming-climate/
,,https://www.motherjones.com/politics/2023/05/ron-desantis-laws/
,,https://www.motherjones.com/politics/2023/05/video-clarence-thomas-scandals-harlan-crow-billionaire-black-nationalism/
,,https://www.motherjones.com/politics/2023/04/fox-news-fired-tucker-carlson-response-same-old-bs/
Welcome to Hell,Abigail Weinberg,https://www.motherjones.com/mojo-wire/2023/05/welcome-to-hell-trump-desantis-2024-instagram-ai-video/
Buying Kevin McCarthy’s Used Chapstick Is Actually Totally Normal,Inae Oh,https://www.motherjones.com/mojo-wire/2023/05/kevin-mccarthy-marjorie-taylor-greene-chapstick/
NAACP Warns Black People Against Traveling to Ron DeSantis’ Florida,Arianna Coghill,https://www.motherjones.com/mojo-wire/2023/05/naacp-warns-black-people-from-traveling-to-ron-desantis-florida/
Experiencing Space Flight Just Got a Lot More Accessible,Daniel King,https://www.motherjones.com/recharge/2022/12/space-flight-portal/
"Remembering George Pérez, a Superhero of Superhero Comics",Dan Spinelli,https://www.motherjones.com/recharge/2022/05/remembering-george-perez-a-superhero-of-superhero-comics/
Ukrainian and Russian Dancers Join Onstage (in Italy) to Fundraise for the Red Cross,Daniel King,https://www.motherjones.com/recharge/2022/04/ukrainian-russian-antiwar-ballet-dancers-for-peace/
Republicans Are Trying to Seize Control Over Voting in Texas’ Largest Democratic County,Ari Berman,https://www.motherjones.com/politics/2023/05/texas-republicans-just-passed-bills-to-takeover-voting-harris-county-houston/
Ron DeSantis Would Love to Borrow Your Plane,Tim Murphy,https://www.motherjones.com/politics/2023/05/ron-desantis-would-love-to-borrow-your-plane/
Western States Pull Colorado River Deal Out of the Hat,Jake Bittle,https://www.motherjones.com/environment/2023/05/colorado-river-deal-drought-2023/
"Fossil Fuel Firms Owe $209 Billion a Year in Climate Reparations, Study Says",Nina Lakhani,https://www.motherjones.com/environment/2023/05/fossil-fuel-climate-reparations-study/
Bolsonaro Allegedly Falsified His Vaccination Status to Enter the US,Isabela Dias,https://www.motherjones.com/politics/2023/05/bolsonaro-allegedly-falsified-his-vaccination-status-to-enter-the-us/
The Coming Tidal Wave of Right Wing Covid Lawsuits,Kiera Butler,https://www.motherjones.com/politics/2023/04/the-coming-tidal-wave-of-right-wing-covid-lawsuits/
One Simple Way to Slash Methane Pollution: Composting,Max Graham,https://www.motherjones.com/environment/2023/05/methane-emissions-reduction-landfill-composting-study/
Alaskan Fishing Boats Are Poaching Threatened Canadian Salmon,Rochelle Baker,https://www.motherjones.com/politics/2023/05/alaska-fishing-boats-poaching-canadian-salmon/
Daniel Penny Claims He Can’t Be Racist Because He Planned a Trip to Africa,Arianna Coghill,https://www.motherjones.com/crime-justice/2023/05/daniel-penny-trip-to-africa-racism/
She Filmed a Teacher Saying the N-Word. Then She Got Suspended For It.,Arianna Coghill,https://www.motherjones.com/crime-justice/2023/05/mary-walton-missouri-n-word-suspended/
The Republican War on Alejandro Mayorkas—the Man With the Most Impossible Job in DC,Isabela Dias,https://www.motherjones.com/politics/2023/05/the-republican-war-on-alejandro-mayorkas-the-man-with-the-most-impossible-job-in-dc/
The DOJ Just Moved to Stop Florida’s “Sabotage” of Biden’s Border Plans,Jackie Flynn Mogensen,https://www.motherjones.com/politics/2023/05/the-doj-just-moved-to-stop-floridas-sabotage-of-bidens-border-plans/
,,https://www.motherjones.com/politics/2023/05/utahs-suicide-pact-with-the-fossil-fuel-industry/
,,https://www.motherjones.com/media/2023/04/asphalt-video-games-microtransactions-loot-boxes-in-game-purchases-capitalism/
,,https://www.motherjones.com/politics/2023/03/anti-trans-transgender-health-care-ban-legislation-bill-minors-children-lgbtq/
,,https://www.motherjones.com/crime-justice/2023/03/who-killed-rasheem-carter/
NAACP Warns Black People Against Traveling to Ron DeSantis’ Florida,Arianna Coghill,https://www.motherjones.com/mojo-wire/2023/05/naacp-warns-black-people-from-traveling-to-ron-desantis-florida/
Daniel Penny Claims He Can’t Be Racist Because He Planned a Trip to Africa,Arianna Coghill,https://www.motherjones.com/crime-justice/2023/05/daniel-penny-trip-to-africa-racism/
She Filmed a Teacher Saying the N-Word. Then She Got Suspended For It.,Arianna Coghill,https://www.motherjones.com/crime-justice/2023/05/mary-walton-missouri-n-word-suspended/
"Louisiana Lawmakers Want to Release Youth Criminal Records. But First, Only In Majority Black Areas.",Jackie Flynn Mogensen,https://www.motherjones.com/politics/2023/05/louisiana-lawmakers-want-to-release-youth-criminal-records-but-first-only-in-majority-black-areas/
