title,byline,url
How an Army of Volunteers Has Welcomed Immigrants in Poland—After the Government Wouldn’t,Molly Schwartz,https://www.motherjones.com/politics/2022/04/army-of-volunteers-welcoming-ukrainian-immigrants-in-poland/
How an Army of Volunteers Has Welcomed Immigrants in Poland—After the Government Wouldn’t,Molly Schwartz,https://www.motherjones.com/politics/2022/04/army-of-volunteers-welcoming-ukrainian-immigrants-in-poland/
The Big Joke Behind Sarah Palin’s Congressional Bid,David Corn,https://www.motherjones.com/politics/2022/04/the-big-joke-behind-sarah-palins-congressional-bid/
Wimbledon’s Russia Ban Is a Huge Net Loss,Dan Spinelli,https://www.motherjones.com/politics/2022/04/wimbledon-tennis-ban-russians-medvedev-rublev/
"A New List of Crazy Shit Trump Did, According to Fiona Hill",Abigail Weinberg,https://www.motherjones.com/mojo-wire/2022/04/trump-fiona-hill-russia-ukraine-wind-turkish-prisons-secretary/
Why the Hell Isn’t Jared Kushner’s $2 Billion Saudi Payment a Big Scandal?,David Corn,https://www.motherjones.com/politics/2022/04/why-the-hell-isnt-jared-kushners-2-billion-saudi-payment-a-big-scandal/
Stanford Threatens to Cut Health Care for Nurses Who Go on Strike,Emily Hofstaedter,https://www.motherjones.com/politics/2022/04/stanford-nurses-health-care-strike-lose-benefits-covid/
Tesla to Racism Lawsuit: You’re Acting Like Elon Musk,Inae Oh,https://www.motherjones.com/mojo-wire/2022/04/tesla-racism-lawsuit/
Report: Democratic Party to Ban Consultants From Union-Busting,Noah Y. Kim,https://www.motherjones.com/politics/2022/04/report-democratic-party-to-ban-consultants-from-union-busting/
The Agonizing Life of a College Student in Ukraine,Azad Mamedov as told to Isabela Dias,https://www.motherjones.com/politics/2022/04/the-agonizing-life-of-a-college-student-in-ukraine/
Alex Jones’s InfoWars Files for Bankruptcy Amid Sandy Hook Lawsuits,Noah Y. Kim,https://www.motherjones.com/mojo-wire/2022/04/alex-jones-infowars-files-for-bankruptcy-amid-sandy-hook-lawsuits/
,,https://www.motherjones.com/mojo-wire/2022/03/donald-trump-talked-about-his-true-enemy-when-asked-about-russias-invasion-of-ukraine-windmills/
,,https://www.motherjones.com/politics/2022/03/john-bolton-donald-trump-ukraine-russia-putin/
,,https://www.motherjones.com/politics/2022/03/no-that-putin-video-didnt-use-a-green-screen-misinformation/
Now We’re Getting Rid of Masks on Planes—Just as Covid Is Spiking Again,Inae Oh,https://www.motherjones.com/mojo-wire/2022/04/covid-plane-mask-mandate/
Leaked Texts Show Senator Mike Lee Pathetic,Noah Y. Kim,https://www.motherjones.com/mojo-wire/2022/04/mike-lee-donald-trump-january-6-texts-coup/
Report: Senators and Former Staffers Say Dianne Feinstein Cannot Fulfill Her Duties,Abigail Weinberg,https://www.motherjones.com/mojo-wire/2022/04/dianne-feinstein-88-senate-memory-report/
Ukrainian and Russian Dancers Join Onstage (in Italy) to Fundraise for the Red Cross,Daniel King,https://www.motherjones.com/recharge/2022/04/ukrainian-russian-antiwar-ballet-dancers-for-peace/
"Mass Shootings Persist, But a New Book Brings Hope and Science to Grappling With Their Prevention",Daniel King,https://www.motherjones.com/recharge/2022/04/mass-shooting-prevention-trigger-points/
"Yeah, I’m Gonna Need You to Go Ahead and Celebrate Michael Boltons’ Birthdays",Daniel King,https://www.motherjones.com/recharge/2022/02/office-space-michael-bolton-assclown-david-herman-birthday/
EPA Has Finally Opened Civil Rights Investigations Over Pollution in “Cancer Alley”,Oliver Laughland,https://www.motherjones.com/politics/2022/04/epa-has-finally-opened-civil-rights-investigations-over-pollution-in-cancer-alley/
​​Oceans Aren’t Just Warming—Their Soundscapes Are Transforming,Matt Simon,https://www.motherjones.com/politics/2022/04/oceans-arent-just-warming-their-soundscapes-are-transforming/
Biden Is Opening Up Public Lands to More Oil and Gas Leasing,Abigail Weinberg,https://www.motherjones.com/environment/2022/04/biden-drilling-federal-land-gas-prices-ukraine/
Can the US Go Green Without Destroying Sacred Native Lands?,Maddie Oatman,https://www.motherjones.com/environment/2022/04/copper-oak-flat-apache-stronghold-sacred-run-electric-car-batteries-green-energy/
"Science Confirms That When White People Read About Covid Racial Disparities, They Respond Selfishly",Jackie Flynn Mogensen,https://www.motherjones.com/politics/2022/04/covid-racial-disparities-study-white-reaction/
"With Emergency SNAP Benefits Ending, a Hunger Cliff Looms",Bridget Huber,https://www.motherjones.com/food/2022/04/with-emergency-snap-benefits-ending-a-hunger-cliff-looms/
Big Apps Made a Meal Out of Local Restaurants. Food Delivery Co-Ops Are Fighting Back.,Dean Kuipers,https://www.motherjones.com/food/2022/04/delivery-apps-grubhub-ubereats-doordash-coop-food-tech/
"As Russia’s Invasion Roils Supply Chains, the World Grows Hungrier",Tom Philpott,https://www.motherjones.com/food/2022/04/russia-ukraine-wheat-fertilizer-invasion-natural-gas-energy-hunger/
"The Long, Scary History of Doctors Reporting Pregnant People to the Cops",Cecilia Nowell,https://www.motherjones.com/crime-justice/2022/04/self-induced-abortion-herrera-texas-murder-hospital/
"New Data Shows Who, Exactly, Got Evicted the Most During the Pandemic",Edwin Rios,https://www.motherjones.com/crime-justice/2022/04/eviction-coronavirus-racism-california/
Ukrainian Refugees Are Being Embraced by Europe. Why Weren’t Syrians?,Isabela Dias,https://www.motherjones.com/politics/2022/03/ukrainian-refugees-are-being-embraced-by-europe-why-werent-syrians/
Democratic Senators Also Don’t Get Why Biden Is Still Using a Cruel Trump-Era Border Policy,Fernanda Echavarri,https://www.motherjones.com/politics/2022/03/democratic-senators-schumer-menendez-biden-end-title-42/
,,https://www.motherjones.com/crime-justice/2022/04/mass-shootings-behavioral-threat-assessment-oxford-high-school-trigger-points/
,,https://www.motherjones.com/crime-justice/2022/04/abolish-child-protective-services-torn-apart-dorothy-roberts-book-excerpt/
,,https://www.motherjones.com/politics/2022/04/hunter-biden-laptop-guo-wengui-bannon-giuliani/
,,https://www.motherjones.com/politics/2022/03/chess-grandmasters-putin-russia-ukraine-war/
January 6 Reckoning: CNN’s Jake Tapper Says the Media Must Confront Republicans’ Big Lie,Abigail Weinberg,https://www.motherjones.com/media/2021/07/january-6-insurrection-capitol-cnn-jake-tapper-podcast/
We Need to Understand How We Got to January 6 Before We Can Move Forward,Fernanda Echavarri,https://www.motherjones.com/politics/2021/06/podcast-january-6-qanon-history-whats-next/
A Radical Idea for Forcing Vaccine Companies to Share Knowledge With the World,Molly Schwartz and Jamilah King,https://www.motherjones.com/politics/2021/05/vaccine-patents-biden-covid-india-dean-baker-pandemic/
,,https://podcasts.apple.com/us/podcast/the-mother-jones-podcast/id1386408605
