title,byline,url
It Can Happen Here,David Corn,https://www.motherjones.com/politics/2024/03/it-can-happen-here-trump-authoritarianism-fascism/
It Can Happen Here,David Corn,https://www.motherjones.com/politics/2024/03/it-can-happen-here-trump-authoritarianism-fascism/
US Cities Could Be Capturing Billions of Gallons of Water Per Day,Matt Simon,https://www.motherjones.com/environment/2024/03/us-cities-could-capture-billions-gallons-rain-water-conservation-drought/
Walgreens and CVS Will Sell the Abortion Pill—and the Pill’s Investors Could Make Bank,Hannah Levintova,https://www.motherjones.com/politics/2024/03/walgreens-cvs-abortion-pill-mifepristone-private-equity-investors/
Nex Benedict’s Death Triggers Federal Investigation,Arianna Coghill,https://www.motherjones.com/criminal-justice/2024/03/nex-benedict-federal-education/
This Week’s Episode of Reveal: How to Catch a Corrupt Philly Cop,Jamilah King,https://www.motherjones.com/criminal-justice/2024/03/this-weeks-episode-of-reveal-how-to-catch-a-corrupt-philly-cop/
How Todd Akin’s “Legitimate Rape” Debacle Previewed the Abortion Agenda of Today’s GOP,Pema Levy,https://www.motherjones.com/politics/2024/03/todd-akin-abortion/
Donald Trump Has One Week Left to Pay E. Jean Carroll. But Will He?,Inae Oh,https://www.motherjones.com/politics/2024/03/donald-trump-pay-e-jean-carroll/
,,https://www.motherjones.com/mojo-wire/2024/02/trump-sneakers-fox-racism-video/
,,https://www.motherjones.com/politics/2024/01/a-crash-course-on-yemen-are-bidens-attacks-on-the-houthis-the-solution/
,,https://www.motherjones.com/politics/2023/11/henry-ford-antisemitism-jacob-schiff-money-kings/
,,https://www.motherjones.com/politics/2023/11/john-hagee-hitler-israel-rally-christian-zionist/
Trump Says Gov. Abbott Is “Absolutely” A Contender for Vice President,Julianne McShane,https://www.motherjones.com/politics/2024/03/trump-greg-abbott-vice-president-border-immigration/
Nikki Haley Joins GOP Colleagues in Suddenly Pivoting on IVF,Julianne McShane,https://www.motherjones.com/politics/2024/03/nikki-haley-joins-gop-colleagues-in-suddenly-pivoting-on-ivf/
Utility Fraud and Corruption Are Threatening the Clean Energy Transition,Mario Alejandro Ariza and Kristi E. Swartz,https://www.motherjones.com/politics/2024/03/utility-fraud-corruption-clean-energy-transition/
Supreme Court Hands Trump a Win and Delays His Election Subversion Prosecution,Pema Levy,https://www.motherjones.com/politics/2024/02/donald-trump-jack-smith-immunity-supreme-court/
Washington State’s Biggest Private-Sector Union Backs “Uncommitted” Democratic Vote,Julianne McShane,https://www.motherjones.com/politics/2024/02/washington-state-ufcw-union-democrats-uncommitted-biden/
"Ohio GOP Candidate JR Majewski Used a Slur, Considered Dropping Out (Again), But Will Stay in the Race",Julia Métraux,https://www.motherjones.com/politics/2024/02/ohio-gop-candidate-jr-majewski-used-a-slur-considered-dropping-out-again-but-will-stay-in-the-race-disability/
Florida Man Facing 91 Criminal Counts Wins Michigan Primary,Jeremy Schulman,https://www.motherjones.com/politics/2024/02/trump-wins-michigan-primary-haley/
Some Michigan Democrats Plan to Vote “Uncommitted” to Send Biden a Message on Palestine,Julianne McShane,https://www.motherjones.com/politics/2024/02/michigan-uncomitted-joe-biden-primary-2024/
Joe Biden’s Age Is an Issue. So Is How the Media Covers It.,"February 13, 2024",https://www.motherjones.com/politics/2024/02/joe-bidens-age-is-an-issue-so-is-how-the-media-cover-it/
Is Biden Shifting His Stance on Israel? Is It Too Late?,"February 4, 2024",https://www.motherjones.com/politics/2024/02/biden-trump-israel-palestine-ceasefire/
A Story of Mother Jones (the Labor Organizer) That’s Relevant a Century Later,"January 9, 2024",https://www.motherjones.com/politics/2024/01/mother-jones-west-virginia-coal-wars-john-kern-congress/
Not Even a Child’s Death Can Stop These Lawmakers From Spewing Hate,Henry Carnell,https://www.motherjones.com/politics/2024/03/nex-benedict-oklahoma-anti-trans-statement-lawmaker-chaya-woods-walters/
GAO Report Warns Climate Change Could Unearth US Nuclear Waste,Anita Hofschneider,https://www.motherjones.com/politics/2024/02/gao-report-climate-change-unearth-nuclear-waste-contamination-marshall-islands/
Should Israel Be Held Accountable for “Ecocide”?,Lylla Younes,https://www.motherjones.com/politics/2024/02/israel-accountable-ecocide-international-criminal-court-hague/
"Producers of “Forever Chemicals” Knew They Were Toxic, Say UN Experts",James Bruggers,https://www.motherjones.com/politics/2024/02/dupont-chemours-fayetteville-toxic-pfas-un-human-rights/
Alabama Has Carried Out Its First Nitrogen Gas Execution,Arianna Coghill,https://www.motherjones.com/criminal-justice/2024/01/alabama-has-carried-out-its-first-nitrogen-gas-execution/
A Dangerous Experiment in Executing Prisoners Is Happening Tonight in Alabama,Arianna Coghill,https://www.motherjones.com/criminal-justice/2024/01/alabama-plans-to-conduct-first-execution-using-nitrogen-gas-united-nations-torture/
"Texas School Can Suspend Black Student for His Hair, Court Rules",Arianna Coghill,https://www.motherjones.com/mojo-wire/2024/02/texas-school-can-suspend-black-student-for-his-hair-court-rules/
SCOTUS Ducks High School Diversity in Admissions Case,Pema Levy,https://www.motherjones.com/politics/2024/02/scotus-ducks-high-school-diversity-and-admissions-case/
"Telehealth Abortions Continue to Rise—Even in Banned States, A New Study Shows",Julianne McShane,https://www.motherjones.com/politics/2024/02/telehealth-abortions-continue-to-rise-even-in-banned-states-a-new-study-shows/
What Happens If We Actually Treat Fetuses Like People?,Katie Herchenroeder,https://www.motherjones.com/politics/2024/02/alabama-supreme-court-decision-fetal-personhood-michele-goodwin/
Anti-Trans Bills Keep Citing the New York Times,Henry Carnell,https://www.motherjones.com/media/2024/02/new-york-times-pamela-paul-anti-trans-bills/
Ohio Law Requires a Transgender Man to Use His Deadname on State Legislature Ballot,Abby Vesoulis,https://www.motherjones.com/politics/2024/02/ohio-law-requires-a-transgender-man-to-use-his-deadname-on-state-legislature-ballot/
,,https://www.motherjones.com/politics/2024/02/domestic-violence-work-dobbs-roe/
,,https://www.motherjones.com/politics/2024/02/bidens-israel-politics-are-alienating-young-campaign-volunteers/
,,https://www.motherjones.com/criminal-justice/2023/10/foster-kids-psychiatric-hospitals-universal-health-services-uhs-alaska-cps/
,,https://www.motherjones.com/politics/2023/09/unhoused-california-photo-essay/
School Shooter’s Mother Convicted in Historic Manslaughter Trial,Mark Follman,https://www.motherjones.com/politics/2024/02/jennifer-crumbley-trial-oxford-school-shooting-michigan/
"Abbott: Texas Would Shoot Migrants, But Biden “Would Charge Us With Murder”",Julianne McShane,https://www.motherjones.com/politics/2024/01/greg-abbott-texas-shoot-migrants-border-biden-murder/
Tribal Nations Are Taking Back Their Food Systems,Bridget Huber,https://www.motherjones.com/food/2024/02/tribal-food-sovereignty-oneida-nation-wisconsin-bison-farm-bill-self-determination/
US Agricuture Secretary “Concerned About the State of Agriculture”,Georgina Gustin,https://www.motherjones.com/food/2024/02/agricuture-secretary-tom-vilsack-state-agriculture-census-usda/
Is It Illegal For the White House to Fight COVID Misinfo? Up to SCOTUS.,Julia Métraux,https://www.motherjones.com/politics/2024/02/is-it-illegal-for-the-white-house-to-fight-covid-misinfo-up-to-scotus/
The Internet’s Favorite Supplement Titan Appears to Be Taking Cues From a Psychic,Kiera Butler,https://www.motherjones.com/politics/2024/02/joseph-mercola-the-internets-favorite-supplement-titan-appears-to-be-taking-cues-from-a-psychic/
The Migrant Families Separated Under Trump Are Still in Legal Limbo,Isabela Dias,https://www.motherjones.com/politics/2024/02/migrant-families-trump-zero-tolerance-six-years-later/
The GOP Border Bill Would Deport Families of Child Migrants,Nina Wang,https://www.motherjones.com/politics/2024/02/hr2-child-migrants-immigration/
