title,byline,url
The World Is Running Out of Fresh Water Fast,Fiona Harvey,https://www.motherjones.com/environment/2023/03/shortage-fresh-water-global-demand-study/
The World Is Running Out of Fresh Water Fast,Fiona Harvey,https://www.motherjones.com/environment/2023/03/shortage-fresh-water-global-demand-study/
Mike Flynn and MAGA Activists Wage War Against a Florida Hospital,Kiera Butler,https://www.motherjones.com/politics/2023/03/mike-flynn-and-maga-activists-wage-war-against-a-florida-hospital/
Steve Bannon Is Neck-Deep in Guo Wengui’s Allegedly Fraudulent Business Empire,Dan Friedman,https://www.motherjones.com/politics/2023/03/steve-bannon-is-neck-deep-in-guo-wenguis-allegedly-fraudulent-business-empire/
“This Was My Baby”: The Family of Black Man Killed By Cops While Experiencing Mental Crisis Speaks Out,Arianna Coghill,https://www.motherjones.com/crime-justice/2023/03/irvo-otieno-virginia-police-mental-illness-murder-black/
Why Didn’t Regulators See Silicon Valley Bank’s Collapse Coming?,Hannah Levintova,https://www.motherjones.com/politics/2023/03/silicon-valley-bank-collapse-banking-system-fdic-federal-reserve/
Silicon Valley Finally Figured Out People Don’t Like It,Ali Breland,https://www.motherjones.com/politics/2023/03/silicon-valley-bank-big-tech/
The GOP Is Flirting With This Hungarian Autocrat’s Generous—And Exclusionary—Family Benefits,Abby Vesoulis,https://www.motherjones.com/politics/2023/03/republican-baby-boom-trump-vance-hungary/
Rich Nations Are Burying the Developing World in Plastic Waste,Joseph Winters,https://www.motherjones.com/environment/2023/03/rich-countries-nations-waste-plastic-exports-chemical-contamination/
MAGA Mogul Guo Wengui Charged in $1 Billion Fraud Scheme,Dan Friedman,https://www.motherjones.com/politics/2023/03/guo-wengui-indicted/
Bone Tired. Underpaid. Performing Surgery. What Could Go Wrong?,Nathan Kohrman,https://www.motherjones.com/politics/2023/03/medical-residents-sleep-time-off-medical-training-reform/
,,https://www.motherjones.com/politics/2023/03/anti-trans-transgender-health-care-ban-legislation-bill-minors-children-lgbtq/
,,https://www.motherjones.com/politics/2023/02/pastor-john-hagee-nikki-haley-donald-trump-gop-primary-extremism/
,,https://www.motherjones.com/politics/2023/01/ticketmaster-taylor-swift-monopoly-senate-hearing/
Ohio Is Suing Norfolk Southern,Abigail Weinberg,https://www.motherjones.com/mojo-wire/2023/03/ohio-is-suing-norfolk-southern/
Shut Up About “Woke.” I’m Trying to Actually Understand the Bank Collapse.,Abigail Weinberg,https://www.motherjones.com/mojo-wire/2023/03/silicon-valley-bank-woke-desantis-fox-news/
Admitted Liar George Santos: I Never Led a Giant Credit Card Skimming Scheme,Inae Oh,https://www.motherjones.com/mojo-wire/2023/03/admitted-liar-george-santos-i-never-led-a-giant-credit-card-skimming-scheme/
Experiencing Space Flight Just Got a Lot More Accessible,Daniel King,https://www.motherjones.com/recharge/2022/12/space-flight-portal/
"Remembering George Pérez, a Superhero of Superhero Comics",Dan Spinelli,https://www.motherjones.com/recharge/2022/05/remembering-george-perez-a-superhero-of-superhero-comics/
Ukrainian and Russian Dancers Join Onstage (in Italy) to Fundraise for the Red Cross,Daniel King,https://www.motherjones.com/recharge/2022/04/ukrainian-russian-antiwar-ballet-dancers-for-peace/
He’s the Most Popular President In the World. Everyone Hates Him.,Tim Murphy,https://www.motherjones.com/politics/2023/03/gianni-infantino-fifa-presidential-election-world-cup-qatar-soccer-football-human-rights/
Biden’s Approval of Alaska Oil Project Shows Inconsistency of Our First “Climate President”,Oliver Milman,https://www.motherjones.com/politics/2023/03/willow-project-joe-biden-approval-criticism-alaska-oil-gas-drilling-climate-president/
"Misuse of Phosphorus Is Wreaking Havoc, Scientists Warn",Robin McKie,https://www.motherjones.com/environment/2023/03/phosphorus-fertilizer-shortage-algae-dead-zones-environment-runoff/
Biden Approves Major Alaskan Oil Drilling Project,Arianna Coghill,https://www.motherjones.com/environment/2023/03/willow-project-alaska-biden/
The Far-Right Bounty Hunter Behind the Explosive Popularity of “Died Suddenly”,Kiera Butler,https://www.motherjones.com/politics/2023/02/stew-peters-the-far-right-bounty-hunter-behind-the-explosive-success-of-died-suddenly/
Jeff Zients to Replace Ron Klain as Biden’s Chief of Staff,Abigail Weinberg,https://www.motherjones.com/politics/2023/01/jeff-zients-to-replace-ron-klain-as-bidens-chief-of-staff/
State Legislatures Are Cracking Down on Foreign Land Ownership,Samuel Shaw,https://www.motherjones.com/politics/2023/03/state-legislatures-are-cracking-down-on-foreign-land-ownership/
"Finally, a Peek Into the Arctic Seed Vault That Could Save Humanity",Patrick Greenfield,https://www.motherjones.com/environment/2023/03/global-seed-vault-svalbard-arctic-virtual-tour/
South Carolina Woman Arrested for Allegedly Taking Abortion Pills,Arianna Coghill,https://www.motherjones.com/crime-justice/2023/03/south-carolina-woman-arrested-for-allegedly-taking-abortion-pills/
The Prison Professor,Abigail Glasgow,https://www.motherjones.com/crime-justice/2023/02/leo-hylton-prison-professor-incarceration-colby/
Ron DeSantis Wants to Make Transporting Migrants a Felony,Isabela Dias,https://www.motherjones.com/politics/2023/02/ron-desantis-wants-to-make-transporting-migrants-a-felony/
The New York Times Just Dropped a Shocking Investigation on Child Labor in America,Arianna Coghill,https://www.motherjones.com/politics/2023/02/new-york-times-child-labor-immigrant-kids/
,,https://www.motherjones.com/politics/2023/03/bannon-guo-ukraine-poland-new-federal-state-of-china/
,,https://www.motherjones.com/politics/2023/02/religious-clergy-fighting-for-abortion-rights/
,,https://www.motherjones.com/politics/2023/02/sam-bankman-fried-was-indicted-for-hundreds-of-illegal-campaign-donations-who-else-knew/
,,https://www.motherjones.com/politics/2023/01/we-tried-to-call-the-top-donors-to-george-santos-2020-campaign-many-dont-seem-to-exist/
“This Was My Baby”: The Family of Black Man Killed By Cops While Experiencing Mental Crisis Speaks Out,Arianna Coghill,https://www.motherjones.com/crime-justice/2023/03/irvo-otieno-virginia-police-mental-illness-murder-black/
Biden Approves Major Alaskan Oil Drilling Project,Arianna Coghill,https://www.motherjones.com/environment/2023/03/willow-project-alaska-biden/
South Carolina Woman Arrested for Allegedly Taking Abortion Pills,Arianna Coghill,https://www.motherjones.com/crime-justice/2023/03/south-carolina-woman-arrested-for-allegedly-taking-abortion-pills/
“We Do This as Parents”: Dwyane Wade and Gabrielle Union-Wade’s Emotional Call to Support Trans Kids,Madison Pauly,https://www.motherjones.com/media/2023/02/dwyane-wade-gabrielle-union-support-trans-kids/
