title,byline,url
Biden Administration Promises to Help School Districts That Defy DeSantis’ Mask Mandate Ban,Ali Breland,https://www.motherjones.com/politics/2021/08/biden-administration-promises-to-help-school-districts-that-defy-desantis-mask-mandate-ban/
Biden Administration Promises to Help School Districts That Defy DeSantis’ Mask Mandate Ban,Ali Breland,https://www.motherjones.com/politics/2021/08/biden-administration-promises-to-help-school-districts-that-defy-desantis-mask-mandate-ban/
A Small Group of Moderate Democrats Threaten to Derail Their Party’s Legacy,Kara Voght,https://www.motherjones.com/mojo-wire/2021/08/moderate-house-democrats-infrastructure-joe-biden/
Restorative Justice Won't Work Without This Crucial Piece,Madison Pauly,https://www.motherjones.com/politics/2021/08/restorative-justice-illinois-privilege-criminal/
"We’re Not Going to the Moon Anytime Soon, But Joe Biden Won’t Kill Trump’s Dream",AJ Vicens,https://www.motherjones.com/mojo-wire/2021/08/joe-biden-moon-nasa-donald-trump/
Big Pharma Keeps Trying to Convince Women They Need Libido Drugs,Teresa Carr,https://www.motherjones.com/environment/2021/08/big-pharma-women-libido-drugs-female-sexual-dysfunction-flibanserin-viagra/
FDA Approves Booster Vaccines for Immunocompromised as Delta Rages Across the Country,AJ Vicens,https://www.motherjones.com/mojo-wire/2021/08/fda-booster-vaccines-immunocompromised-covid-delta/
Infrastructure Bill Includes up to $8 Billion for “Clean” Tech Worse Than Coal,Oliver Milman,https://www.motherjones.com/environment/2021/08/joe-biden-infrastructure-bill-blue-hydrogen-worse-than-coal-study-emissions-climate-change/
America Still Hasn’t Processed Its Original Sin,Michael Mechanic,https://www.motherjones.com/media/2021/08/black-author-america-original-sin-legacy-slavery-clint-smith-book-how-word-passed/
Democrats Are Running Out of Time to Protect Voting Rights,Ari Berman,https://www.motherjones.com/politics/2021/08/democrats-are-running-out-of-time-to-protect-voting-rights/
Despair Not! Vaccination Rates Continue to Rise.,Sinduja Rangarajan,https://www.motherjones.com/politics/2021/08/despair-not-vaccination-rates-continue-to-rise/
,,https://www.motherjones.com/politics/2021/08/andrew-cuomo-resigns/
,,https://www.motherjones.com/politics/2021/07/january-6-hearing-police-testimony/
,,https://www.motherjones.com/politics/2021/07/anthony-fauci-covid-delta-vaccines/
It Sure Looks Like Marjorie Taylor Greene Is About to Get Permanently Banned From Twitter,Inae Oh,https://www.motherjones.com/mojo-wire/2021/08/marjorie-taylor-greene-twitter-ban/
Former Overstock CEO Patrick Byrne Gets Sued for Pushing Election Lies,AJ Vicens,https://www.motherjones.com/mojo-wire/2021/08/patrick-byrne-dominion-defamation/
The Senate Finally Passed an Infrastructure Bill. Here Comes the Hard Part.,Kara Voght,https://www.motherjones.com/mojo-wire/2021/08/infrastructure-joe-biden-senate-passes/
Did You Change Your Mind About COVID-19 Vaccines?,Daniel King,https://www.motherjones.com/recharge/2021/08/covid-vaccine-hesitancy-changing-our-minds/
Send Us Your Thoughts: Will Twitter Permanently Ban Marjorie Taylor Greene?,Daniel King,https://www.motherjones.com/recharge/2021/08/should-twitter-permanently-ban-marjorie-taylor-greene/
The Most Iconic Photo in Music History Inspires the Co-Naming of 126th Street in Harlem,Daniel King,https://www.motherjones.com/recharge/2021/08/great-day-in-harlem-jazz-photo-art-kane/
Who Is Mayim Bialik? A Terrible Choice for Jeopardy Host.,Kiera Butler,https://www.motherjones.com/politics/2021/08/who-is-mayim-bialik-a-terrible-choice-for-jeopardy-host/
QAnon Hero Claims to Present Sensitive Election Files at MyPillow CEO Event,AJ Vicens,https://www.motherjones.com/politics/2021/08/qanon-hero-claims-to-present-sensitive-election-files-at-mypillow-ceo-event/
Working for America’s Biggest Chicken Processor Is No Picnic,Nina Lakhani,https://www.motherjones.com/environment/2021/08/chicken-processor-tyson-foods-guardian-investigation-workers-environment-working-conditions-arkansas-monopoly/
Rufus the Dog Is Counting on Your Generosity. But So Is a Fundraising Firm With a Checkered Past.,Dan Spinelli,https://www.motherjones.com/environment/2021/08/spca-international-animal-charity-innovairre/
Louisiana Has Among the Highest Daily COVID Infections in the World,Edwin Rios,https://www.motherjones.com/coronavirus-updates/2021/08/louisiana-has-among-the-highest-daily-covid-infections-in-the-world/
"As COVID Breaks Records in Arkansas, Its GOP Governor Regrets Ban on Mask Mandates",Inae Oh,https://www.motherjones.com/coronavirus-updates/2021/08/covid-arkansas-asa-hutchinson-mask-madates/
The UN’s Big Climate Report Buried Some Bad News About Our Eating Habits,Tom Philpott,https://www.motherjones.com/food/2021/08/ipcc-report-methane-cows-oil-and-gas-emissions/
Is Lab Meat About to Hit Your Dinner Plate?,Tom Philpott,https://www.motherjones.com/food/2021/08/is-lab-meat-about-to-hit-your-dinner-plate/
Minneapolis Just Gave Some Coronavirus Relief Money to the Police,Samantha Michaels,https://www.motherjones.com/crime-justice/2021/08/minneapolis-just-gave-some-coronavirus-relief-money-to-the-police/
"Biden Said He’d Cut Incarceration in Half. So Far, the Federal Prison Population Is Growing.",Samantha Michaels,https://www.motherjones.com/crime-justice/2021/07/biden-said-hed-cut-incarceration-in-half-so-far-the-federal-prison-population-is-growing/
Trump Weaponized COVID Concerns Against Migrants. Families Are Still Being Brutalized by the Policy.,Isabela Dias,https://www.motherjones.com/politics/2021/07/trump-weaponized-covid-concerns-against-migrants-families-are-still-being-brutalized-by-the-policy/
“Not Necessary”: The Biden Administration Just Canceled More Border Wall Contracts,Hannah Levintova,https://www.motherjones.com/politics/2021/07/not-necessary-the-biden-administration-just-canceled-more-border-wall-contracts/
,,https://www.motherjones.com/politics/2021/08/purdue-pharma-american-medical-association-relationship-opioid-crisis-public-health/
,,https://www.motherjones.com/media/2021/07/hollywood-loves-rape-revenge-plots-but-what-story-are-they-really-telling/
,,https://www.motherjones.com/politics/2021/07/how-flint-closed-the-gap-between-black-and-white-suffering-under-covid/
,,https://www.motherjones.com/politics/2021/08/will-this-court-case-end-the-mining-industrys-150-year-dominance-of-the-west/
January 6 Reckoning: CNN’s Jake Tapper Says the Media Must Confront Republicans’ Big Lie,Abigail Weinberg,https://www.motherjones.com/media/2021/07/january-6-insurrection-capitol-cnn-jake-tapper-podcast/
We Need to Understand How We Got to January 6 Before We Can Move Forward,Fernanda Echavarri,https://www.motherjones.com/politics/2021/06/podcast-january-6-qanon-history-whats-next/
A Radical Idea for Forcing Vaccine Companies to Share Knowledge With the World,Molly Schwartz and Jamilah King,https://www.motherjones.com/politics/2021/05/vaccine-patents-biden-covid-india-dean-baker-pandemic/
,,https://podcasts.apple.com/us/podcast/the-mother-jones-podcast/id1386408605
