title,byline,url
"In Scathing Ruling, Federal Judge Orders Release of Liam Ramos From Detention",Katie Herchenroeder,https://www.motherjones.com/politics/2026/01/in-scathing-ruling-federal-judge-orders-release-of-liam-ramos-from-detention/
"In Scathing Ruling, Federal Judge Orders Release of Liam Ramos From Detention",Katie Herchenroeder,https://www.motherjones.com/politics/2026/01/in-scathing-ruling-federal-judge-orders-release-of-liam-ramos-from-detention/
Trump’s SNAP Rules Are About to Imperil Food Access for Millions,Katie Herchenroeder,https://www.motherjones.com/politics/2026/01/trumps-snap-rules-are-about-to-imperil-food-access-for-millions/
January Was a Warning of Where Trump Will Go Next,Pema Levy,https://www.motherjones.com/politics/2026/01/january-2026-bad-month-trump/
Get Out of Our Cities: Another Nationwide Uprising Against ICE,Katie Herchenroeder,https://www.motherjones.com/politics/2026/01/get-out-of-our-cities-another-nationwide-uprising-against-ice/
Federal Agents Just Arrested an Army Veteran—After He Protested ICE Outside a Church,Julia Lurie,https://www.motherjones.com/politics/2026/01/minneapolis-st-paul-army-veteran-protester-church-don-lemon/
"In a Warming World, Winter Olympics Organizers Will Have to Adapt",Kiley Price,https://www.motherjones.com/politics/2026/02/global-warming-winter-olympics-melting-snow-skiing-adaptation/
How Trumpism Is Trickling Down to Your Town,Reveal,https://www.motherjones.com/politics/2026/01/local-news-doge-solar-power-immigration-idaho-jacksonville-florida-tribal-nations/
,,https://www.motherjones.com/sponsored/10-worst-crises-you-wont-see-in-headlines-but-should/
,,https://www.motherjones.com/sponsored/the-movement-to-build-the-future-america-promised/
,,https://www.motherjones.com/politics/2026/01/minnesota-students-national-general-strike/
,,https://www.motherjones.com/politics/2026/01/trump-minneapolis-twin-cities-tyranny-boston-massacre-british-colonial-occupation-violence-revolution/
,,https://www.motherjones.com/politics/2026/01/rob-schenck-religious-right-immigration-minneapolis-minnesota-christian-nationalism/
,,https://www.motherjones.com/politics/2026/01/warrantless-ice-raid-memo-video-memphis-occupation-home-invasion/
Oregon Bill Would Tax Tourists to Protect Animals and Their Habitats,Amal Ahmed,https://www.motherjones.com/politics/2026/01/oregon-bill-tourism-tax-fund-conservation-species-protection/
RFK’s Overhauled Autism Committee Is Even Worse Than It Looks,Kiera Butler and Anna Merlan,https://www.motherjones.com/politics/2026/01/rfks-overhauled-interagency-autism-coordinating-committee-is-even-worse-than-it-looks/
ICE Deportation Flights Are Getting Longer and Crueler,Gillian Brockell,https://www.motherjones.com/politics/2026/01/omni-ice-deportations-charter-flight-stonepeak-private-equity/
Federal Prosecutors in Minnesota Are “Demoralized and Pissed”,Samantha Michaels,https://www.motherjones.com/politics/2026/01/trump-us-attorneys-office-minnesota-prosecutors-resignations-ice-protesters-evidence-don-lemon/
Mamdani Announces New Settlement Securing Backpay for Delivery Workers,Noah Lanard,https://www.motherjones.com/politics/2026/01/mamdani-ice-delivery-workers-settlement-backpay-uber-gig-workers-million/
True Heroism and Bearing Witness: the Woman Who Documented the Killing of Alex Pretti,James West,https://www.motherjones.com/politics/2026/01/stella-carlson-cnn-interview-pretti-filming-witness/
Yup. Trump Suggested Ilhan Omar Staged Her Own Attack in Minneapolis.,Alex Nguyen,https://www.motherjones.com/politics/2026/01/trump-ilhan-omar-attack-minneapolis-reaction/
Those Brutal “Melania” Documentary Reviews Have Vanished from Letterboxd,James West,https://www.motherjones.com/politics/2026/01/melania-documentary-reviews-deleted-letterboxd/
Is This a Police State?,"January 28, 2026",https://www.motherjones.com/politics/2026/01/police-state-minneapolis-donald-trump-stephen-miller-alex-pretti-renee-good/
The List of Impeachable Offenses Keeps Growing,"January 22, 2026",https://www.motherjones.com/politics/2026/01/donald-trump-impeach-abuse-power-richard-nixon/
The Erasure of January 6,"January 6, 2026",https://www.motherjones.com/politics/2026/01/january-6-5th-anniversary-capitol-mob-trump-orwell/
,,https://www.motherjones.com/politics/2026/01/local-news-doge-solar-power-immigration-idaho-jacksonville-florida-tribal-nations/
,,https://www.motherjones.com/politics/2026/01/rob-schenck-religious-right-immigration-minneapolis-minnesota-christian-nationalism/
,,https://www.motherjones.com/politics/2026/01/transgender-athletes-bans-womens-girls-sports-riley-gaines/
,,https://www.motherjones.com/politics/2026/01/radley-balko-trump-ice-paramilitary-immigration-militarization-police/
The Church at the Center of Don Lemon’s Arrest Has Ties to Christian Nationalism,Kiera Butler,https://www.motherjones.com/politics/2026/01/the-church-at-the-center-of-don-lemons-arrest-has-ties-to-christian-nationalism/
Students Walk Out Across the Country to Protest ICE,Katie Herchenroeder,https://www.motherjones.com/politics/2026/01/students-ice-protest-immigration/
"Trump’s EPA Protects Big Business, Not People or the Environment, Critics Say",Oliver Milman and Dharna Noor,https://www.motherjones.com/politics/2026/01/trump-epa-lee-zeldin-big-business-environment-critics-climate-rules-regulations/
The Tricky Science of Forecasting Extreme Winter Weather,Umair Irfan,https://www.motherjones.com/environment/2026/01/science-forecasting-extreme-winter-weather-cold-snap-snow-ice-storm/
ICE Violence Is Fueled by Misogyny and White Nationalism,Cynthia Miller-Idriss,https://www.motherjones.com/politics/2026/01/ice-violence-misogyny-renee-good-alex-pretti/
"No, Antidepressants Do Not Cause Mass Shootings",Mark Follman,https://www.motherjones.com/politics/2026/01/mass-shootings-antidepressants-rfk-conspiracy-theory/
Celebrating Black Military Service Is Not “DEI Woke Shit.” It’s Essential to America’s Defense.,Matthew Delmont,https://www.motherjones.com/politics/2026/01/history-month-black-military-service-vietnam-war-heroes-dei-recruiting-hegseth-trump-defense/
Trump’s Latest Visa “Pause” Targets 75 Countries He Thinks Are Lazy,Julia Métraux,https://www.motherjones.com/politics/2026/01/trump-public-charge-visa-ban-immigration/
Supreme Court Battle Over Trans Athletes Is About So Much More Than Sports,Madison Pauly,https://www.motherjones.com/politics/2026/01/supreme-court-trans-athletes-west-virginia-riley-gaines-idaho-equal-protection/
RFK Jr. Just Flipped the Food Pyramid to Create a Funnel of Performative Masculinity,Anna Rogers,https://www.motherjones.com/politics/2026/01/rfk-jr-fda-food-pyramid-recommentations-inverted-meat-protein-maxxing-masculinity/
Josh Hawley Asked “Can Men Get Pregnant?” 11 Times at Abortion Hearing,Katie Herchenroeder,https://www.motherjones.com/politics/2026/01/josh-hawley-asked-can-men-get-pregnant-11-times-at-abortion-hearing/
RFK Jr. Could Defund Your Hospital if He Doesn’t Get His Way on Trans Health Care,Katie Herchenroeder and Julia Métraux,https://www.motherjones.com/politics/2025/12/rfk-trans-youth-health-care/
,,https://www.motherjones.com/politics/2025/12/memphis-safe-task-force-trump-ice-crime-immigration-mass-deportations-287g/
,,https://www.motherjones.com/politics/2025/12/your-private-data-is-building-trumps-voter-purge-machine/
,,https://www.motherjones.com/politics/2026/01/ozturk-khalil-documents-deportation-pro-palestine-protest-canary-mission/
,,https://www.motherjones.com/politics/2026/01/ice-detainees-medical-treatment-denied-payments-contractors-va/
How Trump Is Using Violent Tragedies to Divide America,Mark Follman,https://www.motherjones.com/politics/2026/01/trump-violence-assassinations-mass-shootings-ice-lies/
They Couldn’t Care Less About Renée Good’s Killing,Inae Oh,https://www.motherjones.com/politics/2026/01/renee-good-trump-krist-noem-miller-domestic-terrorism/
Arizona Governor Moves to Rein in Groundwater-Guzzling Saudi Megafarms,Nate Halverson,https://www.motherjones.com/politics/2026/01/arizona-governor-katie-hobbs-groundwater-saudi-alfalfa-exports-farming-almari-vicksburg-la-paz-county-fondomonte-lawsuit/
RFK Jr.’s Proteinaceous Food Pyramid Is a Land Hog and a Climate Disaster,Oliver Milman,https://www.motherjones.com/politics/2026/01/rfk-jr-food-pyramid-meat-dairy-protein-increase-agricultural-land-climate-emissions/
"Hey Jon Stewart, Jokes About Wearing Masks Aren’t Funny",Julia Métraux,https://www.motherjones.com/politics/2025/12/hey-jon-stewart-jokes-about-wearing-masks-arent-funny/
Welcome to the New Era of Covid Vaccine Tourism,Julia Métraux,https://www.motherjones.com/politics/2025/09/covid-vaccine-state-tourism-acip-rfk/
The Attack on Ilhan Omar and Trump’s Destructive Politics of Violence,Mark Follman,https://www.motherjones.com/politics/2026/01/ilhan-omar-trump-violence-rhetoric-somalis-minnesota/
"Alex Pretti Was a Hero. To These Workers, He Was a Colleague, Too.",Anna Rogers,https://www.motherjones.com/politics/2026/01/alex-pretti-federal-va-workers-colleagues-unions/
