title,byline,url
Pro-Putin Disinformation on Ukraine Is Thriving in Online Anti-Vax Groups,Kiera Butler,https://www.motherjones.com/politics/2022/03/pro-putin-disinformation-on-ukraine-is-thriving-in-online-anti-vax-groups/
Pro-Putin Disinformation on Ukraine Is Thriving in Online Anti-Vax Groups,Kiera Butler,https://www.motherjones.com/politics/2022/03/pro-putin-disinformation-on-ukraine-is-thriving-in-online-anti-vax-groups/
The US Government Pushed Hundreds of Married Couples Into Disastrous Student Loans,Emma Rindlisbacher,https://www.motherjones.com/politics/2022/03/student-debt-spousal-consolidation-loans-biden-education-department/
She Escaped From Ukraine. Now She’s Haunted by Guilt About Those She Left Behind.,Olha Martynyuk as told to Isabela Dias,https://www.motherjones.com/politics/2022/03/she-escaped-from-ukraine-now-shes-haunted-by-guilt-about-those-she-left-behind/
Jerome Powell Says the Fed Will Raise Interest Rates for the First Time Since 2018,Jacob Rosenberg,https://www.motherjones.com/mojo-wire/2022/03/jerome-powell-fed-raise-interest-rates-inflation/
Montana Gov. Greg Gianforte Killed a Cat on Public Land,Abigail Weinberg,https://www.motherjones.com/mojo-wire/2022/03/montana-gianforte-hunting-puma-cougar-mountain-lion/
Joe Biden Reveals His Enemies List—the Good Kind,David Corn,https://www.motherjones.com/politics/2022/03/joe-biden-reveals-his-enemies-list-the-good-kind/
"Texas’ Big Lie-Pushing, Scandal-Drenched AG Is Heading to a Runoff",Tim Murphy,https://www.motherjones.com/politics/2022/03/texas-ag-ken-paxton-runoff-george-p-bush/
Biden Rallies Congress With a Furious Rebuke of Putin in His First State of the Union,Abigail Weinberg,https://www.motherjones.com/politics/2022/03/biden-state-of-the-union-putin-speech/
"Biden’s Fresh Pitch for Prosperity: Fund My Agenda, Dammit",Abigail Weinberg,https://www.motherjones.com/politics/2022/03/sotu-biden-economic-agenda-minimum-wage-voting-rights/
Climate Negotiators Are Seriously Underestimating Methane’s Warming Power,Fred Pearce,https://www.motherjones.com/environment/2022/03/climate-negotiators-underestimating-methane-warming-power-study-greenhouse-gas-warming/
,,https://www.motherjones.com/politics/2022/02/anti-russian-acts-of-defiance-a-tennis-player-a-piano-player-and-ladies-making-molotov-cocktails/
,,https://www.motherjones.com/mojo-wire/2022/02/from-tv-star-to-wartime-leader-ukrainian-president-zelensky-uses-videos-to-rally-his-country/
,,https://www.motherjones.com/politics/2022/02/guo-wengui-miles-guo-gettr-steve-bannon/
So Apparently Steve Bannon Loved the Piece I Wrote About His Absolute Obsession With China,Dan Spinelli,https://www.motherjones.com/politics/2022/03/steve-bannon-war-room-podcast-um-what/
Translator Chokes Up as Zelenskyy Delivers Emotional Address to European Parliament,Inae Oh,https://www.motherjones.com/mojo-wire/2022/03/ukraine-zelensky-translator-choked-up/
The EU Is Trying to Combat Disinformation From Russian State Media. The US Should Do the Same.,Edwin Rios,https://www.motherjones.com/mojo-wire/2022/02/the-eu-is-trying-to-combat-disinformation-from-russian-state-media-the-us-should-do-the-same/
"Yeah, I’m Gonna Need You to Go Ahead and Celebrate Michael Boltons’ Birthdays",Daniel King,https://www.motherjones.com/recharge/2022/02/office-space-michael-bolton-assclown-david-herman-birthday/
"50 Years After Recording “No Knock,” Gil Scott-Heron’s Protest Song Contains a Prescription",Daniel King,https://www.motherjones.com/recharge/2022/02/no-knock-police-killings-amir-locke-song-gil-scott-heron/
"Politics Is Fun, Actually: City Council Edition",Lil Kalish,https://www.motherjones.com/recharge/2022/01/politics-is-fun-actually-city-council-edition/
Alexei Navalny Calls for Worldwide Protests to Demand End to War,Noah Y. Kim,https://www.motherjones.com/politics/2022/03/alexei-navalny-russia-ukraine-protests/
ACLU Sues Texas Over Investigation of Parents With Transgender Child,Noah Y. Kim,https://www.motherjones.com/politics/2022/03/texas-abbott-paxton-investigation-transgender-children/
World Leaders Agree To Forge a “Historic” Treaty on Plastic Waste,Karen McVeigh,https://www.motherjones.com/environment/2022/03/world-leaders-un-united-nations-environment-programme-resolution-historic-treaty-plastic-waste-pollution/
Amazon Drastically Underestimates Its Carbon Footprint,Will Evans,https://www.motherjones.com/environment/2022/03/amazon-drastically-undercounts-its-carbon-disclosure-project/
Anti-Vaxxers Have a New Obsession: Keeping Your Kids From Seeing Their Doctors,Kiera Butler,https://www.motherjones.com/politics/2022/02/anti-vaxxers-have-a-new-obsession-keeping-your-kids-from-seeing-their-doctors/
Ron DeSantis Wants to Seize Millions from Pro-Masking Schools,Abigail Weinberg,https://www.motherjones.com/mojo-wire/2022/02/ron-desantis-florida-mask-mandate-school-cuts/
Climate Change Is Already Taking a Big Bite Out of Our Food Supply,Tom Philpott,https://www.motherjones.com/food/2022/03/ipcc-report-climate-crops-oceans-farmland-united-nations-greenhouse-gas-emissions/
North Carolina Poultry Frenzy: 500 Million Birds and “Zero Transparency”,Melba Newsome,https://www.motherjones.com/environment/2022/02/north-carolina-poultry-farms-hog-waste-regulations-environmental-problems/
Derek Chauvin’s Colleagues Found Guilty of Violating George Floyd’s Civil Rights,Samantha Michaels,https://www.motherjones.com/crime-justice/2022/02/george-floyd-verdict-derek-chauvin-fellow-minneapolis-officers-guilty-violating-civil-rights/
Plastic Surgery Has a Troubled History Inside Prisons. Some Advocates Want It to Make a Comeback.,Zara Stone,https://www.motherjones.com/media/2022/02/plastic-surgery-prisons-lookism-appearance-bias/
Trump Sent Asylum Seekers Back Into “the Depths of Hell”,Isabela Dias,https://www.motherjones.com/politics/2022/02/trump-deported-cameroonian-asylum-seekers-civil-war-violence-rape-torture-human-rights-watch-report/
More Immigrants Are Waiting in Legal Limbo Than Ever Before. Why Is It So Hard to Fix the Backlog in the Courts?,Fernanda Echavarri,https://www.motherjones.com/politics/2022/02/how-to-fix-record-cases-immigration-courts-backlog/
,,https://www.motherjones.com/politics/2022/02/afghanistan-women-taliban-photoessay/
,,https://www.motherjones.com/environment/2022/02/my-family-lost-our-farm-during-japanese-incarceration-i-went-searching-for-what-remains/
,,https://www.motherjones.com/politics/2022/02/guo-wengui-miles-guo-gettr-steve-bannon/
,,https://www.motherjones.com/food/2022/02/national-restaurant-association-relief-revitalization-fund-pandemic-mcdonalds-subway-nra/
January 6 Reckoning: CNN’s Jake Tapper Says the Media Must Confront Republicans’ Big Lie,Abigail Weinberg,https://www.motherjones.com/media/2021/07/january-6-insurrection-capitol-cnn-jake-tapper-podcast/
We Need to Understand How We Got to January 6 Before We Can Move Forward,Fernanda Echavarri,https://www.motherjones.com/politics/2021/06/podcast-january-6-qanon-history-whats-next/
A Radical Idea for Forcing Vaccine Companies to Share Knowledge With the World,Molly Schwartz and Jamilah King,https://www.motherjones.com/politics/2021/05/vaccine-patents-biden-covid-india-dean-baker-pandemic/
,,https://podcasts.apple.com/us/podcast/the-mother-jones-podcast/id1386408605
