title,byline,url
Starbucks Called Its Flagship Stores a Metaphor for the Company. Now They’re Trying to Unionize.,Noah Lanard,https://www.motherjones.com/politics/2022/02/starbucks-roastery-unionization-willy-wonka-howard-schultz-buffalo/
Starbucks Called Its Flagship Stores a Metaphor for the Company. Now They’re Trying to Unionize.,Noah Lanard,https://www.motherjones.com/politics/2022/02/starbucks-roastery-unionization-willy-wonka-howard-schultz-buffalo/
There’s Still No Penalty for Shamelessness,Tim Murphy,https://www.motherjones.com/politics/2022/02/texas-attorney-general-ken-paxton-george-p-bush-james-baker/
Kamala Harris Promises “Unprecedented” Sanctions If Russia Invades Ukraine,Tim Murphy,https://www.motherjones.com/politics/2022/02/harris-ukraine-sanctions-russia-putin/
Michigan Republicans Were Asked About a Landmark Contraception Case. Their Answers Were “Terrifying.”,Tim Murphy,https://www.motherjones.com/politics/2022/02/michigan-republicans-give-terrifying-answers-on-a-landmark-contraception-case/
"Check Out These Strange Aquatic “Boings,” “Growls,” and “Chatter”",Patrick Greenfield,https://www.motherjones.com/environment/2022/02/listen-strange-sounds-chatter-whales-fish-aquatic-species-global-library-underwater-biological-sounds/
My Family Lost Our Farm During Japanese Incarceration. I Went Searching for What Remains.,Ruth Chizuko Murai,https://www.motherjones.com/environment/2022/02/my-family-lost-our-farm-during-japanese-incarceration-i-went-searching-for-what-remains/
Meet the Know-Nothing MAGA Stalwart About to Take Over Georgia’s Universities,Tom Philpott,https://www.motherjones.com/politics/2022/02/meet-the-know-nothing-maga-stalwart-about-to-take-over-georgias-universities/
REI Calls Itself a Co-op. But That Doesn’t Mean It’s Worker-Friendly.,Emily Hofstaedter,https://www.motherjones.com/politics/2022/02/rei-coop-union-busting/
"Kim Potter, Ex-Cop Who Killed Daunte Wright, Given 16-Month Sentence",Eamon Whalen,https://www.motherjones.com/politics/2022/02/kim-potter-ex-cop-who-killed-daunte-wright-given-16-month-sentence/
The Cops Who Watched George Floyd Die Are Testifying. Their Case Could Set an Important Precedent.,Samantha Michaels,https://www.motherjones.com/crime-justice/2022/02/george-floyd-death-police-trial-bad-training/
,,https://www.motherjones.com/mojo-wire/2022/02/david-perdues-first-campaign-ad-is-just-a-video-of-trump/
,,https://www.motherjones.com/environment/2022/01/video-europe-indigenous-sami-reindeer-herders-climate-change-arctic/
,,https://www.motherjones.com/mojo-wire/2022/01/newt-gingrich-january-6-jail/
Melania Trump Might’ve Bought Her Own NFT,Inae Oh,https://www.motherjones.com/mojo-wire/2022/02/melania-trump-nft/
Biden Rejects Trump’s Executive Privilege Claim and Orders Release of White House Logs,Inae Oh,https://www.motherjones.com/mojo-wire/2022/02/biden-trump-white-house-visitor-logs-executive-privilege/
Ted Cruz’s Old Boss Wants to Keep Him From Stealing the Next Election,Pema Levy,https://www.motherjones.com/politics/2022/02/michael-luttig-ted-cruz-john-eastman/
"50 Years After Recording “No Knock,” Gil Scott-Heron’s Protest Song Contains a Prescription",Daniel King,https://www.motherjones.com/recharge/2022/02/no-knock-police-killings-amir-locke-song-gil-scott-heron/
"Politics Is Fun, Actually: City Council Edition",Lil Kalish,https://www.motherjones.com/recharge/2022/01/politics-is-fun-actually-city-council-edition/
When Communists and Hippies Fought Over Wheatgerm and Wonder Bread in Minneapolis,Eamon Whalen,https://www.motherjones.com/recharge/2022/01/when-communists-and-hippies-fought-over-wheatgerm-and-wonder-bread-in-minneapolis/
Confirmed: Trump Really Did Take Classified Documents to Mar-a-Lago,Inae Oh,https://www.motherjones.com/politics/2022/02/trump-classified-information-boxes-mar-a-lago/
That Time Edmund Hillary Set Out in Pursuit of the Yeti,Tom Ward,https://www.motherjones.com/politics/2022/02/sir-edmund-hillary-everest-explorer-nepal-yeti-expedition/
North Carolina Poultry Frenzy: 500 Million Birds and “Zero Transparency”,Melba Newsome,https://www.motherjones.com/environment/2022/02/north-carolina-poultry-farms-hog-waste-regulations-environmental-problems/
Dirty Dozen: The Private Equity Firms Driving Fossil Fuel Expansion,Nina Lakhani,https://www.motherjones.com/environment/2022/02/report-private-equity-stakeholder-project-firms-funding-fossil-fuel-development/
Canadian Police Are Removing Protesters Blocking Ambassador Bridge,Noah Lanard,https://www.motherjones.com/politics/2022/02/canadian-police-are-removing-protesters-blocking-ambassador-bridge/
Exclusive: White Nationalists and Anti-Vax Moms Plot Ottawa Copycat Convoys on Telegram,Kiera Butler,https://www.motherjones.com/politics/2022/02/exclusive-white-nationalists-and-anti-vax-moms-plot-ottawa-copycat-convoys-on-telegram/
"Rack of Squirrel, Anyone? These Chefs Are Serving Up Invasive Species.",Patrick Greenfield,https://www.motherjones.com/environment/2022/02/rack-squirrel-chefs-serving-invasive-species-wedgewood-miya-invasivorism/
What Should Farmers Grow in the Desert?,Stephen Robert Miller,https://www.motherjones.com/environment/2022/02/colorado-river-desert-guayule-latex-arizona/
Banning the Type of Police Raids That Killed Amir Locke Is Just a Start,Samantha Michaels,https://www.motherjones.com/crime-justice/2022/02/no-knock-police-raids-amir-locke-police-violence-reform/
Her Boyfriend Killed Her Baby While She Was at Work. Oklahoma Might Lock Her Up for Life.,Samantha Michaels,https://www.motherjones.com/crime-justice/2022/02/child-abuse-mothers-sexist-failure-to-protect-law-rebecca-hogue-oklahoma/
Trump Sent Asylum Seekers Back Into “the Depths of Hell”,Isabela Dias,https://www.motherjones.com/politics/2022/02/trump-deported-cameroonian-asylum-seekers-civil-war-violence-rape-torture-human-rights-watch-report/
More Immigrants Are Waiting in Legal Limbo Than Ever Before. Why Is It So Hard to Fix the Backlog in the Courts?,Fernanda Echavarri,https://www.motherjones.com/politics/2022/02/how-to-fix-record-cases-immigration-courts-backlog/
,,https://www.motherjones.com/crime-justice/2022/02/aventiv-securus-lantern-college-pell-grants-prisoners/
,,https://www.motherjones.com/politics/2022/02/amanda-moore-undercover-maga/
,,https://www.motherjones.com/food/2022/02/national-restaurant-association-relief-revitalization-fund-pandemic-mcdonalds-subway-nra/
,,https://www.motherjones.com/politics/2022/01/how-republicans-are-taking-over-election-system-big-lie/
January 6 Reckoning: CNN’s Jake Tapper Says the Media Must Confront Republicans’ Big Lie,Abigail Weinberg,https://www.motherjones.com/media/2021/07/january-6-insurrection-capitol-cnn-jake-tapper-podcast/
We Need to Understand How We Got to January 6 Before We Can Move Forward,Fernanda Echavarri,https://www.motherjones.com/politics/2021/06/podcast-january-6-qanon-history-whats-next/
A Radical Idea for Forcing Vaccine Companies to Share Knowledge With the World,Molly Schwartz and Jamilah King,https://www.motherjones.com/politics/2021/05/vaccine-patents-biden-covid-india-dean-baker-pandemic/
,,https://podcasts.apple.com/us/podcast/the-mother-jones-podcast/id1386408605
