title,byline,url
Even More Key January 6 Text Messages Are Missing,Noah Lanard,https://www.motherjones.com/politics/2022/07/even-more-key-january-6-text-messages-are-missing/
Even More Key January 6 Text Messages Are Missing,Noah Lanard,https://www.motherjones.com/politics/2022/07/even-more-key-january-6-text-messages-are-missing/
The Uvalde Massacre Should Have Been Stopped Long Before That Tragic Day,Mark Follman,https://www.motherjones.com/crime-justice/2022/07/uvalde-mass-shooting-warning-signs-red-flags-threat-assessment/
"While Americans Stare Down a Recession, Oil Companies Are Making Record Profits",Noah Lanard,https://www.motherjones.com/politics/2022/07/while-americans-stare-down-a-recession-oil-companies-are-making-record-profits/
Extreme Flooding in Kentucky Has Killed at Least 16 People,Noah Lanard,https://www.motherjones.com/politics/2022/07/extreme-flooding-in-kentucky-has-killed-at-least-16-people/
"In the GOP’s New Surveillance State, Everyone’s a Snitch",Pema Levy,https://www.motherjones.com/politics/2022/07/in-the-gops-new-surveillance-state-everyones-a-snitch/
We Know Wildfire Smoke Is Terrible for You. But What Does It Do to Cows?,Matt Simon,https://www.motherjones.com/politics/2022/07/we-know-wildfire-smoke-is-terrible-for-you-but-what-does-it-do-to-cows/
Jan. 6 Defendant Claims Judge Sent Her to Prison Because She Wouldn’t Date Him in Law School,Stephanie Mencimer,https://www.motherjones.com/politics/2022/07/simone-gold-jan-6-defendant-claims-judge-sent-her-to-prison-because-she-wouldnt-date-him-in-law-school/
Mandela Barnes Is Now the Clear Favorite to Face Off Against Ron Johnson in Wisconsin,Eamon Whalen,https://www.motherjones.com/politics/2022/07/mandela-barnes-is-now-the-clear-favorite-to-face-off-against-ron-johnson-in-wisconsin/
“Alito Was Using Phrases We Had Invented as Bumper-Sticker Slogans in a Supreme Court Decision”,Rabbi Jack Moline,https://www.motherjones.com/politics/2022/07/alito-was-using-phrases-we-had-invented-as-bumper-sticker-slogans-in-a-supreme-court-decision/
"Nancy Pelosi’s Proposed Taiwan Trip Is a Bad Idea, Even If She Doesn’t Go",Dan Spinelli,https://www.motherjones.com/mojo-wire/2022/07/nancy-pelosi-china-trip-xi-jinping-joe-biden/
,,https://www.motherjones.com/politics/2022/07/blake-masters-peter-thiel-donald-trump-arizona-senate-mark-kelly/
,,https://www.motherjones.com/mojo-wire/2022/07/trump-alaska-rally-vaccine-sarah-palin/
,,https://www.motherjones.com/mojo-wire/2022/06/states-banning-abortion-dobbs-roe-end-trigger-laws/
Crosswalks Aren’t Enough to Keep Cars from Killing,Abigail Weinberg,https://www.motherjones.com/mojo-wire/2022/07/crosswalks-cars-killing-bicyclist-pedestrian-death/
Verizon Says Good Riddance to One America News,Abigail Weinberg,https://www.motherjones.com/mojo-wire/2022/07/verizon-says-good-riddance-to-one-america-news/
I’m Giving You Permission to Stop Talking About Elon Musk’s Sex Life,Inae Oh,https://www.motherjones.com/mojo-wire/2022/07/im-giving-you-permission-to-stop-talking-about-elon-musks-sex-life/
"Remembering George Pérez, a Superhero of Superhero Comics",Dan Spinelli,https://www.motherjones.com/recharge/2022/05/remembering-george-perez-a-superhero-of-superhero-comics/
Ukrainian and Russian Dancers Join Onstage (in Italy) to Fundraise for the Red Cross,Daniel King,https://www.motherjones.com/recharge/2022/04/ukrainian-russian-antiwar-ballet-dancers-for-peace/
"Mass Shootings Persist, But a New Book Brings Hope and Science to Grappling With Their Prevention",Daniel King,https://www.motherjones.com/recharge/2022/04/mass-shooting-prevention-trigger-points/
What Do Indigenous Leaders Think About Co-Managing Bears Ears With the Feds?,B. Toastie,https://www.motherjones.com/politics/2022/07/what-do-indigenous-leaders-think-about-co-managing-bears-ears-with-the-feds/
Of Course Samuel Alito Is Bragging About It,Inae Oh,https://www.motherjones.com/politics/2022/07/samuel-alito-tells-some-jokes/
Kids ATVing in a Nature Preserve Found One of the Biggest Ever Gas Pipeline Leaks,Eamon Whalen,https://www.motherjones.com/environment/2022/07/kids-atving-in-a-nature-reserve-found-one-of-the-biggest-ever-gas-pipeline-leaks/
Extreme Heat Is Making the Fastest-Growing US Cities Unlivable,Oliver Milman,https://www.motherjones.com/environment/2022/07/extreme-heat-wave-texas-arizona-urban-growth-unlivable-cities/
California’s Farms and Meatpackers Had More Covid Violations Than all Other Industries Combined,Tom Philpott,https://www.motherjones.com/food/2022/07/farm-meatpacking-covid-safety-violations-california-osha/
"A Plane of Monkeys, a Pandemic, and a Botched Deal: Inside the Science Crisis You’ve Never Heard Of",Jackie Flynn Mogensen,https://www.motherjones.com/politics/2022/06/animals-testing-monkey-primate-shortage-covid-monkeypox-future-pandemic-vaccines/
Searing Summer Heat Is Driving Food Prices Higher Still,Kate Yoder,https://www.motherjones.com/environment/2022/07/record-breaking-heat-wave-food-prices-crops/
"As Heat Rises, Who Will Protect Farmworkers?","By Bridget Huber, Nancy Averett and Teresa Cotsirilos",https://www.motherjones.com/food/2022/07/as-heat-rises-who-will-protect-farmworkers/
Steve Bannon Is Guilty of Contempt of Congress,Dan Friedman and Dan Spinelli,https://www.motherjones.com/politics/2022/07/steve-bannon-january-6-guilty-congress-contempt/
Relatives of Breonna Taylor and Jacob Blake Went to Ohio to Protest. Then the Cops Came After Them.,Samantha Michaels,https://www.motherjones.com/crime-justice/2022/07/breonna-taylor-jacob-blake-ohio-police-arrest/
"From Texas to Arizona, the GOP Border “Invasion” Argument Keeps Getting Crazier",Isabela Dias,https://www.motherjones.com/politics/2022/07/from-texas-to-arizona-the-gop-border-invasion-argument-keeps-getting-crazier/
SCOTUS May Have Ended Trump’s Cruel Border Policy. It’s Hardly a “Home Run” Victory for Immigrants.,Isabela Dias,https://www.motherjones.com/politics/2022/07/scotus-ended-trumps-cruel-border-policy-but-its-far-from-a-home-run-for-immigrants/
,,https://www.motherjones.com/politics/2022/07/inside-the-powerful-anti-abortion-campaign-to-convince-you-that-everything-is-just-fine/
,,https://www.motherjones.com/politics/2022/07/post-roe-we-need-physicians-to-advocate-for-abortion-care/
,,https://www.motherjones.com/politics/2022/07/blake-masters-peter-thiel-donald-trump-arizona-senate-mark-kelly/
,,https://www.motherjones.com/politics/2022/07/leaked-audio-steve-bannon-trump-2020-election-declare-victory/
January 6 Reckoning: CNN’s Jake Tapper Says the Media Must Confront Republicans’ Big Lie,Abigail Weinberg,https://www.motherjones.com/media/2021/07/january-6-insurrection-capitol-cnn-jake-tapper-podcast/
We Need to Understand How We Got to January 6 Before We Can Move Forward,Fernanda Echavarri,https://www.motherjones.com/politics/2021/06/podcast-january-6-qanon-history-whats-next/
A Radical Idea for Forcing Vaccine Companies to Share Knowledge With the World,Molly Schwartz and Jamilah King,https://www.motherjones.com/politics/2021/05/vaccine-patents-biden-covid-india-dean-baker-pandemic/
,,https://podcasts.apple.com/us/podcast/the-mother-jones-podcast/id1386408605
