title,byline,url
The Iraq Invasion 20 Years Later: It Was Indeed a Big Lie that Launched  the Catastrophic War,David Corn,https://www.motherjones.com/politics/2023/03/the-iraq-invasion-20-years-later-it-was-indeed-a-big-lie-that-launched-the-catastrophic-war/
The Iraq Invasion 20 Years Later: It Was Indeed a Big Lie that Launched  the Catastrophic War,David Corn,https://www.motherjones.com/politics/2023/03/the-iraq-invasion-20-years-later-it-was-indeed-a-big-lie-that-launched-the-catastrophic-war/
Ron DeSantis Really Wants to Remind You That Trump Allegedly Paid Off a Porn Star,Inae Oh,https://www.motherjones.com/politics/2023/03/ron-desantis-trump-porn-star/
We’ve Got What It Takes to End Poverty in America,Michael Mechanic,https://www.motherjones.com/politics/2023/03/matthew-desmond-new-book-poverty-by-america-evicted-pulitzer-prize-interview/
Scientists Deliver “Final Warning” on Climate: Act Now or It’s Too Late,Fiona Harvey,https://www.motherjones.com/politics/2023/03/ipcc-report-2023-climate-crisis-global-warming-action/
Do Solar Farms Really Hurt Property Values?,Dan Gearino,https://www.motherjones.com/environment/2023/03/property-values-solar-farms-wind-turbines/
How Ron DeSantis Ignited a Republican Civil War Over Ukraine,Pema Levy,https://www.motherjones.com/politics/2023/03/how-ron-desantis-ignited-a-republican-war-over-ukraine/
I Am Donald Trump’s Only Hope,Jeremy Schulman,https://www.motherjones.com/politics/2023/03/trump-new-york-arrest-house-republicans/
Manhattan Prosecutor Promises Security After Trump Calls for Protests,Pema Levy,https://www.motherjones.com/politics/2023/03/manhattan-prosecutor-promises-security-after-trump-calls-for-protests/
These Small States Punch Above Their Weight on Clean Energy,Dan Gearino,https://www.motherjones.com/environment/2023/03/states-with-most-wind-solar-clean-energy-development/
"Trump Says He Will Be “Arrested” on Tuesday, Demands Protests",Russ Choma,https://www.motherjones.com/politics/2023/03/donald-trump-arrest/
,,https://www.motherjones.com/politics/2023/03/anti-trans-transgender-health-care-ban-legislation-bill-minors-children-lgbtq/
,,https://www.motherjones.com/politics/2023/02/pastor-john-hagee-nikki-haley-donald-trump-gop-primary-extremism/
,,https://www.motherjones.com/politics/2023/01/ticketmaster-taylor-swift-monopoly-senate-hearing/
Ohio Is Suing Norfolk Southern,Abigail Weinberg,https://www.motherjones.com/mojo-wire/2023/03/ohio-is-suing-norfolk-southern/
Shut Up About “Woke.” I’m Trying to Actually Understand the Bank Collapse.,Abigail Weinberg,https://www.motherjones.com/mojo-wire/2023/03/silicon-valley-bank-woke-desantis-fox-news/
Admitted Liar George Santos: I Never Led a Giant Credit Card Skimming Scheme,Inae Oh,https://www.motherjones.com/mojo-wire/2023/03/admitted-liar-george-santos-i-never-led-a-giant-credit-card-skimming-scheme/
Experiencing Space Flight Just Got a Lot More Accessible,Daniel King,https://www.motherjones.com/recharge/2022/12/space-flight-portal/
"Remembering George Pérez, a Superhero of Superhero Comics",Dan Spinelli,https://www.motherjones.com/recharge/2022/05/remembering-george-perez-a-superhero-of-superhero-comics/
Ukrainian and Russian Dancers Join Onstage (in Italy) to Fundraise for the Red Cross,Daniel King,https://www.motherjones.com/recharge/2022/04/ukrainian-russian-antiwar-ballet-dancers-for-peace/
Wyoming Bans Abortion Pills,Russ Choma,https://www.motherjones.com/politics/2023/03/wyoming-governor-mark-gordon-bans-abortion-pills/
"Swords, Coats, a $24,000 Dagger: The Trumps Failed to Report 117 Foreign Gifts",Russ Choma,https://www.motherjones.com/politics/2023/03/donald-trump-melania-trump-foreign-gifts/
The World Is Running Out of Fresh Water Fast,Fiona Harvey,https://www.motherjones.com/environment/2023/03/shortage-fresh-water-global-demand-study/
Rich Nations Are Burying the Developing World in Plastic Waste,Joseph Winters,https://www.motherjones.com/environment/2023/03/rich-countries-nations-waste-plastic-exports-chemical-contamination/
Mike Flynn and MAGA Activists Wage War Against a Florida Hospital,Kiera Butler,https://www.motherjones.com/politics/2023/03/mike-flynn-and-maga-activists-wage-war-against-a-florida-hospital/
The Far-Right Bounty Hunter Behind the Explosive Popularity of “Died Suddenly”,Kiera Butler,https://www.motherjones.com/politics/2023/02/stew-peters-the-far-right-bounty-hunter-behind-the-explosive-success-of-died-suddenly/
"Misuse of Phosphorus Is Wreaking Havoc, Scientists Warn",Robin McKie,https://www.motherjones.com/environment/2023/03/phosphorus-fertilizer-shortage-algae-dead-zones-environment-runoff/
State Legislatures Are Cracking Down on Foreign Land Ownership,Samuel Shaw,https://www.motherjones.com/politics/2023/03/state-legislatures-are-cracking-down-on-foreign-land-ownership/
“This Was My Baby”: The Family of Black Man Killed by Cops While Experiencing Mental Crisis Speaks Out,Arianna Coghill,https://www.motherjones.com/crime-justice/2023/03/irvo-otieno-virginia-police-mental-illness-murder-black/
Who Killed Rasheem Carter?,Samantha Michaels,https://www.motherjones.com/crime-justice/2023/03/who-killed-rasheem-carter/
Ron DeSantis Wants to Make Transporting Migrants a Felony,Isabela Dias,https://www.motherjones.com/politics/2023/02/ron-desantis-wants-to-make-transporting-migrants-a-felony/
The New York Times Just Dropped a Shocking Investigation on Child Labor in America,Arianna Coghill,https://www.motherjones.com/politics/2023/02/new-york-times-child-labor-immigrant-kids/
,,https://www.motherjones.com/politics/2023/03/gianni-infantino-fifa-presidential-election-world-cup-qatar-soccer-football-human-rights/
,,https://www.motherjones.com/politics/2023/03/bannon-guo-ukraine-poland-new-federal-state-of-china/
,,https://www.motherjones.com/politics/2023/02/sam-bankman-fried-was-indicted-for-hundreds-of-illegal-campaign-donations-who-else-knew/
,,https://www.motherjones.com/politics/2023/01/we-tried-to-call-the-top-donors-to-george-santos-2020-campaign-many-dont-seem-to-exist/
“This Was My Baby”: The Family of Black Man Killed by Cops While Experiencing Mental Crisis Speaks Out,Arianna Coghill,https://www.motherjones.com/crime-justice/2023/03/irvo-otieno-virginia-police-mental-illness-murder-black/
Biden Approves Major Alaskan Oil Drilling Project,Arianna Coghill,https://www.motherjones.com/environment/2023/03/willow-project-alaska-biden/
South Carolina Woman Arrested for Allegedly Taking Abortion Pills,Arianna Coghill,https://www.motherjones.com/crime-justice/2023/03/south-carolina-woman-arrested-for-allegedly-taking-abortion-pills/
“We Do This as Parents”: Dwyane Wade and Gabrielle Union-Wade’s Emotional Call to Support Trans Kids,Madison Pauly,https://www.motherjones.com/media/2023/02/dwyane-wade-gabrielle-union-support-trans-kids/
