title,byline,url
"Hazing, Fighting, Sexual Assaults: How Valley Forge Military Academy Devolved Into “Lord of the Flies”",Jasper Craven,https://www.motherjones.com/politics/2022/04/valley-forge-military-academy-problems-hazing-sexual-assault-lawsuits/
"Hazing, Fighting, Sexual Assaults: How Valley Forge Military Academy Devolved Into “Lord of the Flies”",Jasper Craven,https://www.motherjones.com/politics/2022/04/valley-forge-military-academy-problems-hazing-sexual-assault-lawsuits/
Oklahoma Just Passed a Bill Banning Abortion After Six Weeks,Ruth Murai,https://www.motherjones.com/politics/2022/04/oklahoma-six-week-abortion-ban/
A Guide to Madison Cawthorn’s Many Scandals,Noah Y. Kim,https://www.motherjones.com/politics/2022/04/a-guide-to-madison-cawthorns-many-scandals/
The High-Stakes Immigration Case Before the Supreme Court Isn’t Just About Immigration,Isabela Dias,https://www.motherjones.com/politics/2022/04/remain-in-mexico-the-immigration-case-before-the-supreme-court-isnt-just-about-immigration/
OSHA Found Risk Factors at an Amazon Warehouse Where a Tornado Killed Workers. The Agency Is Not Going to Punish Anyone.,Emily Hofstaedter,https://www.motherjones.com/politics/2022/04/amazon-penalty-osha-warehouse-tornado-illinois/
A Wave of Lawsuits Aims to Halt Louis DeJoy’s Gas-Guzzling Postal Fleet,Abigail Weinberg,https://www.motherjones.com/environment/2022/04/usps-louis-dejoy-gas-guzzling-trucks-postal-service-lawsuits-earthjustice/
The Ivy League’s Reckoning With Slavery Is Long Overdue,Michael Mechanic,https://www.motherjones.com/politics/2022/04/ivy-league-harvard-princeton-dartmouth-slavery-restitution-legacy-admissions/
Charges Connected to Trump White House Are Part of a Broader Probe Into Qatar Influence,Dan Friedman,https://www.motherjones.com/politics/2022/04/richard-olson-qatar-lobbying-trump/
The Folly of Ramping Up American Gas Exports to Europe,Jonathan Mingle,https://www.motherjones.com/politics/2022/04/biden-liquified-natural-gas-lng-exports-europe-russia-ukraine/
European Union Plans “Largest Ever Ban” on Toxic Chemicals,Arthur Neslen,https://www.motherjones.com/politics/2022/04/eu-europe-ban-dangerous-toxic-chemicals-restrictions-roadmap/
,,https://www.motherjones.com/mojo-wire/2022/04/yes-our-video-shown-at-marjorie-taylor-greenes-hearing-was-accurate/
,,https://www.motherjones.com/politics/2022/04/first-amendment-praetorian-january-6-committee-michael-flynn/
,,https://www.motherjones.com/mojo-wire/2022/03/donald-trump-talked-about-his-true-enemy-when-asked-about-russias-invasion-of-ukraine-windmills/
Here’s How DeSantis and Florida Republicans Just Violated Disney’s Civil Rights,Pema Levy,https://www.motherjones.com/mojo-wire/2022/04/desantis-dont-say-gay-republicans-florida/
I Hoped the Low-Rise Jeans Trend Would Die Fast. I was Wrong.,Emily Hofstaedter,https://www.motherjones.com/mojo-wire/2022/04/i-hoped-the-low-rise-jeans-trend-would-die-fast-i-was-wrong/
The Week It Became Obvious: The Biden Admin Is Over Making Covid Decisions,Inae Oh,https://www.motherjones.com/mojo-wire/2022/04/the-week-it-became-obvious-the-biden-admin-is-over-making-covid-decisions/
Ukrainian and Russian Dancers Join Onstage (in Italy) to Fundraise for the Red Cross,Daniel King,https://www.motherjones.com/recharge/2022/04/ukrainian-russian-antiwar-ballet-dancers-for-peace/
"Mass Shootings Persist, But a New Book Brings Hope and Science to Grappling With Their Prevention",Daniel King,https://www.motherjones.com/recharge/2022/04/mass-shooting-prevention-trigger-points/
"Yeah, I’m Gonna Need You to Go Ahead and Celebrate Michael Boltons’ Birthdays",Daniel King,https://www.motherjones.com/recharge/2022/02/office-space-michael-bolton-assclown-david-herman-birthday/
MAGA’s Knives Are Out for Kevin McCarthy,Inae Oh,https://www.motherjones.com/politics/2022/04/kevin-mccarthy-liar-trump/
BREAKING: Elon Musk to Buy Twitter,Noah Y. Kim,https://www.motherjones.com/politics/2022/04/breaking-elon-musk-to-buy-twitter/
"How Love, Dirt, and a Regenerative Farm Eased the Pain of the Climate Crisis for This Writer",Marc Fawcett-Atkinson,https://www.motherjones.com/environment/2022/04/how-love-dirt-and-a-regenerative-farm-eased-the-pain-of-the-climate-crisis-for-this-writer/
Why Old-Growth Forests Matter So Much in the Fight Against Climate Change,Maddie Oatman,https://www.motherjones.com/environment/2022/04/sequoia-biden-forest-old-growth-carbon-sink-climate-goals/
"I’m a Nurse at a Stanford Hospital. I’m Burned Out, Fed Up, and Ready to Strike.",Anonymous as told to Jackie Flynn Mogensen,https://www.motherjones.com/politics/2022/04/stanford-nurse-strike-covid/
Stanford Threatens to Cut Health Care for Nurses Who Go on Strike,Emily Hofstaedter,https://www.motherjones.com/politics/2022/04/stanford-nurses-health-care-strike-lose-benefits-covid/
"With Emergency SNAP Benefits Ending, a Hunger Cliff Looms",Bridget Huber,https://www.motherjones.com/food/2022/04/with-emergency-snap-benefits-ending-a-hunger-cliff-looms/
Big Apps Made a Meal Out of Local Restaurants. Food Delivery Co-Ops Are Fighting Back.,Dean Kuipers,https://www.motherjones.com/food/2022/04/delivery-apps-grubhub-ubereats-doordash-coop-food-tech/
Don’t Share the DC Shooter’s Video of Him Opening Fire on a School,Mark Follman,https://www.motherjones.com/media/2022/04/dc-mass-shooter-video-of-attack/
Texas Halts Execution of Melissa Lucio,Samantha Michaels,https://www.motherjones.com/crime-justice/2022/04/texas-execution-melissa-lucio-mother/
How an Army of Volunteers Has Welcomed Immigrants in Poland—After the Government Wouldn’t,Molly Schwartz,https://www.motherjones.com/politics/2022/04/army-of-volunteers-welcoming-ukrainian-immigrants-in-poland/
Ukrainian Refugees Are Being Embraced by Europe. Why Weren’t Syrians?,Isabela Dias,https://www.motherjones.com/politics/2022/03/ukrainian-refugees-are-being-embraced-by-europe-why-werent-syrians/
,,https://www.motherjones.com/crime-justice/2022/04/mass-shootings-behavioral-threat-assessment-oxford-high-school-trigger-points/
,,https://www.motherjones.com/crime-justice/2022/04/abolish-child-protective-services-torn-apart-dorothy-roberts-book-excerpt/
,,https://www.motherjones.com/politics/2022/04/hunter-biden-laptop-guo-wengui-bannon-giuliani/
,,https://www.motherjones.com/politics/2022/03/chess-grandmasters-putin-russia-ukraine-war/
January 6 Reckoning: CNN’s Jake Tapper Says the Media Must Confront Republicans’ Big Lie,Abigail Weinberg,https://www.motherjones.com/media/2021/07/january-6-insurrection-capitol-cnn-jake-tapper-podcast/
We Need to Understand How We Got to January 6 Before We Can Move Forward,Fernanda Echavarri,https://www.motherjones.com/politics/2021/06/podcast-january-6-qanon-history-whats-next/
A Radical Idea for Forcing Vaccine Companies to Share Knowledge With the World,Molly Schwartz and Jamilah King,https://www.motherjones.com/politics/2021/05/vaccine-patents-biden-covid-india-dean-baker-pandemic/
,,https://podcasts.apple.com/us/podcast/the-mother-jones-podcast/id1386408605
