title,byline,url
DHS Still Has a Civil Rights Team. Aliya Rahman Is Testing It.,Sophie Hurwitz,https://www.motherjones.com/politics/2026/06/ice-dhs-aliya-rahman-complaint-civil-rights-minneapolis-minnesota-crcl/
DHS Still Has a Civil Rights Team. Aliya Rahman Is Testing It.,Sophie Hurwitz,https://www.motherjones.com/politics/2026/06/ice-dhs-aliya-rahman-complaint-civil-rights-minneapolis-minnesota-crcl/
Trump Is Losing His War On Algae,Dan Friedman and Amanda Moore,https://www.motherjones.com/politics/2026/06/trump-algae-reflecting-pool-lincoln-memorial-paint-chips-repair/
Downballot Democrats Are Smashing Recruitment Records,Tim Murphy,https://www.motherjones.com/politics/2026/06/downballot-democratic-candidate-recruitment-2026/
A Mother Jones Investigation Helped Spur a New Alaska Law Protecting Vulnerable Kids,Julia Lurie,https://www.motherjones.com/politics/2026/06/alaska-foster-youth-reform-legislation-hb-36-mother-jones-investigation/
Did Trump Get Special Access to Retatrutide?,Inae Oh,https://www.motherjones.com/politics/2026/06/trump-retatrutide-eli-lilly/
"In This Utah Primary, Trump Endorsed One Candidate, Pardoned the Other",Stephanie Mencimer,https://www.motherjones.com/politics/2026/06/celeste-maloy-phil-lyman-two-maga-diehards-are-fighting-over-whos-maga-enough-in-utah/
The Southern Baptist Convention Was Going Mainstream. Then the Christian Nationalists Weighed In.,Kiera Butler,https://www.motherjones.com/politics/2026/06/the-southern-baptist-convention-was-going-mainstream-then-the-christian-nationalists-weighed-in/
,,https://www.motherjones.com/politics/2026/06/how-democrats-can-still-win-the-redistricting-war-by-2028/
,,https://www.motherjones.com/politics/2026/06/delaney-hall-ice-protests-dhs-congress-video/
,,https://www.motherjones.com/politics/2026/06/bill-pulte-trump-dni/
,,https://www.motherjones.com/politics/2026/05/video-trump-midterms-primaries-base-endorsement/
Trump Threatens Iran as JD Vance Announces “Great Progress” on Ceasefire,Sophie Hurwitz,https://www.motherjones.com/politics/2026/06/trump-threatens-iran-as-jd-vance-announces-great-progress-on-ceasefire/
Why GM Is Betting on a Future With Sodium-Ion Battery Storage,Dan Gearino,https://www.motherjones.com/environment/2026/06/general-motors-gm-peak-energy-sodium-ion-battery-storage-technology-development/
“Willful Neglect”: A New Report on the State of Fatherhood Pulls No Punches,Sophie Hurwitz,https://www.motherjones.com/politics/2026/06/willful-neglect-a-new-report-on-the-state-of-fatherhood-pulls-no-punches/
“Super El Niño” Is Terrible News for Farmers Around the World,Frida Garza,https://www.motherjones.com/environment/2026/06/super-el-nino-effects-impacts-extreme-weather-rainfall-flooding-drought-farmers-crop-failure-famine-hunger/
The Beautiful Game Is More Unaffordable Than Ever,Reveal,https://www.motherjones.com/politics/2026/06/world-cup-soccer-football-fifa-ticket-prices-infantino-haiti/
The Reflecting Pool Mess Is Right Out of Trump’s Destructive Playbook,Alex Nguyen,https://www.motherjones.com/politics/2026/06/the-reflecting-pool-mess-is-right-out-of-trumps-destructive-playbook/
Trump DOJ Outlines Dubious Path to Force People Into Psychiatric Institutions,Julia Métraux,https://www.motherjones.com/politics/2026/06/trump-doj-memo-olmstead-psychiatric-disabilities-institutions-mental-health/
Republicans Question the US-Iran Deal. But Many Are Only Blaming JD Vance.,Alex Nguyen,https://www.motherjones.com/politics/2026/06/republicans-question-the-us-iran-deal-but-many-are-only-blaming-jd-vance/
Trump and Iran: Stupid Is As Stupid Does,"June 19, 2026",https://www.motherjones.com/politics/2026/06/donald-trump-iran-war-deal-mou-hormuz-nuclear-weapons/
Elon Musk: The World’s Worst Trillionaire,"June 17, 2026",https://www.motherjones.com/politics/2026/06/elon-musk-world-worst-trillionaire-spacex-tesla-trump-usaid-doge/
Trump’s “Weaponization” Claim Is Total BS,"June 10, 2026",https://www.motherjones.com/politics/2026/06/donald-trump-weaponization-slush-fund-maga-russia/
,,https://www.motherjones.com/politics/2026/06/world-cup-soccer-football-fifa-ticket-prices-infantino-haiti/
,,https://www.motherjones.com/politics/2026/06/bryan-stevenson-america-slavery-equal-justice/
,,https://www.motherjones.com/politics/2026/06/aids-hiv-epidemic-new-york-blindspot-2026/
,,https://www.motherjones.com/politics/2026/06/heather-cox-richardson-america-democracy/
Trump Takes Two Steps Back in Ending His Iran War,Alex Nguyen,https://www.motherjones.com/politics/2026/06/trump-israel-lebanon-iran-ceasefire-failing/
Report: ICE Caused Humanitarian Crisis in Minnesota,Sophie Hurwitz,https://www.motherjones.com/politics/2026/06/hrw-human-rights-watch-metro-surge-ice-cbp-report-crisis/
“Water-Gate”: FIFA’s Solution to World Cup Heat Is Seen as a Cash Grab,Tik Root,https://www.motherjones.com/environment/2026/06/fifa-world-cup-hydration-breaks-commercials-controversy/
Our Hidden Fungal Networks Could Reach Beyond the Solar System,Wyatt Myskow,https://www.motherjones.com/environment/2026/06/underground-mycorrhizal-fungal-networks-mapping-spun-science/
Trump Told Prosecutors to Target ICE Protesters. A Chicago Jury Wasn’t Buying It.,Sophie Hurwitz,https://www.motherjones.com/politics/2026/06/a-chicago-grand-jury-wasnt-buying-the-case-against-ice-protesters/
Greg Bovino Keeps Posting to Get His Job Back. No One Is Listening.,Sophie Hurwitz,https://www.motherjones.com/politics/2026/05/greg-bovino-ice-delaney-hall-posts/
Kimberlé Crenshaw Says Juneteenth Reminds Us “Freedom Is Not a One and Done Situation”,Jeffrey Kelly,https://www.motherjones.com/media/2026/06/kimberle-crenshaw-juneteenth-backtalker/
Trump Resurrected the Statue of a Slave Owner. Its Pedestal Cost Taxpayers $527K.,Dan Friedman and Abby Vesoulis,https://www.motherjones.com/politics/2026/06/trump-resurrected-the-statue-of-a-slave-owner-its-pedestal-cost-taxpayers-527k/
HHS Pushes Fetal Personhood in New Grant Guidelines,Anna Rogers,https://www.motherjones.com/politics/2026/06/trump-rfk-abortion-hhs-fetal-personhood-ivf-embryo-adoption/
RFK’s Answer to the Maternal Health Crisis: Hide the Data,Chasity Hale,https://www.motherjones.com/politics/2026/06/maternal-health-black-mothers-crisis-listening-national-partnership-hhs-rfk/
New York Hospital Faces Criminal Subpoena in Texas Over Trans Youth Care,Sophie Hurwitz,https://www.motherjones.com/politics/2026/05/new-york-trans-gender-care-hospital-texas/
“Counterterrorism” Now Officially Means Targeting Trans People,Sophie Hurwitz,https://www.motherjones.com/politics/2026/05/trump-gorka-counter-terrorism-transgender-antifa-docuiment/
,,https://www.motherjones.com/politics/2026/06/supreme-court-amicus-briefs-investigation/
,,https://www.motherjones.com/media/2026/05/johnny-appleseed-john-chapman-booze-cider-walking-trails-american-revolution-apples-swedenborg/
,,https://www.motherjones.com/politics/2026/03/exploding-pintos-imploding-politics-celebrating-50-years-of-fearless-journalism/
,,https://www.motherjones.com/politics/2026/02/donald-trumps-national-park-signs-francis-newlands-chevy-chase-circle/
Trump’s Justice Department Is Suing Cities and States to Dismantle Gun Laws,Jennifer Mascia for the Trace,https://www.motherjones.com/politics/2026/06/justice-department-civil-right-division-second-amendment-section/
What Americans Really Think in These Troubled Times,Dan Hoyle,https://www.motherjones.com/politics/2026/05/dan-hoyle-takes-all-kinds-essay/
My Half-Baked Attempt to Cook Through the World Cup,Tim Murphy,https://www.motherjones.com/politics/2026/06/world-cup-cooking-recipies/
The “Lobe Rangers” Are Fighting to Make Farming in Iowa More Sustainable,Anika Jane Beamer,https://www.motherjones.com/politics/2026/06/lobe-rangers-farming-iowa-sustainable-water-crisis-herbicides/
How Disability Shaped American Citizenship,Julia Métraux,https://www.motherjones.com/politics/2026/06/before-disability-american-citizenship-altschuler-book-penn/
RFK Jr. Will Oversee Disability Education Policy,Julia Métraux,https://www.motherjones.com/politics/2026/06/rfk-jr-disability-special-education-hhs-kennedy-autism/
DOJ’s New ICE Protest Indictment Is Its Most Absurd Yet,Sophie Hurwitz,https://www.motherjones.com/politics/2026/06/minneapolis-protest-doj-ice-indictment-antifa-nspm-dhs/
She Froze After Being Released by ICE. The Medical Examiner Ruled It a Homicide.,Sophie Hurwitz,https://www.motherjones.com/politics/2026/06/she-froze-after-being-released-by-ice-the-medical-examiner-ruled-it-a-homicide/
