title,byline,url
Florida Poised to Allow Executions After 8-4 Jury Vote,Noah Lanard,https://www.motherjones.com/politics/2023/04/florida-poised-to-allow-executions-after-8-4-jury-vote/
Florida Poised to Allow Executions After 8-4 Jury Vote,Noah Lanard,https://www.motherjones.com/politics/2023/04/florida-poised-to-allow-executions-after-8-4-jury-vote/
Rutgers Faculty Unions Suspend Historic Strike After Securing Major Victories,Noah Lanard,https://www.motherjones.com/politics/2023/04/rutgers-faculty-unions-suspend-historic-strike-after-securing-major-victories/
Judge Who Blocked Abortion Drug Did Not Disclose Controversial Article,Noah Lanard,https://www.motherjones.com/politics/2023/04/judge-who-blocked-abortion-drug-did-not-disclose-controversial-article/
Mike Pompeo Wants You to Know He Won’t Be President,Noah Lanard,https://www.motherjones.com/politics/2023/04/mike-pompeo-wants-you-to-know-he-wont-be-president/
Why Rutgers Faculty Are Striking for the First Time in 257 Years,Noah Lanard,https://www.motherjones.com/politics/2023/04/rutgers-faculty-strike-graduate-students-adjuncts/
Biden’s Plan to Phase Out Gas Cars Isn’t Crazy at All,Nitish Pahwa,https://www.motherjones.com/environment/2023/04/bidens-plan-to-phase-out-gas-cars-isnt-crazy-at-all/
How MAGA Conspiracies Infected Autism Groups,Kiera Butler,https://www.motherjones.com/politics/2023/04/how-maga-conspiracies-infected-autism-groups/
California Supreme Court to Tesla: Stop Being Racist,Abigail Weinberg,https://www.motherjones.com/mojo-wire/2023/04/california-supreme-court-to-tesla-stop-being-racist/
Florida Just Passed a Six-Week Abortion Ban,Abigail Weinberg,https://www.motherjones.com/politics/2023/04/florida-just-passed-a-six-week-abortion-ban/
Here’s How Climate Change Is Making It Easier to Hit Home Runs,Siri Chilukuri,https://www.motherjones.com/politics/2023/04/heres-how-climate-change-is-making-it-easier-to-hit-home-runs/
,,https://www.motherjones.com/politics/2023/04/kamala-harris-black-tennessee-lawmakers-reaction-biden-obama/
,,https://www.motherjones.com/politics/2023/04/video-tennessee-democrat-interview-expulsion-covenant-shooting/
,,https://www.motherjones.com/politics/2023/03/video-david-corn-warning-trump-chaos-indictment-historic/
I Have Some Questions Now That Harry Is Going to Dad’s Big Boy Party,Inae Oh,https://www.motherjones.com/mojo-wire/2023/04/prince-harry-king-charles-meghan-coronation-invite-update/
Michigan Governor Gretchen Whitmer Overturns 1931 Abortion Ban,Abigail Weinberg,https://www.motherjones.com/politics/2023/04/gretchen-whitmer-michigan-abortion-law-zombie-laws/
Tennessee House Republicans Move to Expel Three Members for Gun Control Protest,Arianna Coghill,https://www.motherjones.com/politics/2023/04/tennessee-gop-republican-house-expel-members-gun-control-protest-nashville-shooting/
Experiencing Space Flight Just Got a Lot More Accessible,Daniel King,https://www.motherjones.com/recharge/2022/12/space-flight-portal/
"Remembering George Pérez, a Superhero of Superhero Comics",Dan Spinelli,https://www.motherjones.com/recharge/2022/05/remembering-george-perez-a-superhero-of-superhero-comics/
Ukrainian and Russian Dancers Join Onstage (in Italy) to Fundraise for the Red Cross,Daniel King,https://www.motherjones.com/recharge/2022/04/ukrainian-russian-antiwar-ballet-dancers-for-peace/
The Biden Administration’s Revolutionary Electric Cars Proposal,Abigail Weinberg,https://www.motherjones.com/politics/2023/04/electric-vehicles-biden-administraiton-proposal-epa-gas-guzzling/
"Justin Pearson, Tennessee Democrat Expelled for Gun Control Protest, Is Reinstated",Arianna Coghill,https://www.motherjones.com/politics/2023/04/justin-pearson-tennessee-democrat-expelled-for-gun-control-protest-is-reinstated/
Will History Absolve Eco-Terrorists?,Eamon Whalen,https://www.motherjones.com/politics/2023/04/how-to-blow-up-a-pipline-review-malm-movie-eco-terrorism/
What Chicago’s New Mayor Means for Environmental Justice,Siri Chilukuri,https://www.motherjones.com/environment/2023/04/what-chicagos-new-mayor-means-for-environmental-justice/
"After a Right-Wing Florida Hospital Protest, a Doctor Loses His Board Certification for Covid Disinformation",Kiera Butler,https://www.motherjones.com/politics/2023/03/sarasota-hospital-covid-misinformation-john-littell-desantis-ladapo/
Mike Flynn and MAGA Activists Wage War Against a Florida Hospital,Kiera Butler,https://www.motherjones.com/politics/2023/03/mike-flynn-and-maga-activists-wage-war-against-a-florida-hospital/
Fries With That Mammoth Burger?,Damian Carrington,https://www.motherjones.com/environment/2023/03/mammoth-burger-meatball-extinct-vow-cultivated-meat-climate-methane/
"Misuse of Phosphorus Is Wreaking Havoc, Scientists Warn",Robin McKie,https://www.motherjones.com/environment/2023/03/phosphorus-fertilizer-shortage-algae-dead-zones-environment-runoff/
“Undemocratic”: Why Is Keith Ellison Taking Over a Case From a Prosecutor He Endorsed?,Eamon Whalen,https://www.motherjones.com/crime-justice/2023/04/minneapolis-keith-ellison-prosecutor-progressive-mary-moriarty-undemocratic/
Louisville Mass Shooter Is the Seventh in 11 Months to Open Fire With an AR-15,Mark Follman,https://www.motherjones.com/politics/2023/04/louisville-mass-shooting-ar15-guns/
Ron DeSantis Wants to Make Transporting Migrants a Felony,Isabela Dias,https://www.motherjones.com/politics/2023/02/ron-desantis-wants-to-make-transporting-migrants-a-felony/
The New York Times Just Dropped a Shocking Investigation on Child Labor in America,Arianna Coghill,https://www.motherjones.com/politics/2023/02/new-york-times-child-labor-immigrant-kids/
,,https://www.motherjones.com/politics/2023/04/wisconsin-supreme-court-election-daniel-kelly-janet-protasiewicz/
,,https://www.motherjones.com/politics/2023/03/ron-desantis-florida-teachers/
,,https://www.motherjones.com/crime-justice/2023/03/who-killed-rasheem-carter/
,,https://www.motherjones.com/politics/2023/01/we-tried-to-call-the-top-donors-to-george-santos-2020-campaign-many-dont-seem-to-exist/
“Undemocratic”: Why Is Keith Ellison Taking Over a Case From a Prosecutor He Endorsed?,Eamon Whalen,https://www.motherjones.com/crime-justice/2023/04/minneapolis-keith-ellison-prosecutor-progressive-mary-moriarty-undemocratic/
Nashville Officials Unanimously Vote to Reinstate Justin Jones,Arianna Coghill,https://www.motherjones.com/politics/2023/04/justin-jones-nashville-vote/
Tennessee House Republicans Move to Expel Three Members for Gun Control Protest,Arianna Coghill,https://www.motherjones.com/politics/2023/04/tennessee-gop-republican-house-expel-members-gun-control-protest-nashville-shooting/
"For Princess Blanding, “The Blood” of Irvo Otieno Is on the Hands of Virginia’s Lawmakers",Arianna Coghill,https://www.motherjones.com/crime-justice/2023/03/princess-blanding-irvo-otieno/
