title,byline,url
The Troubling Mystery of the Trump Shooter’s Motive,Mark Follman,https://www.motherjones.com/politics/2024/07/trump-shooter-assassination-attempt-motive-crooks/
The Troubling Mystery of the Trump Shooter’s Motive,Mark Follman,https://www.motherjones.com/politics/2024/07/trump-shooter-assassination-attempt-motive-crooks/
Donald Trump Was Peter Thiel’s Most Successful Investment,Inae Oh,https://www.motherjones.com/politics/2024/07/peter-thiel-donald-trump-vance-hulk-hogan/
It Doesn’t Take a Conspiracy Theory to Explain Law Enforcement Incompetence,Tim Murphy,https://www.motherjones.com/politics/2024/07/it-doesnt-take-a-conspiracy-theory-to-explain-law-enforcement-incompetence/
Democrats Seem Set on Rushing Joe Biden’s Nomination. Republicans Are Thrilled.,Abby Vesoulis,https://www.motherjones.com/politics/2024/07/democrats-seem-set-on-rushing-joe-bidens-nomination-republicans-are-thrilled/
The Audacity of Elon Musk’s $180 Million Pledge to Elect Donald Trump,Judd Legum and Rebecca Crosby,https://www.motherjones.com/politics/2024/07/elon-musk-america-pac-donald-trump-45-million-mail-absentee-voting/
Here’s the Latest Example of How Conservatives Have Gamed State Supreme Courts to Restrict Abortion,Sarah Szilagy,https://www.motherjones.com/politics/2024/07/heres-the-latest-example-of-how-conservatives-have-gamed-state-supreme-courts-to-restrict-abortion/
Peter Navarro to RNC: “I Went to Prison So You Won’t Have To”,Dan Friedman,https://www.motherjones.com/politics/2024/07/peter-navarro-rnc-prison-speech-trump-guo-wengui/
,,https://www.motherjones.com/sponsored/the-looming-threat-of-christian-nationalism/
,,https://www.motherjones.com/sponsored/navigating-farm-and-ranch-transfers-to-a-new-generation/
,,https://www.motherjones.com/politics/2024/07/the-dnc-just-launched-its-first-paid-media-ad-against-jd-vance/
,,https://www.motherjones.com/politics/2024/07/gop-rnc-trump-shooting-witness-video/
,,https://www.motherjones.com/politics/2024/07/fox-news-kat-abughazaleh-kamala-harris-biden-debate-video/
,,https://www.motherjones.com/politics/2024/07/biden-2024-1968-dnc-convention-johnson-history-video/
Megadonors Are Showering Donald Trump & Co With Cash,Michael Mechanic,https://www.motherjones.com/politics/2024/07/megadonors-donald-trump-fundraising-disclosures/
Employees Sue American Over “Socio-Political” 401(k) Options,Mathilde Augustin,https://www.motherjones.com/politics/2024/07/american-airlines-employees-lawsuit-esg-investing-woke-environmental-social-factors-erisa/
J.D. Vance’s Past Attacks on Trump Aren’t Hypocrisy. They’re His Main Argument.,Jacob Rosenberg,https://www.motherjones.com/politics/2024/07/j-d-vances-past-attacks-on-trump-arent-hypocrisy-theyre-his-main-argument-2024-convention/
RNC Delegates Sound Off on Whether America Should Be a Christian Nation,Kiera Butler,https://www.motherjones.com/politics/2024/07/rnc-delegates-sound-off-on-whether-america-should-be-a-christian-nation/
Another Likely Casualty of the Latest  Supreme Court Rulings: The Taxman,Michael Mechanic,https://www.motherjones.com/politics/2024/07/supreme-court-loper-bright-corner-post-irs-tax-policy/
Biden’s $30m Weekend Fundraising Blitz Breaks Democratic Party Records,James West,https://www.motherjones.com/politics/2024/06/biden-campaign-fundraiser-30-million-hollywood-clooney-obama/
North Carolina House Passes Revised Mask Ban,Julia Métraux,https://www.motherjones.com/politics/2024/06/north-carolina-house-passes-revised-mask-ban/
Hunter Biden Convicted on Federal Gun Charges,Julia Métraux,https://www.motherjones.com/mojo-wire/2024/06/hunter-biden-gun-trial-jury-decision/
Here’s How Biden Could Rattle Trump in Their First Debate,"June 24, 2024",https://www.motherjones.com/politics/2024/06/trump-biden-first-debate-rattle-ridicule-cnn/
The Most Under-Covered Story of 2024: Trump and Right-Wing Extremism,"June 13, 2024",https://www.motherjones.com/politics/2024/06/donald-trump-turning-point-usa-charlie-kirk-right-wing-extremism-our-land-david-corn/
"Here Come the Russians, Again","May 24, 2024",https://www.motherjones.com/politics/2024/05/here-come-the-russians-again/
,,https://www.motherjones.com/politics/2024/06/40-acres-lie-skidaway-island-georgia-racism-the-landings-reveal/
,,https://www.motherjones.com/politics/2024/06/new-reveal-episode-40-acres-lie-part-1/
,,https://www.motherjones.com/environment/2024/06/reveal-arizona-water-the-grab/
,,https://www.motherjones.com/politics/2024/06/how-a-battle-over-solar-power-tore-one-new-york-community-apart/
Why It Took Seven Years to Get One Statistic About Guns,Artis Curiskis,https://www.motherjones.com/politics/2024/07/why-it-took-seven-years-to-get-one-statistic-about-guns/
More and More Rappers Are Hopping Aboard the Trump Train,Arianna Coghill,https://www.motherjones.com/politics/2024/07/trump-2024-campaign-rapper-endorsements-amber-rose-50-cent/
Global Warming Is Making Our Days Longer,Damian Carrington,https://www.motherjones.com/environment/2024/07/study-glaciers-global-warming-climate-change-slowing-earth-rotation/
Legal Patchwork Leaves US Renters Vulnerable to Extreme Heat,Li Zhou,https://www.motherjones.com/politics/2024/07/law-renters-vulnerable-extreme-heat-waves/
How a Young Thug “Meme Page” Helped Expose Georgia’s Broken Court System,Alex Nguyen,https://www.motherjones.com/criminal-justice/2024/07/young-thug-rico-fani-willis-thuggerdaily/
"The Supreme Court’s January 6 Decision Was a Win for Progressive Protesters, Too",Jeremy Schulman,https://www.motherjones.com/criminal-justice/2024/06/supreme-court-fischer-january-6/
The Endless Pursuit of Equality Through College Admissions,Alex Nguyen,https://www.motherjones.com/media/2024/06/admissions-granted-harvard-supreme-court-affirmative-action/
The Shocking Discovery That Suddenly Made Reparations Deeply Personal for One Woman,Alexia Fernández Campbell and Nadia Hamdan,https://www.motherjones.com/politics/2024/06/the-shocking-discovery-that-suddenly-made-reparations-deeply-personal-for-one-woman/
Project 2025 Is Twisting Disability Rights Law to Attack Abortion,Julia Métraux,https://www.motherjones.com/politics/2024/07/project-2025-abortion-disability-rights-heritage-foundation/
Abortion Bans Are Also Terrible for Babies,Nina Martin,https://www.motherjones.com/politics/2024/07/abortion-bans-are-also-terrible-for-babies/
Why Smashing the Administrative State Is a Disaster for Reproductive Rights,Nina Martin,https://www.motherjones.com/politics/2024/07/why-smashing-the-administrative-state-is-a-disaster-for-reproductive-rights/
Carvell Wallace on Life and Love and Coming of Age in a Cruel World,Carvell Wallace,https://www.motherjones.com/media/2024/05/carvell-wallace-another-word-love-memoir-book-excerpt/
,,https://www.motherjones.com/politics/2024/07/peter-singer-princeton-animal-rights-american-democracy-effective-altruism-voting-donald-trump-joe-biden/
,,https://www.motherjones.com/politics/2024/06/menstruation-science-sexism-period-blood-qvin-rose-endometriosis-jen-gunter/
,,https://www.motherjones.com/criminal-justice/2024/05/threat-assessment-mass-shooting-elliot-rodger-isla-vista-mother/
,,https://www.motherjones.com/criminal-justice/2023/10/foster-kids-psychiatric-hospitals-universal-health-services-uhs-alaska-cps/
Trump Got Shot With an AR-15. Don’t Expect His Party to Support a Ban.,Stephanie Mencimer,https://www.motherjones.com/politics/2024/07/trump-got-shot-with-an-ar-15-dont-expect-his-party-to-support-a-ban/
Officials Would Like the Secret Service to Explain Itself,Julianne McShane,https://www.motherjones.com/politics/2024/07/officials-would-like-the-secret-service-to-explain-itself/
Why Donald Trump’s Plan to Stop Taxing Tips Is a Lame Political Stunt,Judd Legum,https://www.motherjones.com/politics/2024/07/donald-trump-proposal-no-tax-tips/
"Awash in Consumer Waste, Germany Tries Encouraging a Culture of Reuse",Ajit Niranjan,https://www.motherjones.com/environment/2024/07/consumer-waste-germany-reuse-recycling-efforts/
"Citing Health Concerns, Some Jewish New Yorkers Push Back Against Proposed Mask Ban",Julia Métraux,https://www.motherjones.com/politics/2024/06/hochul-mask-ban-new-york-subway-covid-israel-palestine/
RFK Jr. Is Even Crazier Than You Might Think,David Corn,https://www.motherjones.com/politics/2024/05/robert-kennedy-jr-conspiracy-theory-covid-pandemic-event-201/
Trump Again Demonizes Migrants for “Poisoning Our Country”,Mark Follman,https://www.motherjones.com/politics/2024/07/trump-fox-news-hannity-migrants-poisoning/
Most Immigrant Deaths in ICE Detention Could Have Been Prevented,Isabela Dias,https://www.motherjones.com/politics/2024/06/most-immigrant-deaths-in-ice-detention-could-have-been-prevented/
