title,byline,url
The Federal Indictment of Donald J. Trump: Historic…and Wild,David Corn,https://www.motherjones.com/politics/2023/06/the-federal-indictment-of-donald-j-trump-historic-and-wild/
The Federal Indictment of Donald J. Trump: Historic…and Wild,David Corn,https://www.motherjones.com/politics/2023/06/the-federal-indictment-of-donald-j-trump-historic-and-wild/
"Trump Indicted Again, Trump Says","Dan Friedman, Russ Choma, and Abigail Weinberg",https://www.motherjones.com/politics/2023/06/trump-indicted-again/
Late Payments and Confusion: One Startup’s Struggle to Make Rent Easier,Emma Rindlisbacher,https://www.motherjones.com/politics/2023/06/flex-rent-housing-portals/
What the Supreme Court's Voting Rights Act Shocker Means for 2024—and Beyond,Pema Levy,https://www.motherjones.com/politics/2023/06/voting-rights-act-supreme-court/
Trump Is Reportedly on Tape Bragging About Keeping Classified Info,Inae Oh,https://www.motherjones.com/politics/2023/06/trump-tape-secret-classified-documents/
How to Get Away With Murder,Tim Murphy,https://www.motherjones.com/politics/2023/06/liv-pga-merger-saudi-arabia-mbs/
Today’s Giant Supreme Court Surprise Ruling Is a Rare Win for Democracy,Ari Berman,https://www.motherjones.com/politics/2023/06/supreme-court-allen-v-milligan-voting-rights-act-alabama/
Virginia Moves Forward With Plan to Exit Carbon-Cutting Coalition as State Is Blanketed by Smoke,Arianna Coghill,https://www.motherjones.com/mojo-wire/2023/06/virginia-regional-greenhouse-gas-initiative-glenn-youngkin/
Wildfires in Canada: Fires Are Burning With Greater Destructive Intensity Over Much Longer Seasons,John Vaillant,https://www.motherjones.com/politics/2023/06/wildfires-in-canada-fires-are-burning-with-greater-destructive-intensity-over-much-longer-seasons/
Eric Adams Is Bringing the GOP’s Anti-Immigrant Crusade to New York,Isabela Dias,https://www.motherjones.com/politics/2023/06/eric-adams-is-bringing-the-gops-anti-immigrant-crusade-to-new-york/
,,https://www.motherjones.com/media/2023/05/halle-bailey-ariel-little-mermaid-backlash-ebony-elizabeth-thomas-interview/
,,https://www.motherjones.com/politics/2023/05/ron-desantis-laws/
,,https://www.motherjones.com/politics/2023/05/video-clarence-thomas-scandals-harlan-crow-billionaire-black-nationalism/
Read the 49-Page Trump Classified Documents Indictment,Abigail Weinberg,https://www.motherjones.com/mojo-wire/2023/06/read-the-49-page-trump-classified-documents-indictment/
Nikki Haley Blames Trans Kids in Locker Rooms for Teen Suicides,Arianna Coghill,https://www.motherjones.com/mojo-wire/2023/06/nikki-haley-trans-kids-teen-suicides/
How the Debt Ceiling Deal Could Finally Restart Your Student Loan Payments,Arianna Coghill,https://www.motherjones.com/mojo-wire/2023/06/student-loans-debt-ceiling-deal/
Experiencing Space Flight Just Got a Lot More Accessible,Daniel King,https://www.motherjones.com/recharge/2022/12/space-flight-portal/
"Remembering George Pérez, a Superhero of Superhero Comics",Dan Spinelli,https://www.motherjones.com/recharge/2022/05/remembering-george-perez-a-superhero-of-superhero-comics/
Ukrainian and Russian Dancers Join Onstage (in Italy) to Fundraise for the Red Cross,Daniel King,https://www.motherjones.com/recharge/2022/04/ukrainian-russian-antiwar-ballet-dancers-for-peace/
"You Can Help Prevent Forest Fires. Yes, Really.",Abigail Weinberg,https://www.motherjones.com/politics/2023/06/forest-fires-climate-change/
Here Is All the Evidence You Needed That Drag Bans Are About Erasing Trans Existence,Henry Carnell,https://www.motherjones.com/politics/2023/06/montana-anti-drag-ban-library-transgender/
What if a “State of Emergency” Isn’t Enough?,Kyubin Kim,https://www.motherjones.com/environment/2023/06/state-of-emergency-keyword-mother-tongue/
Wait? Now We Have to Worry About Plankton?,Kate Yoder,https://www.motherjones.com/environment/2023/06/global-warming-plankton-carbon-emissions-study/
Bolsonaro Allegedly Falsified His Vaccination Status to Enter the US,Isabela Dias,https://www.motherjones.com/politics/2023/05/bolsonaro-allegedly-falsified-his-vaccination-status-to-enter-the-us/
The Coming Tidal Wave of Right Wing Covid Lawsuits,Kiera Butler,https://www.motherjones.com/politics/2023/04/the-coming-tidal-wave-of-right-wing-covid-lawsuits/
Bison Meat Is Hot. Ranchers Are Struggling to Keep Up.,Lela Nargi,https://www.motherjones.com/environment/2023/05/bison-meat-is-hot-ranchers-are-struggling-to-keep-up/
One Simple Way to Slash Methane Pollution: Composting,Max Graham,https://www.motherjones.com/environment/2023/05/methane-emissions-reduction-landfill-composting-study/
Atlanta City Council Approves Funding for “Cop City”,Arianna Coghill,https://www.motherjones.com/crime-justice/2023/06/atlanta-cop-city-vote/
"Tennessee’s Ban on Drag Shows Is Unconstitutional, Judge Rules",Pema Levy,https://www.motherjones.com/politics/2023/06/tennessee-law-ban-drag-shows-ruled-unconstitutional/
Ron DeSantis Can’t Stop Smearing Asylum Seekers,Tim Murphy,https://www.motherjones.com/politics/2023/05/ron-desantis-cant-stop-smearing-asylum-seekers/
All Floridians Should Be Worried About DeSantis’ New Anti-Immigration Law,Isabela Dias,https://www.motherjones.com/politics/2023/05/all-floridians-should-be-worried-about-desantis-new-anti-immigration-law/
,,https://www.motherjones.com/politics/2023/06/pajaro-rebuild-flooding-fema/
,,https://www.motherjones.com/politics/2023/05/student-loan-debt-cancellation-supreme-court-jessica-madison-collective/
,,https://www.motherjones.com/politics/2023/03/anti-trans-transgender-health-care-ban-legislation-bill-minors-children-lgbtq/
,,https://www.motherjones.com/crime-justice/2023/03/who-killed-rasheem-carter/
"Why We Can Imagine Singing Fish, But Not Black Mermaids",Arianna Coghill and Sam Van Pykeren,https://www.motherjones.com/media/2023/05/halle-bailey-ariel-little-mermaid-backlash-ebony-elizabeth-thomas-interview/
NAACP Warns Black People Against Traveling to Ron DeSantis’ Florida,Arianna Coghill,https://www.motherjones.com/mojo-wire/2023/05/naacp-warns-black-people-from-traveling-to-ron-desantis-florida/
Daniel Penny Claims He Can’t Be Racist Because He Planned a Trip to Africa,Arianna Coghill,https://www.motherjones.com/crime-justice/2023/05/daniel-penny-trip-to-africa-racism/
She Filmed a Teacher Saying the N-Word. Then She Got Suspended For It.,Arianna Coghill,https://www.motherjones.com/crime-justice/2023/05/mary-walton-missouri-n-word-suspended/
