title,byline,url
The California Recall Effort Has Officially Failed,Lil Kalish,https://www.motherjones.com/politics/2021/09/the-california-newsom-elder-recall-effort-has-failed/
The California Recall Effort Has Officially Failed,Lil Kalish,https://www.motherjones.com/politics/2021/09/the-california-newsom-elder-recall-effort-has-failed/
Biden Just Threw a Bone to Big Almond,Tom Philpott,https://www.motherjones.com/food/2021/09/biden-just-handed-a-bone-to-big-almond/
The Extreme Right’s Favorite Web Provider Just Got Hacked,AJ Vicens,https://www.motherjones.com/politics/2021/09/epik-hack-anonymous-gab-parler/
I Worked at a Prison. My Boss Stalked Me to Prove I Wasn’t Injured.,Yvonne Stephens As Told To Samantha Michaels,https://www.motherjones.com/politics/2021/09/i-worked-at-a-prison-my-boss-stalked-me-to-prove-i-wasnt-injured/
"Anxious About Climate, 4 in 10 Young People Are Wary of Having Kids",Fiona Harvey,https://www.motherjones.com/environment/2021/09/global-survey-climate-change-anxiety-young-people-children-kids/
California’s Recall Election Rules Are Dumb. BoJack Horseman Offers a Better Option.,Nathalie Baptiste,https://www.motherjones.com/politics/2021/09/californias-recall-election-rules-are-dumb-bojack-horseman-offers-a-better-option/
I Did Social Media for a Baseball Team. My Boss Was Worried I’d Sleep With the Players.,Anonymous As Told To AJ Vicens,https://www.motherjones.com/politics/2021/09/i-did-social-media-for-a-baseball-team-my-boss-was-worried-id-sleep-with-the-players/
The Nonprofit Boss Who Had a “Special Hatred for Women of Color”,Becca Andrews,https://www.motherjones.com/politics/2021/09/the-nonprofit-boss-who-had-a-special-hatred-for-women-of-color/
Democrats Just Introduced a New Voting Rights Bill. It’s Going Nowhere if They Don’t Reform the Filibuster.,Ari Berman,https://www.motherjones.com/politics/2021/09/democrats-just-introduced-a-new-voting-rights-bill-its-going-nowhere-if-they-dont-reform-the-filibuster/
Steve Bannon’s Billionaire Benefactor Was Just Fined $539 Million,Dan Friedman,https://www.motherjones.com/politics/2021/09/steve-bannons-billionaire-benefactor-was-just-fined-539-million/
,,https://www.motherjones.com/politics/2021/09/greg-abbott-abortion-ban-business/
,,https://www.motherjones.com/politics/2021/09/sb8-texas-abortion-ban-spread-alabama/
,,https://www.motherjones.com/mojo-wire/2021/08/donald-trump-statement-joe-biden-afghanistan/
59 Percent of Republicans Say It’s Important to Believe Trump Won the Election,Jeremy Schulman,https://www.motherjones.com/mojo-wire/2021/09/59-percent-of-republicans-say-its-important-to-believe-trump-won-the-election/
The Weather Feels the Same,Clint Hendler,https://www.motherjones.com/mojo-wire/2021/09/20-anniversary-weather-the-same/
Facebook’s AI Seems to Have a Racism Problem,Edwin Rios,https://www.motherjones.com/mojo-wire/2021/09/facebooks-ai-seems-to-have-a-racism-problem/
"After Shuttering for Almost Two Years, the Village Vanguard Reopens to Live Audiences",Daniel King,https://www.motherjones.com/recharge/2021/09/after-shuttering-for-almost-two-years-the-village-vanguard-reopens-to-live-audiences/
A Bright Light in COVID News: Vaccine Approval Could Be Near for 5- to 11-Year-Olds,Daniel King,https://www.motherjones.com/recharge/2021/09/a-bright-light-in-covid-news-vaccine-approval-could-be-near-for-5-to-11-year-olds/
Take a Minute for 40 Things That Have Actually Gotten Better,Daniel King,https://www.motherjones.com/recharge/2021/09/take-a-minute-for-40-things-that-have-actually-gotten-better/
I Worked as a Mail Carrier. My Boss Accused Me of “Malicious Compliance.”,Carl Owen As Told To Noah Lanard,https://www.motherjones.com/politics/2021/09/i-worked-as-a-mail-carrier-my-boss-accused-me-of-malicious-compliance/
"There’s a Phrase We Use About the Bosses at the Bureau of Prisons: “F Up, Move Up”",Anonymous as Told to Samantha Michaels,https://www.motherjones.com/politics/2021/09/theres-a-phrase-we-use-about-the-bosses-at-the-bureau-of-prisons-f-up-move-up/
Indigenous Resistors Are Staving off Tons of Fossil-Fuel Emissions,Adam Mahoney,https://www.motherjones.com/environment/2021/09/indigenous-resistors-are-staving-off-tons-of-fossil-fuel-emissions-in-us-and-canada/
"A Cheap, Low-Tech Method That Could Slash Farm Carbon Emissions",Susan Cosier,https://www.motherjones.com/environment/2021/09/cheap-low-tech-rock-dust-method-could-slash-farm-agricultural-carbon-emissions/
How Lin Wood and His QAnon Fans Tried to Force a Hospital to Use Ivermectin,Ali Breland,https://www.motherjones.com/politics/2021/09/lin-wood-veronica-wolski-ivermectin/
Pro-Trump Doctors Invoke Civil Rights in Bid to Overturn New York’s Vaccine Mandate,Stephanie Mencimer,https://www.motherjones.com/politics/2021/09/simone-gold-new-york-vaccine-lawsuit/
England Intends to Ban Single-Use Culinary Plastics—Very Slowly,Damian Carrington,https://www.motherjones.com/environment/2021/08/england-intends-to-ban-single-use-culinary-plastics-very-slowly/
Want People to Eat Less Meat? Fake Burgers Probably Won’t Cut It.,Charlie Mitchell,https://www.motherjones.com/food/2021/08/want-people-to-eat-less-meat-fake-burgers-probably-wont-cut-it/
The Drug War’s Deepest Failure: Making Users the Enemy,Troy Farah,https://www.motherjones.com/media/2021/09/harm-reduction-movement-war-on-drugs-undoing-maia-szalavitz-book-review/
Her Husband Was in Jail When Ida Hit. She Hasn't Heard From Him Since.,Madison Pauly,https://www.motherjones.com/crime-justice/2021/09/ida-incarcerated-family-hurricane-louisiana-st-charles/
"Odds of Escape Waning for At-Risk Afghans, Despite Assurances",Madison Pauly,https://www.motherjones.com/politics/2021/08/waning-odds-escape-afghanistan-evacuation-taliban/
I Taught English to Afghan Soldiers. Now I’m Part of the “Digital Dunkirk” Trying to Get Them Out.,"Joan Barker, as told to Ian Gordon",https://www.motherjones.com/politics/2021/08/afghanistan-digital-dunkirk-defense-contractors-combat-vets-whatsapp/
,,https://www.motherjones.com/politics/2021/09/theres-no-proof-sunscreen-prevents-cancer-in-black-people-why-do-doctors-keep-pushing-it/
,,https://www.motherjones.com/politics/2021/08/virginia-militia-bedford-campbell-county/
,,https://www.motherjones.com/politics/2021/07/how-flint-closed-the-gap-between-black-and-white-suffering-under-covid/
,,https://www.motherjones.com/politics/2021/08/will-this-court-case-end-the-mining-industrys-150-year-dominance-of-the-west/
January 6 Reckoning: CNN’s Jake Tapper Says the Media Must Confront Republicans’ Big Lie,Abigail Weinberg,https://www.motherjones.com/media/2021/07/january-6-insurrection-capitol-cnn-jake-tapper-podcast/
We Need to Understand How We Got to January 6 Before We Can Move Forward,Fernanda Echavarri,https://www.motherjones.com/politics/2021/06/podcast-january-6-qanon-history-whats-next/
A Radical Idea for Forcing Vaccine Companies to Share Knowledge With the World,Molly Schwartz and Jamilah King,https://www.motherjones.com/politics/2021/05/vaccine-patents-biden-covid-india-dean-baker-pandemic/
,,https://podcasts.apple.com/us/podcast/the-mother-jones-podcast/id1386408605
