title,byline,url
The Christian Right’s Plot to Purge Pro-Palestine Activism From the United States,Kiera Butler,https://www.motherjones.com/politics/2025/05/the-christian-rights-plot-to-purge-pro-palestine-activism-from-the-united-states/
The Christian Right’s Plot to Purge Pro-Palestine Activism From the United States,Kiera Butler,https://www.motherjones.com/politics/2025/05/the-christian-rights-plot-to-purge-pro-palestine-activism-from-the-united-states/
Trump Still Hasn’t Produced Plans to Make IVF More Accessible,Julianne McShane,https://www.motherjones.com/politics/2025/05/trump-still-hasnt-produced-plans-to-make-ivf-more-accessible/
Does Kristi Noem Even Know What Habeas Corpus Is?,Inae Oh,https://www.motherjones.com/politics/2025/05/kristi-noem-habeas-corpus/
"FDA to Cut Covid Booster Access, Excluding In-Home Carers",Julia Métraux,https://www.motherjones.com/politics/2025/05/fda-covid-booster-carers-vaccine-restriction/
Report: Abortion Providers Are Confronting a New Wave of Extremism,Laura C. Morel,https://www.motherjones.com/politics/2025/05/report-abortion-providers-clinic-attacks-are-confronting-a-wave-of-extremism-violence/
"For Trump, le Grift, C’est Moi",David Corn,https://www.motherjones.com/politics/2025/05/trump-grift-crypto-coin-conflict-interest-saudi-qatar-ua/
"A Gun Deemed Too Dangerous for Cops, but Fine for Civilians",Ava Sasani and Champe Barton,https://www.motherjones.com/politics/2025/05/a-gun-deemed-too-dangerous-for-cops-but-fine-for-civilians/
,,https://www.motherjones.com/politics/2025/05/andor-star-wars-republicans-defend-empire-palpatine/
,,https://www.motherjones.com/politics/2025/05/maxwell-frost-democratic-opposition-doge-elon-musk-donald-trump/
,,https://www.motherjones.com/politics/2025/05/no-elon-musk-government-should-not-be-run-like-a-business/
,,https://www.motherjones.com/food/2025/05/savor-butter-emissions-greenhouse-gases-cows-dairy-synthetic/
"Trump’s New Qatari Jet Would Be Just Like the Statue of Liberty, Obviously",Jeremy Schulman,https://www.motherjones.com/politics/2025/05/trumps-qatar-747-emolument-statue-liberty/
Trump Is Furious That His Tariffs Are Doing Exactly What Economists Said They’d Do,Julianne McShane,https://www.motherjones.com/politics/2025/05/trump-walmart-tariffs-bessent/
Redlining Shaped the Power Grid. Communities of Color Are Still Paying the Price.,Mario Alejandro Ariza,https://www.motherjones.com/environment/2025/05/redlining-minority-neighborhoods-power-grid-energy-infrastructure-communities-color/
"Trump’s Pick to Lead the Workplace Safety Agency Will Derail Heat Protections, Advocates Fear",Dharna Noor,https://www.motherjones.com/politics/2025/05/trump-osha-nominee-david-keeling-ups-amazon-workplace-heat-protections-workers/
ICE Officials Just Admitted to Another Major Deportation Error,Russ Choma,https://www.motherjones.com/politics/2025/05/ice-officials-just-admitted-to-another-major-deportation-error/
New Report: Trump Administration Just Got Hit With Another Signal Chat Scandal,James West,https://www.motherjones.com/politics/2025/04/new-york-times-hegseth-signal-yemen/
"We Asked You to Share Protest Photos. Wow, You Delivered.",James West,https://www.motherjones.com/politics/2025/04/protest-photos-audience-april-19-50501/
Powerful Scenes From Anti-Trump Protests Reveal Resistance in Action,James West,https://www.motherjones.com/politics/2025/04/photos-protests-hands-off-50501/
"For Trump, le Grift, C’est Moi",23 hours ago,https://www.motherjones.com/politics/2025/05/trump-grift-crypto-coin-conflict-interest-saudi-qatar-ua/
"America, Say Goodbye to a Generation of Scientists, Researchers, and Policy Experts","May 14, 2025",https://www.motherjones.com/politics/2025/05/trump-musk-doge-cuts-nih-science-research/
A Holocaust Tale for Today,"May 7, 2025",https://www.motherjones.com/politics/2025/05/julian-borger-interview-i-seek-a-kind-person-holocaust/
,,https://www.motherjones.com/politics/2025/05/liz-oyer-fired-mel-gibson-trump-justice-department/
,,https://www.motherjones.com/politics/2025/05/this-weeks-reveal-podcast-lessons-from-a-mass-shooters-mother/
,,https://www.motherjones.com/politics/2025/05/pet-eating-lies-to-deportation-fears-haitians-in-trumps-crosshairs/
,,https://www.motherjones.com/politics/2025/05/reveal-podcast-alabama-roe-v-wade-abortion-prosecute-helpers/
The United States Just Lost Its Perfect Credit Rating Thanks to Trump’s Tax Cuts,Russ Choma,https://www.motherjones.com/politics/2025/05/the-u-s-just-lost-its-perfect-credit-rating-thanks-to-trumps-tax-cuts/
"How Pope Leo Will Approach Climate Change Is Unclear, But the Vibe Is Positive",Ayurella Horn-Muller and Anita Hofschneider,https://www.motherjones.com/politics/2025/05/pope-leo-xiv-views-climate-change-colonialism-indigenous-rights-social-justice-francis/
Trump Administration Aims to Roll Back Limits on Toxic “Forever Chemicals” in Drinking Water,Georgina Gustin,https://www.motherjones.com/politics/2025/05/trump-epa-lee-zeldin-rollback-limits-standards-pfas-forever-chemicals-toxic-drinking-water-supply/
Dudes Emit More Greenhouse Gases Than Women Do. It’s the Cars—and the Meat.,Ajit Niranjan,https://www.motherjones.com/environment/2025/05/men-emit-more-greenhouse-gases-carbon-emissions-than-women-cars-meat-study/
This Week’s Reveal Podcast: The Deputies Who Tortured a Mississippi County,Reveal,https://www.motherjones.com/politics/2025/03/this-weeks-reveal-podcast-the-deputies-who-tortured-a-mississippi-county/
"As Powerful Law Firms Roll Over for Trump, One Lawyer Has Had Enough",Arianna Coghill,https://www.motherjones.com/criminal-justice/2025/03/rachel-cohen-skadden-paul-weiss-trump/
Nikole Hannah-Jones: Trump Is Erasing Black History,Reveal,https://www.motherjones.com/politics/2025/05/nikole-hannah-jones-trump-is-erasing-black-history/
The Case That Could Gut Disabled People’s Right to Equal Health Care,Julia Métraux,https://www.motherjones.com/politics/2025/05/hickson-fifth-circuit-disability-health-case/
DOGE Killed Dozens of Grants That Supported Women Workers,Julianne McShane,https://www.motherjones.com/politics/2025/05/doge-womens-grant-construction-manufacturing-cancelled/
“An Anti-Trans Fever Dream”: HHS Publishes Attack on Gender-Affirming Youth Care,Henry Carnell and Madison Pauly,https://www.motherjones.com/politics/2025/05/hhs-trans-youth-gender-care-report/
A Leaked Memo Reveals Details About Trump’s War on Science at the NIH,Jackie Flynn Mogensen,https://www.motherjones.com/politics/2025/05/nih-hhs-leaked-memo-funding-cuts-trump-war-on-science-vaccines-rfk-climate-change-covid-china/
How Public Schools Became Ground Zero for America’s Culture Wars,Reveal,https://www.motherjones.com/politics/2025/04/dei-public-schools-trump-race-gender-lgbtq/
,,https://www.motherjones.com/politics/2025/05/richie-rich-harvey-comics-good-billionaires-wealth-fantasy-elon-musk-donald-trump-comparisons-inequality/
,,https://www.motherjones.com/environment/2025/04/endangered-species-salamander-hurricane-helene-eastern-hellbender-bog-turtle/
,,https://www.motherjones.com/criminal-justice/2024/05/threat-assessment-mass-shooting-elliot-rodger-isla-vista-mother/
,,https://www.motherjones.com/criminal-justice/2023/10/foster-kids-psychiatric-hospitals-universal-health-services-uhs-alaska-cps/
Trump Administration Erases School Shooting Victims at ATF Headquarters,Julianne McShane,https://www.motherjones.com/politics/2025/05/trump-administration-erases-school-shooting-victims-at-atf-headquarters/
Pam Bondi Cuts “Wasteful” Funds to Support Victims of Violent Crime,Julianne McShane,https://www.motherjones.com/politics/2025/04/bondi-cuts-wasteful-funds-to-support-victims-of-violent-crime/
Trump’s Assault on Small Farmers,Teresa Cotsirilos,https://www.motherjones.com/food/2025/05/small-farmers-doge-cuts-tariffs-rural-assistance-private-equity/
Some States Are Banning Forever Chemicals. Now Industry Is Fighting Back.,Molly Taft,https://www.motherjones.com/politics/2025/04/state-regulations-bans-pfas-forever-chemicals-industry-lobbying-epa-trump/
Pandemic Truthers Take Over HHS Covid Site,Artis Curiskis,https://www.motherjones.com/politics/2025/04/covid-gov-hhs-website-pandemic-misinfo/
“Spiraling Deeper and Deeper Into Danger”: RFK Jr. Forces Out Top Vaccine Official,Arianna Coghill,https://www.motherjones.com/politics/2025/03/robert-kennedy-jr-forces-out-peter-marks-vaccines-measles-fda/
Supreme Court Again Halts Trump’s Alien Enemies Act Deportations,Noah Lanard and Isabela Dias,https://www.motherjones.com/politics/2025/05/scotus-trump-alien-enemies-venezuelan-deportation/
"To End Birthright Citizenship, Trump Is Rewriting Civil War History",Pema Levy,https://www.motherjones.com/politics/2025/05/birthright-citizenship-supreme-court-civil-war-history/
