title,byline,url
Lessons From a Mass Shooter’s Mother,Mark Follman,https://www.motherjones.com/criminal-justice/2024/05/threat-assessment-mass-shooting-elliot-rodger-isla-vista-mother/
Lessons From a Mass Shooter’s Mother,Mark Follman,https://www.motherjones.com/criminal-justice/2024/05/threat-assessment-mass-shooting-elliot-rodger-isla-vista-mother/
A Columbia University Protester Says the NYPD Made Her Remove Her Hijab—Despite New Policy,Jacob Rosenberg and Najib Aminy,https://www.motherjones.com/politics/2024/05/protester-columbia-nypd-hijab-gaza-israel-encampment/
Why I Spent Two Years Investigating a Notorious Mass Shooting,Mark Follman,https://www.motherjones.com/criminal-justice/2024/05/investigating-elliot-rodger-incels-isla-vista-threat-assessment/
North Carolina’s Protest Crackdown Now Includes a Ban on N95s,Julia Métraux,https://www.motherjones.com/politics/2024/05/north-carolina-mask-ban-palestine-campus-protests-covid-immunocompromised/
The Supreme Court Delivers a Rare Win for Black Voters in the South,Ari Berman,https://www.motherjones.com/politics/2024/05/the-supreme-court-delivers-a-rare-win-for-black-voters-in-the-south/
America’s Billionaires Are Really Going to Hate This New Senate Bill,Michael Mechanic,https://www.motherjones.com/politics/2024/05/billionaires-dynasties-bill-grantor-trusts-tax-avoidance-wyden-king-senate-bill/
Carvell Wallace on Life and Love and Coming of Age in a Cruel World,Carvell Wallace,https://www.motherjones.com/media/2024/05/carvell-wallace-another-word-love-memoir-book-excerpt/
,,https://www.motherjones.com/politics/2024/04/gaza-solidarity-encampments-columbia-college-campus-protest-palestine-israel-how-many-protests/
,,https://www.motherjones.com/politics/2024/04/trump-trial-hush-money-stormy-daniels-manhattan-video/
,,https://www.motherjones.com/politics/2024/04/minority-rule-video-democracy-ari-berman-founding-fathers/
,,https://www.motherjones.com/media/2024/03/beyonce-beatles-mccartney-blackbird-cowboy-carter-little-rock/
Yet Another Republican Comes Out Against No-Fault Divorce,Katie Herchenroeder,https://www.motherjones.com/politics/2024/05/ben-carson-gop-no-fault-divorce-law-ban-perilous-fight/
These Tribes Are Building Crossings to Save Wildlife From Becoming Roadkill,Ben Goldfarb,https://www.motherjones.com/environment/2024/05/tribes-building-wildlife-crossings-pilot-program-roads-fatalities/
First They Tried to “Cure” Gayness. Now They’re Fixated on “Healing” Trans People.,Madison Pauly with Henry Carnell,https://www.motherjones.com/politics/2024/05/conversion-therapy-lgbtq-anti-trans-gay-gender-affirming-care/
Learning to Love My Trans Self After Conversion Therapy,Henry Carnell,https://www.motherjones.com/politics/2024/05/lgbtq-anti-trans-conversion-therapy-christianity/
"Report: After Promising to Halt Bomb Shipment, Biden Moving to Send $1 Billion More in Weapons to Israel",Julianne McShane,https://www.motherjones.com/politics/2024/05/biden-bombs-billion-rafah-united-states-gaza-israel/
Trump Wants to Deport Pro-Palestine Protesters—and GOP Lawmakers Are Filing Bills to Make It Happen,Julianne McShane,https://www.motherjones.com/politics/2024/05/trump-protesters-gop-marco-rubio-palestine-college-deport/
Tribal Leaders Ban Gov. Kristi Noem From 20 Percent of South Dakota,Julianne McShane,https://www.motherjones.com/politics/2024/05/kristi-noem-banned/
Virginia Board Votes to Rename Schools Back to Honoring Confederate Military Leaders,Arianna Coghill,https://www.motherjones.com/mojo-wire/2024/05/mountain-view-high-school-honey-run-elementary-school-confederate-renaming/
Modern-Day Lessons From Hiroshima,"May 10, 2024",https://www.motherjones.com/politics/2024/05/hiroshima-nagasaki-modern-day-lessons-nuclear-weapons-our-land/
The GOP’s Grand Plan: Minority Rule,"April 24, 2024",https://www.motherjones.com/politics/2024/04/ari-berman-interview-minority-rule-gop-republicans-founders/
Donald Trump and the United States of Amnesia,"April 3, 2024",https://www.motherjones.com/politics/2024/04/donald-trump-united-states-of-amnesia-better-off-covid/
,,https://www.motherjones.com/politics/2024/04/reveal-podcast-pegasus-spy-el-faro-citizens-lab/
,,https://www.motherjones.com/politics/2024/04/this-weeks-episode-of-reveal-what-happens-when-a-tribal-cops-vanish/
,,https://www.motherjones.com/politics/2024/04/gaza-pregnancy-reveal-episode/
,,https://www.motherjones.com/politics/2024/04/how-famine-and-starvation-can-affect-generations-to-come/
West Virginia Voters Reject January 6 Rioter Running for Congress,Stephanie Mencimer,https://www.motherjones.com/politics/2024/05/derrick-evans-carol-miller-west-virginia-voters-reject-january-6-rioter-running-for-congress/
House Dems Launch Investigation Into Trump’s Meeting With Oil Executives,Dharna Noor,https://www.motherjones.com/politics/2024/05/house-democrats-investigation-trump-meeting-oil-executives-mar-lago-billion/
"Report: Since Paris, Banks Have Channeled $6.9 Trillion to Fossil Fuel Firms",Damien Gayle,https://www.motherjones.com/politics/2024/05/banks-financing-fossil-fuel-industry-trillions-since-paris-climate-agreement/
Climate Scientists Ponder: “Do I Really Want to Bring a Child Into This World?”,Damian Carrington,https://www.motherjones.com/environment/2024/05/climate-scientists-crisis-decision-have-children-kids-childbearing/
Oklahoma Is Finally Trying to Cut Prison Time for Abused Moms,Samantha Michaels,https://www.motherjones.com/politics/2024/04/oklahoma-is-finally-trying-to-cut-prison-time-for-abused-moms/
A New Police Force Chased a 17-Year-Old Boy to His Death. Then It Vanished.,By Samantha Michaels; Film by Mark Helenowski; Photography by Tailyr Irvine,https://www.motherjones.com/criminal-justice/2024/04/crow-nation-police-accountability-braven-glenn-bia/
Lost in the Crowd: The Hidden Biases of Medical Fundraising,Julia Métraux,https://www.motherjones.com/politics/2024/05/nora-kenworthy-crowded-out-gofundme-health-care-crowdfunding/
This Majority-Black City Has a Water Crisis That Privatization Won’t Fix,Lylla Younes,https://www.motherjones.com/politics/2024/05/jackson-mississippi-black-water-crisis-privatization-epa/
The Founder of Mother’s Day Mostly Cared About Her Own Mother,Nina Martin,https://www.motherjones.com/politics/2024/05/mothers-day-anna-jarvis/
A Nurse on the Scene Inside Rafah’s Last Maternity Hospital,Julianne McShane,https://www.motherjones.com/politics/2024/05/a-nurse-on-the-scene-inside-rafahs-last-maternity-hospital/
The UK’s New Study on Gender Affirming Care Misses the Mark in So Many Ways,Henry Carnell,https://www.motherjones.com/politics/2024/05/cass-review-transgender-health-care-nhs-gender-affirming-care/
A Gay Couple Is Suing New York City Over IVF Denial,Pema Levy,https://www.motherjones.com/politics/2024/05/gay-ivf-new-york-city/
,,https://www.motherjones.com/politics/2024/05/privatized-military-housing/
,,https://www.motherjones.com/politics/2024/04/minority-rule-is-threatening-american-democracy-like-never-before/
,,https://www.motherjones.com/criminal-justice/2023/10/foster-kids-psychiatric-hospitals-universal-health-services-uhs-alaska-cps/
,,https://www.motherjones.com/politics/2023/09/unhoused-california-photo-essay/
They Make Viral Gun Videos—With Hardline Christian Values,Lila Hassan,https://www.motherjones.com/politics/2024/03/t-rex-arms-hardline-christian-nationalism-lucas-botkin/
"The Crumbleys Have Been Convicted. Black Parents Will Likely Pay a Price, Too.",Nia t. evans,https://www.motherjones.com/criminal-justice/2024/03/james-jennifer-ethan-crumbley-oxfor-michigan-school-shooting/
Environmentalists Are Having a Cow Over Tyson Foods’ “Climate Friendly” Beef,Georgina Gustin,https://www.motherjones.com/politics/2024/05/usda-tyson-foods-label-brazen-beef-climate-friendly/
TikTok’s Raw Milk Influencers Are Going to Give Us All Bird Flu,Julia Métraux,https://www.motherjones.com/food/2024/05/raw-milk-influencers-h5n1-bird-flu-virus-social-media/
Are You Better Off Than Four Years Ago? OMG You Have Got to Be Kidding Me.,James West,https://www.motherjones.com/politics/2024/03/trump-covid-coronavirus-response-biden-four-years-video/
Is It Illegal For the White House to Fight COVID Misinfo? Up to SCOTUS.,Julia Métraux,https://www.motherjones.com/politics/2024/02/is-it-illegal-for-the-white-house-to-fight-covid-misinfo-up-to-scotus/
Republican-Led States Across the Country Are Copying Texas’ Radical Anti-Immigration Law,Isabela Dias,https://www.motherjones.com/politics/2024/05/texas-sb4-oklahoma-immigration-migrant-biden-copycat-laws/
Why Are Some Latinos Drifting to the Right?,Isabela Dias,https://www.motherjones.com/politics/2024/05/why-are-some-latinos-drifting-to-the-right/
