title,byline,url
"“Even if You Win, You Stay Locked Up”: How ICE Uses Appeals to Keep Immigrants in Detention",Isabela Dias,https://www.motherjones.com/politics/2021/10/even-if-you-win-you-stay-locked-up-how-ice-uses-appeals-to-keep-immigrants-in-detention/
"“Even if You Win, You Stay Locked Up”: How ICE Uses Appeals to Keep Immigrants in Detention",Isabela Dias,https://www.motherjones.com/politics/2021/10/even-if-you-win-you-stay-locked-up-how-ice-uses-appeals-to-keep-immigrants-in-detention/
NYC’s Private Garbage Industry Is Getting Overhauled. Can a Notorious Teamsters Local Clean Up Again?,Andrew Schwartz,https://www.motherjones.com/politics/2021/10/teamsters-local-813-nyc-garbage-mob/
This Workplace Rule Could Have Blunted the Opioid Epidemic. Then Congress Killed It.,Jim Morris,https://www.motherjones.com/politics/2021/10/this-workplace-rule-could-have-blunted-the-opioid-epidemic-then-congress-killed-it/
"Trump Extremists Brought Numerous Guns on January 6, Evidence Shows","Mark Follman, Dan Friedman, Ryan Little, and Sam Van Pykeren",https://www.motherjones.com/crime-justice/2021/09/trump-extremists-guns-january-6-insurrection-congress-domestic-terrorism/
"In an Emotional Hearing, Lawmakers Share Their Own Abortion Stories",Andrea Guzman,https://www.motherjones.com/politics/2021/09/in-an-emotional-hearing-lawmakers-share-their-own-abortion-stories/
GOP Obstructionism Is Threatening the Economy—and Banks Are Freaking Out,Hannah Levintova,https://www.motherjones.com/politics/2021/09/debt-ceiling-mitch-mcconnell-joe-biden-default-banks/
Why Is Ag Secretary Vilsack So Afraid of a Plan to Cut Pesticides and Meat?,Tom Philpott,https://www.motherjones.com/food/2021/09/vilsack-agriculture-pesticides-eu-farm-to-fork-brazil-rainforest-meat/
Good Fences Make Bad Neighbors for Wild Animals,Michael Parks,https://www.motherjones.com/environment/2021/09/ecologists-animal-migration-barbwire-fences-data-research/
"To Get the Infrastructure Deal Done, Dems Need to Trust Each Other. There’s Just One Problem.",Kara Voght,https://www.motherjones.com/politics/2021/09/to-get-the-infrastructure-deal-done-dems-need-to-trust-each-other-theres-just-one-problem/
A Montana Tribe Finalizes a Historic $1.9 Billion Settlement,Mark Armao,https://www.motherjones.com/environment/2021/09/montana-confederated-salish-kootenai-tribe-historic-water-rights-settlement/
,,https://www.motherjones.com/politics/2021/09/beto-orourke-voting-rights-bill-democrat-majorities/
,,https://www.motherjones.com/politics/2021/09/beto-orourke-governor-texas-run-voting-rights-democracy/
,,https://www.motherjones.com/politics/2021/09/greg-abbott-abortion-ban-business/
The California Recall Effort Has Officially Failed,Lil Kalish,https://www.motherjones.com/politics/2021/09/the-california-newsom-elder-recall-effort-has-failed/
California’s Recall Election Rules Are Dumb. BoJack Horseman Offers a Better Option.,Nathalie Baptiste,https://www.motherjones.com/politics/2021/09/californias-recall-election-rules-are-dumb-bojack-horseman-offers-a-better-option/
59 Percent of Republicans Say It’s Important to Believe Trump Won the Election,Jeremy Schulman,https://www.motherjones.com/mojo-wire/2021/09/59-percent-of-republicans-say-its-important-to-believe-trump-won-the-election/
"Jon Stewart, After Six Years Off Air, Launches a New Show on Apple TV+",Daniel King,https://www.motherjones.com/recharge/2021/09/jon-stewart-new-tv-show-apple/
"Barack Obama’s Library, the First Digital-Driven Presidential Archives in History, Breaks Ground Today",Daniel King,https://www.motherjones.com/recharge/2021/09/barack-obama-presidential-library-construction-breaks-ground/
“Birthday Under a Canopy”: A Climate Wish From MoJo’s Production Director,Daniel King,https://www.motherjones.com/recharge/2021/09/birthday-under-a-canopy-a-climate-wish-from-mojos-production-director/
Here’s Why the Bipartisan Police Reform Bill Was Always Going to Fail,Nathalie Baptiste,https://www.motherjones.com/politics/2021/09/heres-why-the-bipartisan-police-reform-bill-was-always-going-to-fail/
"Gen. Milley Defends China Calls, Says He Was “Not Qualified” to Determine Trump’s Mental Health",Dan Spinelli,https://www.motherjones.com/politics/2021/09/mark-milley-donald-trump-nancy-pelosi-china-nukes/
After Devastating Floods Comes a Fresh Scourge: Infectious Goo,Maryn McKenna,https://www.motherjones.com/environment/2021/10/flooding-ida-texas-louisiana-mold-fungi-damage-infectious-allergies/
The Secret to Successful Rewilding Isn’t Trees—It’s People,Phoebe Weston,https://www.motherjones.com/environment/2021/09/secret-successful-rewilding-not-trees-people-conservation-land-restoration/
Inside the Private Facebook Groups Where Anti-Vaxxers Plot to Get Religious Exemptions,Kiera Butler,https://www.motherjones.com/politics/2021/09/inside-the-private-facebook-groups-where-anti-vaxxers-plot-to-get-religious-exemptions/
"Anti-Vaccine Zealots Pose a Threat to Canada’s Democracy, Too",Caroline Orr,https://www.motherjones.com/politics/2021/09/vaccine-zealots-threat-canada-democracy-righ-wing-estremists-white-nationalism/
"In California’s Water Wars, Nuts Are Edging Out People",Tom Philpott,https://www.motherjones.com/environment/2021/09/california-san-joaquin-valley-drinking-water-dry-wells-almonds-pistachios-groundwater-aquifers/
Exhausted Restaurant Workers Now Face the Risk of Vicious Anti-Vaxxers,Nathalie Baptiste,https://www.motherjones.com/food/2021/09/exhausted-restaurant-workers-now-face-the-risk-of-vicious-anti-vaxxers/
The Drug War’s Deepest Failure: Making Users the Enemy,Troy Farah,https://www.motherjones.com/media/2021/09/harm-reduction-movement-war-on-drugs-undoing-maia-szalavitz-book-review/
Her Husband Was in Jail When Ida Hit. She Hasn't Heard From Him Since.,Madison Pauly,https://www.motherjones.com/crime-justice/2021/09/ida-incarcerated-family-hurricane-louisiana-st-charles/
"DHS Secretary Says What We've All Been Thinking: The System Is ""Completely Broken""",Nina Liss-Schultz,https://www.motherjones.com/politics/2021/09/dhs-mayorkas-haiti-immigration-title-42/
Biden Is Continuing a Long Tradition of Mistreating Haitian Migrants,Nathalie Baptiste,https://www.motherjones.com/politics/2021/09/biden-is-continuing-a-long-tradition-of-mistreating-haitian-migrants/
,,https://www.motherjones.com/politics/2021/09/bad-bosses-workers-fought-back-asshole-managers-nurse-guard-amazon-microsoft/
,,https://www.motherjones.com/politics/2021/09/theres-no-proof-sunscreen-prevents-cancer-in-black-people-why-do-doctors-keep-pushing-it/
,,https://www.motherjones.com/politics/2021/07/how-flint-closed-the-gap-between-black-and-white-suffering-under-covid/
,,https://www.motherjones.com/politics/2021/08/will-this-court-case-end-the-mining-industrys-150-year-dominance-of-the-west/
January 6 Reckoning: CNN’s Jake Tapper Says the Media Must Confront Republicans’ Big Lie,Abigail Weinberg,https://www.motherjones.com/media/2021/07/january-6-insurrection-capitol-cnn-jake-tapper-podcast/
We Need to Understand How We Got to January 6 Before We Can Move Forward,Fernanda Echavarri,https://www.motherjones.com/politics/2021/06/podcast-january-6-qanon-history-whats-next/
A Radical Idea for Forcing Vaccine Companies to Share Knowledge With the World,Molly Schwartz and Jamilah King,https://www.motherjones.com/politics/2021/05/vaccine-patents-biden-covid-india-dean-baker-pandemic/
,,https://podcasts.apple.com/us/podcast/the-mother-jones-podcast/id1386408605
