title,byline,url
“They Just Came and Started Breaking Houses.”,Sandy Tolan,https://www.motherjones.com/politics/2021/12/central-romana-sugar-hoyo-de-puerco-demolished/
“They Just Came and Started Breaking Houses.”,Sandy Tolan,https://www.motherjones.com/politics/2021/12/central-romana-sugar-hoyo-de-puerco-demolished/
The Mother of All Vaccines May Be Closer Than You Think,Jackie Flynn Mogensen,https://www.motherjones.com/politics/2021/12/the-mother-of-all-vaccines-may-be-closer-than-you-think/
"Hero of 2021: Fernanda the Tortoise, Whose Species  Everyone Thought Was Extinct",Jackie Flynn Mogensen,https://www.motherjones.com/politics/2021/12/hero-monsters-fernanda-the-giant-tortoise-galapagos-extinction/
Monsters of 2021: The Idiots Defacing Our National Parks,Stephanie Mencimer,https://www.motherjones.com/politics/2021/12/monsters-the-idiots-defacing-our-national-parks/
How Minnesota’s Foster Care System Reminds Native Moms of a Racist Legacy,Jessica Washington,https://www.motherjones.com/politics/2021/12/how-minnesotas-foster-care-system-reminds-native-moms-of-a-racist-legacy/
The Biden Administration Is Ramping Up Its Omicron Response,Abigail Weinberg,https://www.motherjones.com/coronavirus-updates/2021/12/the-biden-administration-is-ramping-up-its-omicron-response/
The Youth Activists Who Wouldn’t Eat Until Congress Took On Voting Rights,Abigail Weinberg,https://www.motherjones.com/politics/2021/12/un-pac-voting-rights-hunger-strike/
,,https://www.motherjones.com/sponsored/farmers-are-seeding-a-regenerative-future/
,,https://www.motherjones.com/sponsored/mother-jones-giving-guide-2021/
Mike Lindell Is Donating MyPillows to Kentucky Tornado Victims,Stephanie Mencimer,https://www.motherjones.com/politics/2021/12/mike-lindell-is-donating-mypillows-to-kentucky-tornado-victims/
Donald Trump Sues New York AG Tish James for Asking Too Many Questions,Russ Choma,https://www.motherjones.com/politics/2021/12/donald-trump-sues-new-york-ag-tish-james-for-asking-too-many-questions/
Joe Manchin Officially Torpedoes Build Back Better,Stephanie Mencimer,https://www.motherjones.com/politics/2021/12/joe-manchin-officially-torpedoes-build-back-better/
,,https://www.motherjones.com/mojo-wire/2021/12/january-capitol-attack-fox-news-mark-meadows-texts/
,,https://www.motherjones.com/mojo-wire/2021/12/tornados-death-arkansas-missouri-kentucky-tennessee-illinois-latest/
,,https://www.motherjones.com/mojo-wire/2021/11/asa-hutchinson-lauren-boebert-ilhan-omar/
The FDA Just Made Medication Abortions a Whole Lot Easier to Get,Lil Kalish,https://www.motherjones.com/politics/2021/12/the-fda-just-made-medication-abortions-a-whole-lot-easier-to-get/
"North Carolina’s Largest Paper, and I, Think Mark Meadows Is a “Disgrace”",Jacob Rosenberg,https://www.motherjones.com/mojo-wire/2021/12/north-carolinas-largest-paper-and-i-think-mark-meadows-is-a-disgrace/
Derek Chauvin Pleads Guilty to Violating George Floyd’s Civil Rights,Abigail Weinberg,https://www.motherjones.com/crime-justice/2021/12/derek-chauvin-george-floyd-guilty-civil-rights-25/
Canadian Pilots Rally to Supply Towns Isolated by Flooding,Marc Fawcett-Atkinson,https://www.motherjones.com/environment/2021/12/volunteer-pilots-rally-flood-isolated-british-columbia-canada-canadian-towns-indigenous/
How Biking Calms My Pandemic Angst,Teri Carhart,https://www.motherjones.com/recharge/2021/11/how-biking-calms-my-pandemic-angst/
Are These Black Leaders on the Cusp of a New National Movement?,Mother Jones,https://www.motherjones.com/recharge/2021/10/video-interview-chokwe-antar-lumumba-india-walton-black-radical-politics/
Sarah Palin Will Get a COVID Vaccine “Over My Dead Body”,Stephanie Mencimer,https://www.motherjones.com/politics/2021/12/sarah-palin-will-get-a-covid-vaccine-over-my-dead-body/
Texas Is Just Going to Build Its Own Border Wall Now,Tim Murphy,https://www.motherjones.com/politics/2021/12/texas-border-wall-abbott-biden-trump/
"For Traditional Reindeer Herders, “This New Snow Has No Name”",Karen McVeigh,https://www.motherjones.com/environment/2021/12/snow-arctic-sami-sweden-reindeer-herders-climate-disaster/
They Survived the Wildfires. Then Came the PTSD.,Kate Wheeling,https://www.motherjones.com/environment/2021/12/california-wildfires-paradise-camp-dixie-bear-trauma-ptsd-climate-change-mental-illness/
"Omicron, However You Pronounce It, Is Out of Control Right Now",Tim Murphy,https://www.motherjones.com/coronavirus-updates/2021/12/omicron-coronavirus-new-york-rates-latest/
“I Was Trying to Protect My Family”,Edwin Rios,https://www.motherjones.com/politics/2021/12/covid-vaccine-kids-black-latinx/
Why Paleontologists Are Getting Into Florida’s Oyster Business,Jack Tamisiea,https://www.motherjones.com/environment/2021/12/paleontologists-florida-oyster-business-fishery-cornell-apalachicola-ay/
Antibiotic Use in US Farm Animals Was Falling. Now It’s Not.,Maryn McKenna,https://www.motherjones.com/food/2021/12/antibiotics-america-farm-animals-livestock-poultry-fda-report/
A Disturbing Gun Case Further Reveals the Peril of January 6,Mark Follman,https://www.motherjones.com/politics/2021/12/guns-january-6-insurrection-trump-congress-taurus-judge/
"Congress Agreed on Drastic Military Sexual Assault Reform. Then ""Four Men Behind Closed Doors"" Got Their Hands On It.",Madison Pauly,https://www.motherjones.com/politics/2021/12/ndaa-sexual-assault-military-gillibrand/
Will Democrats Let the Senate Parliamentarian Stand in the Way of Immigration Reform?,Isabela Dias,https://www.motherjones.com/politics/2021/12/will-democrats-let-the-senate-parliamentarian-stand-in-the-way-of-immigration-reform/
The Biden Administration Thinks Europe Holds the Key to Humane Borders. It’s Not That Simple.,Isabela Dias,https://www.motherjones.com/politics/2021/12/biden-border-asylum-refugees-afghans-europe-greece-spain-germany/
,,https://www.motherjones.com/politics/2021/12/texas-attorney-general-ken-paxton-tried-to-overturn-the-election-now-hes-going-after-roe/
,,https://www.motherjones.com/politics/2021/12/sexual-harassment-workplace-bad-bosses-beta-bionics/
,,https://www.motherjones.com/politics/2021/10/oath-keepers-texas-richard-mack-profile-sheriff/
,,https://www.motherjones.com/politics/2021/09/moody-bible-institute-purity-culture-evangelicalism-sexual-assault-title-ix-mbi-survivors-group/
January 6 Reckoning: CNN’s Jake Tapper Says the Media Must Confront Republicans’ Big Lie,Abigail Weinberg,https://www.motherjones.com/media/2021/07/january-6-insurrection-capitol-cnn-jake-tapper-podcast/
We Need to Understand How We Got to January 6 Before We Can Move Forward,Fernanda Echavarri,https://www.motherjones.com/politics/2021/06/podcast-january-6-qanon-history-whats-next/
A Radical Idea for Forcing Vaccine Companies to Share Knowledge With the World,Molly Schwartz and Jamilah King,https://www.motherjones.com/politics/2021/05/vaccine-patents-biden-covid-india-dean-baker-pandemic/
,,https://podcasts.apple.com/us/podcast/the-mother-jones-podcast/id1386408605
