title,byline,url
DC’s Sole Congressional Rep Is Too Old to Drive. Can She Defend the City From a Hostile GOP?,Stephanie Mencimer,https://www.motherjones.com/politics/2025/05/eleanor-holmes-norton-dcs-sole-congressional-rep-is-too-old-to-drive-can-she-defend-the-city-from-a-hostile-gop/
DC’s Sole Congressional Rep Is Too Old to Drive. Can She Defend the City From a Hostile GOP?,Stephanie Mencimer,https://www.motherjones.com/politics/2025/05/eleanor-holmes-norton-dcs-sole-congressional-rep-is-too-old-to-drive-can-she-defend-the-city-from-a-hostile-gop/
Leaked Memo Reveals Details About Trump’s War on Science at the NIH,Jackie Flynn Mogensen,https://www.motherjones.com/politics/2025/05/nih-hhs-leaked-memo-funding-cuts-trump-war-on-science-vaccines-rfk-climate-change-covid-china/
DOGE Killed Dozens of Grants That Supported Women Workers,Julianne McShane,https://www.motherjones.com/politics/2025/05/doge-womens-grant-construction-manufacturing-cancelled/
The Supreme Court Is Really “Just Vibes”,Pema Levy,https://www.motherjones.com/politics/2025/05/leah-litman-supreme-court-lawless-book/
This Jewish Woman’s Attack by a Pro-Israel Mob Went Viral. Now She’s Speaking Out.,Sophie Hurwitz,https://www.motherjones.com/politics/2025/05/this-jewish-womans-attack-by-a-pro-israel-mob-went-viral-now-shes-speaking-out/
The Case That Could Gut Disabled People’s Right to Equal Health Care,Julia Métraux,https://www.motherjones.com/politics/2025/05/hickson-fifth-circuit-disability-health-case/
"Trump Is Eager to Defund Harvard, Yet Publicly Subsidized Hate Groups Get a Pass",Michael Mechanic,https://www.motherjones.com/politics/2025/05/trump-harvard-ed-martin-vdare-fair-new-century-hate-groups-irs-tax-exempt-status/
,,https://www.motherjones.com/politics/2025/05/maxwell-frost-democratic-opposition-doge-elon-musk-donald-trump/
,,https://www.motherjones.com/politics/2025/05/no-elon-musk-government-should-not-be-run-like-a-business/
,,https://www.motherjones.com/food/2025/05/savor-butter-emissions-greenhouse-gases-cows-dairy-synthetic/
,,https://www.motherjones.com/politics/2025/04/trump-maga-tariff-history-video/
RFK Jr. May Have Inspired Acting US Attorney’s Harassment of Medical Journals,Dan Friedman,https://www.motherjones.com/politics/2025/05/rfk-jr-us-attorney-ed-martin-harassment-medical-journals-nejm-lancet-chest-jama/
Nikole Hannah-Jones: Trump Is Erasing Black History,Reveal,https://www.motherjones.com/politics/2025/05/nikole-hannah-jones-trump-is-erasing-black-history/
A Holocaust Tale for Today,David Corn,https://www.motherjones.com/politics/2025/05/julian-borger-interview-i-seek-a-kind-person-holocaust/
Trump Administration Erases School Shooting Victims at ATF Headquarters,Julianne McShane,https://www.motherjones.com/politics/2025/05/trump-administration-erases-school-shooting-victims-at-atf-headquarters/
North Carolina GOP Judge Finally Concedes After Six-Month Effort to Steal Election Fails,Ari Berman,https://www.motherjones.com/politics/2025/05/gop-judge-jefferson-griffin-concedes-north-carolina-supreme-court-race-allison-riggs/
New Report: Trump Administration Just Got Hit With Another Signal Chat Scandal,James West,https://www.motherjones.com/politics/2025/04/new-york-times-hegseth-signal-yemen/
"We Asked You to Share Protest Photos. Wow, You Delivered.",James West,https://www.motherjones.com/politics/2025/04/protest-photos-audience-april-19-50501/
Powerful Scenes From Anti-Trump Protests Reveal Resistance in Action,James West,https://www.motherjones.com/politics/2025/04/photos-protests-hands-off-50501/
A Holocaust Tale for Today,21 hours ago,https://www.motherjones.com/politics/2025/05/julian-borger-interview-i-seek-a-kind-person-holocaust/
How the Establishment Is Helping Trump’s Revenge-a-thon,"April 16, 2025",https://www.motherjones.com/politics/2025/04/trump-revenge-establishment-law-firms-universities-republicans/
Donald Trump’s War on History,"April 8, 2025",https://www.motherjones.com/politics/2025/04/donald-trump-war-on-history-restoring-truth-sanity-propaganda-racism/
,,https://www.motherjones.com/politics/2025/05/nikole-hannah-jones-trump-is-erasing-black-history/
,,https://www.motherjones.com/politics/2025/04/dei-public-schools-trump-race-gender-lgbtq/
,,https://www.motherjones.com/politics/2025/04/steubenville-ohio-reading-sold-a-story-scores/
,,https://www.motherjones.com/politics/2025/04/trump-tariffs-coal-rural-america/
FEMA Will No Longer Go Door-to-Door to Assist Disaster Victims,Molly Taft,https://www.motherjones.com/politics/2025/05/fema-ending-boots-ground-door-program-disaster-assistance-victims/
24-Hour Vigil to Save Medicaid Takes Over National Mall,Julia Métraux,https://www.motherjones.com/politics/2025/05/medicaid-cuts-vigil-raskin-booker-pelosi/
"Aviation Industry “Failing Dramatically” on Climate, Insiders Say",Damian Carrington,https://www.motherjones.com/environment/2025/05/aviation-airline-industry-climate-emissions-failure-report/
Bird Populations Are Declining Across North America,Patrick Greenfield,https://www.motherjones.com/environment/2025/05/bird-population-decline-north-america-science-study-paper-ebird/
This Week’s Reveal Podcast: The Deputies Who Tortured a Mississippi County,Reveal,https://www.motherjones.com/politics/2025/03/this-weeks-reveal-podcast-the-deputies-who-tortured-a-mississippi-county/
"As Powerful Law Firms Roll Over for Trump, One Lawyer Has Had Enough",Arianna Coghill,https://www.motherjones.com/criminal-justice/2025/03/rachel-cohen-skadden-paul-weiss-trump/
Republicans’ Social Security Attacks Disproportionately Harm Retirees of Color,Julia Métraux,https://www.motherjones.com/politics/2025/03/trump-musk-doge-social-security-race/
Trump Tells DOJ to Prosecute Teachers Who “Unlawfully” Support Trans or Nonbinary Students,Sarah Szilagy and Madison Pauly,https://www.motherjones.com/politics/2025/01/trump-tells-doj-to-prosecute-teachers-who-unlawfully-support-trans-or-nonbinary-students/
“An Anti-Trans Fever Dream”: HHS Publishes Attack on Gender-Affirming Youth Care,Henry Carnell and Madison Pauly,https://www.motherjones.com/politics/2025/05/hhs-trans-youth-gender-care-report/
DOJ Reverses Grant Cancellations for Crime Victim Support,Julianne McShane,https://www.motherjones.com/politics/2025/04/doj-reverses-grant-cancelations-for-crime-victim-support/
The Supreme Court Is Trying to Normalize Its Own Anti-LGBTQ Animus,Pema Levy,https://www.motherjones.com/politics/2025/04/scotus-lgbtq-mongtomery-schools-religious-books/
HHS Plans to Cut the National Suicide Hotline’s Program for LGBTQ Youth,Julia Lurie,https://www.motherjones.com/politics/2025/04/national-suicide-hotline-lgbtq-youth-cuts-rfk-jr-hhs/
,,https://www.motherjones.com/politics/2025/05/richie-rich-harvey-comics-good-billionaires-wealth-fantasy-elon-musk-donald-trump-comparisons-inequality/
,,https://www.motherjones.com/politics/2025/04/trans-kids-attacks-trump-families/
,,https://www.motherjones.com/criminal-justice/2024/05/threat-assessment-mass-shooting-elliot-rodger-isla-vista-mother/
,,https://www.motherjones.com/criminal-justice/2023/10/foster-kids-psychiatric-hospitals-universal-health-services-uhs-alaska-cps/
Pam Bondi Cuts “Wasteful” Funds to Support Victims of Violent Crime,Julianne McShane,https://www.motherjones.com/politics/2025/04/bondi-cuts-wasteful-funds-to-support-victims-of-violent-crime/
How Police Guns End Up in the Hands of Criminals,Reveal,https://www.motherjones.com/politics/2025/04/how-police-guns-end-up-in-the-hands-of-criminals/
Some States Are Banning Forever Chemicals. Now Industry Is Fighting Back.,Molly Taft,https://www.motherjones.com/politics/2025/04/state-regulations-bans-pfas-forever-chemicals-industry-lobbying-epa-trump/
Farmers in Trump Country Banked on Clean Energy Grants. Then Things Changed.,"Mario Alejandro Ariza, Ames Alexander, and Joe Engleman",https://www.motherjones.com/politics/2025/03/farmers-in-trump-country-banked-on-clean-energy-grants-then-things-changed/
Pandemic Truthers Take Over HHS Covid Site,Artis Curiskis,https://www.motherjones.com/politics/2025/04/covid-gov-hhs-website-pandemic-misinfo/
“Spiraling Deeper and Deeper Into Danger”: RFK Jr. Forces Out Top Vaccine Official,Arianna Coghill,https://www.motherjones.com/politics/2025/03/robert-kennedy-jr-forces-out-peter-marks-vaccines-measles-fda/
“Designed to Scare People”: Lawyers Warn of Self-Deportation Notices Posted in Immigration Courts,Isabela Dias,https://www.motherjones.com/politics/2025/05/designed-to-scare-people-lawyers-warn-of-self-deportation-notices-posted-in-immigration-courts/
Trump Admits He’s Iffy on the Whole Due Process Thing,Julianne McShane,https://www.motherjones.com/politics/2025/05/trump-constitution-deportation-meet-press/
