title,byline,url
"Walker, Warnock, and the Epic Battle for Georgia’s Soul",Garrison Hayes,https://www.motherjones.com/politics/2022/12/walker-warnock-georgia-run-off-senate-christianity-belief/
"Walker, Warnock, and the Epic Battle for Georgia’s Soul",Garrison Hayes,https://www.motherjones.com/politics/2022/12/walker-warnock-georgia-run-off-senate-christianity-belief/
Donald Trump Just Weighed In on “#Twittergate”—and I Really Wish He Hadn’t,Jackie Flynn Mogensen,https://www.motherjones.com/politics/2022/12/donald-trump-just-weighed-in-on-twittergate-and-i-really-wish-he-hadnt/
"The US Men’s Soccer Team Lost Today, but the Women Won Big",Jackie Flynn Mogensen,https://www.motherjones.com/politics/2022/12/us-men-world-cup-loss-netherlands-soccer-women-equal-pay/
Twitter Is Regressing Into a Cesspool of Climate Misinformation,Oliver Milman,https://www.motherjones.com/environment/2022/12/elon-musk-twitter-climate-misinformation-denial-climatescam/
“Mr. Trump Explicitly Sanctioning Tax Fraud! That’s What This Document Shows!”,Russ Choma,https://www.motherjones.com/politics/2022/12/mr-trump-explicitly-sanctioning-tax-fraud-thats-what-this-document-shows/
Donald Trump’s Lawyers Might Have Made a Huge Mistake,Russ Choma,https://www.motherjones.com/politics/2022/12/donald-trump-trump-org-tax-fraud-case/
"To Save Whales, Should We Stop Eating Lobster?",Jackie Flynn Mogensen,https://www.motherjones.com/food/2022/12/right-whales-maine-lobster-monterey-seafood-watch-whole-foods-entanglements/
This MAGA PAC Raised Nearly $2 Million Off the Trucker Protests. Where Did All the Money Go?,Stephanie Mencimer,https://www.motherjones.com/politics/2022/12/this-maga-pac-raised-nearly-2-million-off-the-trucker-protests-where-did-all-the-money-go/
Bats Are Nature’s Death Metal Singers. Who Knew?,Ian Sample,https://www.motherjones.com/environment/2022/12/bat-vocalization-death-metal-ozzy-osbourne/
Herschel Walker Said He Got Into Law School. That Seems Highly Unlikely.,Abby Vesoulis,https://www.motherjones.com/politics/2022/12/herschel-walker-law-school-georgia-senate/
,,https://www.motherjones.com/environment/2022/10/brown-pelicans-threatened-gulf-coast-sea-level-rise-climate-change/
,,https://www.motherjones.com/politics/2022/09/it-didnt-start-with-trump-the-decades-long-saga-of-how-the-gop-went-crazy/
,,https://www.motherjones.com/politics/2022/08/full-transcript-of-leaked-steve-bannon-tape-donald-trump-2020-election/
Joe Biden Called Out Antisemitism. Why Can’t Some Republicans?,Arianna Coghill,https://www.motherjones.com/mojo-wire/2022/12/joe-biden-called-out-antisemitism-why-cant-some-republicans/
Madison Cawthorn: Young Men Should Be “Punched in the Face” for Doing Stupid Things,Arianna Coghill,https://www.motherjones.com/mojo-wire/2022/12/madison-cawthorn-young-men-should-be-punched-in-the-face-for-doing-stupid-things/
"Joe Biden, Our First Octogenarian-in-Chief",Abigail Weinberg,https://www.motherjones.com/mojo-wire/2022/11/joe-biden-octogenarian-president-2024-election-fitness/
"Remembering George Pérez, a Superhero of Superhero Comics",Dan Spinelli,https://www.motherjones.com/recharge/2022/05/remembering-george-perez-a-superhero-of-superhero-comics/
Ukrainian and Russian Dancers Join Onstage (in Italy) to Fundraise for the Red Cross,Daniel King,https://www.motherjones.com/recharge/2022/04/ukrainian-russian-antiwar-ballet-dancers-for-peace/
"Mass Shootings Persist, But a New Book Brings Hope and Science to Grappling With Their Prevention",Daniel King,https://www.motherjones.com/recharge/2022/04/mass-shooting-prevention-trigger-points/
It Took Ye Praising Hitler Before the House Judiciary GOP Took Down Its Infamous Tweet,Abigail Weinberg,https://www.motherjones.com/politics/2022/12/kanye-west-hitler-house-judiciary-gop/
"Forced Labor, Child Miners, Payment in Drugs—Clean Energy Supply Chain Has Issues",Adam Morton,https://www.motherjones.com/politics/2022/12/slavery-forced-labor-child-workers-mining-solar-wind-global-energy-supply-chain/
These Scientists Are Looking for “Glacier Blood”,Kylie Mohr,https://www.motherjones.com/environment/2022/11/snowmelt-glaciers-snow-algae-research-skiing-drought/
It turns Out Western Voters Care a Lot About Public Lands,Jonathan Thompson,https://www.motherjones.com/environment/2022/11/2022-midterms-results-western-voters-want-protect-public-lands/
"As RSV Cases Surge, Experts Warn of America’s Worsening ‘Tripledemic’",Abby Vesoulis,https://www.motherjones.com/politics/2022/11/rsv-covid-flu-cases-winter-2022/
"After Decades of Public Service, Dr. Fauci Gives His Final White House Briefing",Arianna Coghill,https://www.motherjones.com/coronavirus-updates/2022/11/after-decades-of-public-service-dr-fauci-gives-his-final-white-house-briefing/
"America’s Food-Security Crisis Is a Water-Security Crisis, Too",Lela Nargi,https://www.motherjones.com/food/2022/11/americas-food-security-crisis-is-a-water-security-crisis-too/
Is Big Agriculture Finally Having a “Come to Jesus” Moment?,Dominic Rushe,https://www.motherjones.com/environment/2022/11/sustainable-markets-initiative-agriculture-task-force-climate-report-jesus-moment-greenwashing/
Are Police Helicopter Fleets Worth the Money?,Angelika Albaladejo,https://www.motherjones.com/politics/2022/12/are-police-helicopter-fleets-worth-the-money/
The Tragedy of the Oxford High School Mass Shooting Deepens,Mark Follman,https://www.motherjones.com/politics/2022/11/oxford-high-school-mass-shooting-threat-assessment/
How Did a State Known for Its War on Immigrants Approve In-State Tuition for Undocumented Students?,Isabela Dias,https://www.motherjones.com/politics/2022/11/arizona-immigration-tuition-students-proposition-308/
“The Writing On the Wall Is Clear: DACA Is Coming to an End.”,Isabela Dias,https://www.motherjones.com/politics/2022/11/the-writing-on-the-wall-is-clear-daca-is-coming-to-an-end/
,,https://www.motherjones.com/politics/2022/11/soccer-football-corruption-oligarchs-cover-story-qatar-power-ball/
,,https://www.motherjones.com/politics/2022/11/the-internet-is-full-of-predators-omegle-lets-you-meet-them/
,,https://www.motherjones.com/politics/2022/10/jim-marchant-nevada-secretary-state-trump-divorce-ice-machine-maga/
,,https://www.motherjones.com/politics/2022/10/matthew-deperno-trump-michigan-foreclosure/
A White Father and Son Allegedly Tried to Kill a Black FedEx Driver. Did Cops Go Easy on Them?,Samantha Michaels,https://www.motherjones.com/crime-justice/2022/11/a-white-father-and-son-allegedly-tried-to-kill-a-black-fedex-driver-did-cops-go-easy-on-them/
Republicans Hoped a “Crime Wave” Was Their Ticket to a Red Wave. It Wasn’t.,Samantha Michaels,https://www.motherjones.com/politics/2022/11/crime-wave-republicans-midterms-fetterman-oz-hochul-zeldin-fear-progressive-reform-criminal-justice/
"In New York City, Racial Equity Ballot Measures Passed by a Wide Margin",Maggie Duffy,https://www.motherjones.com/politics/2022/11/racial-equity-ballot-measures-new-york-city/
Pay Attention to These Insanely Important District Attorney Races,Samantha Michaels,https://www.motherjones.com/politics/2022/10/pay-attention-to-these-insanely-important-district-attorney-races/
