title,byline,url
"Fossil-Fuel Funding of Colleges Is Hurting Clean Energy Transition, New Study Says",Dharna Noor,https://www.motherjones.com/environment/2024/09/fossil-fuel-funding-colleges-universities-clean-energy-transition-study-conflicts-interest/
"Fossil-Fuel Funding of Colleges Is Hurting Clean Energy Transition, New Study Says",Dharna Noor,https://www.motherjones.com/environment/2024/09/fossil-fuel-funding-colleges-universities-clean-energy-transition-study-conflicts-interest/
Free Rein and No Guidance: Long Island’s Cop-Enforced Mask Ban Isn’t Going Great,Julia Métraux,https://www.motherjones.com/criminal-justice/2024/09/new-york-nassau-county-mask-ban-police-enforcement-no-training/
The Feds Charged a Pro-Russian Pundit for Evading Sanctions. He Says They’re Trying to Silence Him.,Dan Friedman,https://www.motherjones.com/politics/2024/09/justice-department-dimitri-anastasia-simes-russian-sanctions-charged/
GOP Senate Candidate in Nevada Can’t Stop Shifting His Position on Abortion,David Corn,https://www.motherjones.com/politics/2024/09/sam-brown-nevada-senate-abortion/
Florida Fires Worker Who Exposed Ron DeSantis’ Plan to Bulldoze State Parks,Richard Luscombe,https://www.motherjones.com/environment/2024/09/florida-parks-ron-desantis-great-outdoors-initiative-whistleblower-fired/
New Indictment Alleges Conservative Media Company Took Millions in Kremlin Cash,Anna Merlan,https://www.motherjones.com/politics/2024/09/tenet-media-russia/
Increasing Workloads and Stagnating Pay—Hotel Workers Are Fighting Back,Serena Lin,https://www.motherjones.com/politics/2024/09/increasing-workloads-and-stagnating-pay-hotel-workers-are-fighting-back/
,,https://www.motherjones.com/politics/2024/08/trump-assassination-attempt-blame-biden-harris/
,,https://www.motherjones.com/politics/2024/08/trump-maga-dnc-project-2025-video-reactions-strategy/
,,https://www.motherjones.com/politics/2024/08/black-republicans-trump-maga-kamala-video/
,,https://www.motherjones.com/politics/2024/08/kamala-harris-climate-crisis-policy-environment/
Trump Is Finally Admitting He Lost the 2020 Election,Julianne McShane,https://www.motherjones.com/politics/2024/09/trump-is-finally-admitting-he-lost-the-2020-election/
Project 2025 Backers Push Propaganda About the Trump Shooting,Mark Follman,https://www.motherjones.com/politics/2024/09/project-2025-trump-assassination-attempt-conspiracy-theories-dei/
State of Denial,Tim Murphy,https://www.motherjones.com/politics/2024/09/arizona-republicans-elections-denial-big-lie/
How the Right Explains Trump’s Authoritarian Logic to Themselves,Tyler McBrien,https://www.motherjones.com/politics/2024/09/lawfare-meaning-trump-trial/
How Elon Musk Is Tying His Love for Trump to His Fight in Brazil,Anna Merlan,https://www.motherjones.com/politics/2024/09/how-elon-musk-is-tying-his-love-for-trump-to-his-fight-in-brazil/
Trump Staff Reportedly Fought at Military Graveyard to Get Good Photo for Social Media,Julianne McShane,https://www.motherjones.com/politics/2024/08/trump-arlington-national-cemetery-photograph-fight-staff/
"Trump Said Some Disabled People “Should Just Die,” According to His Nephew",Julia Métraux,https://www.motherjones.com/mojo-wire/2024/07/donald-trump-nephew-disabled-people-die/
Biden’s $30m Weekend Fundraising Blitz Breaks Democratic Party Records,James West,https://www.motherjones.com/politics/2024/06/biden-campaign-fundraiser-30-million-hollywood-clooney-obama/
Derision and Danger: The Democrats Figure Out How to Attack Trump,"September 3, 2024",https://www.motherjones.com/politics/2024/09/derision-and-danger-the-democrats-figure-out-how-to-attack-trump/
JD Vance’s Racist Populism,"August 9, 2024",https://www.motherjones.com/politics/2024/08/jd-vance-racist-populism-white-privilege-trump-harris/
Here’s How Biden Could Rattle Trump in Their First Debate,"June 24, 2024",https://www.motherjones.com/politics/2024/06/trump-biden-first-debate-rattle-ridicule-cnn/
,,https://www.motherjones.com/criminal-justice/2024/08/suboxone-child-welfare-investigations-addiction-family-separation/
,,https://www.motherjones.com/criminal-justice/2024/07/churn-mental-illness-opioids-seattle-homelessness/
,,https://www.motherjones.com/media/2024/07/the-latest-reveal-podcast-shows-how-the-mormon-church-thwarts-child-sex-abuse-claims/
,,https://www.motherjones.com/politics/2024/06/40-acres-lie-skidaway-island-georgia-racism-the-landings-reveal/
Northwest Coastal Tribes Threatened by Rising Seas Are Drowning—in Paperwork,B. 'Toastie' Oaster,https://www.motherjones.com/politics/2024/09/tribes-climate-adaptation-federal-funding-grants-obstacles/
JD Vance Has Yet Another Connection to Project 2025,Julianne McShane,https://www.motherjones.com/politics/2024/09/jd-vance-project-2025-abortion-ivf/
"Coral Reefs Are Getting Sick, and This Human Medicine Might Help",Benji Jones,https://www.motherjones.com/environment/2024/09/coral-reefs-disease-sctld-sick-human-antibiotics-amoxicilin/
That Time a California Lawmaker Tried Getting Rid of Gas-Powered Vehicles,Scott W. Stern,https://www.motherjones.com/politics/2024/09/california-history-nicholas-petris-ban-gasoline-powered-vehicles/
"Judge Rules Breonna Taylor’s Boyfriend, Not the Police, Caused Her Death",Samantha Michaels,https://www.motherjones.com/criminal-justice/2024/08/judge-rules-breonna-taylors-boyfriend-not-the-police-caused-her-death/
What Would It Mean to Have a Prosecutor as President Right Now?,Samantha Michaels,https://www.motherjones.com/politics/2024/07/kamala-harris-prosecutor-attorney-general-trump-criminal-convictions-presidential-race/
"Michelle Obama: Yes, We Have Affirmative Action for the Wealthy",Michael Mechanic,https://www.motherjones.com/politics/2024/08/michelle-obama-affirmative-action-rich-generational-wealth-democratic-convention-speech/
She Called the Police for Help. They Killed Her Instead.,Arianna Coghill,https://www.motherjones.com/criminal-justice/2024/07/sonya-massey-police-killing-illinois-sangamon-sheriff/
Rootless Masculinity Influencers Are Pivoting to Wildly Antisemitic Claims,Anna Merlan,https://www.motherjones.com/politics/2024/08/masculinity-influencers-antisemitism/
"JD Vance Called Democrats a “Childless Cabal,” But We Did the Math",Michael Mechanic,https://www.motherjones.com/politics/2024/08/jd-vance-democrats-childless-cabal/
"In Republican Primary, Bigot Loses to Election Denier",Sophie Hurwitz,https://www.motherjones.com/politics/2024/08/valentina-gomez-missouri-bigot-election-denier-hoskins/
Will Ohio Strike Down Its Draconian Gender-Affirming Care Ban?,Sarah Szilagy,https://www.motherjones.com/politics/2024/07/will-ohio-strike-down-its-draconian-gender-affirming-care-ban/
,,https://www.motherjones.com/politics/2024/08/trump-mass-deportation-plan-immigration-border-patrol-ice-dhs-migrants-undocumented/
,,https://www.motherjones.com/politics/2024/07/the-secret-plan-to-strike-down-us-gun-laws/
,,https://www.motherjones.com/criminal-justice/2024/05/threat-assessment-mass-shooting-elliot-rodger-isla-vista-mother/
,,https://www.motherjones.com/criminal-justice/2023/10/foster-kids-psychiatric-hospitals-universal-health-services-uhs-alaska-cps/
“People Will Literally Die.” America’s Youngest Congressman Sounds the Alarm.,Garrison Hayes,https://www.motherjones.com/politics/2024/08/trump-kamala-maxwell-frost-guns-climate-interview-video/
JD Vance Reiterates False Claim That Democrats “Tried to Kill” Trump,Mark Follman,https://www.motherjones.com/politics/2024/08/jd-vance-trump-assassination-attempt-democrats/
An Indigenous Restaurant’s Special Ingredient,Mary Ladd,https://www.motherjones.com/food/2024/08/cafe-ohlone-vincent-medina-restaurant-mak-amham-native-berkeley/
This Long-Dead Scientist’s Collection of Rare Seeds Could Help Keep Us Alive,Robin McKie,https://www.motherjones.com/environment/2024/07/arthur-watkins-wheat-seed-collection-rare-varieties-food-supply/
The Covid Vaccine Just Got a Lot More Expensive—If You’re Uninsured,Julia Métraux,https://www.motherjones.com/coronavirus-updates/2024/08/covid-vaccine-cdc-bridge-access-program-sunset-uninsured/
"A Long Island County Banned Masks, and Disabled People Are Suing",Julia Métraux,https://www.motherjones.com/politics/2024/08/long-island-mask-ban-class-action-disability-lawsuit/
Vance Leaves Door Open to Renewed Family Separations Under Trump,Julianne McShane,https://www.motherjones.com/politics/2024/08/jd-vance-family-separation/
Migrant Encounters at the Border Hit Lowest Number in Four Years,Isabela Dias,https://www.motherjones.com/politics/2024/08/migrant-encounters-at-the-border-hit-lowest-number-in-four-years/
