title,byline,url
Leaked Kremlin Memo to Russian Media: It Is “Essential” to Feature Tucker Carlson,David Corn,https://www.motherjones.com/politics/2022/03/exclusive-kremlin-putin-russia-ukraine-war-memo-tucker-carlson-fox/
Leaked Kremlin Memo to Russian Media: It Is “Essential” to Feature Tucker Carlson,David Corn,https://www.motherjones.com/politics/2022/03/exclusive-kremlin-putin-russia-ukraine-war-memo-tucker-carlson-fox/
The Plastics Industry Says It Has a Clever Solution to the Plastics Crisis,Tim Wogan,https://www.motherjones.com/environment/2022/03/weve-got-a-plastic-problem-will-chemical-recycling-solve-it/
The Amazon Rainforest May Be Reaching a Point of No Return,Matt Simon,https://www.motherjones.com/politics/2022/03/the-amazon-rainforest-may-be-reaching-a-point-of-no-return/
Texas Has Been Investigating the Briggle Family Because of Their Trans Son. Here’s Their Story.,Samantha Michaels,https://www.motherjones.com/politics/2022/03/texas-transgender-kids-child-protective-service-investigation-briggle-family/
Ukraine Conflict Is a Bonanza for Oil and Gas Companies,Fiona Harvey,https://www.motherjones.com/environment/2022/03/oil-gas-companies-fossil-fuel-industry-ukraine-russia-war-profits/
"Russian Forces Shelled a Mosque in Mariupol, Ukrainian Officials Say",Ali Breland,https://www.motherjones.com/politics/2022/03/russia-ukraine-mariupol-mosque/
SNL’s Roast of Amazon’s “Grab and Go” Stores Reveals a Sad Truth About Shopping in America,Jackie Flynn Mogensen,https://www.motherjones.com/media/2022/03/saturday-night-live-roast-of-amazons-grab-and-go-stores-reveals-a-sad-truth-about-shopping-in-america/
"Kyiv’s Mayor, With Russian Forces Nearing: “We’re Ready to Fight”",Jackie Flynn Mogensen,https://www.motherjones.com/politics/2022/03/kyiv-russia-ukraine-mayor-vitali-klitschko/
An American Journalist Is the Latest Casualty of Russia’s Ukraine Invasion,Jackie Flynn Mogensen,https://www.motherjones.com/politics/2022/03/brent-renaud-russia-ukraine-journalist-death-juan-arredondo-putin-zelenskyy/
Report: Putin Threatened to Arrest Google Exec Over Pro-Democracy App,Ali Breland,https://www.motherjones.com/politics/2022/03/putin-russia-ukraine-google-apple-facebook-twitter-instagram/
,,https://www.motherjones.com/mojo-wire/2022/03/donald-trump-talked-about-his-true-enemy-when-asked-about-russias-invasion-of-ukraine-windmills/
,,https://www.motherjones.com/politics/2022/03/john-bolton-donald-trump-ukraine-russia-putin/
,,https://www.motherjones.com/politics/2022/03/no-that-putin-video-didnt-use-a-green-screen-misinformation/
Barack Obama has Covid,Jackie Flynn Mogensen,https://www.motherjones.com/mojo-wire/2022/03/barack-obama-has-covid/
"It’s Confirmed: The 2020 Census Did In Fact Undercount Black, Hispanic, and Native American Residents",Abigail Weinberg,https://www.motherjones.com/mojo-wire/2022/03/2020-census-undercount-black-hispanic-native-american-residents/
Florida Approves the Country’s First “Election Police Force”,Inae Oh,https://www.motherjones.com/mojo-wire/2022/03/florida-election-police-force/
"Yeah, I’m Gonna Need You to Go Ahead and Celebrate Michael Boltons’ Birthdays",Daniel King,https://www.motherjones.com/recharge/2022/02/office-space-michael-bolton-assclown-david-herman-birthday/
"50 Years After Recording “No Knock,” Gil Scott-Heron’s Protest Song Contains a Prescription",Daniel King,https://www.motherjones.com/recharge/2022/02/no-knock-police-killings-amir-locke-song-gil-scott-heron/
"Politics Is Fun, Actually: City Council Edition",Lil Kalish,https://www.motherjones.com/recharge/2022/01/politics-is-fun-actually-city-council-edition/
Russia’s Invasion of Ukraine May Become a Defining Moment in US Dependence on Fossil Fuels,Oliver Milman,https://www.motherjones.com/politics/2022/03/russias-invasion-of-ukraine-may-become-a-defining-moment-in-us-dependence-on-fossil-fuels/
The White House Just Approved $200 Million Worth of Weapons for Ukraine,Ali Breland,https://www.motherjones.com/politics/2022/03/the-white-house-just-approved-200-million-worth-of-weapons-for-ukraine/
Ukraine’s Top Climate Scientist Speaks Out,Oliver Milman,https://www.motherjones.com/environment/2022/03/ukraine-climate-scientist-fossil-fuel-putin-russia-war/
EPA Prepares to Approve Bee-Killing Pesticides for 15 More Years,Oliver Milman,https://www.motherjones.com/politics/2022/03/epa-approve-bee-killing-banned-pesticides-insecticides-neonicotinoids-imidacloprid-thiamethoxam-clothianidin-dinotefuran/
Florida Advised Against Covid Vaccines for Kids. This Pediatrician Is Appalled.,Kiera Butler,https://www.motherjones.com/politics/2022/03/florida-advised-against-covid-vaccines-for-kids-this-pediatrician-is-appalled/
"Florida, Unlike the CDC, Says Healthy Kids Shouldn’t Get the Covid Vaccine",Abigail Weinberg,https://www.motherjones.com/mojo-wire/2022/03/florida-unlike-the-cdc-says-healthy-kids-shouldnt-get-the-covid-vaccine/
The Bloody Secret Behind Lab-Grown Meat,Tom Philpott,https://www.motherjones.com/environment/2022/03/lab-meat-fetal-bovine-serum-blood-slaughter-cultured/
Climate Change Is Already Taking a Big Bite Out of Our Food Supply,Tom Philpott,https://www.motherjones.com/food/2022/03/ipcc-report-climate-crops-oceans-farmland-united-nations-greenhouse-gas-emissions/
How the Mainstream Movement Against Gender-Based Violence Fails Black Workers and Survivors,Madison Pauly,https://www.motherjones.com/crime-justice/2022/03/racism-domestic-violence-sexual-assault-movement-anti-me-too-black/
Derek Chauvin’s Colleagues Found Guilty of Violating George Floyd’s Civil Rights,Samantha Michaels,https://www.motherjones.com/crime-justice/2022/02/george-floyd-verdict-derek-chauvin-fellow-minneapolis-officers-guilty-violating-civil-rights/
Ukrainian Refugees Are Being Embraced by Europe. Why Weren’t Syrians?,Isabela Dias,https://www.motherjones.com/politics/2022/03/ukrainian-refugees-are-being-embraced-by-europe-why-werent-syrians/
Democratic Senators Also Don’t Get Why Biden Is Still Using a Cruel Trump-Era Border Policy,Fernanda Echavarri,https://www.motherjones.com/politics/2022/03/democratic-senators-schumer-menendez-biden-end-title-42/
,,https://www.motherjones.com/politics/2022/03/ukraine-russia-war-anti-putin-protest-movement/
,,https://www.motherjones.com/politics/2022/03/bannon-milo-and-other-right-wing-activists-are-hellbent-on-transforming-the-catholic-church/
,,https://www.motherjones.com/politics/2022/03/ukraine-russia-war-anti-putin-protest-movement/
,,https://www.motherjones.com/politics/2022/03/pushback-greece-lesbos-refugees-asylum-seekers-ukraine/
January 6 Reckoning: CNN’s Jake Tapper Says the Media Must Confront Republicans’ Big Lie,Abigail Weinberg,https://www.motherjones.com/media/2021/07/january-6-insurrection-capitol-cnn-jake-tapper-podcast/
We Need to Understand How We Got to January 6 Before We Can Move Forward,Fernanda Echavarri,https://www.motherjones.com/politics/2021/06/podcast-january-6-qanon-history-whats-next/
A Radical Idea for Forcing Vaccine Companies to Share Knowledge With the World,Molly Schwartz and Jamilah King,https://www.motherjones.com/politics/2021/05/vaccine-patents-biden-covid-india-dean-baker-pandemic/
,,https://podcasts.apple.com/us/podcast/the-mother-jones-podcast/id1386408605
