title,byline,url
The Senate Finally Passed an Infrastructure Bill. Here Comes the Hard Part.,Kara Voght,https://www.motherjones.com/mojo-wire/2021/08/infrastructure-joe-biden-senate-passes/
The Senate Finally Passed an Infrastructure Bill. Here Comes the Hard Part.,Kara Voght,https://www.motherjones.com/mojo-wire/2021/08/infrastructure-joe-biden-senate-passes/
Andrew Cuomo Resigns as Governor After Explosive Sexual Harassment Report,Inae Oh,https://www.motherjones.com/politics/2021/08/andrew-cuomo-resigns/
We Have the War on Terror to Thank for Donald Trump,Dan Spinelli,https://www.motherjones.com/politics/2021/08/spencer-ackerman-reign-of-terror-donald-trump/
It Sure Looks Like Marjorie Taylor Greene Is About to Get Permanently Banned From Twitter,Inae Oh,https://www.motherjones.com/mojo-wire/2021/08/marjorie-taylor-greene-twitter-ban/
Former Overstock CEO Patrick Byrne Gets Sued for Pushing Election Lies,AJ Vicens,https://www.motherjones.com/mojo-wire/2021/08/patrick-byrne-dominion-defamation/
Dire Climate Report Puts Ball Squarely in America’s Court,Oliver Milman,https://www.motherjones.com/environment/2021/08/dire-climate-report-puts-ball-squarely-in-americas-court/
"As Wells Run Dry, a Tourist Town Fights for Survival",Maanvi Singh,https://www.motherjones.com/environment/2021/08/wells-run-dry-mendicino-california-fights-survival-drought-water-tourism/
"The Logic of Corporate Accounting Took Over Our Language, and We Hardly Noticed",Robin Kaiser-Schatzlein,https://www.motherjones.com/politics/2021/08/the-logic-of-corporate-accounting-took-over-our-language-and-we-hardly-noticed/
"Fires, Floods, Heatwaves: We’re Just Getting Started, Says IPCC",Damian Carrington,https://www.motherjones.com/environment/2021/08/unequivocal-ipcc-report-human-climate-change-fires-floods-heatwaves-climate-emergency/
"Wait, We Can Mine Valuable Metals Using Shrubbery?",Sandy Milne,https://www.motherjones.com/environment/2021/08/scientists-phytomining-mining-metals-plants-nickel-cobalt-selenium/
,,https://www.motherjones.com/politics/2021/07/january-6-hearing-police-testimony/
,,https://www.motherjones.com/politics/2021/07/anthony-fauci-covid-delta-vaccines/
,,https://www.motherjones.com/mojo-wire/2021/07/siberian-mosquito-tornado/
Top US Health Official: It’s Time for Vaccine Mandates,Edwin Rios,https://www.motherjones.com/mojo-wire/2021/08/top-us-health-official-its-time-for-vaccine-mandates/
The First Guilty Pleas Come Down in January 6 Insurrection Cases,Nathalie Baptiste,https://www.motherjones.com/mojo-wire/2021/08/the-first-guilty-pleas-come-down-in-january-6-insurrection-cases/
Happy Friday: Biden Extended Student Debt Relief Through January,Madison Pauly,https://www.motherjones.com/mojo-wire/2021/08/biden-student-debt-relief-extension-january/
The Most Iconic Photo in Music History Inspires the Co-Naming of 126th Street in Harlem,Daniel King,https://www.motherjones.com/recharge/2021/08/great-day-in-harlem-jazz-photo-art-kane/
What’s Behind the Deep-State Plot Against National Happiness Day This Weekend,Daniel King,https://www.motherjones.com/recharge/2021/08/national-happiness-happens-day-under-attack-by-deep-state/
Olympic Hope Shines Through a COVID Surge,Maya Mukherjee,https://www.motherjones.com/recharge/2021/08/olympic-hope-simone-biles-shine-through-covid-corruption/
"In the End, Cuomo Goes Full Trump",Nathalie Baptiste,https://www.motherjones.com/politics/2021/08/in-the-end-cuomo-goes-full-trump/
Myanmar Opposition Leader: We Need More Help From Biden to Defeat the Military Junta,David Corn,https://www.motherjones.com/politics/2021/08/dr-sasa-myanmar-opposition-joe-biden/
Did a PG&E Power Line Spark the Second-Largest Fire in California History?,Edwin Rios,https://www.motherjones.com/environment/2021/08/did-a-pge-power-line-spark-the-second-largest-fire-in-california-history/
Biotech Greed Is Prolonging the Pandemic. It’s Inexcusable.,Jag Bhalla,https://www.motherjones.com/environment/2021/08/biotech-greed-vaccine-pfizer-covax-astrazeneca-covid-pandemic-profits/
Louisiana Has Among the Highest Daily COVID Infections in the World,Edwin Rios,https://www.motherjones.com/coronavirus-updates/2021/08/louisiana-has-among-the-highest-daily-covid-infections-in-the-world/
"As COVID Breaks Records in Arkansas, Its GOP Governor Regrets Ban on Mask Mandates",Inae Oh,https://www.motherjones.com/coronavirus-updates/2021/08/covid-arkansas-asa-hutchinson-mask-madates/
Small Farms Vanish Every Day in America’s Dairyland: “There Ain’t No Future in Dairy”,Summer Sewell,https://www.motherjones.com/food/2021/07/small-farms-vanish-every-day-in-americas-dairyland-there-aint-no-future-in-dairy/
"For Every $1 We Spend on Food, We Rack Up $2 in Public-Health and Environmental Damage",Tom Philpott,https://www.motherjones.com/food/2021/07/for-every-1-we-spend-on-food-we-rack-up-2-in-public-health-and-environmental-damage/
Minneapolis Just Gave Some Coronavirus Relief Money to the Police,Samantha Michaels,https://www.motherjones.com/crime-justice/2021/08/minneapolis-just-gave-some-coronavirus-relief-money-to-the-police/
"Biden Said He’d Cut Incarceration in Half. So Far, the Federal Prison Population Is Growing.",Samantha Michaels,https://www.motherjones.com/crime-justice/2021/07/biden-said-hed-cut-incarceration-in-half-so-far-the-federal-prison-population-is-growing/
Trump Weaponized COVID Concerns Against Migrants. Families Are Still Being Brutalized by the Policy.,Isabela Dias,https://www.motherjones.com/politics/2021/07/trump-weaponized-covid-concerns-against-migrants-families-are-still-being-brutalized-by-the-policy/
“Not Necessary”: The Biden Administration Just Canceled More Border Wall Contracts,Hannah Levintova,https://www.motherjones.com/politics/2021/07/not-necessary-the-biden-administration-just-canceled-more-border-wall-contracts/
,,https://www.motherjones.com/politics/2021/08/purdue-pharma-american-medical-association-relationship-opioid-crisis-public-health/
,,https://www.motherjones.com/media/2021/07/hollywood-loves-rape-revenge-plots-but-what-story-are-they-really-telling/
,,https://www.motherjones.com/politics/2021/08/purdue-pharma-american-medical-association-relationship-opioid-crisis-public-health/
,,https://www.motherjones.com/politics/2021/07/how-flint-closed-the-gap-between-black-and-white-suffering-under-covid/
January 6 Reckoning: CNN’s Jake Tapper Says the Media Must Confront Republicans’ Big Lie,Abigail Weinberg,https://www.motherjones.com/media/2021/07/january-6-insurrection-capitol-cnn-jake-tapper-podcast/
We Need to Understand How We Got to January 6 Before We Can Move Forward,Fernanda Echavarri,https://www.motherjones.com/politics/2021/06/podcast-january-6-qanon-history-whats-next/
A Radical Idea for Forcing Vaccine Companies to Share Knowledge With the World,Molly Schwartz and Jamilah King,https://www.motherjones.com/politics/2021/05/vaccine-patents-biden-covid-india-dean-baker-pandemic/
,,https://podcasts.apple.com/us/podcast/the-mother-jones-podcast/id1386408605
