title,byline,url
Trump’s Trade War Is Here and Promises to Get Ugly,Pema Levy,https://www.motherjones.com/politics/2025/02/trump-tariffs-trade-war-inflation/
Trump’s Trade War Is Here and Promises to Get Ugly,Pema Levy,https://www.motherjones.com/politics/2025/02/trump-tariffs-trade-war-inflation/
"We May Be Eating Microbes Soon, and That’s a Good Thing",Sara Talpos,https://www.motherjones.com/environment/2025/02/bacteria-algae-microorganisms-food-climate-effects-solein-protein-powder/
This Week’s Episode of Reveal: Immigrants on the Line,Reveal,https://www.motherjones.com/politics/2025/02/immigration-deportation-meatpacking-trump/
Trump’s Tariffs: Another Disaster for the Families Who’ve Lost Everything,Michael Mechanic,https://www.motherjones.com/politics/2025/02/donald-trump-tariffs-canada-mexico-china-inflation-deportation-labor-shortages-disaster-recovery-la-fires-floods/
Trump’s War on Gender is Accelerating,Abby Vesoulis,https://www.motherjones.com/politics/2025/02/trumps-transgender-pronouns-gender-cdc/
SCOOP: Robert F. Kennedy Jr. Admits Settlement for “Misconduct” Accusation,David Corn,https://www.motherjones.com/politics/2025/01/robert-f-kennedy-jr-admits-settlement-for-misconduct-accusation-senate-confirmation/
Trump’s War on Medicaid Will Institutionalize Millions of People,Julia Métraux,https://www.motherjones.com/politics/2025/01/trump-medicaid-institutionalization-hcbs-cuts-gop/
,,https://www.motherjones.com/politics/2025/01/trump-transgender-military-ban-executive-order/
,,https://www.motherjones.com/politics/2025/01/trump-pardon-pam-hemphill-interview-rejected-january-6-insurrectionist/
,,https://www.motherjones.com/politics/2025/01/garrison-hayes-video-inauguration-black-church/
,,https://www.motherjones.com/politics/2025/01/video-heres-what-trumps-most-faithful-fans-want-to-see-next/
Louisiana Indicts NY Doctor for Telemedicine Abortion,Nina Martin,https://www.motherjones.com/politics/2025/01/louisiana-indicts-ny-doctor-for-telemedicine-abortion/
A Former ICE Chief of Staff on How Trump’s Enforcement Push Is Backfiring,Isabela Dias,https://www.motherjones.com/politics/2025/01/former-ice-chief-of-staff-enforcement-tom-homan-jason-houser-interview/
"With Trump’s Mass Deportations, Who Will Rebuild Our Disaster-Stricken Cities?",Nina Lakhani,https://www.motherjones.com/politics/2025/01/donald-trump-ice-mass-deportation-who-rebuild-disaster-cities-immigrants-labor/
I Work at NIH. The Fear Among Staff Is Palpable.,"Anonymous, as told to Jackie Flynn Mogensen",https://www.motherjones.com/politics/2025/01/nih-science-trump-funding-freeze-chaos-chilling-effect-dei/
Kash Patel Suddenly Can’t Seem to Remember His Long Record of Extremism,David Corn and Dan Friedman,https://www.motherjones.com/politics/2025/01/kash-patel-confirmation-hearing-fbi-extremism-january-6/
"The Worst, Most Important, Book I Read This Year",Dan Friedman,https://www.motherjones.com/politics/2024/12/the-worst-book-the-case-for-israel-alan-dershowitz/
Sarah McBride Just Showed Nancy Mace How to Act Like a Member of Congress,Julianne McShane,https://www.motherjones.com/politics/2024/11/sarah-mcbride-nancy-mace-congress-transgender-women-bathroom-transphobia/
Elizabeth Warren Warns That Trump’s Transition “Threatens the American Public”,Julianne McShane,https://www.motherjones.com/politics/2024/11/elizabeth-warren-donald-trump-transition-team-secret-donors/
A Parting Reminder From Jimmy Carter,"January 13, 2025",https://www.motherjones.com/politics/2025/01/a-parting-reminder-from-jimmy-carter/
How Kash Patel Became a Useful Idiot for Vladimir Putin,"December 9, 2024",https://www.motherjones.com/politics/2024/12/kash-patel-fbi-donald-trump-russia-scandal-putin-useful-idiot/
"The Media and Trump: Not Resistance, But Not Acceptance","November 20, 2024",https://www.motherjones.com/politics/2024/11/donald-trump-robert-kennedy-jr-media-press-accommodationist-sanewashing/
,,https://www.motherjones.com/politics/2025/01/war-horse-battle-fallujah-20-years-reveal-podcast-audio/
,,https://www.motherjones.com/politics/2025/01/reveal-episode-presidential-pardons/
,,https://www.motherjones.com/politics/2025/01/fortress-greece-refugees/
,,https://www.motherjones.com/politics/2024/12/this-weeks-episode-of-reveal-a-world-war-ii-incident-nearly-lost-to-history/
"How Trump Makes Tragedies Worse, A History",Julianne McShane,https://www.motherjones.com/politics/2025/01/how-trump-makes-tragedies-worse-a-history/
Christian Nationalists Are Swooning Over JD Vance’s Remarks on Fox News,Kiera Butler,https://www.motherjones.com/politics/2025/01/christian-nationalists-are-swooning-over-jd-vances-remarks-on-fox-news/
Severe Weather Is Increasing the Cost of Living for Black Americans,Adam Mahoney,https://www.motherjones.com/politics/2025/01/severe-weather-is-increasing-the-cost-of-living-for-black-americans/
"For Scientists Studying Environmental Health, Trump’s Diktats Are a Slow-Moving Disaster",Henry Carnell,https://www.motherjones.com/politics/2025/01/trump-executive-orders-nih-nsf-funding-pause-freeze-environmental-health-climate-science-research-interview/
"A Police Officer Chased a Native Teen to His Death. Days Later, the Police Force  Shut Down.",Reveal,https://www.motherjones.com/politics/2025/01/a-police-officer-chased-a-native-teen-to-his-death-days-later-the-police-force-shut-down/
“Incredibly Damaging:” The Fallout From Trump’s January 6 Pardons,Mark Follman,https://www.motherjones.com/politics/2025/01/january-6-pardons-trump-violence-police-terrorism/
Trump Tells DOJ to Prosecute Teachers Who “Unlawfully” Support Trans or Nonbinary Students,Sarah Szilagy and Madison Pauly,https://www.motherjones.com/politics/2025/01/trump-tells-doj-to-prosecute-teachers-who-unlawfully-support-trans-or-nonbinary-students/
What My Black Mother’s Involuntary Sterilization in 1965 Reveals About America Today,Catherine Coleman Flowers,https://www.motherjones.com/politics/2025/01/catherine-coleman-flowers-what-my-black-mothers-involuntary-sterilization-in-1965-reveals-about-america-today/
“Dystopian”: Trump Issues New Order to Stamp Out Trans Youth Healthcare,Madison Pauly and Henry Carnell,https://www.motherjones.com/politics/2025/01/donald-trump-new-executive-order-gender-affirming-care-trans-youth-children-teenagers/
Trump Declares War on Transgender People,Madison Pauly,https://www.motherjones.com/politics/2025/01/trump-declares-war-on-transgender-people/
Transgender Troops Are Bracing for the Decision on Military Ban,Sonner Kehrt,https://www.motherjones.com/politics/2025/01/transgender-troops-are-bracing-for-the-decision-on-military-ban/
"Trump Demands Apology After Bishop Urged Him to “Have Mercy” on Immigrants, LGBTQ",Arianna Coghill,https://www.motherjones.com/politics/2025/01/trump-bishop-budde-apology/
,,https://www.motherjones.com/politics/2025/01/e-bike-subsidy-programs-denver-states-walkable-cities-urban-infrastructure/
,,https://www.motherjones.com/politics/2024/12/grip-there-are-many-programs-trying-to-reduce-recidivism-this-one-works/
,,https://www.motherjones.com/criminal-justice/2024/05/threat-assessment-mass-shooting-elliot-rodger-isla-vista-mother/
,,https://www.motherjones.com/criminal-justice/2023/10/foster-kids-psychiatric-hospitals-universal-health-services-uhs-alaska-cps/
The Secret Plan to Strike Down US Gun Laws,Will Van Sant,https://www.motherjones.com/politics/2025/01/constitutional-defense-fund-bruen-dark-money-ghost-guns-second-amendment/
Alex Jones Is Trying to Halt the Sale of Infowars. Elon Musk’s X Just Got Involved in the Case.,Anna Merlan,https://www.motherjones.com/politics/2024/11/alex-jones-infowars-sale-onion-elon-musk-x/
Inside the Fight for the First Whole Foods Union,Sophie Hurwitz,https://www.motherjones.com/politics/2025/01/whole-foods-union-amazon-philadelphia-ufcw/
A Raw Milk Magnate Has Spent Years Fighting Public Health Agencies. Will RFK Jr. Take His Side?,Anna Merlan,https://www.motherjones.com/politics/2025/01/raw-farm-raw-milk-mark-mcafee/
Inside the RFK Jr.-Alex Jones Bromance,Dan Friedman and David Corn,https://www.motherjones.com/politics/2025/01/rfk-jr-alex-jones-infowars-trump-del-bigtree/
Wildfire Smog Is Deadly—But LA’s Covid Mask Organizers Have It Covered,Julia Métraux,https://www.motherjones.com/politics/2025/01/california-fires-covid-mask-mutual-aid/
Fear Is the Goal,Isabela Dias,https://www.motherjones.com/politics/2025/01/trump-immigration-ice-raid-fear-is-the-goal/
Colombia’s President Rejects Trump’s Deportation Flights,Julianne McShane,https://www.motherjones.com/politics/2025/01/colombias-president-deportation-flights-immigrants-military-planes-homan/
