title,byline,url
Utah Just Became the First State of 2023 to Ban Gender-Affirming Care,Julia Lurie,https://www.motherjones.com/politics/2023/01/utah-just-became-the-first-state-of-2023-to-ban-gender-affirming-care/
Utah Just Became the First State of 2023 to Ban Gender-Affirming Care,Julia Lurie,https://www.motherjones.com/politics/2023/01/utah-just-became-the-first-state-of-2023-to-ban-gender-affirming-care/
Memphis Polices’ First Press Release About Tyre Nichols Was Full of Glaring Omissions,Julia Lurie,https://www.motherjones.com/crime-justice/2023/01/memphis-police-first-press-release-about-tyre-nichols-was-full-of-glaring-omissions/
We Tried to Call the Top Donors to George Santos’ 2020 Campaign. Many Don’t Seem to Exist.,Noah Lanard and David Corn,https://www.motherjones.com/politics/2023/01/we-tried-to-call-the-top-donors-to-george-santos-2020-campaign-many-dont-seem-to-exist/
"At Least Three Killed, Four Injured in Another California Shooting",Julia Lurie,https://www.motherjones.com/crime-justice/2023/01/at-least-three-killed-four-injured-in-another-california-shooting/
Video Shows Police Brutally Beating Tyre Nichols—Then Laughing About It,Samantha Michaels,https://www.motherjones.com/crime-justice/2023/01/video-shows-memphis-police-brutal-beating-tyre-nichols-laughing-about-attack/
"Being Gay Shouldn’t Be a Crime, Pope Says",Emily Hofstaedter,https://www.motherjones.com/politics/2023/01/being-gay-shouldnt-be-a-crime-pope-says/
What to Know About the Risks of Gas Stoves and Appliances,Lisa Song,https://www.motherjones.com/environment/2023/01/what-to-know-about-the-risks-of-gas-stoves-and-appliances/
Fossil-Fuel Power Plants May Be on Their Last Legs,Dan Gearino,https://www.motherjones.com/environment/2023/01/fossil-fuel-power-plants-wind-solar-clean-energy/
A Month in America,Inae Oh,https://www.motherjones.com/mojo-wire/2023/01/a-month-in-america/
“Lies Have Short Legs”: Inside the Brazilian WhatsApp Group Exposing George Santos,Isabela Dias,https://www.motherjones.com/politics/2023/01/george-santos-lies-have-short-legs-whatsapp-group-brazil/
,,https://www.motherjones.com/politics/2023/01/ticketmaster-taylor-swift-monopoly-senate-hearing/
,,https://www.motherjones.com/politics/2022/12/walker-warnock-georgia-run-off-senate-christianity-belief/
,,https://www.motherjones.com/environment/2022/10/brown-pelicans-threatened-gulf-coast-sea-level-rise-climate-change/
It Shouldn’t Just Be Elaine Chao,Inae Oh,https://www.motherjones.com/mojo-wire/2023/01/it-shouldnt-just-be-elaine-chao/
Newport News School Board Votes to Fire Superintendent After School Shooting Involving 6-Year-Old,Arianna Coghill,https://www.motherjones.com/mojo-wire/2023/01/newport-news-school-board-george-parker-fired/
Trump Is Allowed to Return to Facebook and Instagram,Pema Levy,https://www.motherjones.com/mojo-wire/2023/01/trump-is-allowed-to-return-to-facebook-and-instagram/
Experiencing Space Flight Just Got a Lot More Accessible,Daniel King,https://www.motherjones.com/recharge/2022/12/space-flight-portal/
"Remembering George Pérez, a Superhero of Superhero Comics",Dan Spinelli,https://www.motherjones.com/recharge/2022/05/remembering-george-perez-a-superhero-of-superhero-comics/
Ukrainian and Russian Dancers Join Onstage (in Italy) to Fundraise for the Red Cross,Daniel King,https://www.motherjones.com/recharge/2022/04/ukrainian-russian-antiwar-ballet-dancers-for-peace/
The FDA Just Made It Easier for Gay Men to Donate Blood,Abigail Weinberg,https://www.motherjones.com/politics/2023/01/fda-blood-donation-gay-men-guidelines/
"Remembering Victor Navasky, the Unflappable Ringmaster of The Nation",David Corn,https://www.motherjones.com/politics/2023/01/remembering-victor-navasky-the-unlfappable-ringmaster-of-the-nation/
Why Starbucks Is Inviting Social Workers Into Its Stores,Frida Garza,https://www.motherjones.com/environment/2023/01/homeless-starbucks-coffee-social-workers-breaking-ground/
How Just a Fraction of EV Owners Could Stop the US Grid From Failing,Matt Simon,https://www.motherjones.com/environment/2023/01/ev-electric-car-owners-grid-backup-battery-storage/
Jeff Zients to Replace Ron Klain as Biden’s Chief of Staff,Abigail Weinberg,https://www.motherjones.com/politics/2023/01/jeff-zients-to-replace-ron-klain-as-bidens-chief-of-staff/
Meet Ron DeSantis’ New “Public Health Integrity Committee”,Kiera Butler,https://www.motherjones.com/politics/2022/12/meet-ron-desantis-new-public-health-integrity-committee/
My Vegetarian Dilemma: Tasting Lab-Grown Meat From Live Animals,Oliver Milman,https://www.motherjones.com/environment/2023/01/mission-barns-lab-grown-meat-live-animals-taste-test-ethical-eating/
"In Rural California, Farmworkers Fend for Themselves for Health Care",David Bacon,https://www.motherjones.com/environment/2022/12/in-rural-california-farmworkers-fend-for-themselves-for-health-care/
All Five Officers Charged With Second-Degree Murder in Tyre Nichols’ Death,Abigail Weinberg,https://www.motherjones.com/crime-justice/2023/01/tyre-nichols-officers-charged-five-second-degree-murder/
The Case of a 6-Year-Old School Shooter Raises Gut-Wrenching Questions,Mark Follman,https://www.motherjones.com/crime-justice/2023/01/6-year-old-school-shooter-virginia-family-statement-threat-assessment/
“The Stick Is Much Bigger Than the Carrot” in Biden’s New Border Plan,Isabela Dias,https://www.motherjones.com/politics/2023/01/the-stick-is-much-bigger-than-the-carrot-in-bidens-new-border-plan/
Republican States Just Succeeded in Keeping a Key Trump Border Policy in Place,Isabela Dias,https://www.motherjones.com/politics/2022/12/title-42-chief-justice-roberts-republican-states-just-succeeded-in-keeping-a-key-trump-border-policy-in-place/
,,https://www.motherjones.com/politics/2023/01/nick-fuentes/
,,https://www.motherjones.com/media/2023/01/lesbian-best-friend/
,,https://www.motherjones.com/politics/2022/12/hunter-biden-laptop-bannon-guo-musk/
,,https://www.motherjones.com/politics/2022/10/jim-marchant-nevada-secretary-state-trump-divorce-ice-machine-maga/
Memphis Polices’ First Press Release About Tyre Nichols Was Full of Glaring Omissions,Julia Lurie,https://www.motherjones.com/crime-justice/2023/01/memphis-police-first-press-release-about-tyre-nichols-was-full-of-glaring-omissions/
Video Shows Police Brutally Beating Tyre Nichols—Then Laughing About It,Samantha Michaels,https://www.motherjones.com/crime-justice/2023/01/video-shows-memphis-police-brutal-beating-tyre-nichols-laughing-about-attack/
Tyre Nichols’ Attorneys: Memphis Police Stop That Led to Death Was a “Nonstop Beating”,Arianna Coghill,https://www.motherjones.com/crime-justice/2023/01/tyre-nichols-ben-crump-memphis-police-nonstop-beating/
Florida State Colleges Will No Longer “Fund or Support” Critical Race Theory,Arianna Coghill,https://www.motherjones.com/politics/2023/01/florida-state-colleges-will-no-longer-fund-or-support-critical-race-theory/
