title,byline,url
A New Rudy Scandal: FBI Agent Says Giuliani Was Co-opted by Russian Intelligence,Dan Friedman and David Corn,https://www.motherjones.com/politics/2023/09/a-new-rudy-scandal-fbi-agent-says-giuliani-was-co-opted-by-russian-intelligence/
A New Rudy Scandal: FBI Agent Says Giuliani Was Co-opted by Russian Intelligence,Dan Friedman and David Corn,https://www.motherjones.com/politics/2023/09/a-new-rudy-scandal-fbi-agent-says-giuliani-was-co-opted-by-russian-intelligence/
The Rise of Vivek. The Return of Masters. The College Libertarians Won’t Go Away.,Noah Lanard,https://www.motherjones.com/politics/2023/09/blake-masters-vivek-ramaswamy-peter-thiel-primary-elections/
Dog Culture Must End,Abigail Weinberg,https://www.motherjones.com/mojo-wire/2023/09/dog-culture-must-end-bite-me/
Replacing the “Old Relationship”: Rep. Greg Casar On a Historic Congressional Delegation’s Trip to Latin America,Eamon Whalen,https://www.motherjones.com/politics/2023/08/latin-american-delegation-greg-casar-aoc-colombia-brazil-chile/
Even the Wettest States Aren’t Safe From Wildfires Anymore,Oliver Laughland,https://www.motherjones.com/environment/2023/09/louisiana-tiger-island-wildfire/
In the News this Week: Our Legislators Are Old,Arianna Coghill,https://www.motherjones.com/mojo-wire/2023/08/in-the-news-this-week-our-legislators-are-old/
DeSantis’ New Insurance Law Could Make It Harder to Rebuild After Hurricane Idalia,Abby Vesoulis,https://www.motherjones.com/politics/2023/08/hurricane-idalia-desantis-home-insurance/
Is This The End of Prison Phone Fees?,Robin Kaiser-Schatzlein,https://www.motherjones.com/crime-justice/2023/08/conneticut-prison-phone-fees-securus/
"When Plants Can No Longer Stand the Heat, We’re in Trouble",Katie Myers,https://www.motherjones.com/environment/2023/08/study-extreme-heat-plants-photosynthesis/
A Judge Just Halted Efforts to End Immigration Detention in New Jersey,Isabela Dias,https://www.motherjones.com/politics/2023/08/ice-corecivic-judge-halts-efforts-to-end-new-jersey-immigration-detention/
,,https://www.motherjones.com/environment/2023/08/prageru-climate-skeptic-science-florida-education/
,,https://www.motherjones.com/politics/2023/08/florida-slavery-tennessee-capitol-skills-video-scandal-desantis/
,,https://www.motherjones.com/politics/2023/08/white-identity-history-slavery-video/
Why Ron DeSantis Was Booed at a Vigil for Jacksonville Shooting Victims,Arianna Coghill,https://www.motherjones.com/mojo-wire/2023/08/why-ron-desantis-was-booed-at-a-vigil-for-jacksonville-shooting-victims/
Trump Trial Set to Begin Day Before Super Tuesday,Abigail Weinberg,https://www.motherjones.com/mojo-wire/2023/08/trump-trial-super-tuesday-election-2020-january-6/
"Vivek Ramaswamy’s Campaign Slogan Is a Reverse “In This House, We Believe” Yard Sign",Abigail Weinberg,https://www.motherjones.com/mojo-wire/2023/08/vivek-ramaswamys-campaign-slogan-is-a-reverse-in-this-house-we-believe-yard-sign-is-that-on-purpose-gop-debate-2024/
Watch 25-Year-Old Sabrina Ionescu Beat Steph Curry’s 3-Point Contest Record,Julia Lurie,https://www.motherjones.com/recharge/2023/07/sabrina-ionescu-steph-curry-record-wnba-nba-3-point-contest/
Experiencing Space Flight Just Got a Lot More Accessible,Daniel King,https://www.motherjones.com/recharge/2022/12/space-flight-portal/
"Remembering George Pérez, a Superhero of Superhero Comics",Dan Spinelli,https://www.motherjones.com/recharge/2022/05/remembering-george-perez-a-superhero-of-superhero-comics/
The Confusing State of Legal Challenges to Bans on Transgender Healthcare,Katie Herchenroeder,https://www.motherjones.com/politics/2023/08/missouri-texas-transgender-healthcare-bans-confusing-legal-decisions/
"Greek Asylum Policies are Leading to Migrant Deaths, According to Report",Ashifa Kassam,https://www.motherjones.com/politics/2023/08/greek-asylum-policies-are-leading-to-migrant-deaths-according-to-report/
"If Corporations Bore the True Cost of Their Emissions, They’d Owe Trillions",Kate Yoder,https://www.motherjones.com/environment/2023/08/corporate-subsidies-true-cost-carbon-emissions-science-study/
"This Summer’s Fires, Floods, and Heatwaves Are the New Normal",Oliver Milman,https://www.motherjones.com/environment/2023/08/summer-2023-wildfires-flooding-heatwaves-extreme-weather-new-normal/
RFK Jr. Wants to Make It Easier for Doctors to Spread Medical Lies,Kiera Butler,https://www.motherjones.com/politics/2023/07/rfk-jr-ab-2098-california-misinformation-doctors/
Tightly Packed Poultry and Pig Farms Could Be Incubating the Next Deadly Flu,Tom Philpott,https://www.motherjones.com/environment/2023/06/tightly-packed-poultry-and-pig-farms-could-be-incubating-the-next-deadly-flu/
Compost May Just Save This City,Aman Azhar,https://www.motherjones.com/environment/2023/08/how-compost-may-save-baltimore-city/
How Heat-Shattering Ocean Temperatures Impact Fisheries,Max Graham,https://www.motherjones.com/environment/2023/08/how-heat-shattering-ocean-temperatures-impacts-fisheries/
What We Know About the Racist Shooting in Jacksonville,Julia Lurie,https://www.motherjones.com/crime-justice/2023/08/what-we-know-about-the-racist-shooting-in-jacksonville/
Fossil Fuel Firms Continue to Try to Dismiss Climate Lawsuit in Hawaii,Dharna Noor,https://www.motherjones.com/environment/2023/08/fossil-fuel-firms-continue-to-try-to-dismiss-climate-lawsuit-in-hawaii/
Deported and No Way Back Home,Isabela Dias,https://www.motherjones.com/politics/2023/08/migrants-deportations-with-no-way-back-home/
Birthright Citizenship Is Fundamental to “Who We Are as a Nation.” So Why Do Republicans Attack It?,Isabela Dias,https://www.motherjones.com/politics/2023/07/birthright-citizenship-is-fundamental-to-who-we-are-as-a-nation-so-why-do-republicans-attack-it/
,,https://www.motherjones.com/politics/2023/08/michigan-gop-republicans-2024-trump-state-party-blue-wall/
,,https://www.motherjones.com/politics/2023/08/boy-problems-andrew-tate-masculinity-crisis-manosphere/
,,https://www.motherjones.com/politics/2023/06/the-weight-of-water-women-mariners-abused-at-sea-are-finally-breaking-their-silence/
,,https://www.motherjones.com/politics/2023/07/threads-twitter-nick-fuentes/
Why Ron DeSantis Was Booed at a Vigil for Jacksonville Shooting Victims,Arianna Coghill,https://www.motherjones.com/mojo-wire/2023/08/why-ron-desantis-was-booed-at-a-vigil-for-jacksonville-shooting-victims/
How the Right Retired “Negrophile”—and Substituted “Woke”,Anthony Conwright,https://www.motherjones.com/politics/2023/08/negrophilia-woke-right-conservative-desantis/
Compost May Just Save This City,Aman Azhar,https://www.motherjones.com/environment/2023/08/how-compost-may-save-baltimore-city/
How the “Black Tax” Reinforces Poverty,Jake Bittle and Siri Chilukuri,https://www.motherjones.com/environment/2023/08/how-the-black-tax-keeps-many-black-communities-poor/
