title,byline,url
Rootless Masculinity Influencers Are Pivoting to Wildly Antisemitic Claims,Anna Merlan,https://www.motherjones.com/politics/2024/08/masculinity-influencers-antisemitism/
Rootless Masculinity Influencers Are Pivoting to Wildly Antisemitic Claims,Anna Merlan,https://www.motherjones.com/politics/2024/08/masculinity-influencers-antisemitism/
Trump’s January 6 Charges Have Been Renewed—Despite His “Absolute Immunity”,Dan Friedman,https://www.motherjones.com/politics/2024/08/trump-january-6-special-counsel-jack-smith-charges-justice-department/
Which Climate Policies Work Best? This New Study Offers Clues.,Kate Yoder,https://www.motherjones.com/politics/2024/08/science-study-climate-policies-effectiveness/
Tim Walz Was No Protest Leader,Eamon Whalen,https://www.motherjones.com/politics/2024/08/tim-walz-protests-2020-encouraged-vance-george-floyd-frey-minneapolis/
UPS Drivers Won “Historic Heat Protections.” They Say the Company Hasn’t Lived Up to That Promise.,Serena Lin,https://www.motherjones.com/politics/2024/08/ups-drivers-teamsters-heat-protections/
Trump’s Campaign Sure Doesn’t Seem to Want People to Hear Him at the Debate,Julianne McShane,https://www.motherjones.com/politics/2024/08/trump-presidential-debate-muted-mic/
The DNC Gave Kamala Harris a Major Boost,Julianne McShane,https://www.motherjones.com/politics/2024/08/kamala-harris-post-dnc/
,,https://www.motherjones.com/politics/2024/08/trump-maga-dnc-project-2025-video-reactions-strategy/
,,https://www.motherjones.com/politics/2024/08/black-republicans-trump-maga-kamala-video/
,,https://www.motherjones.com/politics/2024/08/kamala-harris-climate-crisis-policy-environment/
,,https://www.motherjones.com/politics/2024/08/why-does-weird-work-tim-walz-republican-democrat-2024-election-trump/
Vance Leaves Door Open to Renewed Family Separations Under Trump,Julianne McShane,https://www.motherjones.com/politics/2024/08/jd-vance-family-separation/
Joe Biden Promised to Be a Bridge. Democrats Finally Made It to the Other Side.,Tim Murphy,https://www.motherjones.com/politics/2024/08/biden-was-a-bridge-walz-harris-dnc-chicago/
Elon Musk’s Lawyers Quietly Subpoena Public Interest Groups,Anna Merlan,https://www.motherjones.com/politics/2024/08/twitter-x-subpoenas-elon-musk/
"Judge Rules Breonna Taylor’s Boyfriend, Not the Police, Caused Her Death",Samantha Michaels,https://www.motherjones.com/criminal-justice/2024/08/judge-rules-breonna-taylors-boyfriend-not-the-police-caused-her-death/
Prosecutor vs. Felon: The Narrative That Dominated the DNC Was Powerful…and Problematic,Pema Levy and Abby Vesoulis,https://www.motherjones.com/politics/2024/08/tprosecutor-vs-felon-kamala-harris-donald-trump-democratic-national-convention/
"Trump Said Some Disabled People “Should Just Die,” According to His Nephew",Julia Métraux,https://www.motherjones.com/mojo-wire/2024/07/donald-trump-nephew-disabled-people-die/
Biden’s $30m Weekend Fundraising Blitz Breaks Democratic Party Records,James West,https://www.motherjones.com/politics/2024/06/biden-campaign-fundraiser-30-million-hollywood-clooney-obama/
North Carolina House Passes Revised Mask Ban,Julia Métraux,https://www.motherjones.com/politics/2024/06/north-carolina-house-passes-revised-mask-ban/
JD Vance’s Racist Populism,"August 9, 2024",https://www.motherjones.com/politics/2024/08/jd-vance-racist-populism-white-privilege-trump-harris/
Here’s How Biden Could Rattle Trump in Their First Debate,"June 24, 2024",https://www.motherjones.com/politics/2024/06/trump-biden-first-debate-rattle-ridicule-cnn/
The Most Under-Covered Story of 2024: Trump and Right-Wing Extremism,"June 13, 2024",https://www.motherjones.com/politics/2024/06/donald-trump-turning-point-usa-charlie-kirk-right-wing-extremism-our-land-david-corn/
,,https://www.motherjones.com/criminal-justice/2024/07/churn-mental-illness-opioids-seattle-homelessness/
,,https://www.motherjones.com/media/2024/07/the-latest-reveal-podcast-shows-how-the-mormon-church-thwarts-child-sex-abuse-claims/
,,https://www.motherjones.com/politics/2024/06/40-acres-lie-skidaway-island-georgia-racism-the-landings-reveal/
,,https://www.motherjones.com/politics/2024/06/new-reveal-episode-40-acres-lie-part-1/
Hundreds More Former GOP Officials Endorse Harris,Julianne McShane,https://www.motherjones.com/politics/2024/08/hundreds-more-former-gop-officials-endorse-harris/
Coming This Fall: Free Covid Tests,Jamilah King,https://www.motherjones.com/politics/2024/08/where-can-i-get-free-covid-tests-fall-2024/
Kamala Harris Barely Mentioned Climate at the DNC. Does It Matter?,Jackie Flynn Mogensen,https://www.motherjones.com/politics/2024/08/kamala-harris-walz-climate-dnc-democrats-convention-global-threat/
The Sunrise Movement Thinks Climate Is the Key to Voters’ Trust,Siri Chilukuri,https://www.motherjones.com/politics/2024/08/sunrise-movement-climate-voters-trust-kamala-harris-green-new-deal/
What Would It Mean to Have a Prosecutor as President Right Now?,Samantha Michaels,https://www.motherjones.com/politics/2024/07/kamala-harris-prosecutor-attorney-general-trump-criminal-convictions-presidential-race/
She Called the Police for Help. They Killed Her Instead.,Arianna Coghill,https://www.motherjones.com/criminal-justice/2024/07/sonya-massey-police-killing-illinois-sangamon-sheriff/
"Michelle Obama: Yes, We Have Affirmative Action for the Wealthy",Michael Mechanic,https://www.motherjones.com/politics/2024/08/michelle-obama-affirmative-action-rich-generational-wealth-democratic-convention-speech/
"The Racist, Xenophobic History of “Excited Delirium”",Julia Métraux,https://www.motherjones.com/criminal-justice/2024/07/excited-delirium-police-deaths-medical-racism/
"JD Vance Called Democrats a “Childless Cabal,” But We Did the Math",Michael Mechanic,https://www.motherjones.com/politics/2024/08/jd-vance-democrats-childless-cabal/
Will Ohio Strike Down Its Draconian Gender-Affirming Care Ban?,Sarah Szilagy,https://www.motherjones.com/politics/2024/07/will-ohio-strike-down-its-draconian-gender-affirming-care-ban/
"In Republican Primary, Bigot Loses to Election Denier",Sophie Hurwitz,https://www.motherjones.com/politics/2024/08/valentina-gomez-missouri-bigot-election-denier-hoskins/
Why Smashing the Administrative State Is a Disaster for Reproductive Rights,Nina Martin,https://www.motherjones.com/politics/2024/07/why-smashing-the-administrative-state-is-a-disaster-for-reproductive-rights/
,,https://www.motherjones.com/politics/2024/08/trump-mass-deportation-plan-immigration-border-patrol-ice-dhs-migrants-undocumented/
,,https://www.motherjones.com/politics/2024/07/the-secret-plan-to-strike-down-us-gun-laws/
,,https://www.motherjones.com/criminal-justice/2024/05/threat-assessment-mass-shooting-elliot-rodger-isla-vista-mother/
,,https://www.motherjones.com/criminal-justice/2023/10/foster-kids-psychiatric-hospitals-universal-health-services-uhs-alaska-cps/
“People Will Literally Die.” America’s Youngest Congressman Sounds the Alarm.,Garrison Hayes,https://www.motherjones.com/politics/2024/08/trump-kamala-maxwell-frost-guns-climate-interview-video/
JD Vance Reiterates False Claim That Democrats “Tried to Kill” Trump,Mark Follman,https://www.motherjones.com/politics/2024/08/jd-vance-trump-assassination-attempt-democrats/
This Long-Dead Scientist’s Collection of Rare Seeds Could Help Keep Us Alive,Robin McKie,https://www.motherjones.com/environment/2024/07/arthur-watkins-wheat-seed-collection-rare-varieties-food-supply/
Why Donald Trump’s Plan to Stop Taxing Tips Is a Lame Political Stunt,Judd Legum,https://www.motherjones.com/politics/2024/07/donald-trump-proposal-no-tax-tips/
"A Long Island County Banned Masks, and Disabled People Are Suing",Julia Métraux,https://www.motherjones.com/politics/2024/08/long-island-mask-ban-class-action-disability-lawsuit/
Tim Walz Is Leading the Way on Long Covid Funding,Julia Métraux,https://www.motherjones.com/politics/2024/08/tim-walz-minnesota-long-covid-funding-harris-vp/
Migrant Encounters at the Border Hit Lowest Number in Four Years,Isabela Dias,https://www.motherjones.com/politics/2024/08/migrant-encounters-at-the-border-hit-lowest-number-in-four-years/
Trump’s Dangerous Campaign of Hatred Against Migrant “Invaders”,Mark Follman,https://www.motherjones.com/politics/2024/08/trump-migrants-invasion-rhetoric-violence-stochastic-terrorism/
