title,byline,url
How Election Deniers Took Over Georgia’s Election System,Justin Glawe and Ari Berman,https://www.motherjones.com/politics/2024/10/how-election-deniers-took-over-georgia-election-system-trump/
How Election Deniers Took Over Georgia’s Election System,Justin Glawe and Ari Berman,https://www.motherjones.com/politics/2024/10/how-election-deniers-took-over-georgia-election-system-trump/
Which Vaccines Will RFK Jr. Come For?,Julia Métraux,https://www.motherjones.com/politics/2024/10/rfk-jr-kennedy-trump-health-vaccines/
Donald Trump Talked About Fixing McDonald’s Ice Cream Machines. Lina Khan Actually Did.,Sophie Hurwitz,https://www.motherjones.com/politics/2024/10/donald-trump-talked-about-fixing-mcdonalds-ice-cream-machines-lina-khan-actually-did/
What Would the Future of Birth Control Be Under Trump? Ask Texas.,Madison Pauly,https://www.motherjones.com/politics/2024/10/what-would-the-future-of-birth-control-be-under-trump-ask-texas/
Donald Trump’s Wish List for Student Debt Will Hurt Millions,Hannah Levintova,https://www.motherjones.com/politics/2024/10/student-debt-relief-donald-trump-jd-vance/
The Catholic Church Is Spending Big to Defeat Abortion Rights Ballot Measures,Heidi Schlumpf and Russ Choma,https://www.motherjones.com/politics/2024/10/catholic-church-abortion-ballot-measures-florida-colorado-south-dakota-missouri/
Extremists Say the Military Authorized Lethal Force Against Americans Ahead of the Election,Sonner Kehrt,https://www.motherjones.com/politics/2024/10/extremists-say-the-military-authorized-lethal-force-against-americans-ahead-of-the-election/
,,https://www.motherjones.com/politics/2024/10/black-voters-project-2025-trump-kamala/
,,https://www.motherjones.com/politics/2024/10/trump-model-management-immigration-investigation/
,,https://www.motherjones.com/politics/2024/10/florida-ron-desantis-project-2025-sex-education/
,,https://www.motherjones.com/politics/2024/09/theobros-jd-vance-christian-nationalism/
Elon Musk’s Ironic Voter Fraud Obsession,Anna Merlan,https://www.motherjones.com/politics/2024/10/elon-musk-voter-fraud-lottery-illegal/
How Taylor Swift Inspired a Push for Fathers to Back Harris,Artis Curiskis,https://www.motherjones.com/politics/2024/10/dobbs-dads-lincoln-project/
Bernie Moreno Is Using Audio Jammers to Block People From Recording His Events,Abby Vesoulis,https://www.motherjones.com/politics/2024/10/bernie-moreno-is-using-audio-jammers-to-block-people-from-recording-his-events-ohio-senate/
Trump Told Turkey’s Dictator He Could Invade Syria. Dozens of Civilians Died.,Dan Friedman,https://www.motherjones.com/politics/2024/10/trump-turkey-erdogan-syria-kurds-conflict-of-interest/
Scary Habits: Why Is Horror So Obsessed With Nuns?,Lena Wilson,https://www.motherjones.com/media/2024/10/nun-horror-immaculate-the-nun-the-conjuring-horror-catholic-church/
Officials Are Sounding the Alarm Over Musk’s Payments to Pro-Trump Voters,Julianne McShane,https://www.motherjones.com/politics/2024/10/pennsylvania-musk-cash-lottery-trump-payments-reaction/
"Trump’s Latest Appearances Are Unhinged, Profane, and Yes, Dangerous",Julianne McShane,https://www.motherjones.com/politics/2024/10/trump-profane-rallies-insults-campaign/
Idaho State Senator Tells Native American Candidate to “Go Back Where You Came From”,Julia Métraux,https://www.motherjones.com/politics/2024/10/idaho-state-senator-dan-foreman-native-american-candidate-go-back-where-you-came-from/
A Message From President JD Vance,"October 29, 2024",https://www.motherjones.com/politics/2024/10/jd-vance-message-president-2026-our-land/
I’m Fed Up With the Obsession Over Polls,"October 22, 2024",https://www.motherjones.com/politics/2024/10/trump-harris-polls-public-opinion-gallup-lepore/
Is It Racist and Misogynist to Demean Kamala Harris?,"October 17, 2024",https://www.motherjones.com/politics/2024/10/kamala-harris-donald-trump-racism-misogyny-our-land/
,,https://www.motherjones.com/politics/2024/10/why-elon-musk-went-full-maga/
,,https://www.motherjones.com/politics/2024/10/reveal-swing-states-election-battlegrounds-audio/
,,https://www.motherjones.com/politics/2024/10/black-voters-republications-trump-podcast-extra-reveal/
,,https://www.motherjones.com/politics/2024/10/whats-up-with-black-maga/
Louisiana Sued Over Law Classifying Abortion Pills as “Controlled Substances”,Sarah Szilagy,https://www.motherjones.com/politics/2024/10/louisiana-sued-abortion-pills-drugs/
"In Turnaround, SCOTUS Legalizes Virginia Voter Purge",Arianna Coghill,https://www.motherjones.com/politics/2024/10/scotus-youngkin-virginia-voter-purge-trump/
A Solid Majority of Young Americans Is Very Worried About Climate Change,Nina Dietz,https://www.motherjones.com/politics/2024/10/young-americans-climate-change-fears-anxiety-politics-study/
"Arizona’s Future Hinges on Water, so Why Isn’t It a Big Campaign Issue?",Jake Bittle,https://www.motherjones.com/politics/2024/10/arizona-water-development-groundwater-politics-campaign/
Watch: A Florida Teen’s Remarkable Fight to Put Her Rapist Behind Bars,Rachel de Leon,https://www.motherjones.com/criminal-justice/2024/10/victim-suspect-pbs-newshour-sexual-assault-rape-teen-polk-county-florida/
This California Ballot Initiative Seeks to End Involuntary Servitude for Prisoners,Serena Lin,https://www.motherjones.com/politics/2024/10/california-ballot-initiative-involuntary-servitude-prisoners-prop-6/
Tens of Thousands of People Are Dying on the Disability Wait List,Julia Métraux,https://www.motherjones.com/politics/2024/10/social-security-disability-delays-harris-univision/
The Hawaii Senator Who Faced Down Racism and Ableism—And Killed Nazis,Julia Métraux,https://www.motherjones.com/politics/2024/10/pbs-renegades-hawaii-inouye-documentary-senate/
Colorado Voters Could Help Victims of Domestic and Sexual Violence,Julianne McShane,https://www.motherjones.com/politics/2024/10/colorado-voters-could-help-victims-of-domestic-and-sexual-violence/
The Consequences of Huge Federal Cuts to Domestic Violence Funding “May Be Death”,Julianne McShane,https://www.motherjones.com/politics/2024/10/domestic-violence-federal-funding-cuts-risks-death/
Suit Over Gender Dysphoria Could Dismantle New Disability Rules,Sarah Szilagy,https://www.motherjones.com/politics/2024/10/suit-over-gender-dysphoria-could-dismantle-disability-rights/
How Abortion Foes Are Using Transphobia to Derail New York’s Equal Rights Amendment,Madison Pauly,https://www.motherjones.com/politics/2024/10/abortion-foes-transphobia-new-york-equal-rights-amendment/
,,https://www.motherjones.com/politics/2024/10/when-inclusion-fails-kids-education-disabilities-idea/
,,https://www.motherjones.com/politics/2024/10/newport-stephen-schwarzman-blackstone-private-equity-miramar-construction-trump/
,,https://www.motherjones.com/criminal-justice/2024/05/threat-assessment-mass-shooting-elliot-rodger-isla-vista-mother/
,,https://www.motherjones.com/criminal-justice/2023/10/foster-kids-psychiatric-hospitals-universal-health-services-uhs-alaska-cps/
The Doctor Who Saw Children Shot in the Head in Gaza—and Tried to Tell the World,Sophie Hurwitz,https://www.motherjones.com/politics/2024/10/feroze-sidhwa-new-york-times-children-gaza-shot-in-head-israel-palestine-doctor/
Trump’s Extreme Rhetoric Is Echoing in Threats of Violence,Mark Follman,https://www.motherjones.com/politics/2024/10/trump-rhetoric-violent-threats-migrants-assassination-attempt-conspiracy-theories/
Aquaculture Is Using Far More Wild Fish as Feed Than Previously Estimated,Kiley Price,https://www.motherjones.com/environment/2024/10/aquaculture-wild-fish-feed-fifo-sustainable-ecosystems/
The Tiny Potato at the Heart of One Tribe’s Fight Against Climate Change,Joseph Lee,https://www.motherjones.com/environment/2024/10/water-potato-climate-change-coeur-d-alene-restoration/
How Donald Trump Caused a Shortage of Lupus Medication,Julia Métraux,https://www.motherjones.com/politics/2024/10/donald-trump-elon-musk-covid-hcq-hydroxychloroquine/
Rep. Ilhan Omar to Introduce Major Long Covid Bill,Julia Métraux,https://www.motherjones.com/politics/2024/09/ilhan-omar-bernie-long-covid-house-bill/
Immigrant Rights Advocates Are Preparing for “The Worst” Under Trump. Will It Be Enough?,Isabela Dias,https://www.motherjones.com/politics/2024/10/trump-immigration-advocates-resistance-the-worst-scenario-mass-deportation-preparation-migration/
Trump’s Former ICE Head’s Plan for Mass Deportation: More Family Separation or Deporting US Citizens,Isabela Dias,https://www.motherjones.com/politics/2024/10/tom-homan-ice-mass-deportation-family-separation-60-minutes/
