title,byline,url
Cop15 Negotiators Are Barely Even Mentioning the Ocean,Chris Michael,https://www.motherjones.com/politics/2022/12/cop15-negotiators-are-barely-even-mentioning-the-ocean/
Cop15 Negotiators Are Barely Even Mentioning the Ocean,Chris Michael,https://www.motherjones.com/politics/2022/12/cop15-negotiators-are-barely-even-mentioning-the-ocean/
Mark Your Calendars: Monday Is “Trump Criminal Referral Day” for the Jan. 6 Panel,James West,https://www.motherjones.com/politics/2022/12/trump-january-6-committee-criminal-referrals-monday/
Donald Trump’s NFT Sale Is the Weirdest Thing on Social Media Today,Russ Choma,https://www.motherjones.com/politics/2022/12/donald-trump-nft-trading-cards-social-media-today/
Here’s All the Ways Elon Musk Embarrassed Himself,Arianna Coghill,https://www.motherjones.com/media/2022/12/heres-all-the-ways-elon-musk-embarrassed-himself/
The Bipartisan Immigration Deal Is Dead on Arrival,Isabela Dias,https://www.motherjones.com/politics/2022/12/sinema-tillis-the-bipartisan-immigration-deal-is-dead-on-arrival/
Manchin’s Permitting Reform Could Lead to More Oil Pipeline Spills,Kristoffer Tigue and Bob Berwyn,https://www.motherjones.com/politics/2022/12/keystone-pipeline-oil-spill-joe-manchin-permitting-reform/
Most Workers Who Were Fired This Year Lost Their Jobs for No Good Reason—Again,Maggie Duffy,https://www.motherjones.com/politics/2022/12/workers-fired-2022-just-cause-nelp-report/
Newly Revealed Texts Show Mark Meadows Is a Liar,David Corn,https://www.motherjones.com/politics/2022/12/newly-revealed-texts-show-mark-meadows-is-a-liar/
Meet Ron DeSantis’ New “Public Health Integrity Committee”,Kiera Butler,https://www.motherjones.com/politics/2022/12/meet-ron-desantis-new-public-health-integrity-committee/
It Took a Team of Female Scientists to Find the Snake Clitoris,Donna Lu,https://www.motherjones.com/environment/2022/12/snakes-have-clitorises-study-taboo-female-genitalia/
,,https://www.motherjones.com/environment/2022/10/brown-pelicans-threatened-gulf-coast-sea-level-rise-climate-change/
,,https://www.motherjones.com/politics/2022/09/it-didnt-start-with-trump-the-decades-long-saga-of-how-the-gop-went-crazy/
,,https://www.motherjones.com/politics/2022/08/full-transcript-of-leaked-steve-bannon-tape-donald-trump-2020-election/
Kyrsten Sinema Is Leaving the Democratic Party,Inae Oh,https://www.motherjones.com/politics/2022/12/kyrsten-sinema-is-leaving-the-democratic-party/
"With NYT on Strike, Let’s Revisit “Not the New York Times”",Abigail Weinberg,https://www.motherjones.com/mojo-wire/2022/12/with-nyt-on-strike-lets-revisit-not-the-new-york-times/
Mark Halperin Said He’s Like a Cancel Culture “Refugee.” Now He’s Making Bank at No Labels.,Madison Pauly,https://www.motherjones.com/mojo-wire/2022/12/mark-halperin-said-hes-like-a-cancel-culture-refugee-now-hes-making-bank-at-no-labels/
Experiencing Space Flight Just Got a Lot More Accessible,Daniel King,https://www.motherjones.com/recharge/2022/12/space-flight-portal/
"Remembering George Pérez, a Superhero of Superhero Comics",Dan Spinelli,https://www.motherjones.com/recharge/2022/05/remembering-george-perez-a-superhero-of-superhero-comics/
Ukrainian and Russian Dancers Join Onstage (in Italy) to Fundraise for the Red Cross,Daniel King,https://www.motherjones.com/recharge/2022/04/ukrainian-russian-antiwar-ballet-dancers-for-peace/
Will Ranked-Choice Voting Kill MAGA? No. Are Republicans Banning It Anyway? Yup.,Emily Hofstaedter,https://www.motherjones.com/politics/2022/12/will-ranked-choice-voting-kill-maga-no-are-republicans-banning-it-anyway-yup/
“Suicide by Cop”: How Police Present Killings as Unavoidable,Isaac Scher,https://www.motherjones.com/politics/2022/12/suicide-by-cop-how-police-present-killings-as-unavoidable/
Nuclear Fusion Promises “Near-Limitless Energy”—Someday,Nicola Davis,https://www.motherjones.com/environment/2022/12/lawrence-livermore-nuclear-fusion-breakthrough-limitless-energy-caveats/
Gold Mining Thugs Cut “Road to Chaos” Through Amazonian Preserve,Tom Phillips,https://www.motherjones.com/environment/2022/12/illegal-gold-mining-amazon-road-amazon-indigenous-preserve-yanomami-jair-bolsonaro/
"As RSV Cases Surge, Experts Warn of America’s Worsening ‘Tripledemic’",Abby Vesoulis,https://www.motherjones.com/politics/2022/11/rsv-covid-flu-cases-winter-2022/
"After Decades of Public Service, Dr. Fauci Gives His Final White House Briefing",Arianna Coghill,https://www.motherjones.com/coronavirus-updates/2022/11/after-decades-of-public-service-dr-fauci-gives-his-final-white-house-briefing/
A Jewish Girl’s Guide to Christmas Cookie Boxes,Ruth Murai,https://www.motherjones.com/food/2022/12/a-jewish-girls-guide-christmas-cookie-boxes-dessert-holiday-gift/
All School Kids Should Eat Lunch for Free,Bridget Huber,https://www.motherjones.com/food/2022/12/school-lunch-universal-california-colorado-pandemic-aid-nutrition/
"The Truth About Stopping Mass Shootings, From Sandy Hook to Uvalde",Mark Follman,https://www.motherjones.com/crime-justice/2022/12/sandy-hook-uvalde-mass-shootings-threat-assessment-red-flag-laws/
A Black Cop Sided With Racial Justice Protesters. It Cost Him His Job.,Gabbriel Schivone,https://www.motherjones.com/crime-justice/2022/12/jervis-middleton-lexington-police-lawsuit-racial-discrimination-black-lives-matter/
How Did a State Known for Its War on Immigrants Approve In-State Tuition for Undocumented Students?,Isabela Dias,https://www.motherjones.com/politics/2022/11/arizona-immigration-tuition-students-proposition-308/
“They Can’t Kill Us All”: These Scholars Lost Their Countries and Found Each Other,Melissa Fay Greene,https://www.motherjones.com/politics/2022/11/they-cant-kill-us-all-these-scholars-lost-their-countries-and-found-each-other/
,,https://www.motherjones.com/politics/2022/12/curtis-boyd-abortion-clergy-consultation-service-preacher-texas-new-mexico-roe/
,,https://www.motherjones.com/politics/2022/12/2022-midterms-crime-new-york-hochul-zeldin-new-york-post/
,,https://www.motherjones.com/politics/2022/12/hunter-biden-laptop-bannon-guo-musk/
,,https://www.motherjones.com/politics/2022/10/jim-marchant-nevada-secretary-state-trump-divorce-ice-machine-maga/
A White Father and Son Allegedly Tried to Kill a Black FedEx Driver. Did Cops Go Easy on Them?,Samantha Michaels,https://www.motherjones.com/crime-justice/2022/11/a-white-father-and-son-allegedly-tried-to-kill-a-black-fedex-driver-did-cops-go-easy-on-them/
Republicans Hoped a “Crime Wave” Was Their Ticket to a Red Wave. It Wasn’t.,Samantha Michaels,https://www.motherjones.com/politics/2022/11/crime-wave-republicans-midterms-fetterman-oz-hochul-zeldin-fear-progressive-reform-criminal-justice/
"In New York City, Racial Equity Ballot Measures Passed by a Wide Margin",Maggie Duffy,https://www.motherjones.com/politics/2022/11/racial-equity-ballot-measures-new-york-city/
Pay Attention to These Insanely Important District Attorney Races,Samantha Michaels,https://www.motherjones.com/politics/2022/10/pay-attention-to-these-insanely-important-district-attorney-races/
