title,byline,url
"GUILTY: 4 Proud Boys, Including Enrique Tarrio, Convicted of Seditious Conspiracy",Dan Friedman,https://www.motherjones.com/politics/2023/05/proud-boys-guilty-seditious-conspiracy-tarrio-nordean-biggs-rehl/
"GUILTY: 4 Proud Boys, Including Enrique Tarrio, Convicted of Seditious Conspiracy",Dan Friedman,https://www.motherjones.com/politics/2023/05/proud-boys-guilty-seditious-conspiracy-tarrio-nordean-biggs-rehl/
Utah’s Suicide Pact With the Fossil Fuel Industry,Stephanie Mencimer,https://www.motherjones.com/politics/2023/05/utahs-suicide-pact-with-the-fossil-fuel-industry/
“How White Men Fight”,Tim Murphy,https://www.motherjones.com/politics/2023/05/white-men-fight-tucker-carlson/
The Dobbs Leak Didn’t Wreck the Supreme Court—the Justices’ Scandals Did,Pema Levy,https://www.motherjones.com/politics/2023/05/supreme-court-scandals/
Bolsonaro Allegedly Falsified His Vaccination Status to Enter the US,Isabela Dias,https://www.motherjones.com/politics/2023/05/bolsonaro-allegedly-falsified-his-vaccination-status-to-enter-the-us/
I Don’t Think Someone “Ranting” on the Subway Means They Deserved to Die,Abigail Weinberg,https://www.motherjones.com/crime-justice/2023/05/subway-death-new-york-city-eric-adams-media-coverage/
"Lampreys, Like Rodney Dangerfield, Deserve a Little Respect",Ted Williams,https://www.motherjones.com/environment/2023/05/sea-lampreys-biology-conservation-rodney-dangerfield-respect/
Environmentalists Seek End to Plastic Industry “Hoax”,James Bruggers,https://www.motherjones.com/politics/2023/05/chemical-advanced-recycling-hoax-pollution-emissions-federal-trade-commission/
Greg Abbott Wants You to Know the Mass Shooting Victims Were No Angels,Tim Murphy,https://www.motherjones.com/politics/2023/05/greg-abbott-wants-you-to-know-the-mass-shooting-victims-were-no-angels/
Judge Rejects Trump’s Request for a Mistrial in E. Jean Carroll Case,Russ Choma,https://www.motherjones.com/politics/2023/05/trump-carroll-judge-kaplan-tacopina-mistrial/
,,https://www.motherjones.com/politics/2023/04/fox-news-fired-tucker-carlson-response-same-old-bs/
,,https://www.motherjones.com/politics/2023/04/kamala-harris-black-tennessee-lawmakers-reaction-biden-obama/
,,https://www.motherjones.com/politics/2023/04/video-tennessee-democrat-interview-expulsion-covenant-shooting/
Rep. Zooey Zephyr Sues Over Removal From Montana State House Floor,Abigail Weinberg,https://www.motherjones.com/mojo-wire/2023/05/zooey-zephyr-montana-democracy-state-floor-expelled-sue/
House Republicans Are Playing Debt-Ceiling Russian Roulette,Michael Mechanic,https://www.motherjones.com/politics/2023/04/house-republicans-debt-ceiling-clean-energy-ira-irs-joe-biden/
Peter Thiel Says Republicans Are Too Focused on Culture War. He Can Blame His Handpicked Candidates.,Eamon Whalen,https://www.motherjones.com/politics/2023/04/peter-thiel-culture-war-2024-donations-blake-masters/
Experiencing Space Flight Just Got a Lot More Accessible,Daniel King,https://www.motherjones.com/recharge/2022/12/space-flight-portal/
"Remembering George Pérez, a Superhero of Superhero Comics",Dan Spinelli,https://www.motherjones.com/recharge/2022/05/remembering-george-perez-a-superhero-of-superhero-comics/
Ukrainian and Russian Dancers Join Onstage (in Italy) to Fundraise for the Red Cross,Daniel King,https://www.motherjones.com/recharge/2022/04/ukrainian-russian-antiwar-ballet-dancers-for-peace/
"Joe Biden Made a “Dark Brandon” Joke at the White House Correspondent’s Dinner, Killing the Meme for Good",Dan Friedman,https://www.motherjones.com/politics/2023/04/joe-biden-dark-brandon-correspondent-dinner/
$30K and a Cushy Italian Trip From a Clout-Chasing Law School? “Fantastico!” Says Gorsuch,Dan Friedman,https://www.motherjones.com/politics/2023/04/gorsuch-scalia-law-school-corruption-supreme-court/
Private Equity Giant Bills Itself a Climate Leader. A New Report Calls BS.,Nina Lakhani,https://www.motherjones.com/environment/2023/05/carlyle-group-private-equity-climate-report-fossil-fuel-energy-gas-oil-investments/
Scientists: Critical Ocean Currents Could Collapse Within Decades,Fred Pearce,https://www.motherjones.com/environment/2023/04/research-ocean-currents-circulation-collapse-climate-impacts/
The Coming Tidal Wave of Right Wing Covid Lawsuits,Kiera Butler,https://www.motherjones.com/politics/2023/04/the-coming-tidal-wave-of-right-wing-covid-lawsuits/
DeSantis Has Lots of Plans to Fight the Left—and None to Preserve Millions of Floridians’ Health Care,Pema Levy,https://www.motherjones.com/politics/2023/04/ron-desantis-medicaid-expansion/
This Fun Guy Is Turning Fungi Into Meat,Marc Fawcett-Atkinson,https://www.motherjones.com/environment/2023/04/mycelium-meat-alternatives-plant-based-high-protein-maia-farms-gavin-schneider/
Fries With That Mammoth Burger?,Damian Carrington,https://www.motherjones.com/environment/2023/03/mammoth-burger-meatball-extinct-vow-cultivated-meat-climate-methane/
Silicon Valley Elites Are Making San Francisco Unsafe and Unlivable,Angelica Cabral,https://www.motherjones.com/crime-justice/2023/04/silicon-valley-elites-are-making-san-francisco-unsafe-and-unlivable/
The Cop Who Killed Breonna Taylor Just Got a New Policing Job,Samantha Michaels,https://www.motherjones.com/crime-justice/2023/04/the-cop-who-killed-breonna-taylor-just-got-a-new-policing-job/
Ron DeSantis Wants to Make Transporting Migrants a Felony,Isabela Dias,https://www.motherjones.com/politics/2023/02/ron-desantis-wants-to-make-transporting-migrants-a-felony/
The New York Times Just Dropped a Shocking Investigation on Child Labor in America,Arianna Coghill,https://www.motherjones.com/politics/2023/02/new-york-times-child-labor-immigrant-kids/
,,https://www.motherjones.com/media/2023/04/asphalt-video-games-microtransactions-loot-boxes-in-game-purchases-capitalism/
,,https://www.motherjones.com/politics/2023/04/these-black-mothers-bet-on-themselves-and-transformed-las-vegas/
,,https://www.motherjones.com/politics/2023/03/anti-trans-transgender-health-care-ban-legislation-bill-minors-children-lgbtq/
,,https://www.motherjones.com/crime-justice/2023/03/who-killed-rasheem-carter/
A Black Teen Rang the Wrong Doorbell. A White Homeowner Shot Him.,Abigail Weinberg,https://www.motherjones.com/crime-justice/2023/04/black-teen-ralph-yarl-shot-white-homeowner-rang-doorbell-missouri/
“Undemocratic”: Why Is Keith Ellison Taking Over a Case From a Prosecutor He Endorsed?,Eamon Whalen,https://www.motherjones.com/crime-justice/2023/04/minneapolis-keith-ellison-prosecutor-progressive-mary-moriarty-undemocratic/
Nashville Officials Unanimously Vote to Reinstate Justin Jones,Arianna Coghill,https://www.motherjones.com/politics/2023/04/justin-jones-nashville-vote/
Tennessee House Republicans Move to Expel Three Members for Gun Control Protest,Arianna Coghill,https://www.motherjones.com/politics/2023/04/tennessee-gop-republican-house-expel-members-gun-control-protest-nashville-shooting/
