title,byline,url
Kevin McCarthy Ousted as House Speaker,Abby Vesoulis,https://www.motherjones.com/politics/2023/10/republicans-democrats-oust-house-speaker-kevin-mccarthy-gaetz/
Kevin McCarthy Ousted as House Speaker,Abby Vesoulis,https://www.motherjones.com/politics/2023/10/republicans-democrats-oust-house-speaker-kevin-mccarthy-gaetz/
Does “And” Mean “And”? Or “Or”? The Supreme Court Will Decide.,Daniel King,https://www.motherjones.com/crime-justice/2023/10/supreme-court-pulsifer-criminal-justice-drug-definitions/
"For Disabled Workers, Discrimination Is Common—If You Even Get to Apply",Julia Métraux,https://www.motherjones.com/politics/2023/10/for-disabled-workers-discrimination-is-common-if-you-even-get-to-apply/
This Book Will Change How You Think About Protest Forever,Eamon Whalen,https://www.motherjones.com/politics/2023/10/vincent-bevins-if-we-burn-interview-mass-protest-decade-2010s-change-how-you-view-protest-forever/
"Wildland Fire Dispatchers Are Critical Workers, and They’re Burned Out",Kylie Mohr,https://www.motherjones.com/environment/2023/10/wildland-fire-dispatchers-us-forest-service-burnout/
Is the Bronze Age Pervert Going Mainstream?,Ali Breland,https://www.motherjones.com/politics/2023/10/bronze-age-pervert-costin-alamariu/
Plant Milk Is Better for Us and the Climate. So Why Do We Subsidize Dairy?,Julia Métraux,https://www.motherjones.com/food/2023/10/milking-it-plant-milk-starbucks-oat-soy-dairy-subsidy-climate/
RFK Jr. Aided by GOP and Trump PAC Donors,David Corn,https://www.motherjones.com/politics/2023/10/robert-kennedy-jr-aided-by-gop-and-trump-pac-donors-chernick/
Who Is Laphonza Butler?,Arianna Coghill,https://www.motherjones.com/mojo-wire/2023/10/laphonza-butler-dianne-feinstein/
The House Voted to Avert a Government Shutdown—For 45 Days,Abby Vesoulis,https://www.motherjones.com/politics/2023/09/government-shutdown-house-vote/
,,https://www.motherjones.com/environment/2023/08/prageru-climate-skeptic-science-florida-education/
,,https://www.motherjones.com/politics/2023/08/florida-slavery-tennessee-capitol-skills-video-scandal-desantis/
,,https://www.motherjones.com/politics/2023/08/white-identity-history-slavery-video/
Biden Flips the Script on Republicans in New Pro-Union Ad,Arianna Coghill,https://www.motherjones.com/mojo-wire/2023/09/biden-union-ad-nikki-haley-tim-scott/
Pennsylvania Is Making it Easier to Register to Vote,Arianna Coghill,https://www.motherjones.com/mojo-wire/2023/09/pennsylvania-is-making-it-easier-to-register-to-vote-josh-shapiro-registration-automatic/
Mike Pence Is Really Bad at Comebacks,Ari Berman,https://www.motherjones.com/politics/2023/09/mike-pence-mitt-romney-ungodly-bad-comeback-trump/
Watch 25-Year-Old Sabrina Ionescu Beat Steph Curry’s 3-Point Contest Record,Julia Lurie,https://www.motherjones.com/recharge/2023/07/sabrina-ionescu-steph-curry-record-wnba-nba-3-point-contest/
Experiencing Space Flight Just Got a Lot More Accessible,Daniel King,https://www.motherjones.com/recharge/2022/12/space-flight-portal/
"Remembering George Pérez, a Superhero of Superhero Comics",Dan Spinelli,https://www.motherjones.com/recharge/2022/05/remembering-george-perez-a-superhero-of-superhero-comics/
A Utility Giant’s Hired Gun Says the Quiet Part Out Loud,Dan Gearino,https://www.motherjones.com/politics/2023/10/utility-opposition-rooftop-solar-shareholder-profits/
Millions of People Could Live Thanks to New Access to Tuberculosis Medication,Ruth Murai,https://www.motherjones.com/politics/2023/10/johnson-johnson-tuberculosis-drug-resistance-patent/
Climate Fiction Is No Longer Dystopian. Just Reality.,Kate Yoder,https://www.motherjones.com/environment/2023/10/climate-fiction-reality/
Dianne Feinstein Had a Complicated Environmental Record,Jake Bittle,https://www.motherjones.com/politics/2023/09/dianne-feinstein-death-environment-legacy/
"DeSantis Administration Recommends Against Boosters, Right as Florida Tops Nation for COVID Hospitalizations",Arianna Coghill,https://www.motherjones.com/politics/2023/09/desantis-administration-recommends-against-boosters-right-as-florida-tops-nation-for-covid-hospitalizations/
RFK Jr. Wants to Make It Easier for Doctors to Spread Medical Lies,Kiera Butler,https://www.motherjones.com/politics/2023/07/rfk-jr-ab-2098-california-misinformation-doctors/
The Way We Farm Is Bad for the Climate. Our Solution Isn’t Much Better.,Matt Reynolds,https://www.motherjones.com/environment/2023/09/agriculture-emissions-climate-change-farming-reforms-biden/
New Study Shows Impacts of Cutting Meat and Dairy Consumption in Half,Max Graham,https://www.motherjones.com/environment/2023/09/meat-dairy-consumption-farming-livestock-climate-emissions/
You’re Sexually Assaulted. You Report. And Police Make You the Suspect.,Rachel de Leon,https://www.motherjones.com/crime-justice/2023/09/youre-sexually-assaulted-you-report-and-police-make-you-the-suspect/
"Are These $2,000 Water Bills Racist?",Henry Carnell,https://www.motherjones.com/environment/2023/09/prichard-alabama-water-board-bill-crisis/
What the United States Can Learn From Brazil About Asylum,Isabela Dias,https://www.motherjones.com/politics/2023/09/united-states-brazil-asylum-policies/
What the New York City Migrant Crisis Is and Isn’t,Isabela Dias,https://www.motherjones.com/politics/2023/09/what-the-new-york-city-migrant-crisis-is-and-isnt/
,,https://www.motherjones.com/environment/2023/09/phoenix-heat-deaths-climate-change-church-wesley-united-methodist-sunbelt-apartheid-addiction-unhoused-housing/
,,https://www.motherjones.com/politics/2023/09/praxis-society-city-dryden-brown-peter-thiel/
,,https://www.motherjones.com/politics/2023/09/unhoused-california-photo-essay/
,,https://www.motherjones.com/crime-justice/2023/08/conneticut-prison-phone-fees-securus/
"Are These $2,000 Water Bills Racist?",Henry Carnell,https://www.motherjones.com/environment/2023/09/prichard-alabama-water-board-bill-crisis/
Child Protective Service Workers Share Their “Secret Truths That Haunt”,Kristin Jones,https://www.motherjones.com/politics/2023/09/child-protective-service-cps-social-worker-truth-telling-abolish/
RICO Charges for “Stop Cop City” Protesters Could Set a Dangerous Precedent,Arianna Coghill,https://www.motherjones.com/crime-justice/2023/09/rico-charges-for-stop-cop-city-protesters-could-set-a-dangerous-precedent-atlanta-brian-kemp-protest/
Louisiana’s Notorious Angola Prison Will No Longer Hold Children,Arianna Coghill,https://www.motherjones.com/crime-justice/2023/09/lousianas-notorious-angola-prison-will-no-longer-hold-children/
