title,byline,url
They Just Wanted to Grow Food. Their Suburban Neighbors Declared War.,Kate Brown,https://www.motherjones.com/environment/2026/02/they-just-wanted-to-grow-food-their-suburban-neighbors-declared-war/
They Just Wanted to Grow Food. Their Suburban Neighbors Declared War.,Kate Brown,https://www.motherjones.com/environment/2026/02/they-just-wanted-to-grow-food-their-suburban-neighbors-declared-war/
CBS Didn’t Want Colbert to Talk to This Democratic Candidate. He Did It Anyway.,Katie Herchenroeder,https://www.motherjones.com/politics/2026/02/cbs-didnt-want-colbert-to-talk-to-this-democratic-candidate-he-did-it-anyway/
Murdoch’s Defense in Epstein Lawsuit: Trump Is Lewd,David Corn,https://www.motherjones.com/politics/2026/02/donald-trump-jeffrey-epstein-lawsuit-wall-street-journal-lewd-bawdy/
Louisiana Bets Big on “Blue Ammonia.” Communities Along Cancer Alley Brace for the Cost.,Ames Alexander,https://www.motherjones.com/politics/2026/02/louisiana-bets-big-on-blue-ammonia-communities-along-cancer-alley-brace-for-the-cost/
These Utilities May Be Wildly Overestimating the AI Boom—at Public Expense,Emily Jones,https://www.motherjones.com/politics/2026/02/utilities-overestimating-ai-boom-data-centers-fossil-fuel-energy-usage-bills/
Tom Homan: Minnesota Should Say “Thank You” for DHS Operation,Alex Nguyen,https://www.motherjones.com/politics/2026/02/tom-homan-minnesota-should-say-thank-you-for-dhs-operation/
Trump’s Climate Repeal Will Kill America’s Transition From Gas Guzzlers to EVs,Marianne Lavelle and Dan Gearino,https://www.motherjones.com/environment/2026/02/trump-epa-endangerment-finding-repeal-climate-transition-evs-electric-vehicles-clean-energy-automakers/
,,https://www.motherjones.com/sponsored/10-worst-crises-you-wont-see-in-headlines-but-should/
,,https://www.motherjones.com/sponsored/the-movement-to-build-the-future-america-promised/
,,https://www.motherjones.com/politics/2026/02/nazi-propaganda-trump-white-house-dhs-kristi-noem-social-media/
,,https://www.motherjones.com/politics/2026/02/this-fish-fluencer-telling-ice-to-fuck-off-is-the-best-thing-youll-watch-today/
,,https://www.motherjones.com/politics/2026/02/gregory-bovino-border-patrol-ice-minneapolis-chicago-new-orleans-video/
,,https://www.motherjones.com/politics/2026/01/minneapolis-st-paul-army-veteran-protester-church-don-lemon/
Trump Promises Billions in Aid to Gaza as Israeli Airstrikes Reportedly Kill 12 Palestinians,Alex Nguyen,https://www.motherjones.com/politics/2026/02/trump-promises-billions-in-aid-to-gaza-as-israeli-airstrikes-reportedly-kill-12-palestinians/
I Went to Minneapolis to Bear Witness—and to Make Amends,Rob Schenck,https://www.motherjones.com/politics/2026/02/rob-schenck-i-went-to-minneapolis-to-bear-witness-and-to-make-amends/
Taken by ICE,Reveal,https://www.motherjones.com/politics/2026/02/ice-immigration-raids-families-trump-la-taco/
The Adorable Patients of This Special Bat Hospital Will Warm Your Heart,Benji Jones,https://www.motherjones.com/environment/2026/02/adorable-photos-flying-foxes-bat-hospital-australia/
"Their Courses Were No Longer Relevant, so These Economics Students Went to Work",Matthew Taylor,https://www.motherjones.com/politics/2026/02/rethinking-economics-movement-academic-instruction-relevance-capitalism-real-world/
Watch the Epstein Survivors’ Powerful Super Bowl Sunday Ad,Alex Nguyen,https://www.motherjones.com/politics/2026/02/epstein-survivors-powerful-super-bowl-sunday-ad-congress/
Illinois Representative Asks God to Get Trump to “Do What Is Right”,Katie Herchenroeder,https://www.motherjones.com/politics/2026/02/illinois-representative-asks-god-to-get-trump-to-do-what-is-right/
Federal Judge Calls Out the Racism of Trump Admin’s Plan to End TPS for Haitians,Alex Nguyen,https://www.motherjones.com/politics/2026/02/temporary-protected-status-kristi-noem-ana-reyes-ruling/
Murdoch’s Defense in Epstein Lawsuit: Trump Is Lewd,6 hours ago,https://www.motherjones.com/politics/2026/02/donald-trump-jeffrey-epstein-lawsuit-wall-street-journal-lewd-bawdy/
Donald Trump’s Plan to Be King of the World,"February 4, 2026",https://www.motherjones.com/politics/2026/02/donald-trump-board-of-peace-gaza-israel-davos-china-russia-scam-king/
Is This a Police State?,"January 28, 2026",https://www.motherjones.com/politics/2026/01/police-state-minneapolis-donald-trump-stephen-miller-alex-pretti-renee-good/
,,https://www.motherjones.com/politics/2026/02/ice-immigration-raids-families-trump-la-taco/
,,https://www.motherjones.com/politics/2026/02/project-2025-donald-trump-dei-chirstian-nationalism/
,,https://www.motherjones.com/politics/2026/02/minneapolis-minnesota-ice-dhs-postal-service-sean-sherman-protest-resistance/
,,https://www.motherjones.com/politics/2026/02/pablo-torre-steve-ballmer-bad-bunny-billionaires-sports-riley-gaines/
"US Military Strikes Another Boat in the Caribbean Sea, Killing 3",Katie Herchenroeder,https://www.motherjones.com/politics/2026/02/us-military-boat-strike-february-13/
Judges Have Rebuked Trump’s Mass Detention of Immigrants Thousands of Times,Katie Herchenroeder,https://www.motherjones.com/politics/2026/02/judges-reuters-immigration-detention/
Ohio Lawmakers Consider Bill That Would Essentially Ban Solar and Wind Projects,Kathiann M. Kowalski,https://www.motherjones.com/politics/2026/02/ohio-lsb294-bill-ban-solar-wind-alec-projects/
The United States Sacrificed $35 Billion in Clean Energy Projects Last Year,Naveena Sadasivam,https://www.motherjones.com/politics/2026/02/united-states-trump-canceled-clean-energy-projects-billions-investment-job-losses/
Trump Repeals Finding That Lets the EPA Regulate Climate-Warming Emissions,Dharna Noor,https://www.motherjones.com/politics/2026/02/trump-repeal-epa-endangerment-finding-regulation-climate-greenhouse-gases/
Trump’s Lust for Greenland’s Rare Earth Minerals Faces Harsh Arctic Realities,Ed Struzik,https://www.motherjones.com/politics/2026/02/trump-greenland-rare-earth-mining-arctic-conditions-cost-obstacles/
How the NAACP Signed Up to Abolish ICE,Chasity Hale,https://www.motherjones.com/politics/2026/02/naacp-derrick-johnson-abolish-ice-campaign/
"Drive Racists Out of Public Life Forever, and Other Lessons From Black History",Chasity Hale,https://www.motherjones.com/politics/2026/02/brian-jones-black-history-month-everyone/
Meet the Mastermind Behind Trump’s Definition of “Woman”,Madison Pauly,https://www.motherjones.com/politics/2026/02/trump-anti-trans-may-mailman-sports-ban-womens-bill-of-rights-terf/
How Sports Became a Battleground Over Trans Rights,Reveal,https://www.motherjones.com/politics/2026/01/transgender-athletes-bans-womens-girls-sports-riley-gaines/
Josh Hawley Asked “Can Men Get Pregnant?” 11 Times at Abortion Hearing,Katie Herchenroeder,https://www.motherjones.com/politics/2026/01/josh-hawley-asked-can-men-get-pregnant-11-times-at-abortion-hearing/
Supreme Court Battle Over Trans Athletes Is About So Much More Than Sports,Madison Pauly,https://www.motherjones.com/politics/2026/01/supreme-court-trans-athletes-west-virginia-riley-gaines-idaho-equal-protection/
,,https://www.motherjones.com/politics/2026/01/history-month-black-military-service-vietnam-war-heroes-dei-recruiting-hegseth-trump-defense/
,,https://www.motherjones.com/politics/2025/12/memphis-safe-task-force-trump-ice-crime-immigration-mass-deportations-287g/
,,https://www.motherjones.com/politics/2025/11/riley-gaines-anti-trans-lia-thomas-ncaa-trump/
,,https://www.motherjones.com/politics/2024/12/utah-adoption-agency-brighter-dobbs/
Minneapolis Is the Violent Reckoning the Gun Rights Movement Has Long Wanted,Mike Spies,https://www.motherjones.com/politics/2026/02/minneapolis-ice-cbp-nra-alex-pretti-renee-good-guns-second-amendment/
"No, Antidepressants Do Not Cause Mass Shootings",Mark Follman,https://www.motherjones.com/politics/2026/01/mass-shootings-antidepressants-rfk-conspiracy-theory/
Trump’s NIH Slashed Research on Chronic Diseases in 2025. Will It Happen Again?,Anna Rogers,https://www.motherjones.com/politics/2026/02/trump-nih-research-budget-cuts-chronic-diseases/
Arizona Governor Moves to Rein in Groundwater-Guzzling Saudi Megafarms,Nate Halverson,https://www.motherjones.com/politics/2026/01/arizona-governor-katie-hobbs-groundwater-saudi-alfalfa-exports-farming-almari-vicksburg-la-paz-county-fondomonte-lawsuit/
"Hey Jon Stewart, Jokes About Wearing Masks Aren’t Funny",Julia Métraux,https://www.motherjones.com/politics/2025/12/hey-jon-stewart-jokes-about-wearing-masks-arent-funny/
Welcome to the New Era of Covid Vaccine Tourism,Julia Métraux,https://www.motherjones.com/politics/2025/09/covid-vaccine-state-tourism-acip-rfk/
I’m a Minneapolis Postal Worker. This Is What I Saw.,Bianca Sonnenberg as told to Artis Curiskis,https://www.motherjones.com/politics/2026/02/minneapolis-postal-worker-bianca-sonnenberg-ice-dhs-alex-pretty/
DHS Claims to be Winding Down in the Twin Cities. Local Leaders Are Still Pissed.,Katie Herchenroeder,https://www.motherjones.com/politics/2026/02/dhs-homan-minnesota-retreat/
