title,byline,url
JD Vance Booed at Winter Olympics Amid Anti-ICE Protests,Katie Herchenroeder,https://www.motherjones.com/politics/2026/02/jd-vance-booed-winter-olympics-protests/
JD Vance Booed at Winter Olympics Amid Anti-ICE Protests,Katie Herchenroeder,https://www.motherjones.com/politics/2026/02/jd-vance-booed-winter-olympics-protests/
Japan Embarks on a Deep-Sea Mining Experiment With Unknown Consequences,Rachel Ramirez,https://www.motherjones.com/politics/2026/02/japan-deep-sea-mining-experiment-seafloor-critical-metals-onsequences/
Testing Kristi Noem’s Transparency Claim,Rachel de Leon,https://www.motherjones.com/politics/2026/02/testing-kristi-noems-transparency-claim/
Watch: Four Shocking Months With Gregory Bovino,Jeremy Schulman,https://www.motherjones.com/politics/2026/02/gregory-bovino-border-patrol-ice-minneapolis-chicago-new-orleans-video/
The President’s Lawyers Submitted False Information About a “Law & Order” Plot to the Supreme Court,Katie Herchenroeder,https://www.motherjones.com/politics/2026/02/e-jean-carroll-law-and-order-supreme-court/
These Haitian Meatpacking Workers Face Deportation. They Voted to Strike Anyway.,Ted Genoways,https://www.motherjones.com/politics/2026/02/jbs-tps-haiti-haitian-meatpacking-workers-deportation-immigration-strike-union/
Trump Posts Video That Depicts Obamas as Apes,Katie Herchenroeder,https://www.motherjones.com/politics/2026/02/trump-posts-video-that-depicts-obamas-as-apes/
,,https://www.motherjones.com/sponsored/10-worst-crises-you-wont-see-in-headlines-but-should/
,,https://www.motherjones.com/sponsored/the-movement-to-build-the-future-america-promised/
,,https://www.motherjones.com/politics/2026/01/minneapolis-st-paul-army-veteran-protester-church-don-lemon/
,,https://www.motherjones.com/politics/2026/01/minnesota-students-national-general-strike/
,,https://www.motherjones.com/politics/2026/01/trump-minneapolis-twin-cities-tyranny-boston-massacre-british-colonial-occupation-violence-revolution/
,,https://www.motherjones.com/politics/2026/01/rob-schenck-religious-right-immigration-minneapolis-minnesota-christian-nationalism/
When Jeffrey Epstein Was the World’s Leading Expert on Getting Away With It,Anna Merlan,https://www.motherjones.com/politics/2026/02/jeffrey-epstein-metoo-men/
Trump Has Betrayed the People of Coal Country. They Love Him Anyway.,Stephanie Mencimer,https://www.motherjones.com/politics/2026/02/trump-coal-country-grundy-rural-appalachia-virginia/
Meet the Mastermind Behind Trump’s Definition of “Woman”,Madison Pauly,https://www.motherjones.com/politics/2026/02/trump-anti-trans-may-mailman-sports-ban-womens-bill-of-rights-terf/
One Protest After Another,Rian Dundon,https://www.motherjones.com/politics/2026/02/portland-ice-protest-photos-dundon/
Michigan Lawsuit Calls Big Oil a “Cartel” That’s Driving High Energy Bills,Dharna Noor,https://www.motherjones.com/politics/2026/02/michigan-lawsuit-big-oil-cartel-high-energy-bills-climate-crisis-accountability/
Illinois Representative Asks God to Get Trump to “Do What Is Right”,Katie Herchenroeder,https://www.motherjones.com/politics/2026/02/illinois-representative-asks-god-to-get-trump-to-do-what-is-right/
Federal Judge Calls Out the Racism of Trump Admin’s Plan to End TPS for Haitians,Alex Nguyen,https://www.motherjones.com/politics/2026/02/temporary-protected-status-kristi-noem-ana-reyes-ruling/
Snowstorms Are Hell for Wheelchair Users—But They Don’t Have to Be,Julia Métraux,https://www.motherjones.com/politics/2026/02/winter-storm-snow-mobility-wheelchair-infrastructure/
Donald Trump’s Plan to Be King of the World,"February 4, 2026",https://www.motherjones.com/politics/2026/02/donald-trump-board-of-peace-gaza-israel-davos-china-russia-scam-king/
Is This a Police State?,"January 28, 2026",https://www.motherjones.com/politics/2026/01/police-state-minneapolis-donald-trump-stephen-miller-alex-pretti-renee-good/
The List of Impeachable Offenses Keeps Growing,"January 22, 2026",https://www.motherjones.com/politics/2026/01/donald-trump-impeach-abuse-power-richard-nixon/
,,https://www.motherjones.com/politics/2026/02/minneapolis-minnesota-ice-dhs-postal-service-sean-sherman-protest-resistance/
,,https://www.motherjones.com/politics/2026/02/pablo-torre-steve-ballmer-bad-bunny-billionaires-sports-riley-gaines/
,,https://www.motherjones.com/politics/2026/01/local-news-doge-solar-power-immigration-idaho-jacksonville-florida-tribal-nations/
,,https://www.motherjones.com/politics/2026/01/rob-schenck-religious-right-immigration-minneapolis-minnesota-christian-nationalism/
"Drive Racists Out of Public Life Forever, and Other Lessons From Black History",Chasity Hale,https://www.motherjones.com/politics/2026/02/brian-jones-black-history-month-everyone/
Editor’s Note,Mother Jones,https://www.motherjones.com/politics/2026/02/memphis-story-editors-note/
The US Government Is Trying to Make Coal Cute. It Isn’t.,Kate Yoder,https://www.motherjones.com/politics/2026/02/trump-administration-interior-doug-burgum-mascot-coalie-ridicule/
Something Unexpected Is Happening With Norway’s Polar Bears,Benji Jones,https://www.motherjones.com/politics/2026/02/norway-svalbard-polar-bears-research-climate-change-adaptation-health/
How to Get Away With Anything,Melissa Lewis and Daniel Moattar,https://www.motherjones.com/politics/2026/02/trump-pardons-2025-january-6-fraud/
Federal Prosecutors in Minnesota Are “Demoralized and Pissed”,Samantha Michaels,https://www.motherjones.com/politics/2026/01/trump-us-attorneys-office-minnesota-prosecutors-resignations-ice-protesters-evidence-don-lemon/
Trump’s Latest Visa “Pause” Targets 75 Countries He Thinks Are Lazy,Julia Métraux,https://www.motherjones.com/politics/2026/01/trump-public-charge-visa-ban-immigration/
One on One With Trump’s Black MAGA Pastor,Reveal,https://www.motherjones.com/politics/2025/12/https-revealnews-org-podcast-maga-black-pastor-racism-trump-christianity-lorenzo-sewell/
How Sports Became a Battleground Over Trans Rights,Reveal,https://www.motherjones.com/politics/2026/01/transgender-athletes-bans-womens-girls-sports-riley-gaines/
Supreme Court Battle Over Trans Athletes Is About So Much More Than Sports,Madison Pauly,https://www.motherjones.com/politics/2026/01/supreme-court-trans-athletes-west-virginia-riley-gaines-idaho-equal-protection/
Josh Hawley Asked “Can Men Get Pregnant?” 11 Times at Abortion Hearing,Katie Herchenroeder,https://www.motherjones.com/politics/2026/01/josh-hawley-asked-can-men-get-pregnant-11-times-at-abortion-hearing/
RFK Jr. Could Defund Your Hospital if He Doesn’t Get His Way on Trans Health Care,Katie Herchenroeder and Julia Métraux,https://www.motherjones.com/politics/2025/12/rfk-trans-youth-health-care/
,,https://www.motherjones.com/politics/2025/12/memphis-safe-task-force-trump-ice-crime-immigration-mass-deportations-287g/
,,https://www.motherjones.com/politics/2025/12/your-private-data-is-building-trumps-voter-purge-machine/
,,https://www.motherjones.com/politics/2026/01/omni-ice-deportations-charter-flight-stonepeak-private-equity/
,,https://www.motherjones.com/politics/2026/01/trump-violence-assassinations-mass-shootings-ice-lies/
Minneapolis Is the Violent Reckoning the Gun Rights Movement Has Long Wanted,Mike Spies,https://www.motherjones.com/politics/2026/02/minneapolis-ice-cbp-nra-alex-pretti-renee-good-guns-second-amendment/
"No, Antidepressants Do Not Cause Mass Shootings",Mark Follman,https://www.motherjones.com/politics/2026/01/mass-shootings-antidepressants-rfk-conspiracy-theory/
Arizona Governor Moves to Rein in Groundwater-Guzzling Saudi Megafarms,Nate Halverson,https://www.motherjones.com/politics/2026/01/arizona-governor-katie-hobbs-groundwater-saudi-alfalfa-exports-farming-almari-vicksburg-la-paz-county-fondomonte-lawsuit/
RFK Jr.’s Proteinaceous Food Pyramid Is a Land Hog and a Climate Disaster,Oliver Milman,https://www.motherjones.com/politics/2026/01/rfk-jr-food-pyramid-meat-dairy-protein-increase-agricultural-land-climate-emissions/
"Hey Jon Stewart, Jokes About Wearing Masks Aren’t Funny",Julia Métraux,https://www.motherjones.com/politics/2025/12/hey-jon-stewart-jokes-about-wearing-masks-arent-funny/
Welcome to the New Era of Covid Vaccine Tourism,Julia Métraux,https://www.motherjones.com/politics/2025/09/covid-vaccine-state-tourism-acip-rfk/
What Democrats Need to Know to Truly Reform ICE,Garrett Graff,https://www.motherjones.com/politics/2026/02/democrats-dhs-ice-reform-graff-cbp/
The Power of Mocking Trump’s Pathetic Monsters,Anna Merlan,https://www.motherjones.com/politics/2026/02/greg-bovino-humor-mockery-pathetic/
