title,byline,url
He Trains Cops in “Witching” To Help Find Corpses. Experts Are Alarmed.,Rene Ebersole,https://www.motherjones.com/crime-justice/2022/03/national-forensic-academy-police-training-dowsing-witching-arpad-vass/
He Trains Cops in “Witching” To Help Find Corpses. Experts Are Alarmed.,Rene Ebersole,https://www.motherjones.com/crime-justice/2022/03/national-forensic-academy-police-training-dowsing-witching-arpad-vass/
Texas’ Anti-Trans Crusade Is Spreading,Samantha Michaels,https://www.motherjones.com/politics/2022/03/alabama-transgender-medical-care-ban-texas-abbott-arkansas-idaho-teenagers-puberty-blockers-hormone-therapy/
"Australian Firm Claims “Giant Leap” Toward Clean, Cheap Hydrogen Power",Peter Hannam,https://www.motherjones.com/environment/2022/03/australian-firm-hysata-claims-giant-leap-clean-cheap-hydrogen-power-electrolysis/
"Bill O’Reilly Defends Tucker Carlson—and Makes One Big, Embarrassing Mistake",David Corn,https://www.motherjones.com/politics/2022/03/bill-oreilly-defends-tucker-carlson-and-makes-one-big-embarrassing-mistake/
Has Ukraine “Won the Information War”? Not So Fast.,Ali Breland,https://www.motherjones.com/politics/2022/03/ukraine-information-war-nick-fuentes/
Politics As Usual May Sound Nicer Than Trumpism. But It’s Still Killing the Planet.,Pema Levy,https://www.motherjones.com/politics/2022/03/sarah-bloom-raskin-federal-reserve/
It’s a Big Deal that the Fed Raised Interest Rates Today,Jacob Rosenberg,https://www.motherjones.com/mojo-wire/2022/03/fed-interest-rates-powell-jerome-austerity-inflation/
"Amid Union Drive, Howard Schultz Is Back in Charge of Starbucks",Noah Lanard,https://www.motherjones.com/politics/2022/03/starbucks-schultz-howard-union-drive-ceo/
"Invoking Pearl Harbor and 9/11, Zelenskyy Issues Extraordinary Plea for Help",Noah Y. Kim,https://www.motherjones.com/politics/2022/03/zelenskyy-congress-address-biden-russia-invasion-ukraine/
British Aristocrats Blamed for Scuttling Proposed Trophy Hunting Ban,Helena Horton,https://www.motherjones.com/environment/2022/03/british-aristocrats-wealthy-peers-blamed-killing-trophy-hunting-ban/
,,https://www.motherjones.com/mojo-wire/2022/03/donald-trump-talked-about-his-true-enemy-when-asked-about-russias-invasion-of-ukraine-windmills/
,,https://www.motherjones.com/politics/2022/03/john-bolton-donald-trump-ukraine-russia-putin/
,,https://www.motherjones.com/politics/2022/03/no-that-putin-video-didnt-use-a-green-screen-misinformation/
We’re Actually Getting Close to Year-Round Daylight Saving Time,Abigail Weinberg,https://www.motherjones.com/mojo-wire/2022/03/senate-passes-daylight-saving-time-this-is-great/
Team That Owes Most of Its Success to a Russian Oligarch Now Wants Other Teams to Be Punished For It,Dan Spinelli,https://www.motherjones.com/mojo-wire/2022/03/abramovich-russia-oligarch-chelsea-middlesborough/
Barack Obama has Covid,Jackie Flynn Mogensen,https://www.motherjones.com/mojo-wire/2022/03/barack-obama-has-covid/
"Yeah, I’m Gonna Need You to Go Ahead and Celebrate Michael Boltons’ Birthdays",Daniel King,https://www.motherjones.com/recharge/2022/02/office-space-michael-bolton-assclown-david-herman-birthday/
"50 Years After Recording “No Knock,” Gil Scott-Heron’s Protest Song Contains a Prescription",Daniel King,https://www.motherjones.com/recharge/2022/02/no-knock-police-killings-amir-locke-song-gil-scott-heron/
"Politics Is Fun, Actually: City Council Edition",Lil Kalish,https://www.motherjones.com/recharge/2022/01/politics-is-fun-actually-city-council-edition/
Top Putin Propagandist Says the Ukraine War Is Just the Beginning,David Corn,https://www.motherjones.com/politics/2022/03/top-putin-propagandist-says-the-ukraine-war-is-just-the-beginning/
China’s State Media Propagandists Are Pushing Putin Talking Points,Dan Spinelli,https://www.motherjones.com/politics/2022/03/putin-china-xi-jinping-propaganda/
5G Expansion Could Send Weather Forecasting Back to the 1970s,Chad Small,https://www.motherjones.com/environment/2022/03/5g-expansion-interfere-weather-prediction-hurricane-tracking-noaacould-take-weather-forecasting-back-to-the-1970/
The Plastics Industry Says It Has a Clever Solution to the Plastics Crisis,Tim Wogan,https://www.motherjones.com/environment/2022/03/weve-got-a-plastic-problem-will-chemical-recycling-solve-it/
Florida Advised Against Covid Vaccines for Kids. This Pediatrician Is Appalled.,Kiera Butler,https://www.motherjones.com/politics/2022/03/florida-advised-against-covid-vaccines-for-kids-this-pediatrician-is-appalled/
"Florida, Unlike the CDC, Says Healthy Kids Shouldn’t Get the Covid Vaccine",Abigail Weinberg,https://www.motherjones.com/mojo-wire/2022/03/florida-unlike-the-cdc-says-healthy-kids-shouldnt-get-the-covid-vaccine/
The Bloody Secret Behind Lab-Grown Meat,Tom Philpott,https://www.motherjones.com/environment/2022/03/lab-meat-fetal-bovine-serum-blood-slaughter-cultured/
Climate Change Is Already Taking a Big Bite Out of Our Food Supply,Tom Philpott,https://www.motherjones.com/food/2022/03/ipcc-report-climate-crops-oceans-farmland-united-nations-greenhouse-gas-emissions/
How the Mainstream Movement Against Gender-Based Violence Fails Black Workers and Survivors,Madison Pauly,https://www.motherjones.com/crime-justice/2022/03/racism-domestic-violence-sexual-assault-movement-anti-me-too-black/
Derek Chauvin’s Colleagues Found Guilty of Violating George Floyd’s Civil Rights,Samantha Michaels,https://www.motherjones.com/crime-justice/2022/02/george-floyd-verdict-derek-chauvin-fellow-minneapolis-officers-guilty-violating-civil-rights/
Ukrainian Refugees Are Being Embraced by Europe. Why Weren’t Syrians?,Isabela Dias,https://www.motherjones.com/politics/2022/03/ukrainian-refugees-are-being-embraced-by-europe-why-werent-syrians/
Democratic Senators Also Don’t Get Why Biden Is Still Using a Cruel Trump-Era Border Policy,Fernanda Echavarri,https://www.motherjones.com/politics/2022/03/democratic-senators-schumer-menendez-biden-end-title-42/
,,https://www.motherjones.com/politics/2022/03/ukraine-russia-war-anti-putin-protest-movement/
,,https://www.motherjones.com/politics/2022/03/bannon-milo-and-other-right-wing-activists-are-hellbent-on-transforming-the-catholic-church/
,,https://www.motherjones.com/politics/2022/03/ukraine-russia-war-anti-putin-protest-movement/
,,https://www.motherjones.com/politics/2022/03/pushback-greece-lesbos-refugees-asylum-seekers-ukraine/
January 6 Reckoning: CNN’s Jake Tapper Says the Media Must Confront Republicans’ Big Lie,Abigail Weinberg,https://www.motherjones.com/media/2021/07/january-6-insurrection-capitol-cnn-jake-tapper-podcast/
We Need to Understand How We Got to January 6 Before We Can Move Forward,Fernanda Echavarri,https://www.motherjones.com/politics/2021/06/podcast-january-6-qanon-history-whats-next/
A Radical Idea for Forcing Vaccine Companies to Share Knowledge With the World,Molly Schwartz and Jamilah King,https://www.motherjones.com/politics/2021/05/vaccine-patents-biden-covid-india-dean-baker-pandemic/
,,https://podcasts.apple.com/us/podcast/the-mother-jones-podcast/id1386408605
