title,byline,url
"An Appalling Moment, Even by Fox News’ Standards",Abigail Weinberg,https://www.motherjones.com/politics/2023/06/trump-arrest-fox-news-chyron/
"An Appalling Moment, Even by Fox News’ Standards",Abigail Weinberg,https://www.motherjones.com/politics/2023/06/trump-arrest-fox-news-chyron/
"Donald Trump Arrested, Again",Inae Oh,https://www.motherjones.com/politics/2023/06/donald-trump-arrested-again/
These Western Cities Are Turning to “Extreme” Water Recycling,Jim Robbins,https://www.motherjones.com/environment/2023/06/cities-graywater-recycling-movement-san-francisco/
What to Know Before Donald Trump Surrenders to Federal Charges,Inae Oh,https://www.motherjones.com/mojo-wire/2023/06/donald-trump-florida-surrender/
The Trump Indictment: Another Sign the GOP Is Addicted to Trump,David Corn,https://www.motherjones.com/politics/2023/06/the-trump-indictment-another-sign-the-gop-is-addicted-to-trump/
Nobody Wants to Be Trump’s Lawyer…Again,Arianna Coghill,https://www.motherjones.com/mojo-wire/2023/06/nobody-wants-to-be-trumps-lawyeragain/
The Koch-Funded Group Undermining US Clean Energy Goals,Oliver Milman and Dharna Noor,https://www.motherjones.com/politics/2023/06/texas-public-policy-foundation-charles-koch-climate-clean-energy-fossil-fuels/
"Left Out of Pat Robertson’s Obits: His Crazy, Antisemitic Conspiracy Theory",David Corn,https://www.motherjones.com/politics/2023/06/left-out-of-pat-robertsons-obits-his-crazy-antisemitic-conspiracy-theory/
The GOP’s “But Her Emails” Crowd Has Had No Problem Defending Trump Over Classified Docs,Chance Townsend,https://www.motherjones.com/politics/2023/06/donald-trump-indictment-gop-comments-desantis-pence-cruz-scott-gaetz-mccarthy/
"Trump’s AG: “If Even Half of It Is True, He’s Toast”",Stephanie Mencimer,https://www.motherjones.com/politics/2023/06/bill-barr-donald-trump-classified-documents-indictment-damning/
,,https://www.motherjones.com/media/2023/05/halle-bailey-ariel-little-mermaid-backlash-ebony-elizabeth-thomas-interview/
,,https://www.motherjones.com/politics/2023/05/ron-desantis-laws/
,,https://www.motherjones.com/politics/2023/05/video-clarence-thomas-scandals-harlan-crow-billionaire-black-nationalism/
Today in Weird Campaign News: Trump Rips Off Matt Damon for New Ad,Arianna Coghill,https://www.motherjones.com/media/2023/06/matt-damon-ben-affleck-air-movie-trump-truth-ad/
“Unabomber” Ted Kaczynski Found Dead in Federal Prison at 81,Arianna Coghill,https://www.motherjones.com/crime-justice/2023/06/unabomber-ted-kaczynski-dead-federal-prison-81/
Read the 49-Page Trump Classified Documents Indictment,Abigail Weinberg,https://www.motherjones.com/mojo-wire/2023/06/read-the-49-page-trump-classified-documents-indictment/
Experiencing Space Flight Just Got a Lot More Accessible,Daniel King,https://www.motherjones.com/recharge/2022/12/space-flight-portal/
"Remembering George Pérez, a Superhero of Superhero Comics",Dan Spinelli,https://www.motherjones.com/recharge/2022/05/remembering-george-perez-a-superhero-of-superhero-comics/
Ukrainian and Russian Dancers Join Onstage (in Italy) to Fundraise for the Red Cross,Daniel King,https://www.motherjones.com/recharge/2022/04/ukrainian-russian-antiwar-ballet-dancers-for-peace/
Sen. Thom Tillis Supported Same-Sex Marriage and Red Flag Laws. North Carolina’s GOP Censured Him.,Stephanie Mencimer,https://www.motherjones.com/politics/2023/06/sen-thom-tillis-censured-north-carolina-gop/
Section of I-95 Collapses Near Philadelphia,Stephanie Mencimer,https://www.motherjones.com/politics/2023/06/section-of-i-95-collapses-near-philadelphia/
California Legislation Would Force Corporate Polluters to Come Clean,Max Graham,https://www.motherjones.com/environment/2023/06/california-bill-climate-corporate-data-accountability-supply-chain-carbon-emissions/
Air Monitoring Stations May Have Amassed a DNA “Treasure Trove”,Matt Simon,https://www.motherjones.com/environment/2023/06/animal-dna-conservation-research-air-monitoring-stations/
Bolsonaro Allegedly Falsified His Vaccination Status to Enter the US,Isabela Dias,https://www.motherjones.com/politics/2023/05/bolsonaro-allegedly-falsified-his-vaccination-status-to-enter-the-us/
The Coming Tidal Wave of Right Wing Covid Lawsuits,Kiera Butler,https://www.motherjones.com/politics/2023/04/the-coming-tidal-wave-of-right-wing-covid-lawsuits/
Bison Meat Is Hot. Ranchers Are Struggling to Keep Up.,Lela Nargi,https://www.motherjones.com/environment/2023/05/bison-meat-is-hot-ranchers-are-struggling-to-keep-up/
One Simple Way to Slash Methane Pollution: Composting,Max Graham,https://www.motherjones.com/environment/2023/05/methane-emissions-reduction-landfill-composting-study/
Atlanta City Council Approves Funding for “Cop City”,Arianna Coghill,https://www.motherjones.com/crime-justice/2023/06/atlanta-cop-city-vote/
"Tennessee’s Ban on Drag Shows Is Unconstitutional, Judge Rules",Pema Levy,https://www.motherjones.com/politics/2023/06/tennessee-law-ban-drag-shows-ruled-unconstitutional/
Eric Adams Is Bringing the GOP’s Anti-Immigrant Crusade to New York,Isabela Dias,https://www.motherjones.com/politics/2023/06/eric-adams-is-bringing-the-gops-anti-immigrant-crusade-to-new-york/
Ron DeSantis Can’t Stop Smearing Asylum Seekers,Tim Murphy,https://www.motherjones.com/politics/2023/05/ron-desantis-cant-stop-smearing-asylum-seekers/
,,https://www.motherjones.com/politics/2023/06/pajaro-rebuild-flooding-fema/
,,https://www.motherjones.com/politics/2023/05/student-loan-debt-cancellation-supreme-court-jessica-madison-collective/
,,https://www.motherjones.com/politics/2023/03/anti-trans-transgender-health-care-ban-legislation-bill-minors-children-lgbtq/
,,https://www.motherjones.com/crime-justice/2023/03/who-killed-rasheem-carter/
"Why We Can Imagine Singing Fish, But Not Black Mermaids",Arianna Coghill and Sam Van Pykeren,https://www.motherjones.com/media/2023/05/halle-bailey-ariel-little-mermaid-backlash-ebony-elizabeth-thomas-interview/
NAACP Warns Black People Against Traveling to Ron DeSantis’ Florida,Arianna Coghill,https://www.motherjones.com/mojo-wire/2023/05/naacp-warns-black-people-from-traveling-to-ron-desantis-florida/
Daniel Penny Claims He Can’t Be Racist Because He Planned a Trip to Africa,Arianna Coghill,https://www.motherjones.com/crime-justice/2023/05/daniel-penny-trip-to-africa-racism/
She Filmed a Teacher Saying the N-Word. Then She Got Suspended For It.,Arianna Coghill,https://www.motherjones.com/crime-justice/2023/05/mary-walton-missouri-n-word-suspended/
