title,byline,url
Trump’s Primetime Speech Was a Dud. He Could Still Use it to Interfere in the Midterms.,Ari Berman,https://www.motherjones.com/politics/2026/07/trump-election-security-speech-china-national-emergency-declaration/
Trump’s Primetime Speech Was a Dud. He Could Still Use it to Interfere in the Midterms.,Ari Berman,https://www.motherjones.com/politics/2026/07/trump-election-security-speech-china-national-emergency-declaration/
ICE and DHS’s Growing Record of Deception,David Corn,https://www.motherjones.com/politics/2026/07/ice-dhs-shootings-deception-lies-lorenzo-salgado-araujo-joan-seastian-guerrero/
Trump’s Election Security Speech: A Good Night for Putin,David Corn,https://www.motherjones.com/politics/2026/07/trump-election-security-speech-a-good-night-for-putin-russia-china/
ICE Contractor Arrested For Shooting Protester,Alex Nguyen,https://www.motherjones.com/politics/2026/07/ice-geo-group-protest-shooting-employee-arrest-colorado-aurora/
What ICE Didn’t Say About Its Latest Killing,Noah Lanard and Sophie Hurwitz,https://www.motherjones.com/politics/2026/07/ice-killing-statement-duran-guerrero-salgado-dhs-pretti-good/
"As America Baked, Team Trump Axed More Than 1,600 Energy Efficiency Web Pages",Amy Qin and Flávio Pessoa,https://www.motherjones.com/politics/2026/07/heat-wave-trump-department-energy-removed-energy-efficiency-utility-savings-web-pages/
Trump’s Deportation Policing Force Is Killing People. It Was “Foreseeable In the Most Tragic Way.”,Isabela Dias,https://www.motherjones.com/politics/2026/07/trumps-deportation-policing-force-is-killing-people-it-was-foreseeable-in-the-most-tragic-way/
,,https://www.motherjones.com/politics/2026/07/the-venice-biennales-us-pavilion-was-supposed-to-say-something-about-america-it-didnt-and-thats-the-point/
,,https://www.motherjones.com/politics/2026/07/biddeford-maine-joan-sebastian-duran-guerrero-ice-shooting-protest-video/
,,https://www.motherjones.com/politics/2026/07/dhs-corecivic-california-oversight-otay-mesa/
,,https://www.motherjones.com/politics/2026/07/world-cup-soccer-us-belgium-balogun-red-card-trump-fifa-infantino/
The Only Research Center For Disabled Parents Is Losing Federal Funding,Julia Métraux,https://www.motherjones.com/politics/2026/07/brandeis-hhs-omb-research-grant-parents-disabilities-funding/
The Election Denier Ecosystem Has a New Symbol Named Spencer Pratt,Anna Merlan,https://www.motherjones.com/politics/2026/07/the-election-denier-ecosystem-has-a-new-symbol-named-spencer-pratt/
Todd Blanche Just Opened the Door to a National Abortion Ban,Garnet Henderson and Susan Rinkunas,https://www.motherjones.com/politics/2026/07/todd-blanche-just-opened-the-door-to-a-national-abortion-ban/
"Indiana, ICE and the Destruction of Immigrant Families",Greg Constantine,https://www.motherjones.com/politics/2026/07/indiana-ice-and-the-destruction-of-immigrant-families/
Moms of Black Babies More Likely to Be Flagged to Police Over Alleged Pregnancy Drug Use,Shoshana Walter,https://www.motherjones.com/criminal-justice/2026/07/false-positives-black-women-alleged-pregnancy-drug-use/
ICE Won’t Change Under Trump,Alex Nguyen,https://www.motherjones.com/politics/2026/07/ice-trump-car-stops-lorenzo-salgado-araujo/
Colombian Man in Maine Reportedly Killed by ICE Agents,Noah Lanard and Sophie Hurwitz,https://www.motherjones.com/politics/2026/07/colombian-immigrant-maine-ice-shooting/
Lawsuit Accuses ICE and Private Prison Contractors of Abusing a Disabled Detainee,Julia Métraux,https://www.motherjones.com/politics/2026/07/ulises-pena-lopez-ice-lawsuit-disabled/
The Most Extreme GOP Candidate in the Nation,"July 15, 2026",https://www.motherjones.com/politics/2026/07/victor-marx-colorado-governor-candidate-republican-gop-extreme-murder/
Trump and Iran: Stupid Is As Stupid Does,"June 19, 2026",https://www.motherjones.com/politics/2026/06/donald-trump-iran-war-deal-mou-hormuz-nuclear-weapons/
Elon Musk: The World’s Worst Trillionaire,"June 17, 2026",https://www.motherjones.com/politics/2026/06/elon-musk-world-worst-trillionaire-spacex-tesla-trump-usaid-doge/
,,https://www.motherjones.com/politics/2026/07/sam-bankman-fried-ftx-collapse-part-2-update-2026/
,,https://www.motherjones.com/politics/2026/07/openai-chatgpt-sam-altman-artificial-intelligence-karen-hao-2026/
,,https://www.motherjones.com/politics/2026/07/sam-bankman-fried-ftx-collapse-part-1-update-2026/
,,https://www.motherjones.com/politics/2026/07/jodi-kantor-shadow-docket-supreme-court-john-roberts/
How Life Got Better For LA’s World Cup Workers,Alex Nguyen,https://www.motherjones.com/politics/2026/07/how-life-got-better-for-las-world-cup-workers/
The Manosphere and Christian Nationalist Roots of Hegseth’s “Low-T” Fixation,Kiera Butler,https://www.motherjones.com/politics/2026/07/the-manosphere-and-christian-nationalist-roots-of-hegseths-low-t-fixation/
Coloradans to Vote on Whether They Have a “Right to Natural Gas”,Maya McDaniel,https://www.motherjones.com/politics/2026/07/colorado-ballot-measure-right-natural-gas-conservative-building-codes-electrification/
"Nation’s Biggest Public Utility Just Doubled Down on Coal, Gas, and Nuclear",Katie Myers,https://www.motherjones.com/politics/2026/07/tennessee-valley-authority-public-utility-coal-gas-nuclear-power/
Trump Told Prosecutors to Target ICE Protesters. A Chicago Jury Wasn’t Buying It.,Sophie Hurwitz,https://www.motherjones.com/politics/2026/06/a-chicago-grand-jury-wasnt-buying-the-case-against-ice-protesters/
Greg Bovino Keeps Posting to Get His Job Back. No One Is Listening.,Sophie Hurwitz,https://www.motherjones.com/politics/2026/05/greg-bovino-ice-delaney-hall-posts/
What Author and Poet Victoria Chang Learned From Trees,Jeffrey Kelly,https://www.motherjones.com/environment/2026/07/victoria-chang-tree-of-knowledge/
Why America at 250 Still Cannot Face Slavery,Reveal,https://www.motherjones.com/politics/2026/07/montgomery-alabama-slavery-bryan-stevenson-equal-justice-initiative-america-250/
"Me, Myself, and IUDs",Julia Lurie,https://www.motherjones.com/politics/2026/07/hormonal-birth-control-iuds-depression-anxiety-mental-health-tiktok/
The Democratic Party Failed Us With Graham Platner,Alex Nguyen,https://www.motherjones.com/politics/2026/07/the-democratic-party-failed-us-with-graham-platner/
The Supreme Court’s Trans Athlete Ruling Is a Threat to Gender Equality,Madison Pauly,https://www.motherjones.com/politics/2026/06/trans-sports-scotus-athletes-gender-equality-brett-kavanaugh/
"Prosecutors Can’t Demand New York Trans Kids’ Medical Records, Judge Says",Sophie Hurwitz,https://www.motherjones.com/politics/2026/06/new-york-trans-kids-medical-records-ruling/
,,https://www.motherjones.com/politics/2026/06/supreme-court-amicus-briefs-investigation/
,,https://www.motherjones.com/media/2026/05/johnny-appleseed-john-chapman-booze-cider-walking-trails-american-revolution-apples-swedenborg/
,,https://www.motherjones.com/politics/2026/02/immigrant-ice-raid-nashville-tennessee-highway-patrol-state-police-287g-republicans/
,,https://www.motherjones.com/politics/2026/02/coeur-dalene-cda-idaho-donald-trump-kootenai-county-republicans/
ICE Keeps Using the Same Justification for Killing Drivers,Sophie Hurwitz,https://www.motherjones.com/politics/2026/07/ice-houston-lorenzo-salgado-araujo-renee-good-killed/
Trump’s Justice Department Is Suing Cities and States to Dismantle Gun Laws,Jennifer Mascia for the Trace,https://www.motherjones.com/politics/2026/06/justice-department-civil-right-division-second-amendment-section/
“Huge Wave” of Carbon Storage Projects Sets off Alarms in Rural Indiana,Erin McCormick,https://www.motherjones.com/environment/2026/07/carbon-capture-storage-projects-rural-clymers-indiana-opposition-risks-health-environment/
“Save Our Bacon” Act Would Bar States From Regulating Factory Farm Cruelty,Frida Garza,https://www.motherjones.com/politics/2026/06/save-bacon-act-factory-farms-cruelty-extreme-confinement-animal-rights-meat-sustainability/
Lawsuit: Meta Used AI For Discriminatory Layoffs,Alex Nguyen,https://www.motherjones.com/politics/2026/07/meta-lawsuit-ai-layoffs-medical-leave-disability-tech-termination/
Polio Made Mitch McConnell MAHA’s Enemy,Julia Métraux,https://www.motherjones.com/politics/2026/07/mitch-mcconnell-polio-vaccine-rfk-trump-illness-senate-disability/
A Haitian Republican Pastor and the Conservative Movement Letting Him Down,Artis Curiskis,https://www.motherjones.com/politics/2026/07/haitian-republican-conservative-movement-tps-supreme-court/
What Trump’s Proposal to Ban Pregnant Tourists Could Look Like,Inae Oh,https://www.motherjones.com/politics/2026/07/trump-ban-pregnant-foreigners-birth-tourism/
