title,byline,url
I Can’t Stop Thinking About the Thin Blue Line Flags in the January 6 Video,Tim Murphy,https://www.motherjones.com/politics/2022/06/i-cant-stop-thinking-about-the-thin-blue-line-flags-in-the-january-6-video/
I Can’t Stop Thinking About the Thin Blue Line Flags in the January 6 Video,Tim Murphy,https://www.motherjones.com/politics/2022/06/i-cant-stop-thinking-about-the-thin-blue-line-flags-in-the-january-6-video/
Denver Deployed Mental Health Workers Instead of Police—and Some Crimes Went Down,Samantha Michaels,https://www.motherjones.com/crime-justice/2022/06/denver-deployed-mental-health-workers-instead-of-police-and-some-crimes-went-down/
One Woman’s Quest to Sow Sustainable Farms,Marc Fawcett-Atkinson,https://www.motherjones.com/environment/2022/06/canada-small-farms-sustainable-seeds-seedchange/
“I Was Slipping in People’s Blood”,Noah Y. Kim,https://www.motherjones.com/politics/2022/06/capitol-police-caroline-edwards-january-6-committee-hearings/
The January 6 Committee’s Battle for Reality,David Corn,https://www.motherjones.com/politics/2022/06/january-6-committee-hearing-battle-for-reality/
How Tesla Is the Fake Meat of Cars,Tom Philpott,https://www.motherjones.com/food/2022/06/elon-musk-tesla-beyond-burger-silicon-valley-hype-climate-change/
"Ed Yong Would Like America to Have a Bit More Empathy, Please",Jackie Flynn Mogensen,https://www.motherjones.com/politics/2022/06/ed-yong-an-immense-world-animals-catfish-sea-turtles-ants-corgis-covid/
January 6 Committee Opens With a Narrative MasterClass,Clara Jeffery,https://www.motherjones.com/politics/2022/06/january-6-committee-narrative-production-storytelling/
Cheney: Trump Said Capitol Attackers “Were Doing What They Should Be Doing”,Dan Friedman,https://www.motherjones.com/politics/2022/06/cheney-trump-said-capitol-attackers-were-doing-what-they-should-be-doing/
“You Do Not Want to Be Assigned to a Location Which Is Hostile to Your Existence”,Sonner Kehrt,https://www.motherjones.com/politics/2022/06/lgbtq-military-discrimination-state-laws/
,,https://www.motherjones.com/mojo-wire/2022/06/star-wars-nerds-black-actress-moses-ingram/
,,https://www.motherjones.com/mojo-wire/2022/05/it-was-the-wrong-decision-period/
,,https://www.motherjones.com/crime-justice/2022/05/beto-orourke-was-right/
Colorado to Investigate Lauren Boebert for Alleged Misuse of Campaign Funds,Abigail Weinberg,https://www.motherjones.com/mojo-wire/2022/06/colorado-lauren-boebert-campaign-funds-investigation/
Jared and Ivanka Knew Trump Was a Loser. But Don’t Believe This Rehab Job.,Inae Oh,https://www.motherjones.com/mojo-wire/2022/06/jared-kushner-ivanka-trump-election-fraud-january-6-committe-hearings/
Uvalde Community Calls for Gun Control in Heartbreaking Hearing,Abigail Weinberg,https://www.motherjones.com/mojo-wire/2022/06/uvalde-gun-control-hearing-roy-guerrero-kimberly-rubio-miah-cerrillo/
"Remembering George Pérez, a Superhero of Superhero Comics",Dan Spinelli,https://www.motherjones.com/recharge/2022/05/remembering-george-perez-a-superhero-of-superhero-comics/
Ukrainian and Russian Dancers Join Onstage (in Italy) to Fundraise for the Red Cross,Daniel King,https://www.motherjones.com/recharge/2022/04/ukrainian-russian-antiwar-ballet-dancers-for-peace/
"Mass Shootings Persist, But a New Book Brings Hope and Science to Grappling With Their Prevention",Daniel King,https://www.motherjones.com/recharge/2022/04/mass-shooting-prevention-trigger-points/
“Superspreaders” Are Dragging Climate Conspiracies Into the Culture Wars,Matthew Taylor,https://www.motherjones.com/politics/2022/06/super-spreaders-climate-conspiracies-misinformation-culture-wars/
"World’s Plodding Embrace of Efficiency Is “Inexplicable,” Says Global Energy Chief",Damian Carrington,https://www.motherjones.com/politics/2022/06/slow-adoption-energy-efficiency-inexplicable-iea-faith-birol/
Will Nebraska Build a $500 Million Canal Just to Own the Libs?,Jake Bittle,https://www.motherjones.com/politics/2022/06/nebraska-south-platte-river-canal-colorado/
"UK Thieves Are Pilfering, and Threatening, Rare Wild Orchids",Helena Horton,https://www.motherjones.com/environment/2022/06/uk-wild-orchid-thefts-biodiversity/
How American Influencers Built a World Wide Web of Vaccine Disinformation,Kiera Butler and Neha Wadekar,https://www.motherjones.com/politics/2022/06/how-american-influencers-built-a-world-wide-web-of-vaccine-disinformation/
Monkeypox Disinfo Is Just Like Covid Disinfo—Plus Homophobia,Kiera Butler,https://www.motherjones.com/politics/2022/05/monkeypox-disinfo-is-just-like-covid-disinfo-plus-homophobia/
Russia’s War Created a Global Hunger Disaster. Climate Change Is Ramping It Up.,Tom Philpott,https://www.motherjones.com/food/2022/06/russia-war-global-hunger-crisis-united-nations-wheat-shortage-climate-change/
The FDA Is Coming for Your Almond Milk,Tom Philpott,https://www.motherjones.com/food/2022/05/oat-milk-almond-milk-dairy-lobby-fda-labeling-plant-based/
The Assassination Plot Against Brett Kavanaugh Is a National Emergency,Jeremy Schulman,https://www.motherjones.com/crime-justice/2022/06/the-assassination-plot-against-brett-kavanaugh-is-a-national-emergency/
The Most Shocking New Statistic on Mass Shootings,Mark Follman,https://www.motherjones.com/politics/2022/06/mass-shootings-public-opinion-polls-gun-laws-shocking-carnage/
“This Is Not Our First Rodeo”: Key Border Cities Say They’re Ready for the End of Title 42,Fernanda Echavarri,https://www.motherjones.com/politics/2022/05/end-title-42-border-preparation-tucson-san-diego/
May Day Marches Highlight Essential Immigrant Labor and Rising Frustration With Biden,Fernanda Echavarri,https://www.motherjones.com/politics/2022/05/may-day-immigrant-labor-marches-biden/
,,https://www.motherjones.com/politics/2022/06/texas-clinics-abortion-ban-pivot-services-travel/
,,https://www.motherjones.com/politics/2022/05/golden-gate-village-affordable-housing-marin-city-bay-area-cooperative/
,,https://www.motherjones.com/politics/2022/05/private-equity-apollo-blackstone-kkr-carlyle-carried-interest-loophole/
,,https://www.motherjones.com/politics/2022/04/hunter-biden-laptop-guo-wengui-bannon-giuliani/
January 6 Reckoning: CNN’s Jake Tapper Says the Media Must Confront Republicans’ Big Lie,Abigail Weinberg,https://www.motherjones.com/media/2021/07/january-6-insurrection-capitol-cnn-jake-tapper-podcast/
We Need to Understand How We Got to January 6 Before We Can Move Forward,Fernanda Echavarri,https://www.motherjones.com/politics/2021/06/podcast-january-6-qanon-history-whats-next/
A Radical Idea for Forcing Vaccine Companies to Share Knowledge With the World,Molly Schwartz and Jamilah King,https://www.motherjones.com/politics/2021/05/vaccine-patents-biden-covid-india-dean-baker-pandemic/
,,https://podcasts.apple.com/us/podcast/the-mother-jones-podcast/id1386408605
