title,byline,url
ChatGPT Gave Me Chilling Advice—as I Simulated Planning a Mass Shooting,Mark Follman,https://www.motherjones.com/media/2026/05/openai-chatgpt-mass-shooting-guardrails-fail/
ChatGPT Gave Me Chilling Advice—as I Simulated Planning a Mass Shooting,Mark Follman,https://www.motherjones.com/media/2026/05/openai-chatgpt-mass-shooting-guardrails-fail/
Exclusive: The Only Woman on Death Row in Mississippi Alleges New Civil Rights Violations in Confinement,Daniel King,https://www.motherjones.com/politics/2026/05/only-woman-death-row-mississippi-chamberlin-gender-inequality/
Republicans Claim Widespread Food Stamp Fraud. What’s Missing: Hard Evidence.,Sophie Hurwitz,https://www.motherjones.com/politics/2026/05/republicans-snap-fraud-welfare-queen/
The Met Gala’s MAGA Problem,Chasity Hale,https://www.motherjones.com/politics/2026/05/the-met-galas-maga-problem/
Are Anti-Trans Measures Being Used as Republican “Ballot Candy”?,Madison Pauly,https://www.motherjones.com/politics/2026/05/anti-trans-measures-ballot-candy-joe-lombardo-collins-platner/
"In His Debut Novel, Blair Palmer Yoxall Rejects the Cowboys vs. Indians Western",Cheyenne McNeill,https://www.motherjones.com/politics/2026/05/blair-palmer-yoxall-treat-them-as-buffalo-interview/
Supreme Court Reinstates Access to Abortion Pills—For Now,Nina Martin,https://www.motherjones.com/politics/2026/05/supreme-court-reinstates-access-to-abortion-pills-for-now/
,,https://www.motherjones.com/sponsored/this-is-what-a-winning-climate-movement-looks-like/
,,https://www.motherjones.com/sponsored/meet-the-moms-fighting-toxic-air-pollution-you-could-be-next/
,,https://www.motherjones.com/politics/2026/04/catholics-welcome-everyone-but-can-they-handle-some-of-these-new-converts/
,,https://www.motherjones.com/politics/2026/04/hasan-piker-live-streamer-israel-palestine-democrat-progressive/
,,https://www.motherjones.com/politics/2026/04/trump-is-branding-america-history-has-a-word-for-that/
,,https://www.motherjones.com/politics/2026/04/we-asked-the-white-house-if-trump-was-considering-nuking-iran-its-response-was-chilling/
Trump’s Crypto Empire Descends Into Warring Lawsuits,Russ Choma,https://www.motherjones.com/politics/2026/05/trumps-crypto-empire-descends-into-warring-lawsuits/
Court Clears Path for “Alligator Alcatraz” on Sacred Tribal Land,Amy Green,https://www.motherjones.com/politics/2026/05/court-clears-path-for-alligator-alcatraz-on-sacred-tribal-land/
"Together, We Beat Bezos",Monika Bauerlein,https://www.motherjones.com/politics/2026/05/bezos-washington-post-50-years/
Why Lauren Sánchez Bezos Is Storming the Gates of the Met Gala,Inae Oh,https://www.motherjones.com/politics/2026/05/lauren-sanchez-bezos-met-gala/
Report: Education Department’s Office for Civil Rights is Flunking,Julia Métraux,https://www.motherjones.com/politics/2026/05/education-department-office-civil-rights-flunking/
Bernie Reminds His Fans: He Would Have Won,Jamilah King,https://www.motherjones.com/politics/2026/05/bernie-sanders-basketball-viral-video-clip/
The Iran War Remains Unpopular—Unless You’re a Weapons Contractor,Sophie Hurwitz,https://www.motherjones.com/politics/2026/05/iran-war-weapons-sales-israel-qatar-kuwait-uae-marco-rubio-congress/
Trump’s Plans to Rebuild DC in His Image Keep Getting Pricier,Sophie Hurwitz,https://www.motherjones.com/politics/2026/05/donald-trump-east-potomac-golf-club-garden-american-heroes/
Joe diGenova: The Right Pick for Trump’s Bogus “Grand Conspiracy” Case,"April 29, 2026",https://www.motherjones.com/politics/2026/04/joe-digenova-trump-justice-department-conspiracy-theory-election-denier/
Tulsi Gabbard’s Dangerous War,"April 22, 2026",https://www.motherjones.com/politics/2026/04/tulsi-gabbard-intelligence-donald-trump-obama-brennan-deep-state/
Tucker Carlson’s Biggest Conspiracy Theory Yet,"April 15, 2026",https://www.motherjones.com/politics/2026/04/tucker-carlsons-biggest-conspiracy-theory-yet-donald-trump-iran-israel-nuclear-weapons/
,,https://www.motherjones.com/politics/2026/05/global-sumud-flotilla-gaza-israel-aid-blockade-2026/
,,https://www.motherjones.com/politics/2026/04/trump-foreign-policy-imperialism-iran/
,,https://www.motherjones.com/politics/2026/04/california-forests-roundup-glyphosate-weed-killer/
,,https://www.motherjones.com/politics/2026/04/earth-day-saving-climate-al-gore-bill-mckibben-catherine-coleman-flowers/
Trump’s SEC Slammed the Door on Small Investors. They Built a New One.,Tik Root,https://www.motherjones.com/politics/2026/05/trumps-sec-slammed-the-door-on-small-investors-they-built-a-new-one/
“Where Have All the Student Protests Gone?”,Sophie Hurwitz,https://www.motherjones.com/politics/2026/05/college-university-student-protests-palestine-israel-gaza-trump/
A New Climate Democracy Is Taking On the Petrostates,Fiona Harvey and Jonathan Watts,https://www.motherjones.com/politics/2026/05/a-new-climate-democracy-is-taking-on-the-petrostates/
The Folly of Trump Taking a “Wrecking Ball” to a Crucial Science Advisory Board,Kiley Bense,https://www.motherjones.com/politics/2026/05/trump-fired-members-national-science-foundation-advisory-board-consequences/
Victims Allege OpenAI Is Responsible for Mass Shooting,Mark Follman,https://www.motherjones.com/criminal-justice/2026/04/lawsuit-openai-chatgpt-tumbler-ridge-mass-shooting-victims/
The Truth About the Trump Plan to Bring Back Execution by Firing Squad,Sophie Hurwitz,https://www.motherjones.com/politics/2026/04/donald-trump-firing-squad/
The Roberts Court Shows Its True Partisan Colors,Pema Levy,https://www.motherjones.com/politics/2026/04/voting-rights-act-callais-louisianna-partisan-gerrymandering/
America Can’t Let Go of George Washington’s Slave-Holding History,Jeffrey Kelly,https://www.motherjones.com/media/2026/04/george-washington-slave-owner-history/
A Right-Wing Court Just Moved to Choke Off Abortion by Mail,Nina Martin,https://www.motherjones.com/politics/2026/05/a-right-wing-court-just-moved-to-choke-off-abortion-by-mail/
Federal Judge Calls RFK Jr. an “Unsafe” Leader in Order Protecting Trans Youth Health Care,Madison Pauly,https://www.motherjones.com/politics/2026/04/federal-judge-rfk-jr-unsafe-leader-in-order-protecting-trans-youth-health-care/
Dave Chappelle Is Outraged That Trans People Were Right About His Jokes,Alex Nguyen,https://www.motherjones.com/politics/2026/04/chappelle-anti-trans-transphobic-gop-republican-comedy-boebert/
Trump Is About to Drop a “Nuclear Weapon” on Trans Youth Health Care,Madison Pauly,https://www.motherjones.com/politics/2026/04/transgender-gender-affirming-care-hhs-manhattan-institute-segm-leor-sapir-trump/
,,https://www.motherjones.com/politics/2026/04/trump-maga-evangelical-crackup-pope-christian/
,,https://www.motherjones.com/politics/2026/03/inside-the-latest-and-scariest-iteration-of-americas-endless-abortion-wars/
,,https://www.motherjones.com/politics/2026/04/cellphone-surveillance-firstwap-reports-lighthouse/
,,https://www.motherjones.com/politics/2026/04/ai-religious-right-christianity-thiel-katherine-boyle-trae-stephens/
Trump Is Safe After Gunfire Erupted at the White House Correspondents’ Dinner,James West,https://www.motherjones.com/politics/2026/04/white-house-correspondents-dinner-shooter-gun-trump/
The Racist Hoax That Changed Boston,Reveal,https://www.motherjones.com/media/2026/03/murder-in-boston-chuck-carol-stuart-1989-globe/
"Food Recalls Are Good, Actually",Jeffrey Kelly,https://www.motherjones.com/food/2026/04/food-recalls-are-good-actually/
Who Killed the Florida Orange?,Alexander Sammon,https://www.motherjones.com/environment/2026/04/florida-orange-juice-industy-decline-death/
Trump’s New Medicaid Work Requirements Are Here,Julia Métraux,https://www.motherjones.com/politics/2026/05/trumps-new-medicaid-work-requirements-are-here/
The New Frontiers of Aging,Julia Métraux,https://www.motherjones.com/politics/2026/04/aging-medical-science-advances-hiv-brain-trauma-disability/
Amazon Powers ICE. Its Workers Aren’t Happy.,Sophie Hurwitz,https://www.motherjones.com/politics/2026/05/amazon-powers-ice-its-workers-arent-happy/
Trump Endorses Rebranding ICE as NICE,Sophie Hurwitz,https://www.motherjones.com/politics/2026/04/trump-endorses-rebranding-ice-as-nice/
