title,byline,url
A 17-Year-Old Processes Police Sexual Violence in One of the Summer’s Most Anticipated Novels,Madison Pauly,https://www.motherjones.com/media/2022/06/leila-mottley-nightcrawling-police-sex-ring-oakland-youth-poet-laureate/
A 17-Year-Old Processes Police Sexual Violence in One of the Summer’s Most Anticipated Novels,Madison Pauly,https://www.motherjones.com/media/2022/06/leila-mottley-nightcrawling-police-sex-ring-oakland-youth-poet-laureate/
The Most Shocking New Statistic on Mass Shootings,Mark Follman,https://www.motherjones.com/politics/2022/06/mass-shootings-public-opinion-polls-gun-laws-shocking-carnage/
Boris Johnson Lives to Party Another Day,Noah Y. Kim,https://www.motherjones.com/politics/2022/06/boris-johnson-no-confidence-united-kingdom-partygate/
Supposed Anti-Pedophilia Lawmaker Hires Person Famously Outcast for Minimizing Child Sex Abuse,Abigail Weinberg,https://www.motherjones.com/mojo-wire/2022/06/marjorie-taylor-greene-milo-yiannopoulos-pedophilia/
"UK Thieves Are Pilfering, and Threatening, Rare Wild Orchids",Helena Horton,https://www.motherjones.com/environment/2022/06/uk-wild-orchid-thefts-biodiversity/
Kevin McCarthy Sided With Trump After January 6. Trump Just Rewarded Him.,Dan Friedman,https://www.motherjones.com/politics/2022/06/kevin-mccarthy-trump-endorsement-speaker-january-6-coup/
"As Congress Putters, the Gun Carnage Continues",Dan Friedman,https://www.motherjones.com/politics/2022/06/congress-gun-debate-restrictions-mass-shootings-toll/
What Peter Navarro Did After His First Court Appearance Is Truly Bizarre,Dan Friedman,https://www.motherjones.com/politics/2022/06/peter-navarro-court-contempt-congress-new-federal-state-china/
Justice Department Won’t Prosecute Two Top Trump Aides for Defying Jan. 6 Committee,Russ Choma,https://www.motherjones.com/politics/2022/06/justice-department-wont-prosecute-two-top-trump-aides-for-defying-jan-6-committee/
Draft Order Would Have Given Armed Trump Supporters Power to Seize Voting Data,Dan Friedman,https://www.motherjones.com/politics/2022/06/draft-order-would-have-given-armed-trump-supporters-power-to-seize-voting-machines/
,,https://www.motherjones.com/mojo-wire/2022/06/star-wars-nerds-black-actress-moses-ingram/
,,https://www.motherjones.com/mojo-wire/2022/05/it-was-the-wrong-decision-period/
,,https://www.motherjones.com/crime-justice/2022/05/beto-orourke-was-right/
Uvalde Mom Who Was Handcuffed Says Police Warned Her Not to Tell Her Story,Russ Choma,https://www.motherjones.com/politics/2022/06/uvalde-mom-who-was-handcuffed-says-police-warned-her-not-to-tell-her-story/
Ron DeSantis Is Hard at Work Doing Bad Shit,Abigail Weinberg,https://www.motherjones.com/mojo-wire/2022/06/ron-desantis-summer-gender-olympics-trans-care/
"Peter Navarro, “Trump’s Looniest Economic Adviser,” Has Been Indicted",Inae Oh,https://www.motherjones.com/mojo-wire/2022/06/peter-navarro-indicted/
"Remembering George Pérez, a Superhero of Superhero Comics",Dan Spinelli,https://www.motherjones.com/recharge/2022/05/remembering-george-perez-a-superhero-of-superhero-comics/
Ukrainian and Russian Dancers Join Onstage (in Italy) to Fundraise for the Red Cross,Daniel King,https://www.motherjones.com/recharge/2022/04/ukrainian-russian-antiwar-ballet-dancers-for-peace/
"Mass Shootings Persist, But a New Book Brings Hope and Science to Grappling With Their Prevention",Daniel King,https://www.motherjones.com/recharge/2022/04/mass-shooting-prevention-trigger-points/
A Russian Billionaire Is Selling his $500 Million Company for $1 After Ukraine Sanctions,Russ Choma,https://www.motherjones.com/politics/2022/06/a-russian-billionaire-is-selling-his-500-million-company-for-1-after-ukraine-sanctions/
The GOP’s Interest in Mental Health Care Is a Familiar Deflection After a Mass Shooting,Stephanie Mencimer,https://www.motherjones.com/politics/2022/06/the-gops-interest-in-mental-health-care-is-a-familiar-deflection-after-a-mass-shooting/
"The Long, Hype-Strewn Road to General Artificial Intelligence",Tristan Greene,https://www.motherjones.com/environment/2022/06/general-artificial-intelligence-technology/
"Key Roundup Ingredient Harms Wild Bee Colonies, New Study Shows",Damian Carrington,https://www.motherjones.com/environment/2022/06/roundup-glyophosphate-weed-killer-wild-bee-colonies-study/
How American Influencers Built a World Wide Web of Vaccine Disinformation,Kiera Butler and Neha Wadekar,https://www.motherjones.com/politics/2022/06/how-american-influencers-built-a-world-wide-web-of-vaccine-disinformation/
Monkeypox Disinfo Is Just Like Covid Disinfo—Plus Homophobia,Kiera Butler,https://www.motherjones.com/politics/2022/05/monkeypox-disinfo-is-just-like-covid-disinfo-plus-homophobia/
Russia’s War Created a Global Hunger Disaster. Climate Change Is Ramping It Up.,Tom Philpott,https://www.motherjones.com/food/2022/06/russia-war-global-hunger-crisis-united-nations-wheat-shortage-climate-change/
The FDA Is Coming for Your Almond Milk,Tom Philpott,https://www.motherjones.com/food/2022/05/oat-milk-almond-milk-dairy-lobby-fda-labeling-plant-based/
Ohio Republicans Pass Bill Allowing Teachers to Carry Guns With Just 24 Hours of Training,Noah Y. Kim,https://www.motherjones.com/crime-justice/2022/06/ohio-republicans-pass-bill-allowing-teachers-to-carry-guns-with-just-24-hours-of-training/
Missouri Investigates Police Shooting of a Black Woman Who Reportedly Said She Was Pregnant,Samantha Michaels,https://www.motherjones.com/crime-justice/2022/05/kansas-city-police-shot-a-black-woman-who-said-she-was-pregnant-and-had-her-hands-in-the-air/
“This Is Not Our First Rodeo”: Key Border Cities Say They’re Ready for the End of Title 42,Fernanda Echavarri,https://www.motherjones.com/politics/2022/05/end-title-42-border-preparation-tucson-san-diego/
May Day Marches Highlight Essential Immigrant Labor and Rising Frustration With Biden,Fernanda Echavarri,https://www.motherjones.com/politics/2022/05/may-day-immigrant-labor-marches-biden/
,,https://www.motherjones.com/politics/2022/05/golden-gate-village-affordable-housing-marin-city-bay-area-cooperative/
,,https://www.motherjones.com/politics/2022/05/the-parents-revolution-will-be-televised-and-its-asra-nomani-on-fox-friends/
,,https://www.motherjones.com/politics/2022/05/private-equity-apollo-blackstone-kkr-carlyle-carried-interest-loophole/
,,https://www.motherjones.com/politics/2022/04/hunter-biden-laptop-guo-wengui-bannon-giuliani/
January 6 Reckoning: CNN’s Jake Tapper Says the Media Must Confront Republicans’ Big Lie,Abigail Weinberg,https://www.motherjones.com/media/2021/07/january-6-insurrection-capitol-cnn-jake-tapper-podcast/
We Need to Understand How We Got to January 6 Before We Can Move Forward,Fernanda Echavarri,https://www.motherjones.com/politics/2021/06/podcast-january-6-qanon-history-whats-next/
A Radical Idea for Forcing Vaccine Companies to Share Knowledge With the World,Molly Schwartz and Jamilah King,https://www.motherjones.com/politics/2021/05/vaccine-patents-biden-covid-india-dean-baker-pandemic/
,,https://podcasts.apple.com/us/podcast/the-mother-jones-podcast/id1386408605
