title,byline,url
Donald Trump’s Latest Crypto Corruption: A Mar-a-Lago Party for His Coin Buyers,Russ Choma,https://www.motherjones.com/politics/2026/04/donald-trump-crypto-coin-corruption-mar-a-lago/
Donald Trump’s Latest Crypto Corruption: A Mar-a-Lago Party for His Coin Buyers,Russ Choma,https://www.motherjones.com/politics/2026/04/donald-trump-crypto-coin-corruption-mar-a-lago/
A Republican Dark Money Group Blankets Virginia With Deceptive Mailers Ahead of Redistricting Vote,Ari Berman,https://www.motherjones.com/politics/2026/04/dark-money-group-per-aspera-blankets-virginia-with-deceptive-mailers-ahead-of-redistricting-vote/
Is Donald Trump Going to Hell?,Inae Oh,https://www.motherjones.com/politics/2026/04/donald-trump-pope-blasphemy/
Power Hungry,Mother Jones,https://www.motherjones.com/politics/2026/04/power-hungry/
He Anonymously Threatened Lawmakers Reining in Shady Hospital Deals. Now He’s Been Arrested.,Hannah Levintova and Ashley Cleek,https://www.motherjones.com/politics/2026/04/mpt-steward-health-arrest-harassment-bruce-tigani-jr-abe/
ICE Smashed Her Car Windows on the Way to the Doctor. Now She’s Fighting Back.,Sophie Hurwitz,https://www.motherjones.com/politics/2026/04/ice-aliyah-rahman-tort-ntca-dhs/
RFK Jr. Vows to Demolish Preventive Medicine,Alex Nguyen,https://www.motherjones.com/politics/2026/04/rfk-jr-preventive-medicine-task-force-overhaul/
,,https://www.motherjones.com/sponsored/this-is-what-a-winning-climate-movement-looks-like/
,,https://www.motherjones.com/sponsored/meet-the-moms-fighting-toxic-air-pollution-you-could-be-next/
,,https://www.motherjones.com/politics/2026/04/trump-is-branding-america-history-has-a-word-for-that/
,,https://www.motherjones.com/politics/2026/04/we-asked-the-white-house-if-trump-was-considering-nuking-iran-its-response-was-chilling/
,,https://www.motherjones.com/politics/2026/04/see-photos-from-the-first-lunar-travelers-since-1972/
,,https://www.motherjones.com/mojo-wire/2026/04/birthright-citizenship-supreme-court-wong-kim-ark-norman-wong/
Dave Chappelle Is Outraged That Trans People Were Right About His Jokes,Alex Nguyen,https://www.motherjones.com/politics/2026/04/chappelle-anti-trans-transphobic-gop-republican-comedy-boebert/
Survivor’s Lawsuit Against Florida Sheriff Moves Forward,Rachel de Leon,https://www.motherjones.com/criminal-justice/2026/04/survivors-lawsuit-against-florida-sheriff-moves-forward/
Pete Hegseth Is Now Opening With Quentin Tarantino,Alex Nguyen,https://www.motherjones.com/politics/2026/04/pete-hegseth-is-now-opening-with-quentin-tarantino/
Graham Platner Apologizes for Using the R-Word,Julia Métraux,https://www.motherjones.com/politics/2026/04/graham-platner-apologizes-for-using-the-r-word/
Are Your Allergies Worse This Season? Climate Change and Pollution Might Be to Blame.,Sophie Hurwitz,https://www.motherjones.com/politics/2026/04/allergies-climate-change-pollution-pollen/
Trump Thinks Jesus Loves Him,Alex Nguyen,https://www.motherjones.com/politics/2026/04/trump-thinks-jesus-loves-him/
A Non-Exhaustive List of Trump’s Deleted Posts,Alex Nguyen,https://www.motherjones.com/politics/2026/04/a-non-exhaustive-list-of-trumps-deleted-posts/
Graham Platner Claims He’s Changed. Why Is He Still Using the R-Word?,Julia Métraux,https://www.motherjones.com/politics/2026/04/graham-platner-maine-tattoo-slur/
Tucker Carlson’s Biggest Conspiracy Theory Yet,"April 15, 2026",https://www.motherjones.com/politics/2026/04/tucker-carlsons-biggest-conspiracy-theory-yet-donald-trump-iran-israel-nuclear-weapons/
Is the Don’s Con Gone?,"April 9, 2026",https://www.motherjones.com/politics/2026/04/donald-trump-con-man-scam-iran-war-pentagon-tariffs-approval-rating/
A MAGA Crack-up?,"April 3, 2026",https://www.motherjones.com/politics/2026/04/maga-trump-crack-up-candace-owens-charlie-kirk-erika-kirk-tucker-carlson-megyn-kelly-joe-kent-kash-patel/
,,https://www.motherjones.com/politics/2026/04/ai-nuclear-disaster-daniel-holz-doomsday-clock/
,,https://www.motherjones.com/politics/2026/04/inside-americas-race-to-hide-the-worlds-money/
,,https://www.motherjones.com/politics/2026/04/keith-ellison-minneapolis-ice-immigration-josh-hawley/
,,https://www.motherjones.com/politics/2026/04/inconsequential-investigations-2026-garrison-hayes-doppelganger-neutral-milk-hotel/
Inside That Weird Anti-Science Conference Where Trump’s EPA Chief Delivered the Keynote,Dharna Noor,https://www.motherjones.com/politics/2026/04/heartland-institute-anti-science-conference-climate-deniers-epa-administrator-lee-zeldin-keynote-speech/
"Creating Baby Geniuses to Thwart the AI Threat? (Yes, Really.)",Abby Vesoulis,https://www.motherjones.com/politics/2026/04/gene-editing-optimization-thiel-altman-armstrong-andreessen-ai-iq/
A “Humbling” Research Finding: Sperm Whales Communicate Surprisingly Like Us,Oliver Milman,https://www.motherjones.com/environment/2026/04/study-ceti-sperm-whales-communicate-like-humans-language/
How the American Oligarchy Went Hyperscale,Tim Murphy,https://www.motherjones.com/politics/2026/04/american-oligarchy-hyperscale-data-centers-meta-openai-oracle-x-musk-altman-zuckerberg-bezos/
The Chilling Role of ChatGPT in Mass Shootings and Other Violence,Mark Follman,https://www.motherjones.com/media/2026/04/chatgpt-tumbler-ridge-fsu-openai-chatbots-mass-shootings/
Trump Says He Made Memphis Safer. Locals Told Me It Felt Like 1930s Germany or North Korea.,Samantha Michaels,https://www.motherjones.com/politics/2026/03/trump-memphis-safe-task-force-local-residents-repressive-police-state/
America Can’t Let Go of George Washington’s Slave-Holding History,Jeffrey Kelly,https://www.motherjones.com/media/2026/04/george-washington-slave-owner-history/
“Who the Fuck Are These Men?”,Michael Edison Hayden,https://www.motherjones.com/politics/2026/02/coeur-dalene-cda-idaho-donald-trump-kootenai-county-republicans/
Trump Is About to Drop a “Nuclear Weapon” on Trans Youth Health Care,Madison Pauly,https://www.motherjones.com/politics/2026/04/transgender-gender-affirming-care-hhs-manhattan-institute-segm-leor-sapir-trump/
Tradwife Horror Story,Maddie Oatman,https://www.motherjones.com/media/2026/04/trad-wife-caro-claire-burke-yesteryear-hannah-neeleman-anne-hathaway/
"On Trans Day of Visibility, Supreme Court Sides With Conversion Therapy",Katie Herchenroeder and Madison Pauly,https://www.motherjones.com/politics/2026/03/trans-day-of-visibility-supreme-court-conversion-therapy-ruling/
The Ugly History Behind the Olympics’ New Gender Test,Schuyler Mitchell,https://www.motherjones.com/politics/2026/03/olympics-gender-testing-anti-trans-genetic-chromosomes-caster-semenya-nazis/
,,https://www.motherjones.com/politics/2026/03/inside-the-latest-and-scariest-iteration-of-americas-endless-abortion-wars/
,,https://www.motherjones.com/politics/2026/02/cory-mills-florida-investigation-profile-stolen-valor-trump-sex-workers-pacem-restraining-order-miss-us/
,,https://www.motherjones.com/politics/2026/02/takeaways-cory-mills-investigation-florida/
,,https://www.motherjones.com/politics/2026/03/ice-dilley-family-detention-center-immigrant-children-liam-ramos-trump/
The Racist Hoax That Changed Boston,Reveal,https://www.motherjones.com/media/2026/03/murder-in-boston-chuck-carol-stuart-1989-globe/
Minneapolis Is the Violent Reckoning the Gun Rights Movement Has Long Wanted,Mike Spies,https://www.motherjones.com/politics/2026/02/minneapolis-ice-cbp-nra-alex-pretti-renee-good-guns-second-amendment/
California Bill Aims to End Spraying of Crops With Toxic “Forever Chemicals”,Liza Gross,https://www.motherjones.com/politics/2026/04/california-bill-ab-1606-pfas-pesticides-food-crops-spraying-toxic-forever-chemicals/
"What Hippies, Tradwives, and Trump Voters Have in Common",Grace Byron,https://www.motherjones.com/politics/2026/04/natural-maha-trans-rights-hormones-measles-rfk-jr-alex-clark/
Hold off on Celebrating Trump’s Proposal to Increase Disability Education Funding,Julia Métraux,https://www.motherjones.com/politics/2026/04/trump-budged-disability-education-rfk/
Home Care Wasn’t Ready for the Climate Crisis—Even Before Trump’s Cuts,Julia Métraux,https://www.motherjones.com/politics/2026/03/hcbs-home-care-medicaid-fema-gop-trump-cuts/
The Scammers Profiting off Trump’s Immigration Crackdown,Laura C. Morel,https://www.motherjones.com/politics/2026/04/the-scammers-profiting-off-trumps-immigration-crackdown/
A Judge Ordered Her Return After a Wrongful Deportation. Now Comes the Hard Part.,Isabela Dias,https://www.motherjones.com/politics/2026/04/a-judge-ordered-her-return-after-a-wrongful-deportation-now-comes-the-hard-part/
