title,byline,url
Does Banning the Taliban From Social Media Actually Help Afghans?,Ali Breland,https://www.motherjones.com/politics/2021/08/does-banning-the-taliban-actually-help-afghans/
Does Banning the Taliban From Social Media Actually Help Afghans?,Ali Breland,https://www.motherjones.com/politics/2021/08/does-banning-the-taliban-actually-help-afghans/
It Took Approximately Zero Seconds for Hawks to Make the Afghanistan Withdrawal About China,Dan Spinelli,https://www.motherjones.com/politics/2021/08/afghanistan-withdrawal-china-john-bolton-hawks/
Florida’s COVID Surge Is Taxing Its Ability to Purify Drinking Water,Matt Simon,https://www.motherjones.com/environment/2021/08/florida-covid-surge-oxygen-shortage-drinking-water-treatment-purification/
Why Facebook Won’t Stop Pushing Propaganda,Monika Bauerlein and Clara Jeffery,https://www.motherjones.com/politics/2021/08/why-facebook-wont-stop-pushing-propaganda/
Drought Is Complicating California’s Plans for a Carbon-Free Future,Brian Tarroja,https://www.motherjones.com/environment/2021/08/california-drought-carbon-future-hydroelectric-hydropower/
COVID and Ida Are a Brutal One-Two Punch for Hospitals in the Storm’s Path,Madison Pauly,https://www.motherjones.com/politics/2021/08/hurricane-ida-covid-louisiana-new-orleans-hospitals/
"Yes, Let’s Mandate Vaccines for Eligible School Children, Fauci Says",Madison Pauly,https://www.motherjones.com/politics/2021/08/yes-lets-mandate-vaccines-for-eligible-school-children-fauci-says/
"Odds of Escape Waning for At-Risk Afghans, Despite Assurances",Madison Pauly,https://www.motherjones.com/politics/2021/08/waning-odds-escape-afghanistan-evacuation-taliban/
"As Hurricane Ida Hits Louisiana, the Climate Change Future Is Upon Us",Tim Murphy,https://www.motherjones.com/politics/2021/08/hurricane-ida-is-about-to-hit-louisiana-and-our-climate-change-future-is-here/
Penguin Classics Launches “New Canon” of Environmental Literature,Alison Flood,https://www.motherjones.com/environment/2021/08/penguin-classics-launches-new-canon-environmental-literature-books/
,,https://www.motherjones.com/mojo-wire/2021/08/donald-trump-statement-joe-biden-afghanistan/
,,https://www.motherjones.com/politics/2021/08/andrew-cuomo-resigns/
,,https://www.motherjones.com/politics/2021/07/january-6-hearing-police-testimony/
Pentagon Orders Airlines to Help Evacuate People Fleeing Afghanistan,Samantha Michaels,https://www.motherjones.com/politics/2021/08/pentagon-airlines-evacuation-afghanistan-kabul-taliban/
"Tropical Storm Henri Bears Down on New England, Me",Ian Gordon,https://www.motherjones.com/politics/2021/08/tropical-storm-henri-new-england-eversource-yikes/
Donald Trump Encouraged People at His Rally to Get Vaccinated. They Booed Him.,Ian Gordon,https://www.motherjones.com/politics/2021/08/donald-trump-cullman-alabama-rally-covid-boo/
The First Afghan Woman in the Paralympics Since 2004 Prepares to Compete,Daniel King,https://www.motherjones.com/recharge/2021/08/first-afghan-woman-in-paralympics-since-2004/
Revisiting Alice Coltrane’s Legacy on the 84th Anniversary of the Pianist and Harpist’s Birth,Daniel King,https://www.motherjones.com/recharge/2021/08/revisiting-alice-coltranes-legacy-on-the-84th-anniversary-of-the-pianist-and-harpists-birth/
"After a 10-Day Strike, a Cleaners Union Wins a Landmark Contract With Pay Raises and Safety Reinforcements",Daniel King,https://www.motherjones.com/recharge/2021/08/cleaners-union-strike-wins-pay-raise-safety/
The Anti-Vax Lawyer Representing Jan. 6 Rioters Has Suddenly Gone Missing,Inae Oh and Dan Friedman,https://www.motherjones.com/politics/2021/08/john-pierce-missing-lawyer/
"Voting Rights Marches Draw Crowds, But They’re Losing the War",Tim Murphy,https://www.motherjones.com/politics/2021/08/voting-rights-marches-draw-crowds-but-theyre-losing-the-war/
England Intends to Ban Single-Use Culinary Plastics—Very Slowly,Damian Carrington,https://www.motherjones.com/environment/2021/08/england-intends-to-ban-single-use-culinary-plastics-very-slowly/
Extinction Rebellion Protesters Paint London Red,Damien Gayle,https://www.motherjones.com/politics/2021/08/extinction-rebellion-2021-climate-protests-paint-london-red/
Americans Are Poisoning Themselves With This Unapproved COVID Drug,Michael Mechanic,https://www.motherjones.com/politics/2021/08/americans-poisoning-themselves-unapproved-covid-drug-ivermectin/
Boosters Before the World Is Vaccinated Isn’t Just Unjust. It Could Prolong the Pandemic for Everyone.,Lil Kalish,https://www.motherjones.com/coronavirus-updates/2021/08/boosters-before-vaccinating-the-world-isnt-just-unethical-it-also-could-prolong-the-pandemic-for-everyone/
Want People to Eat Less Meat? Fake Burgers Probably Won’t Cut It.,Charlie Mitchell,https://www.motherjones.com/food/2021/08/want-people-to-eat-less-meat-fake-burgers-probably-wont-cut-it/
Working for America’s Biggest Chicken Processor Is No Picnic,Nina Lakhani,https://www.motherjones.com/environment/2021/08/chicken-processor-tyson-foods-guardian-investigation-workers-environment-working-conditions-arkansas-monopoly/
"As Hurricane Ida Strands Thousands, the Police Would Rather Focus on “Anti-Looting” Patrols",Samantha Michaels,https://www.motherjones.com/crime-justice/2021/08/hurricane-ida-criminalization-katrina-floodlines-patrols-police/
“Defund the Police” Was a Rallying Cry in 2020. Minneapolis Is About to Vote on What That Means.,Samantha Michaels,https://www.motherjones.com/crime-justice/2021/08/defund-the-police-minneapolis-public-safety-organizers-frey-policing/
Trump Weaponized COVID Concerns Against Migrants. Families Are Still Being Brutalized by the Policy.,Isabela Dias,https://www.motherjones.com/politics/2021/07/trump-weaponized-covid-concerns-against-migrants-families-are-still-being-brutalized-by-the-policy/
“Not Necessary”: The Biden Administration Just Canceled More Border Wall Contracts,Hannah Levintova,https://www.motherjones.com/politics/2021/07/not-necessary-the-biden-administration-just-canceled-more-border-wall-contracts/
,,https://www.motherjones.com/politics/2021/08/virginia-militia-bedford-campbell-county/
,,https://www.motherjones.com/environment/2021/08/spca-international-animal-charity-innovairre/
,,https://www.motherjones.com/politics/2021/07/how-flint-closed-the-gap-between-black-and-white-suffering-under-covid/
,,https://www.motherjones.com/politics/2021/08/will-this-court-case-end-the-mining-industrys-150-year-dominance-of-the-west/
January 6 Reckoning: CNN’s Jake Tapper Says the Media Must Confront Republicans’ Big Lie,Abigail Weinberg,https://www.motherjones.com/media/2021/07/january-6-insurrection-capitol-cnn-jake-tapper-podcast/
We Need to Understand How We Got to January 6 Before We Can Move Forward,Fernanda Echavarri,https://www.motherjones.com/politics/2021/06/podcast-january-6-qanon-history-whats-next/
A Radical Idea for Forcing Vaccine Companies to Share Knowledge With the World,Molly Schwartz and Jamilah King,https://www.motherjones.com/politics/2021/05/vaccine-patents-biden-covid-india-dean-baker-pandemic/
,,https://podcasts.apple.com/us/podcast/the-mother-jones-podcast/id1386408605
