title,byline,url
The Lesson of January 6: Tragedy Does Not Yield National Unity,David Corn,https://www.motherjones.com/politics/2022/01/january-6-lesson-david-corn-essay-national-unity-anniversary/
The Lesson of January 6: Tragedy Does Not Yield National Unity,David Corn,https://www.motherjones.com/politics/2022/01/january-6-lesson-david-corn-essay-national-unity-anniversary/
“Dagger at the Throat of Democracy”: Watch Biden’s Impassioned Jan. 6 Anniversary Speech,James West and Noah Y. Kim,https://www.motherjones.com/politics/2022/01/january-6-biden-trump-speech-insurrection-breaking/
"Across the Country, Republican Groups are Holding “Vigils” for January 6 “Patriot Martyrs”",Eamon Whalen,https://www.motherjones.com/politics/2022/01/across-the-country-republican-groups-are-holding-vigils-for-january-6-patriot-martyrs/
Fossil Fuel Firms Love Google Ads That Masquerade as Search Results,Niamh McIntyre,https://www.motherjones.com/environment/2022/01/fossil-fuel-firms-google-ads-snippets-sponsored-search-results-study/
Trump Continues to Incite the Violent Extremist Movement of January 6,Mark Follman,https://www.motherjones.com/politics/2022/01/donald-trump-extremism-incitement-january6-threats-violence-gop/
USDA Secretary Vilsack’s Son Now Works for a Controversial Ethanol Pipeline Project,Tom Philpott,https://www.motherjones.com/food/2022/01/usda-secretary-vilsack-jess-vilsack-ethanol-pipeline-summit-carbon-solutions/
Merrick Garland Issues Dire Warning About Voting Rights on Eve of January 6,Noah Y. Kim,https://www.motherjones.com/mojo-wire/2022/01/merrick-garland-issues-dire-warning-about-voting-rights-on-eve-of-january-6/
A New Report Connects the Dots on Parler’s Role Ahead of January 6,Ali Breland,https://www.motherjones.com/politics/2022/01/parler-capitol-riot/
The January 6 Committee Just Revealed Alarming Text Messages From Sean Hannity,Dan Friedman,https://www.motherjones.com/politics/2022/01/january-6-committee-sean-hannity-text-messages-trump-meadows/
We Can’t Just Grow Our Way Out of This Climate Mess,Peter Sutoris,https://www.motherjones.com/environment/2022/01/degrowth-undark-climate-crisis/
,,https://www.motherjones.com/mojo-wire/2021/12/january-capitol-attack-fox-news-mark-meadows-texts/
,,https://www.motherjones.com/mojo-wire/2021/12/tornados-death-arkansas-missouri-kentucky-tennessee-illinois-latest/
,,https://www.motherjones.com/mojo-wire/2021/11/asa-hutchinson-lauren-boebert-ilhan-omar/
New York Subpoenas Trump Kids in Probe of Family Business. They Say They Won’t Comply.,Abigail Weinberg,https://www.motherjones.com/mojo-wire/2022/01/new-york-subpoenas-trump-kids-in-probe-of-family-business-they-say-they-wont-comply/
"56 Counties, Cities, and States Just Raised Their Minimum Wage",Hannah Levintova,https://www.motherjones.com/politics/2022/01/56-counties-cities-and-states-just-raised-their-minimum-wage/
Liz Cheney Calls Trump “Unfit for Future Office”,Hannah Levintova,https://www.motherjones.com/mojo-wire/2022/01/liz-cheney-calls-trump-unfit-for-future-office/
Sleuthing for Al Hirschfeld in the Caricaturist’s First Biography,Daniel King,https://www.motherjones.com/recharge/2022/01/sleuthing-for-al-hirschfeld-in-the-caricaturists-first-biography/
“We Can’t Not Give Back. Randal Was a Giver”: 21 Stories of Strength to Close Out 2021,Daniel King,https://www.motherjones.com/recharge/2021/12/strength-justice-joy-to-ring-in-new-year-2022/
Canadian Pilots Rally to Supply Towns Isolated by Flooding,Marc Fawcett-Atkinson,https://www.motherjones.com/environment/2021/12/volunteer-pilots-rally-flood-isolated-british-columbia-canada-canadian-towns-indigenous/
Biden Promised Student Debt Relief for Public Service Workers. The Reality Has Been Painful.,Emma Rindlisbacher,https://www.motherjones.com/politics/2022/01/biden-promised-student-debt-relief-for-public-service-workers-the-reality-has-been-painful/
Chuck Schumer Just Announced a Major Potential Vote on the Future of the Filibuster,Noah Y. Kim,https://www.motherjones.com/politics/2022/01/schumer-filibuster-reform-senate-manchin-voting-rights-letter/
The Year Our Climate Crisis Got Even More Real,Bibi van der Zee,https://www.motherjones.com/environment/2022/01/2021-year-review-climate-crisis-politics-weather-fires-floods-drought-cop26/
"Hey Celebrities, You Can’t Sell NFTs and Say You’re Helping the Planet",Nitish Pahwa,https://www.motherjones.com/environment/2022/01/hey-celebrities-you-cant-sell-nfts-and-say-youre-helping-the-planet/
Desperate Patients Are Shelling Out Thousands for a Long Covid Cure. Is It for Real?,Kiera Butler,https://www.motherjones.com/politics/2022/01/desperate-patients-are-shelling-out-thousands-for-a-long-covid-cure-is-it-for-real/
The Grinch Has a New Name: Omicron,Tom Philpott,https://www.motherjones.com/politics/2021/12/the-grinch-has-a-new-name-omicron/
What Was Monsanto?,Tom Philpott,https://www.motherjones.com/food/2021/12/monsanto-glyphosate-dicamba-lawsuits-bartow-j-elmore-bayer/
‘Tis the Season for Wasting Tons of Food,Arianna Coghill,https://www.motherjones.com/politics/2021/12/food-waste-tiktok-christmas-thanksgiving-holidays/
Ghislaine Is Guilty,Abigail Weinberg,https://www.motherjones.com/crime-justice/2021/12/ghislaine-maxwell-guilty-epstein-sexual-abuse-crimes-little-black-book/
Hero of 2021: The Flight Attendant Who Duct-Taped an Abusive Passenger,Madison Pauly,https://www.motherjones.com/crime-justice/2021/12/hero-the-flight-attendant-who-duct-taped-an-abusive-passenger/
Texas Is Just Going to Build Its Own Border Wall Now,Tim Murphy,https://www.motherjones.com/politics/2021/12/texas-border-wall-abbott-biden-trump/
Will Democrats Let the Senate Parliamentarian Stand in the Way of Immigration Reform?,Isabela Dias,https://www.motherjones.com/politics/2021/12/will-democrats-let-the-senate-parliamentarian-stand-in-the-way-of-immigration-reform/
,,https://www.motherjones.com/politics/2021/12/texas-attorney-general-ken-paxton-tried-to-overturn-the-election-now-hes-going-after-roe/
,,https://www.motherjones.com/politics/2021/12/sexual-harassment-workplace-bad-bosses-beta-bionics/
,,https://www.motherjones.com/politics/2021/10/oath-keepers-texas-richard-mack-profile-sheriff/
,,https://www.motherjones.com/politics/2021/09/moody-bible-institute-purity-culture-evangelicalism-sexual-assault-title-ix-mbi-survivors-group/
January 6 Reckoning: CNN’s Jake Tapper Says the Media Must Confront Republicans’ Big Lie,Abigail Weinberg,https://www.motherjones.com/media/2021/07/january-6-insurrection-capitol-cnn-jake-tapper-podcast/
We Need to Understand How We Got to January 6 Before We Can Move Forward,Fernanda Echavarri,https://www.motherjones.com/politics/2021/06/podcast-january-6-qanon-history-whats-next/
A Radical Idea for Forcing Vaccine Companies to Share Knowledge With the World,Molly Schwartz and Jamilah King,https://www.motherjones.com/politics/2021/05/vaccine-patents-biden-covid-india-dean-baker-pandemic/
,,https://podcasts.apple.com/us/podcast/the-mother-jones-podcast/id1386408605
