title,byline,url
This Woman Drove Straight to Milwaukee After Watching Trump Get Shot,James West,https://www.motherjones.com/politics/2024/07/gop-rnc-trump-shooting-witness-video/
This Woman Drove Straight to Milwaukee After Watching Trump Get Shot,James West,https://www.motherjones.com/politics/2024/07/gop-rnc-trump-shooting-witness-video/
The Republican National Convention Is All About the Man Who Isn't There,Tim Murphy,https://www.motherjones.com/politics/2024/07/republican-national-convention-mike-pence-jd-vance/
The Gaza Pier Is a $320 Million Symbol of the Biden Administration’s “Ineffectiveness”,Sophie Hurwitz,https://www.motherjones.com/politics/2024/07/the-gaza-pier-is-a-320-million-symbol-of-the-biden-administrations-ineffectiveness/
What Happens When a Right-Wing Presidential Candidate Is Attacked?,Isabela Dias,https://www.motherjones.com/politics/2024/07/what-happens-when-a-right-wing-presidential-candidate-is-attacked-bolsonaro-trump-stabbing-shooting-2024-2018/
Anti-Abortion Firebrands Are Celebrating the Trump-Vance Ticket,Julianne McShane,https://www.motherjones.com/politics/2024/07/trump-vance-running-mate-anti-abortion-ticket/
Which Office Is Kari Lake Running For Exactly?,Tim Murphy,https://www.motherjones.com/politics/2024/07/which-office-is-kari-lake-running-for-exactly-arizona-senate-governor/
Even Republicans From DC Get Behind Trump at the GOP Convention,Stephanie Mencimer,https://www.motherjones.com/politics/2024/07/even-republicans-from-dc-get-behind-trump-at-the-gop-convention/
,,https://www.motherjones.com/sponsored/the-looming-threat-of-christian-nationalism/
,,https://www.motherjones.com/sponsored/navigating-farm-and-ranch-transfers-to-a-new-generation/
,,https://www.motherjones.com/politics/2024/07/fox-news-kat-abughazaleh-kamala-harris-biden-debate-video/
,,https://www.motherjones.com/politics/2024/07/biden-2024-1968-dnc-convention-johnson-history-video/
,,https://www.motherjones.com/politics/2024/06/racist-comments-reconstruction-black-republicans-video/
,,https://www.motherjones.com/politics/2024/04/gaza-solidarity-encampments-columbia-college-campus-protest-palestine-israel-how-many-protests/
Legal Patchwork Leaves Many US Renters Vulnerable to Extreme Heat,Li Zhou,https://www.motherjones.com/politics/2024/07/law-renters-vulnerable-extreme-heat-waves/
J.D. Vance Is Trump’s Running Mate,Inae Oh,https://www.motherjones.com/politics/2024/07/jd-vance-is-trumps-running-mate/
RNC Official: Nothing In Our Platform Says We Won’t Ban Abortion Nationwide,Julianne McShane,https://www.motherjones.com/politics/2024/07/rnc-platform-ed-martin-abortion-ban-softening-gop/
"For Christian Nationalists, the Trump Shooting Proves He Was Anointed by God",Kiera Butler,https://www.motherjones.com/politics/2024/07/for-christian-nationalists-the-trump-shooting-proves-he-was-anointed-by-god/
The GOP Convention Kicks Off in a City Where Republicans Don’t Want People to Vote,Ari Berman,https://www.motherjones.com/politics/2024/07/republican-national-convention-milwaukee-voter-suppression/
Biden’s $30m Weekend Fundraising Blitz Breaks Democratic Party Records,James West,https://www.motherjones.com/politics/2024/06/biden-campaign-fundraiser-30-million-hollywood-clooney-obama/
North Carolina House Passes Revised Mask Ban,Julia Métraux,https://www.motherjones.com/politics/2024/06/north-carolina-house-passes-revised-mask-ban/
Hunter Biden Convicted on Federal Gun Charges,Julia Métraux,https://www.motherjones.com/mojo-wire/2024/06/hunter-biden-gun-trial-jury-decision/
Here’s How Biden Could Rattle Trump in Their First Debate,"June 24, 2024",https://www.motherjones.com/politics/2024/06/trump-biden-first-debate-rattle-ridicule-cnn/
The Most Under-Covered Story of 2024: Trump and Right-Wing Extremism,"June 13, 2024",https://www.motherjones.com/politics/2024/06/donald-trump-turning-point-usa-charlie-kirk-right-wing-extremism-our-land-david-corn/
"Here Come the Russians, Again","May 24, 2024",https://www.motherjones.com/politics/2024/05/here-come-the-russians-again/
,,https://www.motherjones.com/politics/2024/06/40-acres-lie-skidaway-island-georgia-racism-the-landings-reveal/
,,https://www.motherjones.com/politics/2024/06/new-reveal-episode-40-acres-lie-part-1/
,,https://www.motherjones.com/environment/2024/06/reveal-arizona-water-the-grab/
,,https://www.motherjones.com/politics/2024/06/how-a-battle-over-solar-power-tore-one-new-york-community-apart/
Aileen Cannon Threw Out the Trump Documents Case—Just Like Clarence Thomas Wanted,Pema Levy,https://www.motherjones.com/politics/2024/07/aileen-cannon-trump-documents-clarence-thomas-jack-smith/
"In Stunning Decision, Judge Cannon Dismisses Trump Documents Charges",Inae Oh,https://www.motherjones.com/politics/2024/07/trump-documents-case-dismissed-aileen-cannon/
Texas Leaders Worry Bitcoin Mines and Big Data Will Crash the Power Grid,Keaton Peters,https://www.motherjones.com/politics/2024/07/texas-bitcoin-mines-data-centers-power-grid-demand/
"Plagued by Developers and Rising Seas, a Historic Black Community Embraces Conservation",Daniel Shailer,https://www.motherjones.com/politics/2024/07/10-mile-charleston-south-carolina-historic-black-community-heirs-coastal-development/
How a Young Thug “Meme Page” Helped Expose Georgia’s Broken Court System,Alex Nguyen,https://www.motherjones.com/criminal-justice/2024/07/young-thug-rico-fani-willis-thuggerdaily/
"The Supreme Court’s January 6 Decision Was a Win for Progressive Protesters, Too",Jeremy Schulman,https://www.motherjones.com/criminal-justice/2024/06/supreme-court-fischer-january-6/
The Endless Pursuit of Equality Through College Admissions,Alex Nguyen,https://www.motherjones.com/media/2024/06/admissions-granted-harvard-supreme-court-affirmative-action/
The Shocking Discovery That Suddenly Made Reparations Deeply Personal for One Woman,Alexia Fernández Campbell and Nadia Hamdan,https://www.motherjones.com/politics/2024/06/the-shocking-discovery-that-suddenly-made-reparations-deeply-personal-for-one-woman/
Project 2025 Is Twisting Disability Rights Law to Attack Abortion,Julia Métraux,https://www.motherjones.com/politics/2024/07/project-2025-abortion-disability-rights-heritage-foundation/
Abortion Bans Are Also Terrible for Babies,Nina Martin,https://www.motherjones.com/politics/2024/07/abortion-bans-are-also-terrible-for-babies/
Why Smashing the Administrative State Is a Disaster for Reproductive Rights,Nina Martin,https://www.motherjones.com/politics/2024/07/why-smashing-the-administrative-state-is-a-disaster-for-reproductive-rights/
Carvell Wallace on Life and Love and Coming of Age in a Cruel World,Carvell Wallace,https://www.motherjones.com/media/2024/05/carvell-wallace-another-word-love-memoir-book-excerpt/
,,https://www.motherjones.com/politics/2024/07/peter-singer-princeton-animal-rights-american-democracy-effective-altruism-voting-donald-trump-joe-biden/
,,https://www.motherjones.com/politics/2024/06/menstruation-science-sexism-period-blood-qvin-rose-endometriosis-jen-gunter/
,,https://www.motherjones.com/criminal-justice/2024/05/threat-assessment-mass-shooting-elliot-rodger-isla-vista-mother/
,,https://www.motherjones.com/criminal-justice/2023/10/foster-kids-psychiatric-hospitals-universal-health-services-uhs-alaska-cps/
Officials Would Like the Secret Service to Explain Itself,Julianne McShane,https://www.motherjones.com/politics/2024/07/officials-would-like-the-secret-service-to-explain-itself/
US Surgeon General Declares Gun Violence a Public Health Crisis,Arianna Coghill,https://www.motherjones.com/politics/2024/06/us-surgeon-general-gun-violence-public-health-crisis/
Why Donald Trump’s Plan to Stop Taxing Tips Is a Lame Political Stunt,Judd Legum,https://www.motherjones.com/politics/2024/07/donald-trump-proposal-no-tax-tips/
"Awash in Consumer Waste, Germany Tries Encouraging a Culture of Reuse",Ajit Niranjan,https://www.motherjones.com/environment/2024/07/consumer-waste-germany-reuse-recycling-efforts/
"Citing Health Concerns, Some Jewish New Yorkers Push Back Against Proposed Mask Ban",Julia Métraux,https://www.motherjones.com/politics/2024/06/hochul-mask-ban-new-york-subway-covid-israel-palestine/
RFK Jr. Is Even Crazier Than You Might Think,David Corn,https://www.motherjones.com/politics/2024/05/robert-kennedy-jr-conspiracy-theory-covid-pandemic-event-201/
Trump Again Demonizes Migrants for “Poisoning Our Country”,Mark Follman,https://www.motherjones.com/politics/2024/07/trump-fox-news-hannity-migrants-poisoning/
Most Immigrant Deaths in ICE Detention Could Have Been Prevented,Isabela Dias,https://www.motherjones.com/politics/2024/06/most-immigrant-deaths-in-ice-detention-could-have-been-prevented/
