title,byline,url
It’s Been 21 Years and Politicians Still Say the Same Things About 9/11,Tom Philpott,https://www.motherjones.com/politics/2022/09/its-been-21-years-and-politicians-still-say-the-same-things-about-9-11/
It’s Been 21 Years and Politicians Still Say the Same Things About 9/11,Tom Philpott,https://www.motherjones.com/politics/2022/09/its-been-21-years-and-politicians-still-say-the-same-things-about-9-11/
It Didn’t Start with Trump: The Decades-Long Saga of How the GOP Went Crazy,David Corn,https://www.motherjones.com/politics/2022/09/it-didnt-start-with-trump-the-decades-long-saga-of-how-the-gop-went-crazy/
An Anti-Vaccine Doctor Turned Capitol Insurrectionist Was Just Released Early from Prison,Stephanie Mencimer,https://www.motherjones.com/politics/2022/09/an-anti-vaccine-doctor-turned-capitol-insurrectionist-was-just-released-early-from-prison/
Climate Rebels Are “Disarming” Europe’s SUVs,Damien Gayle,https://www.motherjones.com/politics/2022/09/tyre-extinguishers-europe-climate-activists-disarm-suvs/
Elizabeth Warren Introduces Bill to Bolster Union Power,Hannah Levintova,https://www.motherjones.com/politics/2022/09/elizabeth-warren-introduces-bill-to-bolster-union-power/
Marjorie Taylor Greene Shows Up to Celebrate Vocational School She Won’t Support in Congress,Stephanie Mencimer,https://www.motherjones.com/politics/2022/09/marjorie-taylor-greene-shows-up-to-celebrate-vocational-school-she-wont-support-in-congress/
Beavers Are Finally Getting the Rebrand They Deserve,Jackie Flynn Mogensen,https://www.motherjones.com/environment/2022/09/beavers-wildfires-wetlands-conservation-flooding-publicist/
Climate Delegates Flock to Cairo to Prep for Next UN Summit,John Woodside,https://www.motherjones.com/politics/2022/09/un-climate-delegates-cairo-cop27-summit/
The Colorado River Is Dying. Can Its Aquatic Dinosaurs Be Saved?,Stephanie Mencimer,https://www.motherjones.com/politics/2022/09/colorado-river-dying-can-its-aquatic-dinosaurs-be-saved/
DC Mayor Responds to Months-Long Migrant Busing By Declaring a Public Emergency,Isabela Dias,https://www.motherjones.com/politics/2022/09/dc-mayor-responds-to-months-long-migrant-busing-by-declaring-a-public-emergency/
,,https://www.motherjones.com/politics/2022/08/full-transcript-of-leaked-steve-bannon-tape-donald-trump-2020-election/
,,https://www.motherjones.com/mojo-wire/2022/08/beto-orourke-calls-out-motherfucker-who-laughed-over-uvalde-mass-shooting/
,,https://www.motherjones.com/crime-justice/2022/08/failure-to-protect-domestic-abuse-child-oklahoma-women-inequality-prison/
We Now Interrupt Nothing to Bring You News of the Queen’s Death,Jacob Rosenberg,https://www.motherjones.com/mojo-wire/2022/09/queen-death-social-media-deluge/
Masks Are Now Optional on New York City Transit,Abigail Weinberg,https://www.motherjones.com/mojo-wire/2022/09/new-york-city-transit-mask-mandate/
Obamas Return to White House for First Portrait Unveiling in Ten Years,Arianna Coghill,https://www.motherjones.com/mojo-wire/2022/09/obamas-return-to-white-house-for-first-portrait-unveiling-in-ten-years/
"Remembering George Pérez, a Superhero of Superhero Comics",Dan Spinelli,https://www.motherjones.com/recharge/2022/05/remembering-george-perez-a-superhero-of-superhero-comics/
Ukrainian and Russian Dancers Join Onstage (in Italy) to Fundraise for the Red Cross,Daniel King,https://www.motherjones.com/recharge/2022/04/ukrainian-russian-antiwar-ballet-dancers-for-peace/
"Mass Shootings Persist, But a New Book Brings Hope and Science to Grappling With Their Prevention",Daniel King,https://www.motherjones.com/recharge/2022/04/mass-shooting-prevention-trigger-points/
"Electric Utilities Key Players in Climate Denial, Study Finds",Zoya Teirstein,https://www.motherjones.com/politics/2022/09/electric-utilities-key-players-in-climate-denial-study-finds/
Republicans Are Desperately Trying to Change Their Tune on Abortion,Abigail Weinberg,https://www.motherjones.com/politics/2022/09/republicans-roe-dobbs-midterms-changed-stance/
US Officials “Red-List” Lobsters to Help Critically Endangered Whales,Karen McVeigh,https://www.motherjones.com/environment/2022/09/endangered-north-atlantic-right-whale-lobster-lines-red-list/
Your Home May One Day Have Its Own Clean-Hydrogen Unit,Donna Lu,https://www.motherjones.com/environment/2022/09/clean-hydrogen-study-solar-electrolysis-home-panels/
The New and Improved Covid Boosters Are Ready to Roll,Madison Pauly,https://www.motherjones.com/environment/2022/09/new-covid-boosters-available-omicron-cdc/
Free Covid Tests Will Soon No Longer Be Available Through the US Postal Service,Samantha Michaels,https://www.motherjones.com/coronavirus-updates/2022/08/free-covid-tests-usps-mail-ending-congress/
The Curry Trap: How a Continent’s Worth of Food Got Mashed Into One Word,Anmol Irfan,https://www.motherjones.com/food/2022/08/curry-indian-food-colonialism-british-spice-blend-chai-pani-diaspora/
How the Inflation Reduction Act Affects Food and Agriculture,Tom Philpott,https://www.motherjones.com/food/2022/08/inflation-reduction-act-food-agriculture-farming/
Breonna Taylor’s Boyfriend Reflects on the Cost of Her Death at the Hands of Police,Samantha Michaels,https://www.motherjones.com/crime-justice/2022/08/breonna-taylor-kenneth-walker-police-shooting-conviction/
Breonna Taylor Is Dead Because Cops Lied. One Finally Pleaded Guilty.,Samantha Michaels,https://www.motherjones.com/crime-justice/2022/08/breonna-taylor-death-no-knock-raid-cops-lied-warrant/
Biden Makes Big Move to Protect Dreamers—But the Program Remains Under Threat,Isabela Dias,https://www.motherjones.com/politics/2022/08/biden-makes-big-move-to-protect-dreamers-but-the-program-remains-under-threat/
Greg Abbott Bused Thousands of Migrants from Texas to DC. What Happened Once They Arrived?,Isabela Dias,https://www.motherjones.com/politics/2022/08/greg-abbott-bused-thousands-of-migrants-from-texas-to-dc-what-happened-once-they-arrived/
,,https://www.motherjones.com/politics/2022/08/abortion-bans-states-social-safety-net-dobbs/
,,https://www.motherjones.com/politics/2022/08/royce-white-nba-steve-bannon-black-lives-matter/
,,https://www.motherjones.com/crime-justice/2022/08/failure-to-protect-domestic-abuse-child-oklahoma-women-inequality-prison/
,,https://www.motherjones.com/politics/2022/08/its-potentially-illegal-as-crypto-crashed-coinbase-stopped-some-notifications/
January 6 Reckoning: CNN’s Jake Tapper Says the Media Must Confront Republicans’ Big Lie,Abigail Weinberg,https://www.motherjones.com/media/2021/07/january-6-insurrection-capitol-cnn-jake-tapper-podcast/
We Need to Understand How We Got to January 6 Before We Can Move Forward,Fernanda Echavarri,https://www.motherjones.com/politics/2021/06/podcast-january-6-qanon-history-whats-next/
A Radical Idea for Forcing Vaccine Companies to Share Knowledge With the World,Molly Schwartz and Jamilah King,https://www.motherjones.com/politics/2021/05/vaccine-patents-biden-covid-india-dean-baker-pandemic/
,,https://podcasts.apple.com/us/podcast/the-mother-jones-podcast/id1386408605
