title,byline,url
Why the Big Lie Is Still Dominating Wisconsin Politics,Ari Berman,https://www.motherjones.com/politics/2024/03/wisconsin-vos-supreme-court-trump/
Why the Big Lie Is Still Dominating Wisconsin Politics,Ari Berman,https://www.motherjones.com/politics/2024/03/wisconsin-vos-supreme-court-trump/
What the Fani Willis Ruling Says About the Criminal Justice System,Jeremy Schulman,https://www.motherjones.com/politics/2024/03/fani-willis-trump-fulton-county-georgia-mcafee/
Russians Found a Different Way to Make Their Votes Matter,Ari Berman,https://www.motherjones.com/politics/2024/03/russians-putin-election-nalvalny-protest/
"“You’re Not Doing a Prank,” Tucker Carlson Tells Man Pranking Him",Daniel Moattar,https://www.motherjones.com/politics/2024/03/tucker-carlson-royal-prank-kate-middleton-palace-photo/
The GOP Is Too Scared to Let South Dakota Vote on Abortion,Madison Pauly,https://www.motherjones.com/politics/2024/03/south-dakota-republican-abortion-ballot-measure-noem-gop-choice/
How Psychedelic Drugs Are Going Mainstream,Madison Pauly,https://www.motherjones.com/media/2024/03/reveal-prx-psychedelic-drugs-mainstream-conference-rick-perry-aaron-rodgers/
This Was the Hottest Winter on Record—but What Does That Mean?,Oliver Milman and Dharna Noor,https://www.motherjones.com/environment/2024/03/this-was-the-hottest-winter-on-record-what-does-that-mean/
,,https://www.motherjones.com/politics/2024/03/naacp-nazism-derrick-johnson-trump-biden/
,,https://www.motherjones.com/politics/2024/03/lara-trump-is-all-about-meritocracy/
,,https://www.motherjones.com/mojo-wire/2024/02/trump-sneakers-fox-racism-video/
,,https://www.motherjones.com/politics/2024/01/a-crash-course-on-yemen-are-bidens-attacks-on-the-houthis-the-solution/
Inside the Movement to Ban Lab-Grown Meat,Wyatt Myskow and Lee Hedgepeth,https://www.motherjones.com/politics/2024/03/inside-the-movement-to-ban-lab-grown-meat/
Fani Willis Can Remain in Charge of Trump Prosecution in Georgia,Pema Levy,https://www.motherjones.com/politics/2024/03/fani-willis-will-remain-in-charge-of-trump-prosecution-in-georgia/
"The Crumbleys Have Been Convicted. Black Parents Will Likely Pay a Price, Too.",Nia t. evans,https://www.motherjones.com/criminal-justice/2024/03/james-jennifer-ethan-crumbley-oxfor-michigan-school-shooting/
It’s Not Just Sandy Hook. Aaron Rodgers Has Some Very Strange Thoughts About…Buildings.,Tim Murphy,https://www.motherjones.com/politics/2024/03/its-not-just-sandy-hook-aaron-rodgers-has-some-very-strange-thoughts-about-buildings/
Justice Ginsburg’s Family Decries Bestowing RBG Award on Elon Musk and Rupert Murdoch,David Corn and Ali Breland,https://www.motherjones.com/politics/2024/03/justice-ginsburgs-family-decries-bestowing-rbg-award-on-elon-musk-and-rupert-murdoch/
No One Wants to Go to GOP Spring Break,Inae Oh,https://www.motherjones.com/mojo-wire/2024/03/republican-retreat-hate-each-other/
Biden’s “An Illegal” Remark Is More Than Just a Slip,Isabela Dias,https://www.motherjones.com/mojo-wire/2024/03/biden-illegal-laken-riley-georgia-state-of-the-union-slip/
YouTube’s Austin Ambitions Aren’t Going Well. Just Ask These Workers.,Arianna Coghill,https://www.motherjones.com/mojo-wire/2024/03/youtube-austin-livestream-layoff/
Trump’s Back on Top. This Is Not Fine.,"March 10, 2024",https://www.motherjones.com/politics/2024/03/trumps-back-on-top-this-is-not-fine/
It Can Happen Here,"March 1, 2024",https://www.motherjones.com/politics/2024/03/it-can-happen-here-trump-authoritarianism-fascism/
Joe Biden’s Age Is an Issue. So Is How the Media Covers It.,"February 13, 2024",https://www.motherjones.com/politics/2024/02/joe-bidens-age-is-an-issue-so-is-how-the-media-cover-it/
Lawmakers Are Finally Taking Action to Prevent Kids From Being Warehoused in Psych Hospitals,Julia Lurie,https://www.motherjones.com/politics/2024/03/north-star-alaska-child-welfare-foster-kids-psychiatric-hospitals/
We Exposed the Mormon Church’s Protection of an Ex-Bishop Accused of Sexual Abuse. He Was Just Arrested.,Michael Montgomery,https://www.motherjones.com/politics/2024/03/ap-reveal-cir-mormon-bishop-alleged-child-sex-abuse-arrest/
New EPA Rule Cracks Down on Toxic Chemical That Sterilizes Medical Equipment,Lylla Younes,https://www.motherjones.com/environment/2024/03/new-epa-rule-cracks-down-on-toxic-chemical-that-sterilizes-medical-equipment/
"With Biden on the Campaign Trail, It’s Time to Fact-Check His Climate Plans",Oliver Milman and Nina Lakhani,https://www.motherjones.com/politics/2024/03/with-biden-on-the-campaign-trail-its-time-to-fact-check-his-climate-plans/
This Week’s Episode of Reveal: How to Catch a Corrupt Philly Cop,Jamilah King,https://www.motherjones.com/criminal-justice/2024/03/this-weeks-episode-of-reveal-how-to-catch-a-corrupt-philly-cop/
Nex Benedict’s Death Triggers Federal Investigation,Arianna Coghill,https://www.motherjones.com/criminal-justice/2024/03/nex-benedict-federal-education/
Elon Musk Keeps Spreading a Very Specific Kind of Racism,Arianna Coghill and Garrison Hayes,https://www.motherjones.com/politics/2024/03/elon-musk-racist-tweets-science-video/
"Texas School Can Suspend Black Student for His Hair, Court Rules",Arianna Coghill,https://www.motherjones.com/mojo-wire/2024/02/texas-school-can-suspend-black-student-for-his-hair-court-rules/
Let’s Not Take Over-the-Counter Birth Control Pills for Granted,Jackie Flynn Mogensen,https://www.motherjones.com/politics/2024/03/the-pill-drugstore-birth-control-elaine-tyler-may/
What if Everything We Are Told to Think About Periods Is Wrong?,Maddie Oatman,https://www.motherjones.com/politics/2024/03/periods-menstruation-jen-gunter-stigma-patriarchy-blood-abortion/
Biden’s Highest-Ranking Trans Official Is Learning the Limits of Representation,Nathan Kohrman,https://www.motherjones.com/politics/2024/03/bidens-highest-ranking-trans-official-is-learning-the-limits-of-representation/
"Telehealth Abortions Continue to Rise—Even in Banned States, A New Study Shows",Julianne McShane,https://www.motherjones.com/politics/2024/02/telehealth-abortions-continue-to-rise-even-in-banned-states-a-new-study-shows/
,,https://www.motherjones.com/politics/2024/03/american-labor-ehrp-mother-jones-magnum-photography/
,,https://www.motherjones.com/politics/2024/02/domestic-violence-work-dobbs-roe/
,,https://www.motherjones.com/criminal-justice/2023/10/foster-kids-psychiatric-hospitals-universal-health-services-uhs-alaska-cps/
,,https://www.motherjones.com/politics/2023/09/unhoused-california-photo-essay/
School Shooter’s Mother Convicted in Historic Manslaughter Trial,Mark Follman,https://www.motherjones.com/politics/2024/02/jennifer-crumbley-trial-oxford-school-shooting-michigan/
"Abbott: Texas Would Shoot Migrants, But Biden “Would Charge Us With Murder”",Julianne McShane,https://www.motherjones.com/politics/2024/01/greg-abbott-texas-shoot-migrants-border-biden-murder/
Some Academics Get Funding for Propping Up the Livestock Industry,Georgina Gustin,https://www.motherjones.com/environment/2024/03/some-academics-get-funding-for-propping-up-the-livestock-industry/
Banned Wildlife Products Are Rampant on Facebook Marketplace,Marina Wang,https://www.motherjones.com/environment/2024/03/banned-illegal-wildlife-products-poaching-facebook-marketplace/
Is It Illegal For the White House to Fight COVID Misinfo? Up to SCOTUS.,Julia Métraux,https://www.motherjones.com/politics/2024/02/is-it-illegal-for-the-white-house-to-fight-covid-misinfo-up-to-scotus/
The Internet’s Favorite Supplement Titan Appears to Be Taking Cues From a Psychic,Kiera Butler,https://www.motherjones.com/politics/2024/02/joseph-mercola-the-internets-favorite-supplement-titan-appears-to-be-taking-cues-from-a-psychic/
The Migrant Families Separated Under Trump Are Still in Legal Limbo,Isabela Dias,https://www.motherjones.com/politics/2024/02/migrant-families-trump-zero-tolerance-six-years-later/
The GOP Border Bill Would Deport Families of Child Migrants,Nina Wang,https://www.motherjones.com/politics/2024/02/hr2-child-migrants-immigration/
