title,byline,url
Federal Court: TikTok May Be Liable for a 10-Year-Old’s Death,Abby Vesoulis,https://www.motherjones.com/politics/2024/08/federal-court-tiktok-230-liable-blackout-challenge-nylah-anderson-death/
Federal Court: TikTok May Be Liable for a 10-Year-Old’s Death,Abby Vesoulis,https://www.motherjones.com/politics/2024/08/federal-court-tiktok-230-liable-blackout-challenge-nylah-anderson-death/
The Two States Where the GOP Is Taking on Ableist Language,Julia Métraux,https://www.motherjones.com/politics/2024/08/nevada-north-dakota-ableist-language-gop-bipartisan-disability-rights/
These School Buses No Longer Belch Pollution. They Also Give the Grid a Break,Matt Simon,https://www.motherjones.com/environment/2024/08/oakland-unified-electric-school-buses-pollution-power-grid-battery-storage/
Trump’s Baseless Claims About the Assassination Attempt Are Dangerous,Mark Follman,https://www.motherjones.com/politics/2024/08/trump-assassination-attempt-blame-biden-harris/
JD Vance Responds to Trump Team’s Arlington Altercation With Lies and Telling Harris to “Go to Hell”,Julianne McShane,https://www.motherjones.com/politics/2024/08/jd-vance-arlington-cemetery-trump-harris-attack/
Theo Von Asked All the Right Questions. Trump Gave the Wrong Answers.,Russ Choma,https://www.motherjones.com/politics/2024/08/theo-von-donald-trump-bernie-sanders/
Inside One of the Last Hospitals in Gaza,Sophie Hurwitz,https://www.motherjones.com/politics/2024/08/gaza-european-hospital-doctor-palestine-israel-war/
,,https://www.motherjones.com/politics/2024/08/trump-maga-dnc-project-2025-video-reactions-strategy/
,,https://www.motherjones.com/politics/2024/08/black-republicans-trump-maga-kamala-video/
,,https://www.motherjones.com/politics/2024/08/kamala-harris-climate-crisis-policy-environment/
,,https://www.motherjones.com/politics/2024/08/why-does-weird-work-tim-walz-republican-democrat-2024-election-trump/
"Brutal: Extreme Heat Has Wiped Out Some 21,500 Americans in 24 Years",Anna Betts,https://www.motherjones.com/environment/2024/08/extreme-heat-related-death-toll-united-states-study/
Trump Staff Reportedly Fought at Military Graveyard to Get Good Photo for Social Media,Julianne McShane,https://www.motherjones.com/politics/2024/08/trump-arlington-national-cemetery-photograph-fight-staff/
Rootless Masculinity Influencers Are Pivoting to Wildly Antisemitic Claims,Anna Merlan,https://www.motherjones.com/politics/2024/08/masculinity-influencers-antisemitism/
Trump’s January 6 Charges Have Been Renewed—Despite His “Absolute Immunity”,Dan Friedman,https://www.motherjones.com/politics/2024/08/trump-january-6-special-counsel-jack-smith-charges-justice-department/
Which Climate Policies Work Best? This New Study Offers Clues.,Kate Yoder,https://www.motherjones.com/politics/2024/08/science-study-climate-policies-effectiveness/
"Trump Said Some Disabled People “Should Just Die,” According to His Nephew",Julia Métraux,https://www.motherjones.com/mojo-wire/2024/07/donald-trump-nephew-disabled-people-die/
Biden’s $30m Weekend Fundraising Blitz Breaks Democratic Party Records,James West,https://www.motherjones.com/politics/2024/06/biden-campaign-fundraiser-30-million-hollywood-clooney-obama/
North Carolina House Passes Revised Mask Ban,Julia Métraux,https://www.motherjones.com/politics/2024/06/north-carolina-house-passes-revised-mask-ban/
JD Vance’s Racist Populism,"August 9, 2024",https://www.motherjones.com/politics/2024/08/jd-vance-racist-populism-white-privilege-trump-harris/
Here’s How Biden Could Rattle Trump in Their First Debate,"June 24, 2024",https://www.motherjones.com/politics/2024/06/trump-biden-first-debate-rattle-ridicule-cnn/
The Most Under-Covered Story of 2024: Trump and Right-Wing Extremism,"June 13, 2024",https://www.motherjones.com/politics/2024/06/donald-trump-turning-point-usa-charlie-kirk-right-wing-extremism-our-land-david-corn/
,,https://www.motherjones.com/criminal-justice/2024/07/churn-mental-illness-opioids-seattle-homelessness/
,,https://www.motherjones.com/media/2024/07/the-latest-reveal-podcast-shows-how-the-mormon-church-thwarts-child-sex-abuse-claims/
,,https://www.motherjones.com/politics/2024/06/40-acres-lie-skidaway-island-georgia-racism-the-landings-reveal/
,,https://www.motherjones.com/politics/2024/06/new-reveal-episode-40-acres-lie-part-1/
Tim Walz Was No Protest Leader,Eamon Whalen,https://www.motherjones.com/politics/2024/08/tim-walz-protests-2020-encouraged-vance-george-floyd-frey-minneapolis/
Hundreds More Former GOP Officials Endorse Harris,Julianne McShane,https://www.motherjones.com/politics/2024/08/hundreds-more-former-gop-officials-endorse-harris/
Kamala Harris Barely Mentioned Climate at the DNC. Does It Matter?,Jackie Flynn Mogensen,https://www.motherjones.com/politics/2024/08/kamala-harris-walz-climate-dnc-democrats-convention-global-threat/
The Sunrise Movement Thinks Climate Is the Key to Voters’ Trust,Siri Chilukuri,https://www.motherjones.com/politics/2024/08/sunrise-movement-climate-voters-trust-kamala-harris-green-new-deal/
"Judge Rules Breonna Taylor’s Boyfriend, Not the Police, Caused Her Death",Samantha Michaels,https://www.motherjones.com/criminal-justice/2024/08/judge-rules-breonna-taylors-boyfriend-not-the-police-caused-her-death/
What Would It Mean to Have a Prosecutor as President Right Now?,Samantha Michaels,https://www.motherjones.com/politics/2024/07/kamala-harris-prosecutor-attorney-general-trump-criminal-convictions-presidential-race/
"Michelle Obama: Yes, We Have Affirmative Action for the Wealthy",Michael Mechanic,https://www.motherjones.com/politics/2024/08/michelle-obama-affirmative-action-rich-generational-wealth-democratic-convention-speech/
She Called the Police for Help. They Killed Her Instead.,Arianna Coghill,https://www.motherjones.com/criminal-justice/2024/07/sonya-massey-police-killing-illinois-sangamon-sheriff/
"JD Vance Called Democrats a “Childless Cabal,” But We Did the Math",Michael Mechanic,https://www.motherjones.com/politics/2024/08/jd-vance-democrats-childless-cabal/
Will Ohio Strike Down Its Draconian Gender-Affirming Care Ban?,Sarah Szilagy,https://www.motherjones.com/politics/2024/07/will-ohio-strike-down-its-draconian-gender-affirming-care-ban/
"In Republican Primary, Bigot Loses to Election Denier",Sophie Hurwitz,https://www.motherjones.com/politics/2024/08/valentina-gomez-missouri-bigot-election-denier-hoskins/
Why Smashing the Administrative State Is a Disaster for Reproductive Rights,Nina Martin,https://www.motherjones.com/politics/2024/07/why-smashing-the-administrative-state-is-a-disaster-for-reproductive-rights/
,,https://www.motherjones.com/politics/2024/08/trump-mass-deportation-plan-immigration-border-patrol-ice-dhs-migrants-undocumented/
,,https://www.motherjones.com/politics/2024/07/the-secret-plan-to-strike-down-us-gun-laws/
,,https://www.motherjones.com/criminal-justice/2024/05/threat-assessment-mass-shooting-elliot-rodger-isla-vista-mother/
,,https://www.motherjones.com/criminal-justice/2023/10/foster-kids-psychiatric-hospitals-universal-health-services-uhs-alaska-cps/
“People Will Literally Die.” America’s Youngest Congressman Sounds the Alarm.,Garrison Hayes,https://www.motherjones.com/politics/2024/08/trump-kamala-maxwell-frost-guns-climate-interview-video/
JD Vance Reiterates False Claim That Democrats “Tried to Kill” Trump,Mark Follman,https://www.motherjones.com/politics/2024/08/jd-vance-trump-assassination-attempt-democrats/
This Long-Dead Scientist’s Collection of Rare Seeds Could Help Keep Us Alive,Robin McKie,https://www.motherjones.com/environment/2024/07/arthur-watkins-wheat-seed-collection-rare-varieties-food-supply/
Why Donald Trump’s Plan to Stop Taxing Tips Is a Lame Political Stunt,Judd Legum,https://www.motherjones.com/politics/2024/07/donald-trump-proposal-no-tax-tips/
"A Long Island County Banned Masks, and Disabled People Are Suing",Julia Métraux,https://www.motherjones.com/politics/2024/08/long-island-mask-ban-class-action-disability-lawsuit/
Tim Walz Is Leading the Way on Long Covid Funding,Julia Métraux,https://www.motherjones.com/politics/2024/08/tim-walz-minnesota-long-covid-funding-harris-vp/
Vance Leaves Door Open to Renewed Family Separations Under Trump,Julianne McShane,https://www.motherjones.com/politics/2024/08/jd-vance-family-separation/
Migrant Encounters at the Border Hit Lowest Number in Four Years,Isabela Dias,https://www.motherjones.com/politics/2024/08/migrant-encounters-at-the-border-hit-lowest-number-in-four-years/
