title,byline,url
Biden Believes He Has “the Authority” to Use 14th Amendment in Debt Ceiling Battle,Ali Breland,https://www.motherjones.com/politics/2023/05/biden-believes-he-has-the-authority-to-use-14th-amendment-in-debt-ceiling-battle/
Biden Believes He Has “the Authority” to Use 14th Amendment in Debt Ceiling Battle,Ali Breland,https://www.motherjones.com/politics/2023/05/biden-believes-he-has-the-authority-to-use-14th-amendment-in-debt-ceiling-battle/
Ron DeSantis Would Love to Borrow Your Plane,Tim Murphy,https://www.motherjones.com/politics/2023/05/ron-desantis-would-love-to-borrow-your-plane/
Donald Trump Hasn’t Said Much About Daniel Penny. He Doesn’t Need To.,Tim Murphy,https://www.motherjones.com/politics/2023/05/donald-trump-hasnt-said-much-about-daniel-penny-he-doesnt-need-to/
George Santos Just Hired the Only Man He Can Trust,Tim Murphy,https://www.motherjones.com/politics/2023/05/george-santos-just-hired-the-only-man-he-can-trust/
Biden Administration Seeks to Curb Misleading Use of Recycling Logo,Oliver Milman,https://www.motherjones.com/environment/2023/05/epa-rule-misleading-recycling-logo/
The Republican War on Alejandro Mayorkas—the Man With the Most Impossible Job in DC,Isabela Dias,https://www.motherjones.com/politics/2023/05/the-republican-war-on-alejandro-mayorkas-the-man-with-the-most-impossible-job-in-dc/
House Republicans’ Work Requirements “Are Not About Work”,Michael Mechanic,https://www.motherjones.com/politics/2023/05/house-republicans-work-requirements-harm-poor-matthew-desmond-poverty-america-interview/
How Would Ron DeSantis “Make America Florida”?,Arianna Coghill,https://www.motherjones.com/politics/2023/05/ron-desantis-laws/
Work Requirements for Federal Aid Programs Are a Bad Idea,Abigail Weinberg,https://www.motherjones.com/politics/2023/05/work-requirements-bad-idea-biden-debt-ceiling-mccarthy/
Supreme Court Declines to Make It Easier to Sue Social Media Companies,Abby Vesoulis,https://www.motherjones.com/politics/2023/05/section-230-gonzalez-supreme-court-decision/
,,https://www.motherjones.com/politics/2023/05/video-clarence-thomas-scandals-harlan-crow-billionaire-black-nationalism/
,,https://www.motherjones.com/politics/2023/04/fox-news-fired-tucker-carlson-response-same-old-bs/
,,https://www.motherjones.com/politics/2023/04/kamala-harris-black-tennessee-lawmakers-reaction-biden-obama/
Trump Wants Credit for All the Abortion Bans. He Also Doesn’t Have a Policy.,Inae Oh,https://www.motherjones.com/politics/2023/05/donald-trump-abortion-2024-position/
A Problem for DeSantis: Reports Say He Has No Rizz,Abigail Weinberg,https://www.motherjones.com/politics/2023/05/ron-desantis-trump-the-problem-of-rizz/
Liberals Aren’t the Ones Canceling Motherhood,Abigail Weinberg,https://www.motherjones.com/mojo-wire/2023/05/fox-news-motherhood-mothers-day-column/
Experiencing Space Flight Just Got a Lot More Accessible,Daniel King,https://www.motherjones.com/recharge/2022/12/space-flight-portal/
"Remembering George Pérez, a Superhero of Superhero Comics",Dan Spinelli,https://www.motherjones.com/recharge/2022/05/remembering-george-perez-a-superhero-of-superhero-comics/
Ukrainian and Russian Dancers Join Onstage (in Italy) to Fundraise for the Red Cross,Daniel King,https://www.motherjones.com/recharge/2022/04/ukrainian-russian-antiwar-ballet-dancers-for-peace/
How John Durham Succeeded by Failing,David Corn,https://www.motherjones.com/politics/2023/05/how-john-durham-succeeded-by-failing/
Montana GOP Just Passed an Aggressive Law to Thwart Climate Science,Kristoffer Tigue,https://www.motherjones.com/politics/2023/05/montana-republicans-pass-anti-climate-science-law/
One Simple Way to Slash Methane Pollution: Composting,Max Graham,https://www.motherjones.com/environment/2023/05/methane-emissions-reduction-landfill-composting-study/
Oceans Protect Us by Absorbing Vast Amounts of Heat—but Payback Is Coming,Graham Readfearn,https://www.motherjones.com/environment/2023/05/oceans-warming-heat-absorption-rising-surface-temperature/
Bolsonaro Allegedly Falsified His Vaccination Status to Enter the US,Isabela Dias,https://www.motherjones.com/politics/2023/05/bolsonaro-allegedly-falsified-his-vaccination-status-to-enter-the-us/
The Coming Tidal Wave of Right Wing Covid Lawsuits,Kiera Butler,https://www.motherjones.com/politics/2023/04/the-coming-tidal-wave-of-right-wing-covid-lawsuits/
Alaskan Fishing Boats Are Poaching Threatened Canadian Salmon,Rochelle Baker,https://www.motherjones.com/politics/2023/05/alaska-fishing-boats-poaching-canadian-salmon/
What If We Tricked Locusts Into Eating Each Other?,Hannah Devlin,https://www.motherjones.com/environment/2023/05/nontoxic-pest-control-locusts-cannibalism-pheromones/
She Filmed a Teacher Saying the N-Word. Then She Got Suspended For It.,Arianna Coghill,https://www.motherjones.com/crime-justice/2023/05/mary-walton-missouri-n-word-suspended/
Daniel Penny Charged With Second-Degree Manslaughter,Arianna Coghill,https://www.motherjones.com/crime-justice/2023/05/daniel-penny-second-degree-manslaughter/
The DOJ Just Moved to Stop Florida’s “Sabotage” of Biden’s Border Plans,Jackie Flynn Mogensen,https://www.motherjones.com/politics/2023/05/the-doj-just-moved-to-stop-floridas-sabotage-of-bidens-border-plans/
"As the Pandemic Formally Ends, a Border Policy Booting Asylum Seekers Will Finally Lift",Isabela Dias,https://www.motherjones.com/politics/2023/05/title-42/
,,https://www.motherjones.com/politics/2023/05/utahs-suicide-pact-with-the-fossil-fuel-industry/
,,https://www.motherjones.com/media/2023/04/asphalt-video-games-microtransactions-loot-boxes-in-game-purchases-capitalism/
,,https://www.motherjones.com/politics/2023/03/anti-trans-transgender-health-care-ban-legislation-bill-minors-children-lgbtq/
,,https://www.motherjones.com/crime-justice/2023/03/who-killed-rasheem-carter/
She Filmed a Teacher Saying the N-Word. Then She Got Suspended For It.,Arianna Coghill,https://www.motherjones.com/crime-justice/2023/05/mary-walton-missouri-n-word-suspended/
"Louisiana Lawmakers Want to Release Youth Criminal Records. But First, Only In Majority Black Areas.",Jackie Flynn Mogensen,https://www.motherjones.com/politics/2023/05/louisiana-lawmakers-want-to-release-youth-criminal-records-but-first-only-in-majority-black-areas/
Daniel Penny Charged With Second-Degree Manslaughter,Arianna Coghill,https://www.motherjones.com/crime-justice/2023/05/daniel-penny-second-degree-manslaughter/
A Black Teen Rang the Wrong Doorbell. A White Homeowner Shot Him.,Abigail Weinberg,https://www.motherjones.com/crime-justice/2023/04/black-teen-ralph-yarl-shot-white-homeowner-rang-doorbell-missouri/
