title,byline,url
GOP Sen. Tuberville Thinks You’re Complaining Too Much About the Heat,Russ Choma,https://www.motherjones.com/politics/2023/07/gop-sen-tuberville-thinks-youre-complaining-too-much-about-the-heat/
GOP Sen. Tuberville Thinks You’re Complaining Too Much About the Heat,Russ Choma,https://www.motherjones.com/politics/2023/07/gop-sen-tuberville-thinks-youre-complaining-too-much-about-the-heat/
Another Indictment! Trump Told Aides to Delete Security Footage in Coverup Attempt,Dan Friedman and Abigail Weinberg,https://www.motherjones.com/politics/2023/07/trump-charges-indictment-mar-a-lago-classified-footage/
Cities Are Grappling With “Forever Chemicals” in Drinking Water,Sarah Trent,https://www.motherjones.com/politics/2023/07/pfas-forever-chemicals-city-drinking-water-vancouver-epa-limits/
The Colorado Provides Drinking Water to 40 Million People. Do They Know What Utah Does to It Upstream?,Stephanie Mencimer,https://www.motherjones.com/environment/2023/07/uinta-basin-colorado-river-fracking-oil-gas/
Voting Rights Are Still Under Assault. Sen. Raphael Warnock Has a New Plan to Protect Them.,Ari Berman,https://www.motherjones.com/politics/2023/07/raphael-warnock-voting-rights/
How Florida Undermined the “Benefits” of Newly Free Black People,Michael Mechanic,https://www.motherjones.com/politics/2023/07/slavery-beneficial-skills-florida-ron-desantis-stop-woke-black-codes/
Lawmakers Spoke Up For an Indicted Chinese Mogul. Campaign Cash Followed.,Dan Friedman,https://www.motherjones.com/politics/2023/07/george-santos-paul-gosar-andy-ogles-guo-wengui-steve-bannon-lawmakers-spoke-up-for-an-indicted-chinese-mogul-campaign-cash-followed/
The Clean Energy Transition Is “Vulnerable to Abuse by Malicious Actors”,Joseph Winters,https://www.motherjones.com/politics/2023/07/commodity-futures-trading-commission-carbon-offsets-market-manipulation/
Ivermectin May Be Good for Humans After All—Indirectly,Maryn McKenna,https://www.motherjones.com/environment/2023/07/ivermectin-deer-study-lone-star-ticks-lyme/
Birthright Citizenship Is Fundamental to “Who We Are as a Nation.” So Why Do Republicans Attack It?,Isabela Dias,https://www.motherjones.com/politics/2023/07/birthright-citizenship-is-fundamental-to-who-we-are-as-a-nation-so-why-do-republicans-attack-it/
,,https://www.motherjones.com/politics/2023/07/tim-scott-south-carolina-video-gop-primary-race-racism-buffalo-charlottesville-trump/
,,https://www.motherjones.com/politics/2023/06/nikki-haley-barack-obama-video-race-2024-daily-mail/
,,https://www.motherjones.com/media/2023/05/halle-bailey-ariel-little-mermaid-backlash-ebony-elizabeth-thomas-interview/
Not Everyone Is Happy About E-Bikes in National Parks,Abigail Weinberg,https://www.motherjones.com/mojo-wire/2023/07/not-everyone-is-happy-about-e-bikes-in-national-parks/
UPS and Teamsters Reach Deal to Avert Strike,Abigail Weinberg,https://www.motherjones.com/mojo-wire/2023/07/ups-and-teamsters-reach-deal-to-avert-strike/
"Massive Crowds of Israelis Are Protesting Netanyahu’s Supreme Court Power Play, Again",Dan Friedman,https://www.motherjones.com/politics/2023/07/israeli-protests-netanyahu-supreme-court-massive-crowds-jerusalem/
Watch 25-Year-Old Sabrina Ionescu Beat Steph Curry’s 3-Point Contest Record,Julia Lurie,https://www.motherjones.com/recharge/2023/07/sabrina-ionescu-steph-curry-record-wnba-nba-3-point-contest/
Experiencing Space Flight Just Got a Lot More Accessible,Daniel King,https://www.motherjones.com/recharge/2022/12/space-flight-portal/
"Remembering George Pérez, a Superhero of Superhero Comics",Dan Spinelli,https://www.motherjones.com/recharge/2022/05/remembering-george-perez-a-superhero-of-superhero-comics/
Report: More Than 3 Million People Were Kicked Off of Medicaid in 38 States,Arianna Coghill,https://www.motherjones.com/politics/2023/07/report-more-than-3-million-people-were-kicked-off-of-medicaid-in-38-states/
The Latest Congressional Hearing on UFOs Was Full of Wild Claims,Sophie Hayssen,https://www.motherjones.com/politics/2023/07/congress-ufo-hearing-david-grusch/
Tesla Can’t Even Do the One Thing It’s Supposed to Be Good At,Abigail Weinberg,https://www.motherjones.com/environment/2023/07/tesla-ev-battery-range/
The New Tucker Is Just Like the Old Tucker: a Climate Denialist,Kristoffer Tigue,https://www.motherjones.com/environment/2023/07/jesse-watters-tucker-carlson-fox-news-climate-denialism/
RFK Jr. Wants to Make It Easier for Doctors to Spread Medical Lies,Kiera Butler,https://www.motherjones.com/politics/2023/07/rfk-jr-ab-2098-california-misinformation-doctors/
Tightly Packed Poultry and Pig Farms Could Be Incubating the Next Deadly Flu,Tom Philpott,https://www.motherjones.com/environment/2023/06/tightly-packed-poultry-and-pig-farms-could-be-incubating-the-next-deadly-flu/
The End of Russia and Ukraine’s Grain Deal Is Bad News For The Global Food Supply,Eamon Whalen,https://www.motherjones.com/politics/2023/07/the-end-of-russia-and-ukraines-grain-deal-is-bad-news-for-the-global-food-supply/
The Perils of Farming Salmon in a Warming World,Jessica McKenzie,https://www.motherjones.com/environment/2023/07/salmon-fish-farming-aquaculture-environmental-hazards-patagonia-chile/
Disability “Testers” Keep Businesses Accessible. Will SCOTUS Ban Them?,Julia Métraux,https://www.motherjones.com/crime-justice/2023/07/disability-testers-keep-businesses-accessible-will-scotus-ban-them/
Court: Time for Florida to Stop Needlessly Institutionalizing Disabled Kids,Julia Métraux,https://www.motherjones.com/crime-justice/2023/07/court-time-for-florida-to-stop-needlessly-institutionalizing-disabled-kids/
Federal Judge Blocks Biden Administration’s Rule Restricting Asylum,Isabela Dias,https://www.motherjones.com/politics/2023/07/federal-judge-blocks-biden-administrations-rule-restricting-asylum/
This Is How Northern Mexico Became a Climate Migration Destination,Caroline Tracey,https://www.motherjones.com/environment/2023/07/this-is-how-northern-mexico-became-a-climate-migration-destination/
,,https://www.motherjones.com/media/2023/07/are-you-there-god-its-me-shannon-hale/
,,https://www.motherjones.com/politics/2023/06/abortion-dobbs-health-care-doctors/
,,https://www.motherjones.com/politics/2023/03/anti-trans-transgender-health-care-ban-legislation-bill-minors-children-lgbtq/
,,https://www.motherjones.com/crime-justice/2023/03/who-killed-rasheem-carter/
Biden Designates National Monuments Honoring Emmett Till,Arianna Coghill,https://www.motherjones.com/politics/2023/07/biden-designates-national-monuments-honoring-emmett-till/
Civil Rights Groups Challenge Harvard’s Legacy Admissions,Arianna Coghill,https://www.motherjones.com/politics/2023/07/harvard-legacy-admissions/
"SCOTUS OKs Affirmative Action—if It Helps Black Americans Get in “the Bunker, Not the Boardroom”",Nia t. evans,https://www.motherjones.com/politics/2023/06/military-academy-exception-supreme-court-affirmative-action/
"After the Police Kill Your Loved One, Who Can You Lean On?",Samantha Michaels,https://www.motherjones.com/crime-justice/2023/06/after-the-police-kill-your-loved-one-who-can-you-lean-on/
