title,byline,url
Trump’s Lies About Abortion in America Were Particularly Appalling,Julianne McShane,https://www.motherjones.com/politics/2024/06/trumps-lies-about-abortion-in-america-were-particularly-appalling/
Trump’s Lies About Abortion in America Were Particularly Appalling,Julianne McShane,https://www.motherjones.com/politics/2024/06/trumps-lies-about-abortion-in-america-were-particularly-appalling/
"The First National Data on Birth Control Post-Dobbs Is Here, and the News Is Not Good",Nina Martin,https://www.motherjones.com/politics/2024/06/the-first-national-data-on-birth-control-post-dobbs-is-here-and-the-news-is-not-good/
Supreme Court Avoids Deciding Whether Women Can Get Emergency Abortions,Pema Levy,https://www.motherjones.com/politics/2024/06/moyle-idaho-supreme-court-abortion-leak/
The Race to Understand—and Profit From—Period Blood,Maddie Oatman,https://www.motherjones.com/politics/2024/06/menstruation-science-sexism-period-blood-qvin-rose-endometriosis-jen-gunter/
Trump Is Inciting Violence as the Election Approaches,Mark Follman,https://www.motherjones.com/politics/2024/06/donald-trump-violence-threats-fbi-migrants-judges/
The Utah Governor’s Lonely Crusade to Make Politics Nice Again,Stephanie Mencimer,https://www.motherjones.com/politics/2024/06/spencer-cox-phil-lyman-utah-disagree-better/
MAGA Candidate Loses Bid to Replace Mitt Romney,Stephanie Mencimer,https://www.motherjones.com/politics/2024/06/trent-staggs-john-curtis-maga-candidate-loses-bid-to-replace-mitt-romney/
,,https://www.motherjones.com/politics/2024/06/racist-comments-reconstruction-black-republicans-video/
,,https://www.motherjones.com/politics/2024/04/gaza-solidarity-encampments-columbia-college-campus-protest-palestine-israel-how-many-protests/
,,https://www.motherjones.com/politics/2024/04/trump-trial-hush-money-stormy-daniels-manhattan-video/
,,https://www.motherjones.com/politics/2024/04/minority-rule-video-democracy-ari-berman-founding-fathers/
"Rising Seas Will Disrupt Millions of US lives by 2050, Study Finds",Nina Lakhani,https://www.motherjones.com/environment/2024/06/rising-sea-levels-us-coastal-states-disruption-2050-study/
Jamaal Bowman Loses Primary to George Latimer—and a Lot of AIPAC Money,Sophie Hurwitz,https://www.motherjones.com/politics/2024/06/jamaal-bowman-loses-primary-to-george-latimer-and-a-lot-of-aipac-money/
Most Immigrant Deaths in ICE Detention Could Have Been Prevented,Isabela Dias,https://www.motherjones.com/politics/2024/06/most-immigrant-deaths-in-ice-detention-could-have-been-prevented/
US Surgeon General Declares Gun Violence a Public Health Crisis,Arianna Coghill,https://www.motherjones.com/politics/2024/06/us-surgeon-general-gun-violence-public-health-crisis/
Will Congress’ Power Over Tax Policy Survive This Supreme Court?,Michael Mechanic,https://www.motherjones.com/politics/2024/06/moore-us-supreme-court-ruling-pollock-congress-16th-amendment-taxation/
Biden’s $30m Weekend Fundraising Blitz Breaks Democratic Party Records,James West,https://www.motherjones.com/politics/2024/06/biden-campaign-fundraiser-30-million-hollywood-clooney-obama/
North Carolina House Passes Revised Mask Ban,Julia Métraux,https://www.motherjones.com/politics/2024/06/north-carolina-house-passes-revised-mask-ban/
Hunter Biden Convicted on Federal Gun Charges,Julia Métraux,https://www.motherjones.com/mojo-wire/2024/06/hunter-biden-gun-trial-jury-decision/
Here’s How Biden Could Rattle Trump in Their First Debate,"June 24, 2024",https://www.motherjones.com/politics/2024/06/trump-biden-first-debate-rattle-ridicule-cnn/
The Most Under-Covered Story of 2024: Trump and Right-Wing Extremism,"June 13, 2024",https://www.motherjones.com/politics/2024/06/donald-trump-turning-point-usa-charlie-kirk-right-wing-extremism-our-land-david-corn/
"Here Come the Russians, Again","May 24, 2024",https://www.motherjones.com/politics/2024/05/here-come-the-russians-again/
,,https://www.motherjones.com/politics/2024/06/40-acres-lie-skidaway-island-georgia-racism-the-landings-reveal/
,,https://www.motherjones.com/politics/2024/06/new-reveal-episode-40-acres-lie-part-1/
,,https://www.motherjones.com/environment/2024/06/reveal-arizona-water-the-grab/
,,https://www.motherjones.com/politics/2024/06/how-a-battle-over-solar-power-tore-one-new-york-community-apart/
“Storm Clouds Loom Ahead”: Justice Jackson Has a Warning About the Big SCOTUS Abortion Punt,Pema Levy,https://www.motherjones.com/politics/2024/06/supreme-court-emtala-abortion/
A Renowned Debate Expert on How Biden Can Beat Trump’s Lies in Real Time,Inae Oh,https://www.motherjones.com/politics/2024/06/biden-trump-2024-debate-mic-muting-cocaine/
G7 Nations Are Ignoring the “Cow in the Room”—Beef and Dairy Emissions,Ayurella Horn-Muller,https://www.motherjones.com/environment/2024/06/g7-summit-nations-ignoring-beef-dairy-agriculture-carbon-emissions/
"Finally, the American Climate Corps Is Getting Down to Business",Kate Yoder,https://www.motherjones.com/environment/2024/06/finally-the-american-climate-corps-is-getting-underway/
New Connecticut Law Aims to Support Victims of Sexual Assault—and Prevent Them From Being Treated Like Suspects,Rachel de Leon,https://www.motherjones.com/criminal-justice/2024/06/connecticut-law-sexual-assault-victim-suspect/
The Laws That Make It Shockingly Easy for Survivors to Be Jailed for Their Abusers’ Crimes,Shannon Heffernan,https://www.motherjones.com/politics/2024/06/the-laws-that-make-it-shockingly-easy-for-survivors-to-be-jailed-for-their-abusers-crimes/
The Shocking Discovery That Suddenly Made Reparations Deeply Personal for One Woman,Alexia Fernández Campbell and Nadia Hamdan,https://www.motherjones.com/politics/2024/06/the-shocking-discovery-that-suddenly-made-reparations-deeply-personal-for-one-woman/
Blood and Soil,April Simpson,https://www.motherjones.com/politics/2024/06/blood-and-soil/
Trad Wives Are Thriving in the Post-Dobbs Era,Morgan Jerkins,https://www.motherjones.com/politics/2024/06/trad-wife-wives-nara-smith-estee-williams-dobbs-roe-escapism/
Democrats Are Trying to Repeal a Zombie Law That Could Ban Abortion Nationwide,Julianne McShane,https://www.motherjones.com/politics/2024/06/democrats-are-trying-to-repeal-a-zombie-law-that-could-ban-abortion-nationwide/
Carvell Wallace on Life and Love and Coming of Age in a Cruel World,Carvell Wallace,https://www.motherjones.com/media/2024/05/carvell-wallace-another-word-love-memoir-book-excerpt/
Learning to Love My Trans Self After Conversion Therapy,Henry Carnell,https://www.motherjones.com/politics/2024/05/lgbtq-anti-trans-conversion-therapy-christianity/
,,https://www.motherjones.com/politics/2024/06/west-bank-midwives-maternal-health-crisis/
,,https://www.motherjones.com/politics/2024/06/how-q-became-everything-big-feature-wayfair-balenciaga/
,,https://www.motherjones.com/criminal-justice/2024/05/threat-assessment-mass-shooting-elliot-rodger-isla-vista-mother/
,,https://www.motherjones.com/criminal-justice/2023/10/foster-kids-psychiatric-hospitals-universal-health-services-uhs-alaska-cps/
The Supreme Court Just Proved That Its Gun Rulings Have Been a Disaster,Pema Levy,https://www.motherjones.com/politics/2024/06/supreme-court-guns-rahimi/
The Supreme Court Upholds a Law Disarming Domestic Abusers,Nina Martin,https://www.motherjones.com/politics/2024/06/supreme-court-upholds-law-disarming-domestic-abusers/
“The Whole Building Becomes This Big Brick Oven”,Frida Garza,https://www.motherjones.com/environment/2024/06/restaurant-workers-cooks-servers-extreme-heat/
Our Fixation on Forests as a Climate Solution Is Causing Problems,Kate Yoder,https://www.motherjones.com/environment/2024/05/forests-carbon-sequestration-climate-solutions-indigenous-people/
"Citing Health Concerns, Some Jewish New Yorkers Push Back Against Proposed Mask Ban",Julia Métraux,https://www.motherjones.com/politics/2024/06/hochul-mask-ban-new-york-subway-covid-israel-palestine/
RFK Jr. Is Even Crazier Than You Might Think,David Corn,https://www.motherjones.com/politics/2024/05/robert-kennedy-jr-conspiracy-theory-covid-pandemic-event-201/
"From VP Hype to Migrant Bashing, Trump’s Noise Machine Is on Full Blast",Julianne McShane,https://www.motherjones.com/politics/2024/06/trump-vp-migrants-ufc-christians/
Biden Gives Relief to Undocumented Spouses of US Citizens,Isabela Dias,https://www.motherjones.com/politics/2024/06/biden-gives-relief-to-undocumented-spouses-of-us-citizens/
