title,byline,url
"Donald Trump Sexually Abused and Defamed E. Jean Carroll, Jury Finds",Russ Choma,https://www.motherjones.com/politics/2023/05/donald-trump-sexually-abused-and-defamed-e-jean-carroll-jury-finds/
"Donald Trump Sexually Abused and Defamed E. Jean Carroll, Jury Finds",Russ Choma,https://www.motherjones.com/politics/2023/05/donald-trump-sexually-abused-and-defamed-e-jean-carroll-jury-finds/
Jordan Neely’s Family Is Demanding Justice. Protesters in New York Agree.,Arianna Coghill,https://www.motherjones.com/crime-justice/2023/05/jordan-neelys-family-is-demanding-justice-protesters-in-new-york-agree/
Alaskan Fishing Boats Are Poaching Threatened Canadian Salmon,Rochelle Baker,https://www.motherjones.com/politics/2023/05/alaska-fishing-boats-poaching-canadian-salmon/
Gov. Ron DeSantis Restricts Chinese Citizens From Buying Land in Florida,Arianna Coghill,https://www.motherjones.com/politics/2023/05/ron-desantis-florida-chinese-citizens-buying-land-florida/
Report: Man Risks Millions to Talk About Politics on Twitter,Jacob Rosenberg,https://www.motherjones.com/mojo-wire/2023/05/tucker-carlson-new-show-twitter-elon-musk/
Donald Trump Nabs the Critical Endorsement of His Wife,Inae Oh,https://www.motherjones.com/politics/2023/05/melania-endorses-donald-trump/
This Supreme Court Case Could Kneecap the Executive Branch,Zoya Teirstein,https://www.motherjones.com/environment/2023/05/supreme-court-loper-raimondo-case-biden-administration-executive-power/
The Texas Mall Massacre and the Disturbing Evolution of America’s Mass Shootings,Mark Follman,https://www.motherjones.com/politics/2023/05/texas-mass-shooting-shopping-mall-allen-greg-abbott-ar15s/
The Massive “Batteries” Hiding Beneath Our Feet,Matt Simon,https://www.motherjones.com/environment/2023/05/aquifer-thermal-energy-storage-heating-cooling-renewable-energy/
"The E. Jean Carroll Rape Case is Wrapping Up, and Trump Won't Be Testifying",Russ Choma,https://www.motherjones.com/politics/2023/05/deadline-looms-for-donald-trump-to-decide-whether-to-testify-in-e-jean-carroll-rape-case/
,,https://www.motherjones.com/politics/2023/04/fox-news-fired-tucker-carlson-response-same-old-bs/
,,https://www.motherjones.com/politics/2023/04/kamala-harris-black-tennessee-lawmakers-reaction-biden-obama/
,,https://www.motherjones.com/politics/2023/04/video-tennessee-democrat-interview-expulsion-covenant-shooting/
New York Bans Gas Stoves in New Buildings,Maggie Duffy,https://www.motherjones.com/mojo-wire/2023/05/new-york-gas-stoves-new-buildings/
Is Anyone Really Listening to E. Jean Carroll?,Inae Oh,https://www.motherjones.com/politics/2023/05/e-jean-carroll-testimony-trump-donald-assault/
I Don’t Think Someone “Ranting” on the Subway Means They Deserved to Die,Abigail Weinberg,https://www.motherjones.com/crime-justice/2023/05/subway-death-new-york-city-eric-adams-media-coverage/
Experiencing Space Flight Just Got a Lot More Accessible,Daniel King,https://www.motherjones.com/recharge/2022/12/space-flight-portal/
"Remembering George Pérez, a Superhero of Superhero Comics",Dan Spinelli,https://www.motherjones.com/recharge/2022/05/remembering-george-perez-a-superhero-of-superhero-comics/
Ukrainian and Russian Dancers Join Onstage (in Italy) to Fundraise for the Red Cross,Daniel King,https://www.motherjones.com/recharge/2022/04/ukrainian-russian-antiwar-ballet-dancers-for-peace/
Did Elon Musk Unleash Racist Dog Whistles to Woo Tucker Carlson?,Ali Breland,https://www.motherjones.com/politics/2023/05/elon-musk-tucker-carlson/
George Santos Surrenders to Face Federal Criminal Charges,Noah Lanard,https://www.motherjones.com/politics/2023/05/george-santos-surrenders-to-face-federal-criminal-charges/
What If We Tricked Locusts Into Eating Each Other?,Hannah Devlin,https://www.motherjones.com/environment/2023/05/nontoxic-pest-control-locusts-cannibalism-pheromones/
"Small Alaskan Town Plagued by a Foul, Chartreuse Menace",Saima Sidik,https://www.motherjones.com/environment/2023/05/blue-green-algae-cyanobacteria-fish-kills-alaska-research/
Bolsonaro Allegedly Falsified His Vaccination Status to Enter the US,Isabela Dias,https://www.motherjones.com/politics/2023/05/bolsonaro-allegedly-falsified-his-vaccination-status-to-enter-the-us/
The Coming Tidal Wave of Right Wing Covid Lawsuits,Kiera Butler,https://www.motherjones.com/politics/2023/04/the-coming-tidal-wave-of-right-wing-covid-lawsuits/
This Fun Guy Is Turning Fungi Into Meat,Marc Fawcett-Atkinson,https://www.motherjones.com/environment/2023/04/mycelium-meat-alternatives-plant-based-high-protein-maia-farms-gavin-schneider/
Fries With That Mammoth Burger?,Damian Carrington,https://www.motherjones.com/environment/2023/03/mammoth-burger-meatball-extinct-vow-cultivated-meat-climate-methane/
Jury to Decide Whether Donald Trump Raped and Defamed E. Jean Carroll,Russ Choma,https://www.motherjones.com/politics/2023/05/jury-decide-donald-trump-raped-defamed-e-jean-carroll/
Silicon Valley Elites Are Making San Francisco Unsafe and Unlivable,Angelica Cabral,https://www.motherjones.com/crime-justice/2023/04/silicon-valley-elites-are-making-san-francisco-unsafe-and-unlivable/
"As the Pandemic Formally Ends, a Border Policy Booting Asylum Seekers Will Finally Lift",Isabela Dias,https://www.motherjones.com/politics/2023/05/title-42/
"Johns Hopkins Said It Canceled Its ICE Contracts. Then, It Opened New Ones With Customs and Border Protection.",Maggie Duffy,https://www.motherjones.com/politics/2023/05/john-hopkins-ice-border-patrol-contracts/
,,https://www.motherjones.com/politics/2023/05/utahs-suicide-pact-with-the-fossil-fuel-industry/
,,https://www.motherjones.com/media/2023/04/asphalt-video-games-microtransactions-loot-boxes-in-game-purchases-capitalism/
,,https://www.motherjones.com/politics/2023/03/anti-trans-transgender-health-care-ban-legislation-bill-minors-children-lgbtq/
,,https://www.motherjones.com/crime-justice/2023/03/who-killed-rasheem-carter/
A Black Teen Rang the Wrong Doorbell. A White Homeowner Shot Him.,Abigail Weinberg,https://www.motherjones.com/crime-justice/2023/04/black-teen-ralph-yarl-shot-white-homeowner-rang-doorbell-missouri/
“Undemocratic”: Why Is Keith Ellison Taking Over a Case From a Prosecutor He Endorsed?,Eamon Whalen,https://www.motherjones.com/crime-justice/2023/04/minneapolis-keith-ellison-prosecutor-progressive-mary-moriarty-undemocratic/
Nashville Officials Unanimously Vote to Reinstate Justin Jones,Arianna Coghill,https://www.motherjones.com/politics/2023/04/justin-jones-nashville-vote/
Tennessee House Republicans Move to Expel Three Members for Gun Control Protest,Arianna Coghill,https://www.motherjones.com/politics/2023/04/tennessee-gop-republican-house-expel-members-gun-control-protest-nashville-shooting/
