title,byline,url
Trump’s Targets,Mother Jones Staff,https://www.motherjones.com/politics/2025/02/trump-second-term-the-hit-list-targeted-package-landing-page/
Trump’s Targets,Mother Jones Staff,https://www.motherjones.com/politics/2025/02/trump-second-term-the-hit-list-targeted-package-landing-page/
Everything Elon Musk Touches Is a Conflict of Interest,Tim Murphy,https://www.motherjones.com/politics/2025/02/elon-musk-conflicts-of-interest-tesla-spacex-starlink-south-africa-russia-taiwan-ukraine-doge-trump/
How Elon Musk and His DOGE Goons Are Following the Private Equity Playbook,Anna Merlan,https://www.motherjones.com/politics/2025/02/elon-musk-doge-private-equity/
No Jail for Bannon After Fraud Plea Deal,Dan Friedman,https://www.motherjones.com/politics/2025/02/steve-bannon-pleads-guilty-fraud-border-wall-new-york-bragg/
“A Real Estate Development for the Future”: Trump Doubles Down on Plan to Take Over Gaza,Julianne McShane,https://www.motherjones.com/politics/2025/02/trump-gaza-real-estate-takeover/
Elon Musk Keeps Boosting White Nationalists on X,Noah Lanard,https://www.motherjones.com/politics/2025/02/elon-musk-x-racists-boosting-white-nationalists-south-africa-antisemitism-adl-springfield-doge-holocaust/
Polls Keep Showing Americans Want Elon Musk and DOGE Out of Government,Julianne McShane,https://www.motherjones.com/politics/2025/02/polls-elon-doge-out-of-government/
,,https://www.motherjones.com/politics/2025/02/hidden-history-transgender-affirming-health-care/
,,https://www.motherjones.com/politics/2025/02/elon-musk-doge-idea-usgao-aoc/
,,https://www.motherjones.com/politics/2025/02/trump-vought-christian-nationalism-nar-prayer/
,,https://www.motherjones.com/politics/2025/02/lara-trump-fox-news-hires-a-trump-family-member-for-a-saturday-night-show/
These States Won’t Let Utilities Charge Customers for Their Lobbying and Marketing,Akielly Hu,https://www.motherjones.com/politics/2025/02/colorado-connecticut-maine-states-utilities-charge-customers-lobbying-marketing-legal-costs-shareholder-profits/
Trump Finally Found His Kind of Refugee,Ian Gordon,https://www.motherjones.com/politics/2025/02/donald-trump-elon-musk-south-africa-refugee-afrikaner/
Report: Elon’s Cybertrucks Are Deadlier Than Infamous Ford Pintos,Julianne McShane,https://www.motherjones.com/politics/2025/02/report-cybertruck-safety-ford-pinto/
Canada’s Trump Card in a Tariff War: Turning Off the Oil Taps,John Woodside,https://www.motherjones.com/politics/2025/02/canada-trump-tariff-war-crude-oil-supply-american-us-refineries/
A Federal Judge Blocked DOGE’s Access to Treasury Systems—for Now,Samantha Michaels,https://www.motherjones.com/politics/2025/02/federal-judge-blocks-doge-elon-musk-treasury-systems/
Elon Musk’s Use of AI to Slash Education Spending Could Put Disabled Students at Risk,Julia Métraux,https://www.motherjones.com/politics/2025/02/ai-artifical-intelligence-determine-cuts-department-education-disabled-students-disabiility-rights/
The Anti-Trump Resistance Is Alive at This Historic Black DC Church,Mother Jones,https://www.motherjones.com/politics/2025/01/garrison-hayes-video-inauguration-black-church/
Video: Here’s What Trump’s Most Faithful Fans Want to See Next,Mother Jones,https://www.motherjones.com/politics/2025/01/video-heres-what-trumps-most-faithful-fans-want-to-see-next/
It’s a War. Do Democrats Get That?,"February 4, 2025",https://www.motherjones.com/politics/2025/02/elon-musk-donald-trump-doge-treasury-opm-usaid-democrats-opposition/
A Parting Reminder From Jimmy Carter,"January 13, 2025",https://www.motherjones.com/politics/2025/01/a-parting-reminder-from-jimmy-carter/
How Kash Patel Became a Useful Idiot for Vladimir Putin,"December 9, 2024",https://www.motherjones.com/politics/2024/12/kash-patel-fbi-donald-trump-russia-scandal-putin-useful-idiot/
,,https://www.motherjones.com/politics/2025/01/war-horse-battle-fallujah-20-years-reveal-podcast-audio/
,,https://www.motherjones.com/politics/2025/01/reveal-episode-presidential-pardons/
,,https://www.motherjones.com/politics/2025/01/fortress-greece-refugees/
,,https://www.motherjones.com/politics/2024/12/this-weeks-episode-of-reveal-a-world-war-ii-incident-nearly-lost-to-history/
Trump Wants to Deport Student Protesters. I Would Be On the Top of the List,Sophie Hurwitz,https://www.motherjones.com/politics/2025/02/palestine-student-deportation-momodou-taal-interview/
The Danger of Trump’s Plan for a Private USPS,Alex Nguyen,https://www.motherjones.com/politics/2025/02/trump-cut-doge-post-office-usps/
Can the Rule of Law Save the IRA?,Henry Carnell,https://www.motherjones.com/politics/2025/02/targeted-package-biden-trump-ira-green-energy-investment/
Trump’s Pause on Cross-Border Collaboration Threatens Weather Forecasting and Fisheries Research,Marc Fawcett-Atkinson,https://www.motherjones.com/politics/2025/02/trump-pause-research-communications-foreign-nationals-noaa-weather-service-climate-science-fisheries/
Oklahoma Moms Locked Up for Their Abusers’ Violence Might Finally Get a Break,Samantha Michaels,https://www.motherjones.com/politics/2025/02/oklahoma-failure-to-protect-kerry-king-dave-rader/
She Was Raped and Relentlessly Demanded Answers—Until the City Took Her to Court for Harassment,Kelsey Turner,https://www.motherjones.com/criminal-justice/2025/02/seattle-suburb-snoqualmie-rape-police-requests-harassment/
Trump Tells DOJ to Prosecute Teachers Who “Unlawfully” Support Trans or Nonbinary Students,Sarah Szilagy and Madison Pauly,https://www.motherjones.com/politics/2025/01/trump-tells-doj-to-prosecute-teachers-who-unlawfully-support-trans-or-nonbinary-students/
What My Black Mother’s Involuntary Sterilization in 1965 Reveals About America Today,Catherine Coleman Flowers,https://www.motherjones.com/politics/2025/01/catherine-coleman-flowers-what-my-black-mothers-involuntary-sterilization-in-1965-reveals-about-america-today/
Finding My Trans Community Changed My Life. Now I Help Others Find Theirs.,Keira Richards as told to Madison Pauly,https://www.motherjones.com/politics/2025/02/transgender-pipeline-colorado-housing-keira-richards/
“Beyond Terrifying”—Being the Parent of a Trans Child with Trump in Office,Henry Carnell,https://www.motherjones.com/politics/2025/02/trump-targeted-package-trans-child-parent-interview/
Why Are Institutions Bowing to Trump’s Illegal Anti-Trans Orders?,Sarah Szilagy,https://www.motherjones.com/politics/2025/02/why-are-institutions-bowing-to-trumps-illegal-anti-trans-orders/
Government Commission Halts Investigations of LGBTQ+ Workplace Discrimination,Abby Vesoulis,https://www.motherjones.com/politics/2025/02/equal-opportunity-employment-commission-eeoc-halts-trans-sexual-orientation-lgbtq-dicrimination-cases-donald-trump-andrea-lucas/
,,https://www.motherjones.com/politics/2025/01/e-bike-subsidy-programs-denver-states-walkable-cities-urban-infrastructure/
,,https://www.motherjones.com/politics/2024/12/grip-there-are-many-programs-trying-to-reduce-recidivism-this-one-works/
,,https://www.motherjones.com/criminal-justice/2024/05/threat-assessment-mass-shooting-elliot-rodger-isla-vista-mother/
,,https://www.motherjones.com/criminal-justice/2023/10/foster-kids-psychiatric-hospitals-universal-health-services-uhs-alaska-cps/
The Secret Plan to Strike Down US Gun Laws,Will Van Sant,https://www.motherjones.com/politics/2025/01/constitutional-defense-fund-bruen-dark-money-ghost-guns-second-amendment/
Alex Jones Is Trying to Halt the Sale of Infowars. Elon Musk’s X Just Got Involved in the Case.,Anna Merlan,https://www.motherjones.com/politics/2024/11/alex-jones-infowars-sale-onion-elon-musk-x/
Trump’s Claim of Routing Water to Los Angeles Is Hogwash. It All Goes to Central Valley Megafarms.,Jake Bittle,https://www.motherjones.com/politics/2025/02/donald-trump-order-routing-water-los-angeles-fires-false-central-valley-megafarms-big-agriculture/
"We May Be Eating Microbes Soon, and That’s a Good Thing",Sara Talpos,https://www.motherjones.com/environment/2025/02/bacteria-algae-microorganisms-food-climate-effects-solein-protein-powder/
"How Trump Makes Tragedies Worse, A History",Julianne McShane,https://www.motherjones.com/politics/2025/01/how-trump-makes-tragedies-worse-a-history/
Inside the RFK Jr.-Alex Jones Bromance,Dan Friedman and David Corn,https://www.motherjones.com/politics/2025/01/rfk-jr-alex-jones-infowars-trump-del-bigtree/
“It’s a Free for All”: When ICE Comes for a Community,Leah Montange as told to Isabela Dias,https://www.motherjones.com/politics/2025/02/trump-ice-deportation-targeted-package-leah-montange/
“The System Is Made So That We Lose”,Maru Mora-Villalpando as told to Isabela Dias,https://www.motherjones.com/politics/2025/02/mass-deportation-immigrant-undocumented-activist-maru-mora-villalpando/
