title,byline,url
How Federal Judges Put a Trans Civil Rights Lawyer under Criminal Investigation,Pema Levy,https://www.motherjones.com/politics/2025/09/trans-civil-rights-lawyers-investigation/
How Federal Judges Put a Trans Civil Rights Lawyer under Criminal Investigation,Pema Levy,https://www.motherjones.com/politics/2025/09/trans-civil-rights-lawyers-investigation/
The Global Far Right Is Making Charlie Kirk a Martyr,Anna Merlan,https://www.motherjones.com/politics/2025/09/charlie-kirk-international-symbol/
Late-Night Rallies Around Jimmy Kimmel,Arianna Coghill,https://www.motherjones.com/politics/2025/09/jimmy-kimmel-late-night-support-stephen-colbert-jon-stewart/
The Supreme Court Greenlit Trump’s Political Prosecutions—Even Unlawful Ones,Pema Levy,https://www.motherjones.com/politics/2025/09/donald-trump-political-prosecutions-supreme-court/
The “Chaos and Cruelty” of Trump’s Worksite Immigration Raids,Isabela Dias,https://www.motherjones.com/politics/2025/09/trump-dhs-immigration-worksite-raids-hundai-plant-south-korea-homan-interview-raiding-homeland-lopez/
Gov. Spencer Cox Has Been Preaching Calm in a Violent Moment—But There’s Something Missing,Stephanie Mencimer,https://www.motherjones.com/politics/2025/09/gov-spencer-cox-has-been-preaching-calm-in-a-violent-moment-but-whats-missing/
Justice Department Aims to Kill State Laws That Compel Major Polluters to Pay for Climate Harm,Dharna Noor,https://www.motherjones.com/politics/2025/09/justice-department-vermont-new-york-laws-holding-major-polluters-accountable-climate-damages/
,,https://www.motherjones.com/politics/2025/09/hasan-piker-interview-charlie-kirk-killing/
,,https://www.motherjones.com/politics/2025/09/charlie-kirk-legacy-ezra-klein-2020-election-trump-turning-point/
,,https://www.motherjones.com/politics/2025/09/baltimore-national-guard-mayor-brandon-scott-video/
,,https://www.motherjones.com/politics/2025/08/taylor-swift-maga-trad-wives/
Senate Committee Seeks Intel on Polluters’ Efforts to Kill Critical EPA Rule,Dharna Noor,https://www.motherjones.com/politics/2025/09/senate-committee-environment-public-works-oil-industry-lobbying-epa-endangerment-rule/
“Amateur Hour”: The Man Sending US Military Contractors to Gaza,Noah Lanard,https://www.motherjones.com/politics/2025/09/gaza-military-contractor-ug-solutions-soundcloud-govoni-warcrimes-palestine-israel-ghf-aid/
Name the One Political Party Led by Those Who Call for Violence,David Corn,https://www.motherjones.com/politics/2025/09/charlie-kirk-republicans-gop-violence-democrats-hypocrisy/
The Trump Administration’s Latest Power Grab: Your Voter Data,Ari Berman,https://www.motherjones.com/politics/2025/09/the-trump-administrations-latest-power-grab-your-voter-data/
His Book on Charlie Kirk Was About to Come Out. Then His Subject Was Murdered.,Kiera Butler,https://www.motherjones.com/politics/2025/09/matthew-boedy-book-on-charlie-kirk-was-about-to-come-out-then-his-subject-was-murdered/
Trump’s Immigration Police State Is Growing at Warp Speed,Ian Gordon,https://www.motherjones.com/politics/2025/09/trump-287g-local-police-deportation-detention-ice/
"Stephen Miller Pours Fuel on the Fire, Again",Ian Gordon,https://www.motherjones.com/politics/2025/09/stephen-miller-charlie-kirk-tyler-robinson-extreme-rhetoric-id/
"Let’s Review Trump’s Week of Massive Legal Losses, Shall We?",Julianne McShane,https://www.motherjones.com/politics/2025/09/legal-defeats-trump-admin-agenda-courts-history/
Name the One Political Party Led by Those Who Call for Violence,"September 17, 2025",https://www.motherjones.com/politics/2025/09/charlie-kirk-republicans-gop-violence-democrats-hypocrisy/
Impeach RFK Jr.,"September 8, 2025",https://www.motherjones.com/politics/2025/09/impeach-rfk-jr-health-human-services-vaccines-senate/
Donald Trump Revs Up His Revenge Goons,"August 27, 2025",https://www.motherjones.com/politics/2025/08/donald-trump-revenge-retribution-john-bolton-kash-patel-fbi-raid/
,,https://www.motherjones.com/politics/2025/09/charlie-kirk-and-trumps-looming-political-crackdown/
,,https://www.motherjones.com/politics/2025/09/black-violence-generational-trauma-trymaine-lee/
,,https://www.motherjones.com/politics/2025/09/ice-raids-reveal-podcast/
,,https://www.motherjones.com/criminal-justice/2025/09/black-men-violence-america-trymaine-lee/
This Republican Attempt to Scuttle Federal Land Plans Could Cause Great Upheaval,Lois Parshley,https://www.motherjones.com/politics/2025/09/republican-senate-changes-congressional-review-act-federal-land-use-upheaval/
Both the Left and the Right are Targeted by Political Violence. Who Perpetrates It?,Abby Vesoulis,https://www.motherjones.com/politics/2025/09/both-the-left-and-the-right-are-targeted-by-political-violence-who-perpetrates-it/
Trump’s War on Wind Power Has One Very Big Exception,Russ Choma,https://www.motherjones.com/politics/2025/09/donald-trump-eric-trump-bitcoin-mining-wind-power/
North America’s First Battery-Grade Cobalt Refinery Is Proposed—in Canada,Abdul Matin Sarfraz,https://www.motherjones.com/environment/2025/09/ontario-canada-first-north-american-cobalt-refinery-proposal-ev-batteries/
The Key Missing Piece to the Megahit “Adolescence”,Mark Follman,https://www.motherjones.com/media/2025/09/adolescence-netflix-threat-assessment-violence-prevention/
Why Rehab Often Fuels Relapse Instead of Recovery,Reveal,https://www.motherjones.com/criminal-justice/2025/08/drug-rehab-addiction-opioids-shoshana-walter/
"The Supreme Court Says ICE Can Consider Race, But Colleges Can’t.",Pema Levy,https://www.motherjones.com/politics/2025/09/supreme-court-race-racial-profiling/
Ibram X. Kendi vs. America’s “Antiracism Backlash”,Reveal,https://www.motherjones.com/politics/2025/07/ibram-x-kendi-antiracism-dei-trump-howard-university/
Right-Wing Fanatics Are Weaponizing America’s Anti-Discrimination Agency,Abby Vesoulis,https://www.motherjones.com/politics/2025/09/donald-trump-weaponizing-equal-employment-opportunity-commission-stephen-miller-dei/
Republicans Want More Pregnant Women in Prisons. A New Book Describes What It’s Like.,Julianne McShane,https://www.motherjones.com/politics/2025/09/republicans-want-more-pregnant-women-in-prisons-a-new-book-describes-what-its-like/
"Trump’s Mental Health Plan: Defund, Incarcerate, Disappear",Julianne McShane and Julia Métraux,https://www.motherjones.com/politics/2025/08/trump-mental-health-housing-homelessness-institutionalization/
Mass Shooters Are Not Disproportionately Transgender,Abby Vesoulis,https://www.motherjones.com/politics/2025/08/mass-shooters-are-not-disproportionately-transgender/
,,https://www.motherjones.com/criminal-justice/2025/07/golden-state-killer-deangelo-victims-compensation-problems-police-accountability/
,,https://www.motherjones.com/politics/2025/07/how-the-world-bank-left-african-hospital-patients-detained-and-in-crushing-debt/
,,https://www.motherjones.com/politics/2025/09/gaza-military-contractor-ug-solutions-soundcloud-govoni-warcrimes-palestine-israel-ghf-aid/
,,https://www.motherjones.com/politics/2025/09/trumps-mortgage-fraud-smears-backfire-on-his-administration/
The Full Weight of the Federal Government Is Being Used to Memorialize Charlie Kirk,Anna Merlan,https://www.motherjones.com/politics/2025/09/the-full-weight-of-the-federal-government-is-being-used-to-memorialize-charlie-kirk/
Politicians Unite to Condemn Killing of Conservative Influencer Charlie Kirk,Julianne McShane,https://www.motherjones.com/politics/2025/09/conservative-influencer-charlie-kirk-shot-in-utah/
Can We Feed 10 Billion People Without Destroying the Planet in the Process?,Juanpablo Ramirez-Franco,https://www.motherjones.com/politics/2025/09/eating-earth-michael-grunwald-interview-food-agriculture-production-climate-biofuels/
Legalizing Wolf Hunting in the US West Does Little to Prevent Livestock Loss,Marina Dunbar,https://www.motherjones.com/environment/2025/08/ranchers-conservationists-wolf-hunting-livestock-fight-debate/
Welcome to the New Era of Covid Vaccine Tourism,Julia Métraux,https://www.motherjones.com/politics/2025/09/covid-vaccine-state-tourism-acip-rfk/
Florida’s Surgeon General Just Said He Will Eliminate “All Vaccine Mandates”,Kiera Butler,https://www.motherjones.com/politics/2025/09/joseph-ladapo-floridas-surgeon-general-just-said-he-will-eliminate-all-vaccine-mandates/
Elon Musk Urges Brits to “Fight Back” Against Their Political Enemies,Julianne McShane,https://www.motherjones.com/politics/2025/09/elon-musk-urges-brits-to-fight-back-against-their-political-enemies/
Mass Deportations Ensnare Immigrant Service Members and Veterans,Hannah Psalma Ramirez,https://www.motherjones.com/politics/2025/09/upheaval-immigrant-troops/
