title,byline,url
Howard Schultz Came Out of Retirement to Destroy Starbucks’ Union—and His Legacy,Noah Lanard,https://www.motherjones.com/politics/2023/03/howard-schultz-starbucks-union-busting-buffalo-brooklyn/
Howard Schultz Came Out of Retirement to Destroy Starbucks’ Union—and His Legacy,Noah Lanard,https://www.motherjones.com/politics/2023/03/howard-schultz-starbucks-union-busting-buffalo-brooklyn/
Republicans Are Trying to Link Mass Shootings to Trans People,Abby Vesoulis,https://www.motherjones.com/politics/2023/03/tennessee-school-shooting-trans-people-guns/
These Games Are Rigged—Like Our Economy,Michael Mechanic,https://www.motherjones.com/media/2023/03/capitalism-games-rigged-economy-monopoly-yahtzee/
"""I Am the School-to-Prison Pipeline"": How Terrance Roberts Plans to Fight Violence",Maggie Duffy,https://www.motherjones.com/crime-justice/2023/03/terrance-roberts-denver-mayor-election/
Seabed Mining for the Sake of Clean Energy Is a Wicked Trade-Off,Robin McKie,https://www.motherjones.com/environment/2023/03/deep-sea-mining-rare-metals-clean-energy-environmental-destruction-study/
Fries With That Mammoth Burger?,Damian Carrington,https://www.motherjones.com/environment/2023/03/mammoth-burger-meatball-extinct-vow-cultivated-meat-climate-methane/
The Government Subsidizes Electric Vehicles. Why Not E-Bikes?,David Zipper,https://www.motherjones.com/politics/2023/03/federal-subsidies-e-bikes-cars-climate-change/
DeSantis Seeks to Expand “Don’t Say Gay” Rules for All K-12 Students,Madison Pauly,https://www.motherjones.com/politics/2023/03/desantis-dont-say-gay-k-12-students-florida/
20 Striking Images of Protest Against Israeli Democracy Under Siege,Mark Murrmann,https://www.motherjones.com/politics/2023/03/images-photos-israel-knesset-judicial-reforms-protests-crowds-benjamin-netanyahu-democracy-corruption/
Anti-Abortion Republicans Are Pushing State Legislation to Undermine Election Results,Madison Pauly,https://www.motherjones.com/politics/2023/03/anti-abortion-republicans-elections-roe/
,,https://www.motherjones.com/politics/2023/03/reparations-tik-tok-instagram-history-racism-comments-reponses-video/
,,https://www.motherjones.com/politics/2023/03/anti-trans-transgender-health-care-ban-legislation-bill-minors-children-lgbtq/
,,https://www.motherjones.com/politics/2023/02/pastor-john-hagee-nikki-haley-donald-trump-gop-primary-extremism/
Someone Pull Me Away From Gwyneth Paltrow’s Ski Trial Drama,Inae Oh,https://www.motherjones.com/mojo-wire/2023/03/gwyneth-paltrow-ski-trial/
The Trump Protests So Far: Mostly Press and Also Someone in a Diaper,Noah Lanard,https://www.motherjones.com/mojo-wire/2023/03/trump-protests-press-diaper-indictment-grand-jury-manhattan-new-york/
Ohio Is Suing Norfolk Southern,Abigail Weinberg,https://www.motherjones.com/mojo-wire/2023/03/ohio-is-suing-norfolk-southern/
Experiencing Space Flight Just Got a Lot More Accessible,Daniel King,https://www.motherjones.com/recharge/2022/12/space-flight-portal/
"Remembering George Pérez, a Superhero of Superhero Comics",Dan Spinelli,https://www.motherjones.com/recharge/2022/05/remembering-george-perez-a-superhero-of-superhero-comics/
Ukrainian and Russian Dancers Join Onstage (in Italy) to Fundraise for the Red Cross,Daniel King,https://www.motherjones.com/recharge/2022/04/ukrainian-russian-antiwar-ballet-dancers-for-peace/
How the FBI Used ‘Cop City’ Protests to Snoop on Activists in Chicago,Adam Federman,https://www.motherjones.com/politics/2023/03/fbi-cop-city-protests-spying-activists-chicago-domestic-terrorism/
Crucial Supreme Court Race in Wisconsin Shatters Spending Record,Madison Pauly,https://www.motherjones.com/politics/2023/03/wisconsin-supreme-court-election-spending-abortion-2024/
“Cancer Alley” Residents’ Zoning Lawsuit Cites “Racial Cleansing”,James Bruggers,https://www.motherjones.com/politics/2023/03/cancer-alley-zoning-lawsuit-environmental-justice-race/
"In Utah, Protesting a Pipeline Might Get You Five Years in Prison",Naveena Sadasivam,https://www.motherjones.com/environment/2023/03/utah-critical-infrastructure-pipeline-protests-prison/
"After a Right-Wing Florida Hospital Protest, a Doctor Loses His Board Certification for Covid Disinformation",Kiera Butler,https://www.motherjones.com/politics/2023/03/sarasota-hospital-covid-misinformation-john-littell-desantis-ladapo/
Mike Flynn and MAGA Activists Wage War Against a Florida Hospital,Kiera Butler,https://www.motherjones.com/politics/2023/03/mike-flynn-and-maga-activists-wage-war-against-a-florida-hospital/
"Misuse of Phosphorus Is Wreaking Havoc, Scientists Warn",Robin McKie,https://www.motherjones.com/environment/2023/03/phosphorus-fertilizer-shortage-algae-dead-zones-environment-runoff/
State Legislatures Are Cracking Down on Foreign Land Ownership,Samuel Shaw,https://www.motherjones.com/politics/2023/03/state-legislatures-are-cracking-down-on-foreign-land-ownership/
The Cops Who Raided Afroman’s House Are Suing After Being Featured In His Music Videos,Arianna Coghill,https://www.motherjones.com/crime-justice/2023/03/afroman-house-raid-police-video-suing/
Rap On Trial Is Now Mainstream,Eamon Whalen,https://www.motherjones.com/crime-justice/2023/03/young-thug-gunna-rap-on-trial-lyrics-ysl-atlanta-erik-nielson/
Ron DeSantis Wants to Make Transporting Migrants a Felony,Isabela Dias,https://www.motherjones.com/politics/2023/02/ron-desantis-wants-to-make-transporting-migrants-a-felony/
The New York Times Just Dropped a Shocking Investigation on Child Labor in America,Arianna Coghill,https://www.motherjones.com/politics/2023/02/new-york-times-child-labor-immigrant-kids/
,,https://www.motherjones.com/politics/2023/03/drunk-driving-infastructure-bill-technology-dadss-safety/
,,https://www.motherjones.com/politics/2023/03/gianni-infantino-fifa-presidential-election-world-cup-qatar-soccer-football-human-rights/
,,https://www.motherjones.com/crime-justice/2023/03/who-killed-rasheem-carter/
,,https://www.motherjones.com/politics/2023/01/we-tried-to-call-the-top-donors-to-george-santos-2020-campaign-many-dont-seem-to-exist/
Newly Released Footage Shows At Least 10 People Restraining Irvo Otieno,Arianna Coghill,https://www.motherjones.com/crime-justice/2023/03/irvo-otieno-video/
“This Was My Baby”: The Family of Black Man Killed by Cops While Experiencing Mental Crisis Speaks Out,Arianna Coghill,https://www.motherjones.com/crime-justice/2023/03/irvo-otieno-virginia-police-mental-illness-murder-black/
Biden Approves Major Alaskan Oil Drilling Project,Arianna Coghill,https://www.motherjones.com/environment/2023/03/willow-project-alaska-biden/
South Carolina Woman Arrested for Allegedly Taking Abortion Pills,Arianna Coghill,https://www.motherjones.com/crime-justice/2023/03/south-carolina-woman-arrested-for-allegedly-taking-abortion-pills/
