title,byline,url
"In the US, Counting The Dead In Gaza Has Become A Gruesome Political Game",Sophie Hurwitz,https://www.motherjones.com/politics/2024/07/palestine-gaza-israel-death-toll-gaza-health-ministry/
"In the US, Counting The Dead In Gaza Has Become A Gruesome Political Game",Sophie Hurwitz,https://www.motherjones.com/politics/2024/07/palestine-gaza-israel-death-toll-gaza-health-ministry/
AOC Wants to Impeach SCOTUS Justices Thomas and Alito,Julianne McShane,https://www.motherjones.com/politics/2024/07/aoc-clarence-thomas-supreme-court-alito-misconduct-impeachment/
Project 2025 Is Twisting Disability Rights Law to Attack Abortion,Julia Métraux,https://www.motherjones.com/politics/2024/07/project-2025-abortion-disability-rights-heritage-foundation/
Biden’s Right: It Is an Orchestrated Attack,Inae Oh,https://www.motherjones.com/politics/2024/07/obama-pelosi-biden-drop-out-race/
Peter Singer Is Through With America,Evan Mandery,https://www.motherjones.com/politics/2024/07/peter-singer-princeton-animal-rights-american-democracy-effective-altruism-voting-donald-trump-joe-biden/
The Teamsters President Is Courting Trump—Despite His Anti-Labor Record,Serena Lin,https://www.motherjones.com/politics/2024/07/the-teamsters-boss-is-courting-trump-despite-his-anti-labor-record/
A Right-Wing Mogul Is on Trial for a Massive Fraud Scheme. He Blames China.,Dan Friedman,https://www.motherjones.com/politics/2024/07/guo-trial-closing-arguments-china/
,,https://www.motherjones.com/sponsored/the-looming-threat-of-christian-nationalism/
,,https://www.motherjones.com/sponsored/navigating-farm-and-ranch-transfers-to-a-new-generation/
,,https://www.motherjones.com/politics/2024/07/biden-2024-1968-dnc-convention-johnson-history-video/
,,https://www.motherjones.com/politics/2024/06/racist-comments-reconstruction-black-republicans-video/
,,https://www.motherjones.com/politics/2024/04/gaza-solidarity-encampments-columbia-college-campus-protest-palestine-israel-how-many-protests/
,,https://www.motherjones.com/politics/2024/04/trump-trial-hush-money-stormy-daniels-manhattan-video/
"Awash in Consumer Waste, Germany Tries Encouraging a Culture of Reuse",Ajit Niranjan,https://www.motherjones.com/environment/2024/07/consumer-waste-germany-reuse-recycling-efforts/
Republicans Preview the Voter Suppression Policies They’ll Enact if Trump Wins,Ari Berman,https://www.motherjones.com/politics/2024/07/republicans-preview-the-voter-suppression-policies-trump-save-act/
Why Smashing the Administrative State Is a Disaster for Reproductive Rights,Nina Martin,https://www.motherjones.com/politics/2024/07/why-smashing-the-administrative-state-is-a-disaster-for-reproductive-rights/
More Democrats Yell (Respectfully) That Biden Should Reconsider Staying in the Race,Inae Oh,https://www.motherjones.com/politics/2024/07/pelosi-biden-drop-out-michael-bennett/
The Problematic Chemicals Fueling America’s EV Revolution,"Craig Welch, Jana Cholakovska, Pooja Sarkar, Alec Gitelman, Emilie Rosso, and Clare Fieseler",https://www.motherjones.com/politics/2024/07/ev-lithium-ion-battery-manufacturing-pollution-chemical-contamination-pfas-forever-chemicals-health-risks/
Biden’s $30m Weekend Fundraising Blitz Breaks Democratic Party Records,James West,https://www.motherjones.com/politics/2024/06/biden-campaign-fundraiser-30-million-hollywood-clooney-obama/
North Carolina House Passes Revised Mask Ban,Julia Métraux,https://www.motherjones.com/politics/2024/06/north-carolina-house-passes-revised-mask-ban/
Hunter Biden Convicted on Federal Gun Charges,Julia Métraux,https://www.motherjones.com/mojo-wire/2024/06/hunter-biden-gun-trial-jury-decision/
Here’s How Biden Could Rattle Trump in Their First Debate,"June 24, 2024",https://www.motherjones.com/politics/2024/06/trump-biden-first-debate-rattle-ridicule-cnn/
The Most Under-Covered Story of 2024: Trump and Right-Wing Extremism,"June 13, 2024",https://www.motherjones.com/politics/2024/06/donald-trump-turning-point-usa-charlie-kirk-right-wing-extremism-our-land-david-corn/
"Here Come the Russians, Again","May 24, 2024",https://www.motherjones.com/politics/2024/05/here-come-the-russians-again/
,,https://www.motherjones.com/politics/2024/06/40-acres-lie-skidaway-island-georgia-racism-the-landings-reveal/
,,https://www.motherjones.com/politics/2024/06/new-reveal-episode-40-acres-lie-part-1/
,,https://www.motherjones.com/environment/2024/06/reveal-arizona-water-the-grab/
,,https://www.motherjones.com/politics/2024/06/how-a-battle-over-solar-power-tore-one-new-york-community-apart/
The GOP’s “Softened” Abortion Platform Is a Ruse,Julianne McShane,https://www.motherjones.com/politics/2024/07/gop-republican-platform-fetal-personhood-abortion-ban/
Trump Again Demonizes Migrants for “Poisoning Our Country”,Mark Follman,https://www.motherjones.com/politics/2024/07/trump-fox-news-hannity-migrants-poisoning/
Extreme Heat Is Coming for Your Rail Commute,Matt Simon,https://www.motherjones.com/environment/2024/07/extreme-heat-rail-train-commute-derailments-sun-kinks/
Oregon Suit Blaming Oil Firms for 2021 “Heat Dome” Disaster May Have a Shot,Victoria St. Martin,https://www.motherjones.com/environment/2024/07/oregon-suit-blaming-oil-firms-for-2021-heat-dome-disaster-may-have-a-shot/
How a Young Thug “Meme Page” Helped Expose Georgia’s Broken Court System,Alex Nguyen,https://www.motherjones.com/criminal-justice/2024/07/young-thug-rico-fani-willis-thuggerdaily/
"The Supreme Court’s January 6 Decision Was a Win for Progressive Protesters, Too",Jeremy Schulman,https://www.motherjones.com/criminal-justice/2024/06/supreme-court-fischer-january-6/
The Endless Pursuit of Equality Through College Admissions,Alex Nguyen,https://www.motherjones.com/media/2024/06/admissions-granted-harvard-supreme-court-affirmative-action/
The Shocking Discovery That Suddenly Made Reparations Deeply Personal for One Woman,Alexia Fernández Campbell and Nadia Hamdan,https://www.motherjones.com/politics/2024/06/the-shocking-discovery-that-suddenly-made-reparations-deeply-personal-for-one-woman/
Abortion Bans Are Also Terrible for Babies,Nina Martin,https://www.motherjones.com/politics/2024/07/abortion-bans-are-also-terrible-for-babies/
"The First National Data on Birth Control Post-Dobbs Is Here, and the News Is Not Good",Nina Martin,https://www.motherjones.com/politics/2024/06/the-first-national-data-on-birth-control-post-dobbs-is-here-and-the-news-is-not-good/
Carvell Wallace on Life and Love and Coming of Age in a Cruel World,Carvell Wallace,https://www.motherjones.com/media/2024/05/carvell-wallace-another-word-love-memoir-book-excerpt/
Learning to Love My Trans Self After Conversion Therapy,Henry Carnell,https://www.motherjones.com/politics/2024/05/lgbtq-anti-trans-conversion-therapy-christianity/
,,https://www.motherjones.com/politics/2024/06/menstruation-science-sexism-period-blood-qvin-rose-endometriosis-jen-gunter/
,,https://www.motherjones.com/politics/2024/06/west-bank-midwives-maternal-health-crisis/
,,https://www.motherjones.com/criminal-justice/2024/05/threat-assessment-mass-shooting-elliot-rodger-isla-vista-mother/
,,https://www.motherjones.com/criminal-justice/2023/10/foster-kids-psychiatric-hospitals-universal-health-services-uhs-alaska-cps/
US Surgeon General Declares Gun Violence a Public Health Crisis,Arianna Coghill,https://www.motherjones.com/politics/2024/06/us-surgeon-general-gun-violence-public-health-crisis/
The Supreme Court Just Proved That Its Gun Rulings Have Been a Disaster,Pema Levy,https://www.motherjones.com/politics/2024/06/supreme-court-guns-rahimi/
“The Whole Building Becomes This Big Brick Oven”,Frida Garza,https://www.motherjones.com/environment/2024/06/restaurant-workers-cooks-servers-extreme-heat/
Our Fixation on Forests as a Climate Solution Is Causing Problems,Kate Yoder,https://www.motherjones.com/environment/2024/05/forests-carbon-sequestration-climate-solutions-indigenous-people/
"Citing Health Concerns, Some Jewish New Yorkers Push Back Against Proposed Mask Ban",Julia Métraux,https://www.motherjones.com/politics/2024/06/hochul-mask-ban-new-york-subway-covid-israel-palestine/
RFK Jr. Is Even Crazier Than You Might Think,David Corn,https://www.motherjones.com/politics/2024/05/robert-kennedy-jr-conspiracy-theory-covid-pandemic-event-201/
Most Immigrant Deaths in ICE Detention Could Have Been Prevented,Isabela Dias,https://www.motherjones.com/politics/2024/06/most-immigrant-deaths-in-ice-detention-could-have-been-prevented/
"From VP Hype to Migrant Bashing, Trump’s Noise Machine Is on Full Blast",Julianne McShane,https://www.motherjones.com/politics/2024/06/trump-vp-migrants-ufc-christians/
