title,byline,url
War: US and Israel Launch Massive Attack on Iran,Katie Herchenroeder,https://www.motherjones.com/politics/2026/02/us-israel-war-iran-trump/
War: US and Israel Launch Massive Attack on Iran,Katie Herchenroeder,https://www.motherjones.com/politics/2026/02/us-israel-war-iran-trump/
How Trump Will Fill His Gulags,Pema Levy,https://www.motherjones.com/politics/2026/02/trump-refugee-immigant-ice-detention/
Teaching Kids to Read: How One School District Gets It Right,Reveal,https://www.motherjones.com/politics/2026/02/sold-a-story-steubenville-ohio-reading-2026/
“They Want Me to Hide or Leave or Disappear”,Katie Herchenroeder,https://www.motherjones.com/politics/2026/02/kansas-anti-trans-id-law-avery-rowland/
Would You Pay $49 a Month to Drink Recycled Wastewater?,Matt Simon,https://www.motherjones.com/environment/2026/02/wastewater-recycling-cities-drought-southwest-west-arizona/
Jesse Jackson Told Me Why He Really Ran for President,Douglas Foster,https://www.motherjones.com/politics/2026/02/jesse-jackson-1987-profile-presidency-obama-race/
Trump Media’s Stock Price Is Falling Even Faster Than His Poll Numbers,Russ Choma,https://www.motherjones.com/politics/2026/02/trump-medias-stock-price-truth-social-bitcoin/
,,https://www.motherjones.com/sponsored/10-worst-crises-you-wont-see-in-headlines-but-should/
,,https://www.motherjones.com/sponsored/the-movement-to-build-the-future-america-promised/
,,https://www.motherjones.com/politics/2026/02/ice-facility-portland-what-chemicals-used-tear-gas-hc-smoke-protests/
,,https://www.motherjones.com/politics/2026/02/video-trump-repeal-epa-endangerment-finding-climate-rule-explainer/
,,https://www.motherjones.com/politics/2026/02/nazi-propaganda-trump-white-house-dhs-kristi-noem-social-media/
,,https://www.motherjones.com/politics/2026/02/this-fish-fluencer-telling-ice-to-fuck-off-is-the-best-thing-youll-watch-today/
Trump’s War on National Park Signs Is Even Dumber Than You Think,Dan Friedman,https://www.motherjones.com/politics/2026/02/donald-trumps-national-park-signs-francis-newlands-chevy-chase-circle/
The Trump Administration’s Favorite Nuclear Startup Has Ties to Russia and Epstein,Kiera Butler,https://www.motherjones.com/politics/2026/02/the-trump-administrations-favorite-nuclear-startup-has-ties-to-russia-and-epstein/
Florida Continues Its Execution Spree Despite Problematic Track Record,Oishika Neogi,https://www.motherjones.com/politics/2026/02/florida-death-penalty-desantis/
Agriculture Is Consuming Grasslands and Wetlands at Alarming Rates,Georgina Gustin,https://www.motherjones.com/politics/2026/02/agriculture-land-conversion-grasslands-wetlands-forests-carbon-sinks/
Leaked Documents Show Meta Cracking Down on Access to Abortion Information,Tekendra Parmar,https://www.motherjones.com/politics/2026/02/meta-abortion-ai-chatbot-leak-teen-info-ban/
Trump May Force Banks to Demand Your Papers. Survivors of Abuse Will Pay.,Katie Herchenroeder,https://www.motherjones.com/politics/2026/02/trump-banking-citizenship-domestic-abuse-survivors/
"Nurul Amin Shah Alam, Blind Rohingya Refugee Dumped by Border Patrol, Dies in Cold",Julia Métraux,https://www.motherjones.com/mojo-wire/2026/02/shah-alam-buffalo-rohingya-blind-man-border-patrol/
"Colbert Takes CBS to Task, Again",Katie Herchenroeder,https://www.motherjones.com/politics/2026/02/colbert-takes-cbs-to-task-again/
Murdoch’s Defense in Epstein Lawsuit: Trump Is Lewd,"February 17, 2026",https://www.motherjones.com/politics/2026/02/donald-trump-jeffrey-epstein-lawsuit-wall-street-journal-lewd-bawdy/
Donald Trump’s Plan to Be King of the World,"February 4, 2026",https://www.motherjones.com/politics/2026/02/donald-trump-board-of-peace-gaza-israel-davos-china-russia-scam-king/
Is This a Police State?,"January 28, 2026",https://www.motherjones.com/politics/2026/01/police-state-minneapolis-donald-trump-stephen-miller-alex-pretti-renee-good/
,,https://www.motherjones.com/politics/2026/02/sold-a-story-steubenville-ohio-reading-2026/
,,https://www.motherjones.com/politics/2026/02/ibram-x-kendi-antiracism-authoritarian-age-black-history/
,,https://www.motherjones.com/politics/2026/02/black-history-month-nikole-hannah-jones-jelani-cobb-trymaine-lee/
,,https://www.motherjones.com/politics/2026/02/bayard-rustin-martin-luther-king-jr-black-history-month/
DHS Abducts Columbia Student From College Housing,Katie Herchenroeder,https://www.motherjones.com/politics/2026/02/dhs-ice-columbia-protest-detained-abducted-ellie-aghayeva/
Trump’s Surgeon General Pick Proves Devoted to MAHA’s Dangerous Talking Points,Alex Nguyen,https://www.motherjones.com/politics/2026/02/casey-means-senate-hearing/
Supreme Court Agrees to Hear Fossil Fuel Firms’ Bid for Climate Immunity,Dharna Noor,https://www.motherjones.com/politics/2026/02/supreme-court-hear-fossil-fuel-climate-immunity-case-lawsuit-boulder-colorado/
How Trump Appointees Derailed a Clean Energy Future at the Nation’s Largest Public Utility,Katie Myers and Rebecca Egan McCarthy,https://www.motherjones.com/environment/2026/02/tva-how-trumps-appointees-derailed-a-clean-energy-future-at-the-nations-largest-public-utility/
Trump Repeals Finding That Lets the EPA Regulate Climate-Warming Emissions,Dharna Noor,https://www.motherjones.com/politics/2026/02/trump-repeal-epa-endangerment-finding-regulation-climate-greenhouse-gases/
Trump’s Lust for Greenland’s Rare Earth Minerals Faces Harsh Arctic Realities,Ed Struzik,https://www.motherjones.com/politics/2026/02/trump-greenland-rare-earth-mining-arctic-conditions-cost-obstacles/
“Who the Fuck Are These Men?”,Michael Edison Hayden,https://www.motherjones.com/politics/2026/02/coeur-dalene-cda-idaho-donald-trump-kootenai-county-republicans/
How the NAACP Signed Up to Abolish ICE,Chasity Hale,https://www.motherjones.com/politics/2026/02/naacp-derrick-johnson-abolish-ice-campaign/
Meet the Mastermind Behind Trump’s Definition of “Woman”,Madison Pauly,https://www.motherjones.com/politics/2026/02/trump-anti-trans-may-mailman-sports-ban-womens-bill-of-rights-terf/
"Bad Bunny, Billionaires, and the Business of Sports",Reveal,https://www.motherjones.com/politics/2026/02/pablo-torre-steve-ballmer-bad-bunny-billionaires-sports-riley-gaines/
How Sports Became a Battleground Over Trans Rights,Reveal,https://www.motherjones.com/politics/2026/01/transgender-athletes-bans-womens-girls-sports-riley-gaines/
Josh Hawley Asked “Can Men Get Pregnant?” 11 Times at Abortion Hearing,Katie Herchenroeder,https://www.motherjones.com/politics/2026/01/josh-hawley-asked-can-men-get-pregnant-11-times-at-abortion-hearing/
,,https://www.motherjones.com/politics/2026/02/cory-mills-florida-investigation-profile-stolen-valor-trump-sex-workers-pacem-restraining-order-miss-us/
,,https://www.motherjones.com/politics/2026/01/history-month-black-military-service-vietnam-war-heroes-dei-recruiting-hegseth-trump-defense/
,,https://www.motherjones.com/politics/2026/02/cory-mills-florida-investigation-profile-stolen-valor-trump-sex-workers-pacem-restraining-order-miss-us/
,,https://www.motherjones.com/politics/2026/02/immigrant-ice-raid-nashville-tennessee-highway-patrol-state-police-287g-republicans/
Minneapolis Is the Violent Reckoning the Gun Rights Movement Has Long Wanted,Mike Spies,https://www.motherjones.com/politics/2026/02/minneapolis-ice-cbp-nra-alex-pretti-renee-good-guns-second-amendment/
"No, Antidepressants Do Not Cause Mass Shootings",Mark Follman,https://www.motherjones.com/politics/2026/01/mass-shootings-antidepressants-rfk-conspiracy-theory/
Watch: Gregory Bovino Asks Our Journalist to Bake Him a Pie,Jeremy Schulman,https://www.motherjones.com/politics/2026/02/watch-gregory-bovino-border-patrol-reporter-pie/
Farmers Were Promised $400 Million in Drought Aid. Trump’s USDA Ghosted Them.,Ayurella Horn-Muller,https://www.motherjones.com/politics/2026/02/farmers-drought-aid-water-saving-commodities-usda-trump-grants/
"Hey Jon Stewart, Jokes About Wearing Masks Aren’t Funny",Julia Métraux,https://www.motherjones.com/politics/2025/12/hey-jon-stewart-jokes-about-wearing-masks-arent-funny/
Welcome to the New Era of Covid Vaccine Tourism,Julia Métraux,https://www.motherjones.com/politics/2025/09/covid-vaccine-state-tourism-acip-rfk/
ICE Took Their Papers—and Won’t Give Them Back,Julia Lurie,https://www.motherjones.com/politics/2026/02/ice-detention-keeping-not-returning-immigration-documents-work-permits/
The Haitians of Springfield Are Under Attack Yet Again,Samantha Michaels,https://www.motherjones.com/politics/2026/02/haitian-immigrants-springfield-ohio-tps-temporary-protected-status-bomb-threats-lawsuit-trump-ice/
