title,byline,url
What if Walmart Turned Its Parking Lots Into Solar Farms?,Michael Mechanic,https://www.motherjones.com/environment/2023/04/walmart-supercenter-parking-lots-solar-farms/
What if Walmart Turned Its Parking Lots Into Solar Farms?,Michael Mechanic,https://www.motherjones.com/environment/2023/04/walmart-supercenter-parking-lots-solar-farms/
The Green Movement’s Best Weapon Has Become a Problem,Chris Elmendorf,https://www.motherjones.com/politics/2023/04/ceqa-green-movement-building-housing-crisis-environmental-laws/
"Autopsy: “Cop City” Protester Shot by Police Had 57 Gunshot Wounds, No Gunpowder on Hands",Eamon Whalen,https://www.motherjones.com/politics/2023/04/cop-city-autopsy-57-gunshot-wounds-gunpowder-residue-manuel-paez-teran/
I’m So Mad I Didn’t Enter Mike Lindell’s Stupid Contest,Tim Murphy,https://www.motherjones.com/politics/2023/04/mike-lindell-five-million/
Electrify Everything,Mother Jones,https://www.motherjones.com/environment/2023/04/electrify-everything-landing-page-cover-story/
The Little City That Could,Lois Parshley,https://www.motherjones.com/environment/2023/04/microgrids-chelsea-massachusetts-environmental-justice-climate-resilience/
Snapshots From a Clean Energy Future,Michael Mechanic,https://www.motherjones.com/environment/2023/04/microgrids-power-renewables-distributed-power-clean-energy/
Why Kentucky Is Dead Last in Wind and Solar Energy Production,James Bruggers and Dan Gearino,https://www.motherjones.com/politics/2023/04/kentucky-coal-politics-wind-solar-production/
Dominion and Fox News Settle Lawsuit,Inae Oh,https://www.motherjones.com/politics/2023/04/fox-news-dominion-lawsuit-settled-tucker-carlosn-rupert-murdoch/
"Jeff Sessions, Leo DiCaprio, and a Fugee—What’s Next in the Nutty Pras Michel Trial?",Dan Friedman,https://www.motherjones.com/politics/2023/04/pras-michel-fugees-trial-jeff-sessions-leonardo-dicaprio-christie-guiliani-trump-obama/
,,https://www.motherjones.com/politics/2023/04/kamala-harris-black-tennessee-lawmakers-reaction-biden-obama/
,,https://www.motherjones.com/politics/2023/04/video-tennessee-democrat-interview-expulsion-covenant-shooting/
,,https://www.motherjones.com/politics/2023/03/video-david-corn-warning-trump-chaos-indictment-historic/
A Black Teen Rang the Wrong Doorbell. A White Homeowner Shot Him.,Abigail Weinberg,https://www.motherjones.com/crime-justice/2023/04/black-teen-ralph-yarl-shot-white-homeowner-rang-doorbell-missouri/
California Supreme Court to Tesla: Stop Being Racist,Abigail Weinberg,https://www.motherjones.com/mojo-wire/2023/04/california-supreme-court-to-tesla-stop-being-racist/
I Have Some Questions Now That Harry Is Going to Dad’s Big Boy Party,Inae Oh,https://www.motherjones.com/mojo-wire/2023/04/prince-harry-king-charles-meghan-coronation-invite-update/
Experiencing Space Flight Just Got a Lot More Accessible,Daniel King,https://www.motherjones.com/recharge/2022/12/space-flight-portal/
"Remembering George Pérez, a Superhero of Superhero Comics",Dan Spinelli,https://www.motherjones.com/recharge/2022/05/remembering-george-perez-a-superhero-of-superhero-comics/
Ukrainian and Russian Dancers Join Onstage (in Italy) to Fundraise for the Red Cross,Daniel King,https://www.motherjones.com/recharge/2022/04/ukrainian-russian-antiwar-ballet-dancers-for-peace/
Why Are We So Afraid of Nuclear Power?,Tyler J. Kelley,https://www.motherjones.com/politics/2023/04/nuclear-power-clean-energy-renewable-safe/
Health Care Without Mifepristone? “The Experience for Patients Is Going to Be Awful.”,Abby Vesoulis,https://www.motherjones.com/politics/2023/04/health-care-without-mifepristone-the-experience-for-patients-is-going-to-be-awful/
What “Electrify Everything” Actually Looks Like,Jesse D. Jenkins,https://www.motherjones.com/environment/2023/04/electrify-everything-scope-data/
The Next Big Thing in Recycling: Expired Solar Panels,Jon Hurdle,https://www.motherjones.com/environment/2023/04/recycling-solar-panels-silver-copper-waste-landfill/
DeSantis Has Lots of Plans to Fight the Left—and None to Preserve Millions of Floridians’ Health Care,Pema Levy,https://www.motherjones.com/politics/2023/04/ron-desantis-medicaid-expansion/
"After a Right-Wing Florida Hospital Protest, a Doctor Loses His Board Certification for Covid Disinformation",Kiera Butler,https://www.motherjones.com/politics/2023/03/sarasota-hospital-covid-misinformation-john-littell-desantis-ladapo/
Fries With That Mammoth Burger?,Damian Carrington,https://www.motherjones.com/environment/2023/03/mammoth-burger-meatball-extinct-vow-cultivated-meat-climate-methane/
"Misuse of Phosphorus Is Wreaking Havoc, Scientists Warn",Robin McKie,https://www.motherjones.com/environment/2023/03/phosphorus-fertilizer-shortage-algae-dead-zones-environment-runoff/
"During a Weekend Plagued by Gun Violence, GOP Stars Flock to the NRA Convention",Julia Lurie,https://www.motherjones.com/crime-justice/2023/04/during-a-weekend-plagued-by-gun-violence-gop-stars-flock-to-the-nra-convention/
“Undemocratic”: Why Is Keith Ellison Taking Over a Case From a Prosecutor He Endorsed?,Eamon Whalen,https://www.motherjones.com/crime-justice/2023/04/minneapolis-keith-ellison-prosecutor-progressive-mary-moriarty-undemocratic/
Ron DeSantis Wants to Make Transporting Migrants a Felony,Isabela Dias,https://www.motherjones.com/politics/2023/02/ron-desantis-wants-to-make-transporting-migrants-a-felony/
The New York Times Just Dropped a Shocking Investigation on Child Labor in America,Arianna Coghill,https://www.motherjones.com/politics/2023/02/new-york-times-child-labor-immigrant-kids/
,,https://www.motherjones.com/politics/2023/04/how-maga-conspiracies-infected-autism-groups/
,,https://www.motherjones.com/politics/2023/04/wisconsin-supreme-court-election-daniel-kelly-janet-protasiewicz/
,,https://www.motherjones.com/crime-justice/2023/03/who-killed-rasheem-carter/
,,https://www.motherjones.com/politics/2023/01/we-tried-to-call-the-top-donors-to-george-santos-2020-campaign-many-dont-seem-to-exist/
A Black Teen Rang the Wrong Doorbell. A White Homeowner Shot Him.,Abigail Weinberg,https://www.motherjones.com/crime-justice/2023/04/black-teen-ralph-yarl-shot-white-homeowner-rang-doorbell-missouri/
“Undemocratic”: Why Is Keith Ellison Taking Over a Case From a Prosecutor He Endorsed?,Eamon Whalen,https://www.motherjones.com/crime-justice/2023/04/minneapolis-keith-ellison-prosecutor-progressive-mary-moriarty-undemocratic/
Nashville Officials Unanimously Vote to Reinstate Justin Jones,Arianna Coghill,https://www.motherjones.com/politics/2023/04/justin-jones-nashville-vote/
Tennessee House Republicans Move to Expel Three Members for Gun Control Protest,Arianna Coghill,https://www.motherjones.com/politics/2023/04/tennessee-gop-republican-house-expel-members-gun-control-protest-nashville-shooting/
