title,byline,url
DHS Secretary Says US Is Prepared for Migrant Influx When Trump’s Pandemic Policy Ends,Fernanda Echavarri,https://www.motherjones.com/politics/2022/05/dhs-mayorkas-title-42-pandemic-trump-immigration-border/
DHS Secretary Says US Is Prepared for Migrant Influx When Trump’s Pandemic Policy Ends,Fernanda Echavarri,https://www.motherjones.com/politics/2022/05/dhs-mayorkas-title-42-pandemic-trump-immigration-border/
Tomato Workers Put Wendy’s Billionaire in the Hot Seat,Tom Philpott,https://www.motherjones.com/food/2022/05/tomato-workers-wendys-poultry-coalition-imokalee-workers-labor/
May Day Marches Highlight Essential Immigrant Labor and Rising Frustration With Biden,Fernanda Echavarri,https://www.motherjones.com/politics/2022/05/may-day-immigrant-labor-marches-biden/
Pelosi Vows Unwavering Support for Ukraine in Unannounced Meeting With Zelenskyy,Fernanda Echavarri,https://www.motherjones.com/politics/2022/05/pelosi-zelenskyy-meeting-ukraine-support/
Climate Change May Fuel “Devastating” Disease Outbreaks,Oliver Milman,https://www.motherjones.com/politics/2022/04/climate-change-disease-outbreaks-pandemics-zoonotic-spillover-viruses/
Sean Hannity (Once Again) Confirms He Is Not a Journalist,Noah Y. Kim,https://www.motherjones.com/politics/2022/04/hannity-trump-meadows-big-lie-texting-scandal-cnn/
She Accused Her Ex-Husband of Abuse. She’s Still Stuck With His Student Loans.,Emma Rindlisbacher,https://www.motherjones.com/politics/2022/04/spousal-consolidation-student-loans/
A San Francisco Public Defender Explains What the Media Are Getting Wrong About the “Crime Wave”,Eamon Whalen,https://www.motherjones.com/crime-justice/2022/04/san-francisco-crime-wave-media-public-defender-chesa-boudin/
Research: Seas May Face Most Cataclysmic Extinction in 250 Million Years,Oliver Milman,https://www.motherjones.com/environment/2022/04/research-seas-may-face-most-cataclysmic-extinction-in-250-million-years/
Russia’s War on Ukraine Has Nearly Doubled Its Fossil-Fuel Revenues,Fiona Harvey,https://www.motherjones.com/politics/2022/04/russias-ukraine-war-double-fossil-fuel-revenues-price-spikes/
,,https://www.motherjones.com/mojo-wire/2022/04/yes-our-video-shown-at-marjorie-taylor-greenes-hearing-was-accurate/
,,https://www.motherjones.com/politics/2022/04/first-amendment-praetorian-january-6-committee-michael-flynn/
,,https://www.motherjones.com/mojo-wire/2022/03/donald-trump-talked-about-his-true-enemy-when-asked-about-russias-invasion-of-ukraine-windmills/
Trump Warns of “Dangerous Fruit” in Sworn Deposition,Inae Oh,https://www.motherjones.com/mojo-wire/2022/04/trump-warns-of-dangerous-fruit-in-sworn-deposition/
Oklahoma Just Passed a Bill Banning Abortion After Six Weeks,Ruth Murai,https://www.motherjones.com/politics/2022/04/oklahoma-six-week-abortion-ban/
Here’s How DeSantis and Florida Republicans Just Violated Disney’s Civil Rights,Pema Levy,https://www.motherjones.com/mojo-wire/2022/04/desantis-dont-say-gay-republicans-florida/
Ukrainian and Russian Dancers Join Onstage (in Italy) to Fundraise for the Red Cross,Daniel King,https://www.motherjones.com/recharge/2022/04/ukrainian-russian-antiwar-ballet-dancers-for-peace/
"Mass Shootings Persist, But a New Book Brings Hope and Science to Grappling With Their Prevention",Daniel King,https://www.motherjones.com/recharge/2022/04/mass-shooting-prevention-trigger-points/
"Yeah, I’m Gonna Need You to Go Ahead and Celebrate Michael Boltons’ Birthdays",Daniel King,https://www.motherjones.com/recharge/2022/02/office-space-michael-bolton-assclown-david-herman-birthday/
Special Grand Jury Will Convene Monday to Investigate Trump’s Attempt to Overturn Georgia Election,Noah Y. Kim,https://www.motherjones.com/politics/2022/04/fani-willis-georgia-election-donald-trump-2020-grand-jury-special/
Fox’s Maria Bartiromo Fed Trump Interview Questions in Advance,Noah Y. Kim,https://www.motherjones.com/politics/2022/04/fox-maria-bartiromo-donald-trump-election-2020-mark-meadows/
The Queen Conch’s Gambit,Cynthia Barnett,https://www.motherjones.com/environment/2022/05/queen-conch-gambit-sea-snail-hatchery-climate-change/
A Wave of Lawsuits Aims to Halt Louis DeJoy’s Gas-Guzzling Postal Fleet,Abigail Weinberg,https://www.motherjones.com/environment/2022/04/usps-louis-dejoy-gas-guzzling-trucks-postal-service-lawsuits-earthjustice/
Does Politico Know Who Kamala Harris Is?,Pema Levy,https://www.motherjones.com/politics/2022/04/kamala-harris-covid-paxlovid/
"I’m a Nurse at a Stanford Hospital. I’m Burned Out, Fed Up, and Ready to Strike.",Anonymous as told to Jackie Flynn Mogensen,https://www.motherjones.com/politics/2022/04/stanford-nurse-strike-covid/
"How Love, Dirt, and a Regenerative Farm Eased the Pain of the Climate Crisis for This Writer",Marc Fawcett-Atkinson,https://www.motherjones.com/environment/2022/04/how-love-dirt-and-a-regenerative-farm-eased-the-pain-of-the-climate-crisis-for-this-writer/
"With Emergency SNAP Benefits Ending, a Hunger Cliff Looms",Bridget Huber,https://www.motherjones.com/food/2022/04/with-emergency-snap-benefits-ending-a-hunger-cliff-looms/
Don’t Share the DC Shooter’s Video of Him Opening Fire on a School,Mark Follman,https://www.motherjones.com/media/2022/04/dc-mass-shooter-video-of-attack/
Texas Halts Execution of Melissa Lucio,Samantha Michaels,https://www.motherjones.com/crime-justice/2022/04/texas-execution-melissa-lucio-mother/
The High-Stakes Immigration Case Before the Supreme Court Isn’t Just About Immigration,Isabela Dias,https://www.motherjones.com/politics/2022/04/remain-in-mexico-the-immigration-case-before-the-supreme-court-isnt-just-about-immigration/
How an Army of Volunteers Has Welcomed Immigrants in Poland—After the Government Wouldn’t,Molly Schwartz,https://www.motherjones.com/politics/2022/04/army-of-volunteers-welcoming-ukrainian-immigrants-in-poland/
,,https://www.motherjones.com/crime-justice/2022/04/mass-shootings-behavioral-threat-assessment-oxford-high-school-trigger-points/
,,https://www.motherjones.com/crime-justice/2022/04/abolish-child-protective-services-torn-apart-dorothy-roberts-book-excerpt/
,,https://www.motherjones.com/politics/2022/04/hunter-biden-laptop-guo-wengui-bannon-giuliani/
,,https://www.motherjones.com/politics/2022/03/chess-grandmasters-putin-russia-ukraine-war/
January 6 Reckoning: CNN’s Jake Tapper Says the Media Must Confront Republicans’ Big Lie,Abigail Weinberg,https://www.motherjones.com/media/2021/07/january-6-insurrection-capitol-cnn-jake-tapper-podcast/
We Need to Understand How We Got to January 6 Before We Can Move Forward,Fernanda Echavarri,https://www.motherjones.com/politics/2021/06/podcast-january-6-qanon-history-whats-next/
A Radical Idea for Forcing Vaccine Companies to Share Knowledge With the World,Molly Schwartz and Jamilah King,https://www.motherjones.com/politics/2021/05/vaccine-patents-biden-covid-india-dean-baker-pandemic/
,,https://podcasts.apple.com/us/podcast/the-mother-jones-podcast/id1386408605
