title,byline,url
Today It's Critical Race Theory. 200 Years Ago It Was Abolitionist Literature.,Anthony Conwright,https://www.motherjones.com/politics/2021/07/critical-race-theory-slave-abolition-school-literature/
Today It's Critical Race Theory. 200 Years Ago It Was Abolitionist Literature.,Anthony Conwright,https://www.motherjones.com/politics/2021/07/critical-race-theory-slave-abolition-school-literature/
Republicans Suddenly Want You to Get Vaccinated. They Hope You Listen to Their Pelosi-Bashing More.,Inae Oh,https://www.motherjones.com/politics/2021/07/republicans-vaccine-shift/
A Postal Worker Filed Three OSHA Complaints about COVID Protections. She Got 6 Weeks in the Hospital Instead.,Maryam Jameel,https://www.motherjones.com/politics/2021/07/a-postal-worker-filed-three-osha-complaints-about-covid-protections-she-got-6-weeks-in-the-hospital-instead/
House Progressives Get Antsy Over Senate’s Lead Role in Infrastructure Debates,Kara Voght,https://www.motherjones.com/politics/2021/07/house-progressives-infrastructure-senate/
Pelosi Rejects Two Big Lie Enthusiasts From Jan. 6 Commission,Inae Oh,https://www.motherjones.com/politics/2021/07/pelosi-jordan-banks-january-6-commission/
Olympic Mascots Have Always Been the Stuff of Nightmares. Tokyo Is No Different.,Patrick Caldwell,https://www.motherjones.com/media/2021/07/olympic-mascots-tokyo-miraitowa-someity/
A Rare 100-Pound Moonfish Washed up on the Oregon Coast,Oliver Milman,https://www.motherjones.com/politics/2021/07/heres-what-happens-when-a-rare-100-pound-moonfish-washes-up-on-the-oregon-coast/
Jeff Bezos Thanks Amazon Workers and Customers for Making Him So Rich He Can Go to Space,Tim Murphy,https://www.motherjones.com/politics/2021/07/jeff-bezos-thanks-amazon-workers-and-customers-for-making-him-so-rich-he-can-go-to-space/
New Poll: Arizona Democrats Love Biden and Kelly. Kyrsten Sinema? Not So Much.,Tim Murphy,https://www.motherjones.com/politics/2021/07/new-poll-arizona-democrats-love-biden-and-kelly-kyrsten-sinema-not-so-much/
Think Twice Before You Build That Seawall,Matt Simon,https://www.motherjones.com/environment/2021/07/think-twice-before-you-build-that-seawall/
,,https://www.motherjones.com/politics/2021/05/5-ways-a-dark-money-group-is-trying-to-rig-our-elections/
,,https://www.motherjones.com/politics/2021/05/heritage-foundation-dark-money-voter-suppression-laws/
,,https://www.motherjones.com/politics/2021/05/caitlyn-jenner-espys-trans-sports/
I Am Simply Asking if Ashton Kutcher Is a CIA Asset,Ali Breland,https://www.motherjones.com/mojo-wire/2021/07/ashton-kutcher-cia-krasinki-china-tiktok/
I Can’t Stop Staring at This Siberian Mosquito Tornado,Clint Hendler,https://www.motherjones.com/mojo-wire/2021/07/siberian-mosquito-tornado/
Matt Gaetz and Marjorie Taylor Greene Can’t Find Anyone Willing to Host Their California Rally,Aaron Wiener,https://www.motherjones.com/politics/2021/07/matt-gaetz-and-marjorie-taylor-greene-cant-find-anyone-willing-to-host-their-california-rally/
"The National Spelling Bee Finals, Canceled by COVID Last Year, Are Tonight. Take Our Very Serious Quiz.",Daniel King,https://www.motherjones.com/recharge/2021/07/national-spelling-bee-is-back-after-covid-cancellation/
“A Vegetable Oasis in an Urban Landscape”,Jacob Rosenberg,https://www.motherjones.com/recharge/2021/07/a-vegetable-oasis-in-an-urban-landscape/
"60 Years After the Yankees Told Her the Dugout Was No Place for a Girl, She Threw Out the First Pitch",Amanda Silverman,https://www.motherjones.com/recharge/2021/06/yankees-bat-girl-60-year-dream-go-gwen/
How Trump and Conservative Media Are Cashing in on Disinformation,David Corn,https://www.motherjones.com/politics/2021/07/donald-trump-federalist-big-lie-disinformation/
Top Trump Adviser Arrested and Charged With Secretly Lobbying for the UAE,"Dan Friedman, Russ Choma, and David Corn",https://www.motherjones.com/politics/2021/07/top-trump-adviser-arrested-and-charged-with-secretly-lobbying-for-the-uae/
The USDA Wants to Make Farms Climate-Friendly. Will It Work?,Leah Douglas,https://www.motherjones.com/environment/2021/07/farmers-climate-change-conservation-reserve-program/
Here’s What Climate Scientists Are Really Saying About This Catastrophic Summer,Sofia Andrade,https://www.motherjones.com/environment/2021/07/heres-what-climate-scientists-are-really-saying-about-this-catastrophic-summer/
"Biden Said He’d Cut Incarceration in Half. So Far, the Federal Prison Population Is Growing.",Samantha Michaels,https://www.motherjones.com/crime-justice/2021/07/biden-said-hed-cut-incarceration-in-half-so-far-the-federal-prison-population-is-growing/
The Pandemic Is Roaring Back Where Vaccination Rates Are Low,Noah Lanard,https://www.motherjones.com/politics/2021/07/coronavirus-pandemic-arkansas-delta/
Cory Booker Just Picked a Fight With Giant Meatpackers,Tom Philpott,https://www.motherjones.com/food/2021/07/cory-booker-meat-meatpackers-beef-corporate-consolidation/
Why the Northwest’s “Heat Dome” Is So Dangerous,Julia Lurie,https://www.motherjones.com/environment/2021/06/heat-dome-seattle-portland-northwest-drought-climate-change-hot/
Darnella Frazier Filmed George Floyd’s Murder. The Minneapolis Police Just Killed Her Uncle.,Samantha Michaels,https://www.motherjones.com/crime-justice/2021/07/darnella-frazier-filmed-george-floyds-murder-the-minneapolis-police-just-killed-her-uncle/
The Pandemic Proved We Don’t Need Bail,Madison Pauly,https://www.motherjones.com/crime-justice/2021/07/the-pandemic-proved-we-dont-need-bail/
"“When There’s a Disaster, That’s When People Want to Know About Haiti”",Nathalie Baptiste,https://www.motherjones.com/politics/2021/07/when-theres-a-disaster-thats-when-people-want-to-know-about-haiti-a-dispatch-from-the-diaspora/
How Merrick Garland Acts Like Donald Trump’s Lawyer,Dan Friedman,https://www.motherjones.com/politics/2021/06/merrick-garland-joe-biden-donald-trump-policies-doj-court-cases/
,,https://www.motherjones.com/politics/2021/07/the-moral-panic-over-critical-race-theory-is-coming-for-a-north-carolina-teacher-of-the-year/
,,https://www.motherjones.com/politics/2021/07/is-trans-telehealth-the-future-or-just-a-cash-grab/
,,https://www.motherjones.com/crime-justice/2021/06/russian-sergey-grishin-421-media-billionaire-instagram-content-farm-trump-threats/
,,https://www.motherjones.com/politics/2021/05/air-purifier-covid-asthma-unproven-science-coronavirus-ionization/
We Need to Understand How We Got to January 6 Before We Can Move Forward,Fernanda Echavarri,https://www.motherjones.com/politics/2021/06/podcast-january-6-qanon-history-whats-next/
A Radical Idea for Forcing Vaccine Companies to Share Knowledge With the World,Molly Schwartz and Jamilah King,https://www.motherjones.com/politics/2021/05/vaccine-patents-biden-covid-india-dean-baker-pandemic/
"Doctor, Lawyer, Insurrectionist: The Radicalization of Simone Gold",Stephanie Mencimer,https://www.motherjones.com/politics/2021/05/doctor-lawyer-insurrectionist-the-radicalization-of-simone-gold/
,,https://podcasts.apple.com/us/podcast/the-mother-jones-podcast/id1386408605
