title,byline,url
Montana Tribe Finalizes Historic $1.9 Billion Settlement,Mark Armao,https://www.motherjones.com/environment/2021/09/montana-confederated-salish-kootenai-tribe-historic-water-rights-settlement/
Montana Tribe Finalizes Historic $1.9 Billion Settlement,Mark Armao,https://www.motherjones.com/environment/2021/09/montana-confederated-salish-kootenai-tribe-historic-water-rights-settlement/
"Gen. Milley Defends China Calls, Says He Was “Not Qualified” to Determine Trump’s Mental Health",Dan Spinelli,https://www.motherjones.com/politics/2021/09/mark-milley-donald-trump-nancy-pelosi-china-nukes/
The Secret to Successful Rewilding Isn’t Trees—It’s People,Phoebe Weston,https://www.motherjones.com/environment/2021/09/secret-successful-rewilding-not-trees-people-conservation-land-restoration/
My Wife Was Dying of Brain Cancer. My Boss at Amazon Told Me to Perform or Quit.,Anonymous as Told To Noah Lanard,https://www.motherjones.com/politics/2021/09/my-wife-was-dying-of-brain-cancer-my-boss-at-amazon-told-me-to-perform-or-quit/
Democrats Are Living in Different Realities When It Comes to Passing Biden’s Agenda,Kara Voght,https://www.motherjones.com/politics/2021/09/democrats-pelosi-budget-infrastructure-biden-agenda/
Wall Street Mortgage Bankers Are Freaking Out About Climate Change,Naveena Sadasivam,https://www.motherjones.com/environment/2021/09/wall-street-mortgage-bankers-report-climate-change-housing-finance/
"DHS Secretary Says What We've All Been Thinking: The System Is ""Completely Broken""",Nina Liss-Schultz,https://www.motherjones.com/politics/2021/09/dhs-mayorkas-haiti-immigration-title-42/
How a Mysterious Russian Businessman Got His Picture Taken With Donald Trump,"Russ Choma, Hannah Levintova, and Dan Friedman",https://www.motherjones.com/politics/2021/09/wead-benton-indictment/
Joe Biden Is Down to Tax the Richest of the Rich. Congress? Not So Much.,Michael Mechanic,https://www.motherjones.com/politics/2021/09/joe-biden-tax-rich-congress-democrats-reconciliation-step-up-basis-capital-gains-bezos/
A Fed-Up Judge Rips a January 6 Defendant: “You’ve Disgraced This Country”,Ali Breland,https://www.motherjones.com/politics/2021/09/capitol-riot-insurrection-donald-trump-judge-disgraced/
,,https://www.motherjones.com/politics/2021/09/beto-orourke-voting-rights-bill-democrat-majorities/
,,https://www.motherjones.com/politics/2021/09/beto-orourke-governor-texas-run-voting-rights-democracy/
,,https://www.motherjones.com/politics/2021/09/greg-abbott-abortion-ban-business/
The California Recall Effort Has Officially Failed,Lil Kalish,https://www.motherjones.com/politics/2021/09/the-california-newsom-elder-recall-effort-has-failed/
California’s Recall Election Rules Are Dumb. BoJack Horseman Offers a Better Option.,Nathalie Baptiste,https://www.motherjones.com/politics/2021/09/californias-recall-election-rules-are-dumb-bojack-horseman-offers-a-better-option/
59 Percent of Republicans Say It’s Important to Believe Trump Won the Election,Jeremy Schulman,https://www.motherjones.com/mojo-wire/2021/09/59-percent-of-republicans-say-its-important-to-believe-trump-won-the-election/
"Barack Obama’s Library, the First Digital-Driven Presidential Archives in History, Breaks Ground Today",Daniel King,https://www.motherjones.com/recharge/2021/09/barack-obama-presidential-library-construction-breaks-ground/
“Birthday Under a Canopy”: A Climate Wish From MoJo’s Production Director,Daniel King,https://www.motherjones.com/recharge/2021/09/birthday-under-a-canopy-a-climate-wish-from-mojos-production-director/
The Founders of Stop AAPI Hate’s Anti-Violence App Make Time’s 100 Most Influential List,Daniel King,https://www.motherjones.com/recharge/2021/09/stop-anti-asian-hate-violence-app-makes-100-most-influential-list/
There's A Flurry of Studies Trashing the Democrats' Tax Agenda. They Have Corporate and GOP Dark Money Ties.,Kara Voght,https://www.motherjones.com/politics/2021/09/theres-a-flurry-of-studies-trashing-the-democrats-tax-agenda-they-have-corporate-and-gop-dark-money-ties/
The “Most Important Question” on Earth: How Soon Will China Quit Coal?,Vincent Ni,https://www.motherjones.com/politics/2021/09/most-important-question-china-pledge-coal-facilities-climate-change/
Biden’s Pledge to Double US Climate Aid Doesn’t Go Nearly Far Enough,Alexander C. Kaufman,https://www.motherjones.com/environment/2021/09/biden-pledge-double-climate-aid-not-enough/
"Babies Ingesting High Levels of Microplastics, Alarming Research Finds",Matt Simon,https://www.motherjones.com/environment/2021/09/human-infants-ingesting-high-levels-microplstics-baby-feces-pet-bpa-chemicals/
Inside the Private Facebook Groups Where Anti-Vaxxers Plot to Get Religious Exemptions,Kiera Butler,https://www.motherjones.com/politics/2021/09/inside-the-private-facebook-groups-where-anti-vaxxers-plot-to-get-religious-exemptions/
"Anti-Vaccine Zealots Pose a Threat to Canada’s Democracy, Too",Caroline Orr,https://www.motherjones.com/politics/2021/09/vaccine-zealots-threat-canada-democracy-righ-wing-estremists-white-nationalism/
"In California’s Water Wars, Nuts Are Edging Out People",Tom Philpott,https://www.motherjones.com/environment/2021/09/california-san-joaquin-valley-drinking-water-dry-wells-almonds-pistachios-groundwater-aquifers/
Exhausted Restaurant Workers Now Face the Risk of Vicious Anti-Vaxxers,Nathalie Baptiste,https://www.motherjones.com/food/2021/09/exhausted-restaurant-workers-now-face-the-risk-of-vicious-anti-vaxxers/
The Drug War’s Deepest Failure: Making Users the Enemy,Troy Farah,https://www.motherjones.com/media/2021/09/harm-reduction-movement-war-on-drugs-undoing-maia-szalavitz-book-review/
Her Husband Was in Jail When Ida Hit. She Hasn't Heard From Him Since.,Madison Pauly,https://www.motherjones.com/crime-justice/2021/09/ida-incarcerated-family-hurricane-louisiana-st-charles/
Biden Is Continuing a Long Tradition of Mistreating Haitian Migrants,Nathalie Baptiste,https://www.motherjones.com/politics/2021/09/biden-is-continuing-a-long-tradition-of-mistreating-haitian-migrants/
The US Special Envoy for Haiti Just Resigned Over the “Inhumane” Treatment of Haitian Migrants,Noah Lanard,https://www.motherjones.com/politics/2021/09/us-special-envoy-haiti-resigns-del-rio-biden/
,,https://www.motherjones.com/politics/2021/09/bad-bosses-workers-fought-back-asshole-managers-nurse-guard-amazon-microsoft/
,,https://www.motherjones.com/politics/2021/09/theres-no-proof-sunscreen-prevents-cancer-in-black-people-why-do-doctors-keep-pushing-it/
,,https://www.motherjones.com/politics/2021/07/how-flint-closed-the-gap-between-black-and-white-suffering-under-covid/
,,https://www.motherjones.com/politics/2021/08/will-this-court-case-end-the-mining-industrys-150-year-dominance-of-the-west/
January 6 Reckoning: CNN’s Jake Tapper Says the Media Must Confront Republicans’ Big Lie,Abigail Weinberg,https://www.motherjones.com/media/2021/07/january-6-insurrection-capitol-cnn-jake-tapper-podcast/
We Need to Understand How We Got to January 6 Before We Can Move Forward,Fernanda Echavarri,https://www.motherjones.com/politics/2021/06/podcast-january-6-qanon-history-whats-next/
A Radical Idea for Forcing Vaccine Companies to Share Knowledge With the World,Molly Schwartz and Jamilah King,https://www.motherjones.com/politics/2021/05/vaccine-patents-biden-covid-india-dean-baker-pandemic/
,,https://podcasts.apple.com/us/podcast/the-mother-jones-podcast/id1386408605
