title,byline,url
RFK Jr. Super-PAC Puts Promoters of Conspiracy Theories on the Payroll,David Corn,https://www.motherjones.com/politics/2024/02/robert-f-kennedy-jr-conspiracy-theory-super-pac-american-values-2024/
RFK Jr. Super-PAC Puts Promoters of Conspiracy Theories on the Payroll,David Corn,https://www.motherjones.com/politics/2024/02/robert-f-kennedy-jr-conspiracy-theory-super-pac-american-values-2024/
The Long Era of Republican Gerrymandering in Wisconsin May Finally Be Over,Ari Berman,https://www.motherjones.com/politics/2024/02/republican-gerrymandering-new-maps-wisconsin-tony-evers/
SCOTUS Ducks High School Diversity in Admissions Case,Pema Levy,https://www.motherjones.com/politics/2024/02/scotus-ducks-high-school-diversity-and-admissions-case/
"At the UN, the US Vetoes a Ceasefire Resolution—and Proposes Another One",Jacob Rosenberg,https://www.motherjones.com/politics/2024/02/at-the-un-the-us-is-finally-working-for-a-ceasefire/
"Biden Blames Putin for Aleksei Navalny’s Death, Urges Ukraine Funding",Abby Vesoulis,https://www.motherjones.com/politics/2024/02/biden-putin-navalny-ukraine-congress-funding/
Leslie Jamison on Finding “Infinitude” in Motherhood,Sophie Murguia,https://www.motherjones.com/media/2024/02/leslie-jamison-splinters-interview/
This Week’s Episode of Reveal: Journalism and Protest at the Dawn of AIDS,Daniel Moattar,https://www.motherjones.com/politics/2024/02/this-weeks-episode-of-reveal-journalism-and-protest-at-the-dawn-of-aids/
,,https://www.motherjones.com/politics/2024/01/a-crash-course-on-yemen-are-bidens-attacks-on-the-houthis-the-solution/
,,https://www.motherjones.com/politics/2023/11/henry-ford-antisemitism-jacob-schiff-money-kings/
,,https://www.motherjones.com/politics/2023/11/john-hagee-hitler-israel-rally-christian-zionist/
,,https://www.motherjones.com/politics/2023/11/martin-luther-king-jr-mlk-israel-palestine-1967-video/
Shoebox Lady Is Not Alone—Americans Got Scammed for More Than $10 Billion in 2023,Abby Vesoulis,https://www.motherjones.com/politics/2024/02/shoebox-scam-americans-fraud-10-billion-2023/
Ohio Law Requires a Transgender Man to Use His Deadname on State Legislature Ballot,Abby Vesoulis,https://www.motherjones.com/politics/2024/02/ohio-law-requires-a-transgender-man-to-use-his-deadname-on-state-legislature-ballot/
Another Big Question About AI: Its Carbon Footprint,David Berreby,https://www.motherjones.com/environment/2024/02/ai-artificial-intelligence-carbon-footprint-climate-change-data-centers-electricity-consumption/
Here’s How Ski Resorts Are Adapting to Climate Change,Tik Root,https://www.motherjones.com/environment/2024/02/ski-resorts-snowmaking-climate-change-adapting/
Onslaught of Raw Sewage Near US-Mexico Border Is a Public Health Crisis,Maanvi Singh,https://www.motherjones.com/politics/2024/02/tijuana-river-sewage-contamination-public-health-crisis/
Reagan’s Daughter: Cognitive Tests For Presidential Candidates Would Be ‘A Good Idea’,Julianne McShane,https://www.motherjones.com/politics/2024/02/reagans-daughter-cognitive-tests-for-presidential-candidates-would-be-a-good-idea/
Trump Supporters Are Donating to a GoFundMe To Pay His $355 Million Legal Fine,Julianne McShane,https://www.motherjones.com/politics/2024/02/trump-supporters-are-donating-to-a-gofundme-to-pay-his-355-million-legal-fine/
Report: Trump “Favors” a 16-Week National Abortion Ban,Julianne McShane,https://www.motherjones.com/politics/2024/02/report-trump-favors-a-16-week-national-abortion-ban-new-york-times/
Joe Biden’s Age Is an Issue. So Is How the Media Covers It.,"February 13, 2024",https://www.motherjones.com/politics/2024/02/joe-bidens-age-is-an-issue-so-is-how-the-media-cover-it/
Is Biden Shifting His Stance on Israel? Is It Too Late?,"February 4, 2024",https://www.motherjones.com/politics/2024/02/biden-trump-israel-palestine-ceasefire/
A Story of Mother Jones (the Labor Organizer) That’s Relevant a Century Later,"January 9, 2024",https://www.motherjones.com/politics/2024/01/mother-jones-west-virginia-coal-wars-john-kern-congress/
"Nikki Haley Refuses to Drop Out, Even as She Prepares to Lose South Carolina",Julianne McShane,https://www.motherjones.com/politics/2024/02/nikki-haley-refuses-to-drop-out-even-as-she-prepares-to-lose-south-carolina/
Report: Trump-Branded NYC Real Estate Plummeted in Value Since 2016,Julianne McShane,https://www.motherjones.com/politics/2024/02/report-trump-branded-nyc-real-estate-plummeted-in-value-since-2016/
About to Break Down? You Might Be a Cybertruck.,Henry Carnell,https://www.motherjones.com/politics/2024/02/about-to-break-down-you-might-be-a-cybertruck/
Some Alabamians Can’t Even Flush Their Toilets. The EPA Is Here to Help.,Lee Hedgepeth,https://www.motherjones.com/politics/2024/02/black-belt-alabama-toilet-sewage-infrastructure-epa-biden-administration/
Alabama Has Carried Out Its First Nitrogen Gas Execution,Arianna Coghill,https://www.motherjones.com/criminal-justice/2024/01/alabama-has-carried-out-its-first-nitrogen-gas-execution/
A Dangerous Experiment in Executing Prisoners Is Happening Tonight in Alabama,Arianna Coghill,https://www.motherjones.com/criminal-justice/2024/01/alabama-plans-to-conduct-first-execution-using-nitrogen-gas-united-nations-torture/
Charlie Kirk Doesn’t Really Seem to Mind White Nationalism,Ali Breland,https://www.motherjones.com/politics/2024/02/charlie-kirk-whiteness-turning-points-usa/
The Farm Bill Hall of Shame,Claire Kelloway,https://www.motherjones.com/food/2024/02/farm-bill-racism-black-farmers-consolidation-crop-insurance/
More Than 150 Democrats Urge Biden to Help Stop the Criminalization of Pregnant People,Julianne McShane,https://www.motherjones.com/politics/2024/02/biden-pregnancy-criminalization-democrats-letter/
A Nurse Called Police After a Black Woman Miscarried—There’s a History to That,Julianne McShane,https://www.motherjones.com/politics/2024/01/a-nurse-called-police-after-a-black-woman-miscarried-theres-a-history-to-that/
"Catholic Priests Can Now Bless Same-Sex Couples, as Long as They Don’t Look Like Marriages",Katie Herchenroeder,https://www.motherjones.com/politics/2023/12/pope-francis-same-sex-marriage-blessings/
Florida Students Have Questions About the Ziegler Scandal. The Law Bridget Pushed Means Teachers Can’t Answer Them.,Kiera Butler,https://www.motherjones.com/politics/2023/12/bridget-christain-ziegler-moms-for-liberty-sarasota-teachers-dont-say-gay/
,,https://www.motherjones.com/politics/2024/02/bidens-israel-politics-are-alienating-young-campaign-volunteers/
,,https://www.motherjones.com/politics/2024/01/oligarchs-art-collectors-billionaires-money-picasso-free-ports/
,,https://www.motherjones.com/criminal-justice/2023/10/foster-kids-psychiatric-hospitals-universal-health-services-uhs-alaska-cps/
,,https://www.motherjones.com/politics/2023/09/unhoused-california-photo-essay/
School Shooter’s Mother Convicted in Historic Manslaughter Trial,Mark Follman,https://www.motherjones.com/politics/2024/02/jennifer-crumbley-trial-oxford-school-shooting-michigan/
"Abbott: Texas Would Shoot Migrants, But Biden “Would Charge Us With Murder”",Julianne McShane,https://www.motherjones.com/politics/2024/01/greg-abbott-texas-shoot-migrants-border-biden-murder/
US Agricuture Secretary “Concerned About the State of Agriculture”,Georgina Gustin,https://www.motherjones.com/food/2024/02/agricuture-secretary-tom-vilsack-state-agriculture-census-usda/
The Essential Workers Missing From the Farm Bill,Teresa Cotsirilos,https://www.motherjones.com/food/2024/02/farm-bill-farmworkers-owners-snap-meatpacking-climate-change/
Is It Illegal For the White House to Fight COVID Misinfo? Up to SCOTUS.,Julia Métraux,https://www.motherjones.com/politics/2024/02/is-it-illegal-for-the-white-house-to-fight-covid-misinfo-up-to-scotus/
The Internet’s Favorite Supplement Titan Appears to Be Taking Cues From a Psychic,Kiera Butler,https://www.motherjones.com/politics/2024/02/joseph-mercola-the-internets-favorite-supplement-titan-appears-to-be-taking-cues-from-a-psychic/
The Forgotten Origins of a Migration Crisis,Isabela Dias,https://www.motherjones.com/politics/2024/02/jonathan-blitzer-migration-crisis-everyone-who-is-gone-is-here-interview/
The House Just Voted to Impeach Mayorkas. How Did We Get Here?,Isabela Dias,https://www.motherjones.com/mojo-wire/2024/02/mayorkas-impeachment-immigration-dhs-timeline/
