title,byline,url
Far-Right Influencers Defended an Accused Fraudster. They Had Help.,Dan Friedman,https://www.motherjones.com/politics/2023/07/guo-influencers-karoline-leavitt-gavin-wax-matt-palumbo/
Far-Right Influencers Defended an Accused Fraudster. They Had Help.,Dan Friedman,https://www.motherjones.com/politics/2023/07/guo-influencers-karoline-leavitt-gavin-wax-matt-palumbo/
My Deeply Unsettling Return to the Moms for Liberty Conference,Kiera Butler,https://www.motherjones.com/politics/2023/07/moms-for-liberty-conference/
Anarcho-Tyranny: How the New Right Explains Itself,Noah Lanard,https://www.motherjones.com/politics/2023/07/anarcho-tyranny-penny-neely-sam-francis-new-right/
How I Got “Crime-Pilled” by a Bunch of Very-Online Web Sleuths,Chance Townsend,https://www.motherjones.com/media/2023/07/true-crime-austin-rainey-st-ripper-lady-bird-lake-drowning-web-sleuthing/
"More Than 1,500 US Fossil Fuel Lobbyists Serve as “Double Agents”",Oliver Milman,https://www.motherjones.com/politics/2023/07/fossil-fuel-lobbyists-database-guardian-double-agents/
Why Has Joe Biden Just Rewarded a Guy Who Supported Murderous War Criminals?,David Corn,https://www.motherjones.com/politics/2023/07/elliott-abrams-war-biden-white-house-bipartisanship/
A Massive UPS Strike Is Imminent,Eamon Whalen,https://www.motherjones.com/mojo-wire/2023/07/ups-strike-teamsters-obrien-supply-chain-packages/
Top Climate Groups Took Millions From Billionaire Oil and Gas Investors,Kiran Stacey,https://www.motherjones.com/environment/2023/07/wwf-climate-nonprofit-groups-fossil-fuel-donations/
"Amid Heatwave, Texas Firms Vented Vast Quantities of Toxins",Dylan Baddour,https://www.motherjones.com/environment/2023/07/texas-heatwave-natural-gas-pipeline-toxic-releases/
"For July 4th, Let’s Celebrate Great American Patriots: Government Bureaucrats",David Corn,https://www.motherjones.com/politics/2023/07/for-july-4th-lets-celebrate-great-american-patriots-government-bureaucrats/
,,https://www.motherjones.com/politics/2023/06/nikki-haley-barack-obama-video-race-2024-daily-mail/
,,https://www.motherjones.com/media/2023/05/halle-bailey-ariel-little-mermaid-backlash-ebony-elizabeth-thomas-interview/
,,https://www.motherjones.com/politics/2023/05/ron-desantis-laws/
It Sure Was Hot Yesterday,Inae Oh,https://www.motherjones.com/mojo-wire/2023/07/the-worlds-hottest-day-ever/
North Carolina Just Lost Its Status as an Abortion Destination,Abigail Weinberg,https://www.motherjones.com/mojo-wire/2023/06/north-carolina-abortion-ban-destination-the-south-governor-roy-cooper/
The Psychedelics Movement Doesn’t Need Aaron Rodgers,Abigail Weinberg,https://www.motherjones.com/mojo-wire/2023/06/psychedelics-aaron-rodgers-ayahuasca/
Experiencing Space Flight Just Got a Lot More Accessible,Daniel King,https://www.motherjones.com/recharge/2022/12/space-flight-portal/
"Remembering George Pérez, a Superhero of Superhero Comics",Dan Spinelli,https://www.motherjones.com/recharge/2022/05/remembering-george-perez-a-superhero-of-superhero-comics/
Ukrainian and Russian Dancers Join Onstage (in Italy) to Fundraise for the Red Cross,Daniel King,https://www.motherjones.com/recharge/2022/04/ukrainian-russian-antiwar-ballet-dancers-for-peace/
Climate Activists Want to See More Constitutions Like Montana’s,Dharna Noor,https://www.motherjones.com/politics/2023/07/held-montana-climate-lawsuit-constitution-green-amendments/
Civil Rights Groups Challenge Harvard’s Legacy Admissions,Arianna Coghill,https://www.motherjones.com/politics/2023/07/harvard-legacy-admissions/
"Under Republican Pressure, EPA Ditched “Cancer Alley” Cases",Lylla Younes,https://www.motherjones.com/politics/2023/07/epa-cancer-alley-lawsuits-republican-attorney-general-jeff-landry/
The Perils of Farming Salmon in a Warming World,Jessica McKenzie,https://www.motherjones.com/environment/2023/07/salmon-fish-farming-aquaculture-environmental-hazards-patagonia-chile/
Tightly Packed Poultry and Pig Farms Could Be Incubating the Next Deadly Flu,Tom Philpott,https://www.motherjones.com/environment/2023/06/tightly-packed-poultry-and-pig-farms-could-be-incubating-the-next-deadly-flu/
Bolsonaro Allegedly Falsified His Vaccination Status to Enter the US,Isabela Dias,https://www.motherjones.com/politics/2023/05/bolsonaro-allegedly-falsified-his-vaccination-status-to-enter-the-us/
Some Asian Chefs Worry Gas-Stove Bans Will Limit Their Home Cooking,Isaac Phan Nay,https://www.motherjones.com/food/2023/06/some-asian-canadians-are-not-happy-about-gas-stove-bans/
Bison Meat Is Hot. Ranchers Are Struggling to Keep Up.,Lela Nargi,https://www.motherjones.com/environment/2023/05/bison-meat-is-hot-ranchers-are-struggling-to-keep-up/
"After the Police Kill Your Loved One, Who Can You Lean On?",Samantha Michaels,https://www.motherjones.com/crime-justice/2023/06/after-the-police-kill-your-loved-one-who-can-you-lean-on/
Melinda Katz Once Faced Off Against DSA. Now It’s New York’s Police Lobby.,Maggie Duffy,https://www.motherjones.com/crime-justice/2023/06/queens-district-attorney-race-george-grasso-melinda-katz/
Trump and DeSantis Are Competing to Show Who Hates Immigrants the Most,Isabela Dias,https://www.motherjones.com/politics/2023/06/trump-and-desantis-are-competing-to-show-who-hates-immigrants-the-most/
The Supreme Court Delivered a Big Win to the Biden Administration on Immigration,Isabela Dias,https://www.motherjones.com/politics/2023/06/the-supreme-court-delivered-a-big-win-to-the-biden-administration-on-immigration/
,,https://www.motherjones.com/politics/2023/06/abortion-dobbs-health-care-doctors/
,,https://www.motherjones.com/politics/2023/06/after-metoo/
,,https://www.motherjones.com/politics/2023/03/anti-trans-transgender-health-care-ban-legislation-bill-minors-children-lgbtq/
,,https://www.motherjones.com/crime-justice/2023/03/who-killed-rasheem-carter/
Civil Rights Groups Challenge Harvard’s Legacy Admissions,Arianna Coghill,https://www.motherjones.com/politics/2023/07/harvard-legacy-admissions/
"SCOTUS OKs Affirmative Action—if It Helps Black Americans Get in “the Bunker, Not the Boardroom”",Nia t. evans,https://www.motherjones.com/politics/2023/06/military-academy-exception-supreme-court-affirmative-action/
"After the Police Kill Your Loved One, Who Can You Lean On?",Samantha Michaels,https://www.motherjones.com/crime-justice/2023/06/after-the-police-kill-your-loved-one-who-can-you-lean-on/
Atlanta Residents Could Soon Vote on Cop City,Eamon Whalen,https://www.motherjones.com/politics/2023/06/atlanta-residents-could-soon-vote-on-cop-city/
