title,byline,url
American Oligarchy,Mother Jones,https://www.motherjones.com/politics/2024/01/american-oligarchy/
American Oligarchy,Mother Jones,https://www.motherjones.com/politics/2024/01/american-oligarchy/
Haley Is More Climate Conscious Than Trump—Which Isn’t Saying Much,Phil McKenna,https://www.motherjones.com/politics/2024/01/new-hampshire-nikki-haley-climate-paris-agreement-withdrawl-trump-hoax/
Some of Trump’s Biggest Fans Wish He Would Show a Little Restraint. Lol.,Abby Vesoulis,https://www.motherjones.com/politics/2024/01/even-trumps-biggest-supporters-think-he-lies/
"In New Hampshire, Trump Isn’t the Only Candidate Keeping Reporters Out",Abby Vesoulis,https://www.motherjones.com/politics/2024/01/in-new-hampshire-trump-isnt-the-only-candidate-keeping-reporters-out/
Big Oil Launches Propaganda Campaign to Thwart US Energy Transition,Dharna Noor,https://www.motherjones.com/politics/2024/01/fossil-fuel-oil-gas-api-propaganda-media-campaign-energy-transition/
Ron DeSantis Quits Presidential Race and Endorses Trump,Dan Friedman,https://www.motherjones.com/politics/2024/01/ron-desantis-quits-presidential-race-and-endorses-trump/
Don’t Blame a Puzzle for the Demise of Ron DeSantis’ Campaign,Dan Friedman,https://www.motherjones.com/politics/2024/01/dont-blame-a-puzzle-for-the-demise-of-ron-desantis-campaign/
,,https://www.motherjones.com/politics/2023/11/henry-ford-antisemitism-jacob-schiff-money-kings/
,,https://www.motherjones.com/politics/2023/11/john-hagee-hitler-israel-rally-christian-zionist/
,,https://www.motherjones.com/politics/2023/11/martin-luther-king-jr-mlk-israel-palestine-1967-video/
,,https://www.motherjones.com/politics/2023/11/jamie-raskin-explains-why-he-voted-to-keep-george-santos-in-congressfor-now/
Biden Challenger Dean Phillips Signals He Might Not Leave the Race Quietly,Dan Friedman,https://www.motherjones.com/politics/2024/01/biden-challenger-dean-phillips-no-labels/
"In GOP Primary Bubble, Nobody Gives a Damn About Climate Change",Oliver Milman,https://www.motherjones.com/politics/2024/01/republican-primary-climate-change-science/
Why the COP28 Climate Pact Likely Won’t Cut It,Fred Pearce,https://www.motherjones.com/politics/2024/01/cop28-un-climate-pact-problems-bad-science/
Utah Legislature Advances an Extreme Trans Bathroom Ban,Stephanie Mencimer,https://www.motherjones.com/politics/2024/01/utah-legislature-advances-an-extreme-trans-bathroom-ban/
Nikki Haley Questions Trump’s Mental Competence,Stephanie Mencimer,https://www.motherjones.com/politics/2024/01/nikki-haley-donald-trump-mental/
ABC Just Canceled Thursday’s Planned GOP Debate,Arianna Coghill,https://www.motherjones.com/mojo-wire/2024/01/abc-just-canceled-thursdays-planned-gop-debate/
Three Migrants Drowned After Texas’ Attempt to Seize Control of the Border,Julianne McShane,https://www.motherjones.com/politics/2024/01/three-migrants-drowned-after-texas-attempts-to-seize-control-of-the-border/
Rep. Cori Bush Calls on Congress to End Race-Based Hair Discrimination,Arianna Coghill,https://www.motherjones.com/politics/2024/01/rep-cori-bush-calls-on-congress-to-end-race-based-hair-discrimination/
A Story of Mother Jones (the Labor Organizer) That’s Relevant a Century Later,"January 9, 2024",https://www.motherjones.com/politics/2024/01/mother-jones-west-virginia-coal-wars-john-kern-congress/
Norman Lear: “I Love Liberty.”,"December 12, 2023",https://www.motherjones.com/politics/2023/12/norman-lear-i-love-liberty/
An Idiotic Proposal From Nikki Haley,"December 1, 2023",https://www.motherjones.com/politics/2023/12/an-idiotic-proposal-from-nikki-haley/
Monet Changes Everything,Ezra Chowaiki,https://www.motherjones.com/politics/2024/01/oligarchs-art-collectors-billionaires-money-picasso-free-ports/
Welcome to America’s Wealthiest Zip Code,Dave Gilson,https://www.motherjones.com/politics/2024/01/fisher-island-florida-wealthiest-zip-code-oligarch-map-plutocracy/
Famed Climatologist Michael Mann Finally Faces His Detractors in Court,Dharna Noor,https://www.motherjones.com/environment/2024/01/michael-mann-climate-scientist-defamation-trial-denial/
Puerto Rico Is Harnessing Home Solar Rigs to Stabilize Its Power Grid,Gabriela Aoun Angueira,https://www.motherjones.com/politics/2024/01/puerto-rico-residental-solar-batteries-power-grid/
"Two Men Kill 3,600 Birds, Including Bald Eagles, for “Significant Sums of Cash”",Michael Sainato,https://www.motherjones.com/environment/2023/12/two-men-kill-3600-birds-including-bald-eagles-for-significant-sums-of-cash/
Rudy Giuliani Ordered to Pay $148 Million to the Election Workers He Defamed,Dan Friedman,https://www.motherjones.com/politics/2023/12/rudy-giuliani-jury-verdict-defamation-lies-trump-148-million-georgia-election-workers/
California Needs to Keep Funding Sickle Cell Care. Will It?,Julia Métraux,https://www.motherjones.com/politics/2024/01/california-needs-to-keep-funding-sickle-cell-care-will-it/
What It Was Like to Be a Black Patient in a Jim Crow Asylum,Julia Métraux,https://www.motherjones.com/politics/2024/01/antonia-hylton-madness-book-interview-crownsville-black-asylum/
Meet the Retired Women Bringing Switzerland to Court Over Climate Inaction,Ajit Niranjan,https://www.motherjones.com/environment/2024/01/meet-the-retired-women-bringing-switzerland-to-court-over-climate-inaction/
Have Endometriosis? Be Wary of That Popular Facebook Group,Kiera Butler,https://www.motherjones.com/politics/2023/12/endometriosis-nancy-nook-facebook/
"Catholic Priests Can Now Bless Same-Sex Couples, as Long as They Don’t Look Like Marriages",Katie Herchenroeder,https://www.motherjones.com/politics/2023/12/pope-francis-same-sex-marriage-blessings/
Florida Students Have Questions About the Ziegler Scandal. The Law Bridget Pushed Means Teachers Can’t Answer Them.,Kiera Butler,https://www.motherjones.com/politics/2023/12/bridget-christain-ziegler-moms-for-liberty-sarasota-teachers-dont-say-gay/
,,https://www.motherjones.com/environment/2023/12/endangered-species-act-fifty-years/
,,https://www.motherjones.com/environment/2023/12/venus-flytrap-julie-moore-saccket-supreme-court-endangered-species-act/
,,https://www.motherjones.com/criminal-justice/2023/10/foster-kids-psychiatric-hospitals-universal-health-services-uhs-alaska-cps/
,,https://www.motherjones.com/politics/2023/09/unhoused-california-photo-essay/
"Abbott: Texas Would Shoot Migrants, But Biden “Would Charge Us With Murder”",Julianne McShane,https://www.motherjones.com/politics/2024/01/greg-abbott-texas-shoot-migrants-border-biden-murder/
"First School Shooting of 2024 Leaves One Dead, Five Injured",Julianne McShane,https://www.motherjones.com/politics/2024/01/first-school-shooting-of-2024-leaves-one-dead-five-injured/
Did the Largest Pediatrician Group Miss the Mark on GMOs?,Kiera Butler,https://www.motherjones.com/food/2024/01/american-academy-of-pediatrics-gmos-food-safety-children-roundup-glyphosate-carcinogen/
24 Climate Predictions for 2024,Grist Staff,https://www.motherjones.com/politics/2024/01/climate-change-predictions-politics-2024/
"When You’re Young, Lonely, and Chronically Ill, Online Communities Offer a Lifeline",Julia Métraux,https://www.motherjones.com/media/2023/11/long-covid-loneliness-online-communities-twitch-discord-animal-crossing/
RFK Jr. Aided by GOP and Trump PAC Donors,David Corn,https://www.motherjones.com/politics/2023/10/robert-kennedy-jr-aided-by-gop-and-trump-pac-donors-chernick/
Republicans Are Grasping for a Reason to Impeach DHS Secretary Alejandro Mayorkas,Isabela Dias,https://www.motherjones.com/politics/2024/01/republicans-impeach-dhs-secretary-alejandro-mayorkas/
Excessive Heat and Air Pollution Are Putting Farmworkers’ Lives at Risk,Liza Gross and Peter Aldhous,https://www.motherjones.com/politics/2023/12/heat-and-air-pollution-putting-scores-of-california-farmworkers-lives-at-risk/
