title,byline,url
"On the Heels of Europe’s Devastating Floods, Scientists Warn More Is Yet to Come",Jena Brooker,https://www.motherjones.com/environment/2021/07/on-the-heels-of-europes-devastating-floods-scientists-warn-more-is-yet-to-come/
"On the Heels of Europe’s Devastating Floods, Scientists Warn More Is Yet to Come",Jena Brooker,https://www.motherjones.com/environment/2021/07/on-the-heels-of-europes-devastating-floods-scientists-warn-more-is-yet-to-come/
Civil Rights Groups to Biden: Abolish Filibuster to Protect Voting Rights,Ari Berman,https://www.motherjones.com/politics/2021/07/civil-rights-groups-to-biden-abolish-filibuster-to-protect-voting-rights/
A Running List of the Petty Fascism at the Olympics,Mother Jones,https://www.motherjones.com/mojo-wire/2021/07/a-running-list-of-the-petty-fascism-at-the-olympics/
Mississippi Urges Supreme Court to Overturn Roe v. Wade,Ari Berman,https://www.motherjones.com/politics/2021/07/mississippi-urges-supreme-court-to-overturn-roe-v-wade/
"For Every $1 We Spend on Food, We Rack Up $2 in Public-Health and Environmental Damage",Tom Philpott,https://www.motherjones.com/food/2021/07/for-every-1-we-spend-on-food-we-rack-up-2-in-public-health-and-environmental-damage/
Her DACA Application Was Pending. Then a Federal Judge in Texas Ruled Against the Program.,Isabela Dias,https://www.motherjones.com/politics/2021/07/her-daca-application-was-pending-then-a-federal-judge-in-texas-ruled-against-the-program/
Who Stands to Benefit Most From California’s Climate Resilience Funds? White Men.,Piper McDaniel,https://www.motherjones.com/environment/2021/07/who-stands-to-benefit-most-from-californias-climate-resilience-funds-white-men/
Today It's Critical Race Theory. 200 Years Ago It Was Abolitionist Literature.,Anthony Conwright,https://www.motherjones.com/politics/2021/07/critical-race-theory-slave-abolition-school-literature/
Republicans Suddenly Want You to Get Vaccinated. They Hope You Listen to Their Pelosi-Bashing More.,Inae Oh,https://www.motherjones.com/politics/2021/07/republicans-vaccine-shift/
A Postal Worker Filed Three OSHA Complaints about COVID Protections. She Got 6 Weeks in the Hospital Instead.,Maryam Jameel,https://www.motherjones.com/politics/2021/07/a-postal-worker-filed-three-osha-complaints-about-covid-protections-she-got-6-weeks-in-the-hospital-instead/
,,https://www.motherjones.com/politics/2021/05/5-ways-a-dark-money-group-is-trying-to-rig-our-elections/
,,https://www.motherjones.com/politics/2021/05/heritage-foundation-dark-money-voter-suppression-laws/
,,https://www.motherjones.com/politics/2021/05/caitlyn-jenner-espys-trans-sports/
Cleveland’s Baseball Team Changes Name to Guardians,Ari Berman,https://www.motherjones.com/mojo-wire/2021/07/clevelands-baseball-team-changes-name-to-guardians/
I Am Simply Asking if Ashton Kutcher Is a CIA Asset,Ali Breland,https://www.motherjones.com/mojo-wire/2021/07/ashton-kutcher-cia-krasinki-china-tiktok/
I Can’t Stop Staring at This Siberian Mosquito Tornado,Clint Hendler,https://www.motherjones.com/mojo-wire/2021/07/siberian-mosquito-tornado/
"The National Spelling Bee Finals, Canceled by COVID Last Year, Are Tonight. Take Our Very Serious Quiz.",Daniel King,https://www.motherjones.com/recharge/2021/07/national-spelling-bee-is-back-after-covid-cancellation/
“A Vegetable Oasis in an Urban Landscape”,Jacob Rosenberg,https://www.motherjones.com/recharge/2021/07/a-vegetable-oasis-in-an-urban-landscape/
"60 Years After the Yankees Told Her the Dugout Was No Place for a Girl, She Threw Out the First Pitch",Amanda Silverman,https://www.motherjones.com/recharge/2021/06/yankees-bat-girl-60-year-dream-go-gwen/
Pelosi Rejects Two Big Lie Enthusiasts From Jan. 6 Commission,Inae Oh,https://www.motherjones.com/politics/2021/07/pelosi-jordan-banks-january-6-commission/
House Progressives Get Antsy Over Senate’s Lead Role in Infrastructure Debates,Kara Voght,https://www.motherjones.com/politics/2021/07/house-progressives-infrastructure-senate/
Think Twice Before You Build That Seawall,Matt Simon,https://www.motherjones.com/environment/2021/07/think-twice-before-you-build-that-seawall/
The USDA Wants to Make Farms Climate-Friendly. Will It Work?,Leah Douglas,https://www.motherjones.com/environment/2021/07/farmers-climate-change-conservation-reserve-program/
"Biden Said He’d Cut Incarceration in Half. So Far, the Federal Prison Population Is Growing.",Samantha Michaels,https://www.motherjones.com/crime-justice/2021/07/biden-said-hed-cut-incarceration-in-half-so-far-the-federal-prison-population-is-growing/
The Pandemic Is Roaring Back Where Vaccination Rates Are Low,Noah Lanard,https://www.motherjones.com/politics/2021/07/coronavirus-pandemic-arkansas-delta/
Cory Booker Just Picked a Fight With Giant Meatpackers,Tom Philpott,https://www.motherjones.com/food/2021/07/cory-booker-meat-meatpackers-beef-corporate-consolidation/
Why the Northwest’s “Heat Dome” Is So Dangerous,Julia Lurie,https://www.motherjones.com/environment/2021/06/heat-dome-seattle-portland-northwest-drought-climate-change-hot/
Darnella Frazier Filmed George Floyd’s Murder. The Minneapolis Police Just Killed Her Uncle.,Samantha Michaels,https://www.motherjones.com/crime-justice/2021/07/darnella-frazier-filmed-george-floyds-murder-the-minneapolis-police-just-killed-her-uncle/
The Pandemic Proved We Don’t Need Bail,Madison Pauly,https://www.motherjones.com/crime-justice/2021/07/the-pandemic-proved-we-dont-need-bail/
"“When There’s a Disaster, That’s When People Want to Know About Haiti”",Nathalie Baptiste,https://www.motherjones.com/politics/2021/07/when-theres-a-disaster-thats-when-people-want-to-know-about-haiti-a-dispatch-from-the-diaspora/
How Merrick Garland Acts Like Donald Trump’s Lawyer,Dan Friedman,https://www.motherjones.com/politics/2021/06/merrick-garland-joe-biden-donald-trump-policies-doj-court-cases/
,,https://www.motherjones.com/politics/2021/07/the-moral-panic-over-critical-race-theory-is-coming-for-a-north-carolina-teacher-of-the-year/
,,https://www.motherjones.com/politics/2021/07/is-trans-telehealth-the-future-or-just-a-cash-grab/
,,https://www.motherjones.com/crime-justice/2021/06/russian-sergey-grishin-421-media-billionaire-instagram-content-farm-trump-threats/
,,https://www.motherjones.com/politics/2021/05/air-purifier-covid-asthma-unproven-science-coronavirus-ionization/
We Need to Understand How We Got to January 6 Before We Can Move Forward,Fernanda Echavarri,https://www.motherjones.com/politics/2021/06/podcast-january-6-qanon-history-whats-next/
A Radical Idea for Forcing Vaccine Companies to Share Knowledge With the World,Molly Schwartz and Jamilah King,https://www.motherjones.com/politics/2021/05/vaccine-patents-biden-covid-india-dean-baker-pandemic/
"Doctor, Lawyer, Insurrectionist: The Radicalization of Simone Gold",Stephanie Mencimer,https://www.motherjones.com/politics/2021/05/doctor-lawyer-insurrectionist-the-radicalization-of-simone-gold/
,,https://podcasts.apple.com/us/podcast/the-mother-jones-podcast/id1386408605
