title,byline,url
"As Congress Putters, the Gun Carnage Continues",Dan Friedman,https://www.motherjones.com/politics/2022/06/congress-gun-debate-restrictions-mass-shootings-toll/
"As Congress Putters, the Gun Carnage Continues",Dan Friedman,https://www.motherjones.com/politics/2022/06/congress-gun-debate-restrictions-mass-shootings-toll/
What Peter Navarro Did After His First Court Appearance Is Truly Bizarre,Dan Friedman,https://www.motherjones.com/politics/2022/06/peter-navarro-court-contempt-congress-new-federal-state-china/
Justice Department Won’t Prosecute Two Top Trump Aides for Defying Jan. 6 Committee,Russ Choma,https://www.motherjones.com/politics/2022/06/justice-department-wont-prosecute-two-top-trump-aides-for-defying-jan-6-committee/
Draft Order Would Have Given Armed Trump Supporters Power to Seize Voting Data,Dan Friedman,https://www.motherjones.com/politics/2022/06/draft-order-would-have-given-armed-trump-supporters-power-to-seize-voting-machines/
A Russian Billionaire Is Selling his $500 Million Company for $1 After Ukraine Sanctions,Russ Choma,https://www.motherjones.com/politics/2022/06/a-russian-billionaire-is-selling-his-500-million-company-for-1-after-ukraine-sanctions/
The GOP’s Interest in Mental Health Care Is a Familiar Deflection After a Mass Shooting,Stephanie Mencimer,https://www.motherjones.com/politics/2022/06/the-gops-interest-in-mental-health-care-is-a-familiar-deflection-after-a-mass-shooting/
"What to Say if a Kid Asks, “What Does It Feel Like to Die?” and Other Questions About Mass Shootings",Jackie Flynn Mogensen,https://www.motherjones.com/politics/2022/06/how-to-talk-to-kids-about-school-shootings-child-psychologist/
Uvalde Mom Who Was Handcuffed Says Police Warned Her Not to Tell Her Story,Russ Choma,https://www.motherjones.com/politics/2022/06/uvalde-mom-who-was-handcuffed-says-police-warned-her-not-to-tell-her-story/
"Key Roundup Ingredient Harms Wild Bee Colonies, New Study Shows",Damian Carrington,https://www.motherjones.com/environment/2022/06/roundup-glyophosphate-weed-killer-wild-bee-colonies-study/
"Peter Navarro, “Trump’s Looniest Economic Adviser,” Has Been Indicted",Inae Oh,https://www.motherjones.com/mojo-wire/2022/06/peter-navarro-indicted/
,,https://www.motherjones.com/mojo-wire/2022/06/star-wars-nerds-black-actress-moses-ingram/
,,https://www.motherjones.com/mojo-wire/2022/05/it-was-the-wrong-decision-period/
,,https://www.motherjones.com/crime-justice/2022/05/beto-orourke-was-right/
Ron DeSantis Is Hard at Work Doing Bad Shit,Abigail Weinberg,https://www.motherjones.com/mojo-wire/2022/06/ron-desantis-summer-gender-olympics-trans-care/
"To Argue Against Gun Control, Lauren Boebert Notes That “We Didn’t Ban Planes” After 9/11",Abigail Weinberg,https://www.motherjones.com/mojo-wire/2022/06/boebert-9-11-planes-ban-gun-control-hannity/
The Feds Step in to Investigate the Uvalde Cops’ Response to the Massacre,Tom Philpott,https://www.motherjones.com/mojo-wire/2022/05/doj-uvalde-cops-response-investigation/
"Remembering George Pérez, a Superhero of Superhero Comics",Dan Spinelli,https://www.motherjones.com/recharge/2022/05/remembering-george-perez-a-superhero-of-superhero-comics/
Ukrainian and Russian Dancers Join Onstage (in Italy) to Fundraise for the Red Cross,Daniel King,https://www.motherjones.com/recharge/2022/04/ukrainian-russian-antiwar-ballet-dancers-for-peace/
"Mass Shootings Persist, But a New Book Brings Hope and Science to Grappling With Their Prevention",Daniel King,https://www.motherjones.com/recharge/2022/04/mass-shooting-prevention-trigger-points/
Imprisoned in a Sauna With No Exit,Sarah Sax,https://www.motherjones.com/politics/2022/06/deadly-heat-wave-dome-pacific-northwest-prisons/
The Education Department Just Took Its Biggest Debt Cancellation Step Ever,Hannah Levintova,https://www.motherjones.com/politics/2022/06/education-department-student-debt-cancellation-corinthian/
"The Long, Hype-Strewn Road to General Artificial Intelligence",Tristan Greene,https://www.motherjones.com/environment/2022/06/general-artificial-intelligence-technology/
Top Scientist: We Can’t Adapt Our Way Out of This Climate Crisis,Fiona Harvey,https://www.motherjones.com/environment/2022/06/climate-scientist-katharine-hayhoe-crisis-adaptation-global-warming-impact/
How American Influencers Built a World Wide Web of Vaccine Disinformation,Kiera Butler and Neha Wadekar,https://www.motherjones.com/politics/2022/06/how-american-influencers-built-a-world-wide-web-of-vaccine-disinformation/
Monkeypox Disinfo Is Just Like Covid Disinfo—Plus Homophobia,Kiera Butler,https://www.motherjones.com/politics/2022/05/monkeypox-disinfo-is-just-like-covid-disinfo-plus-homophobia/
Russia’s War Created a Global Hunger Disaster. Climate Change Is Ramping It Up.,Tom Philpott,https://www.motherjones.com/food/2022/06/russia-war-global-hunger-crisis-united-nations-wheat-shortage-climate-change/
The FDA Is Coming for Your Almond Milk,Tom Philpott,https://www.motherjones.com/food/2022/05/oat-milk-almond-milk-dairy-lobby-fda-labeling-plant-based/
Ohio Republicans Pass Bill Allowing Teachers to Carry Guns With Just 24 Hours of Training,Noah Y. Kim,https://www.motherjones.com/crime-justice/2022/06/ohio-republicans-pass-bill-allowing-teachers-to-carry-guns-with-just-24-hours-of-training/
Missouri Investigates Police Shooting of a Black Woman Who Reportedly Said She Was Pregnant,Samantha Michaels,https://www.motherjones.com/crime-justice/2022/05/kansas-city-police-shot-a-black-woman-who-said-she-was-pregnant-and-had-her-hands-in-the-air/
“This Is Not Our First Rodeo”: Key Border Cities Say They’re Ready for the End of Title 42,Fernanda Echavarri,https://www.motherjones.com/politics/2022/05/end-title-42-border-preparation-tucson-san-diego/
May Day Marches Highlight Essential Immigrant Labor and Rising Frustration With Biden,Fernanda Echavarri,https://www.motherjones.com/politics/2022/05/may-day-immigrant-labor-marches-biden/
,,https://www.motherjones.com/politics/2022/05/golden-gate-village-affordable-housing-marin-city-bay-area-cooperative/
,,https://www.motherjones.com/politics/2022/05/the-parents-revolution-will-be-televised-and-its-asra-nomani-on-fox-friends/
,,https://www.motherjones.com/politics/2022/05/private-equity-apollo-blackstone-kkr-carlyle-carried-interest-loophole/
,,https://www.motherjones.com/politics/2022/04/hunter-biden-laptop-guo-wengui-bannon-giuliani/
January 6 Reckoning: CNN’s Jake Tapper Says the Media Must Confront Republicans’ Big Lie,Abigail Weinberg,https://www.motherjones.com/media/2021/07/january-6-insurrection-capitol-cnn-jake-tapper-podcast/
We Need to Understand How We Got to January 6 Before We Can Move Forward,Fernanda Echavarri,https://www.motherjones.com/politics/2021/06/podcast-january-6-qanon-history-whats-next/
A Radical Idea for Forcing Vaccine Companies to Share Knowledge With the World,Molly Schwartz and Jamilah King,https://www.motherjones.com/politics/2021/05/vaccine-patents-biden-covid-india-dean-baker-pandemic/
,,https://podcasts.apple.com/us/podcast/the-mother-jones-podcast/id1386408605
